name,state,date_acquired,book_value,investment_income,ownership_pct
AA Euro Investment Fund (Lux) SCSP Luxembourg,LUX,09/02/2021,0,0,5.0
"AEA Investors Small Business Fund III, L.P. New York",NY,03/24/2016,0,0,0.67
"AEA Investors Small Business Fund IV, L.P. New York",NY,10/10/2019,0,0,1.14
"Apollo Natural Resources Partners II, L.P. New York",NY,09/28/2016,0,0,0.71
"Arlington Capital Partners V, L.P. Chevy Chase",MD,08/23/2019,0,0,0.66
"Arlington Capital Partners VI, L.P. Chevy Chase",MD,05/24/2023,0,0,0.34
"Arsenal Capital Partners Growth, L.P. New York",NY,03/02/2022,0,0,0.29
"Arsenal Capital Partners V, L.P. New York",NY,07/16/2019,0,0,1.29
"Arsenal Capital Partners VI, L.P. New York",NY,05/20/2022,0,0,0.27
"Aterian Investment Partners II, L.P. New York",NY,02/07/2014,0,0,2.07
"Aurora Equity Partners V, L.P. Los Angeles",CA,06/09/2016,0,0,1.59
"Birch Hill Equity Partners V, L.P. Toronto",CAN,11/25/2015,0,0,1.08
"Birch Hill Equity Partners VI, L.P. Toronto",CAN,12/16/2020,0,0,1.09
"Calera Capital Partners VI, L.P. San Francisco",CA,11/02/2022,0,0,2.68
"Catterton Latin America II, L.P. Greenwich",CT,07/18/2016,0,0,0.78
"Catterton Partners IX, L.P. Greenwich",CT,05/21/2020,0,0,0.67
"Catterton Partners VIII, L.P. Greenwich",CT,06/12/2017,0,0,0.51
"Clairvest Equity Partners VI-A, L.P. Toronto",CAN,07/02/2020,0,0,6.03
"Frazier Healthcare Growth Buyout Fund X, L.P. Seattle",WA,06/10/2021,0,0,0.43
"Green Equity Investors VII, L.P. Los Angeles",CA,05/11/2017,0,0,0.09
"E03 000000-00-0 Green Equity Investors IX, L.P. Los Angeles",CA,08/14/2023,0,0,0.04
"Graham Partners VI, L.P. Newtown Square",PA,09/20/2023,0,0,0.9
"Harvest Partners VIII, L.P. New York",NY,11/26/2019,0,0,1.26
"Haveli VC Gaming Fund I, L.P. Wilmington",DE,04/04/2022,0,0,0.14
"Insight Partners XII, L.P. New York",NY,08/26/2021,0,0,0.06
"JFL Equity Investors V, L.P. New York",NY,08/14/2020,0,0,3.51
"JFL Equity Investors VI, L.P. New York",NY,09/05/2023,0,0,0.7
KKR North America Fund XIII SCSp New York,NY,05/04/2022,0,0,0.03
"Leeds Equity Partners VI, L.P. New York",NY,06/01/2017,0,0,1.2
"Littlejohn Fund V, L.P. Greenwich",CT,07/02/2014,0,0,0.49
"Lovell Minnick Equity Partners IV, L.P. Radnor",PA,03/26/2015,0,0,1.16
"Lovell Minnick Equity Partners V, L.P. Radnor",PA,10/24/2019,0,0,2.52
"Lovell Minnick Equity Partners VI, L.P. Radnor",PA,01/12/2024,0,0,3.0
"Madison Dearborn Capital Partners VIII, L.P. Chicago",IL,11/19/2020,0,0,0.79
"MidOcean Partners VI, L.P. New York",NY,08/23/2022,0,0,1.13
"Motive Capital Fund II-A, L.P. Wilmington",DE,08/06/2021,0,0,21.5
"NewSpring Growth Capital III, L.P. Radnor",PA,03/02/2012,0,0,3.57
"NewSpring Growth Capital V, L.P. Radnor",PA,08/04/2020,0,0,14.86
"North Castle Partners VI, L.P. Greenwich",CT,03/29/2016,0,0,2.07
"North Castle Partners VII, L.P. Greenwich",CT,12/28/2018,0,0,1.9
"NOVA Infrastructure Fund I, L.P. Wilmington",DE,05/26/2021,0,0,21.89
"NOVA Infrastructure GP I, L.P. Wilmington",DE,05/31/2021,0,0,2.2
"Revelstoke Capital Partners Fund II, L.P. Denver",CO,07/19/2018,0,0,2.09
"Riverside Fund VI-A, L.P. Boston",MA,06/13/2019,0,0,3.0
"Seidler Equity Partners V, L.P. Marina Del Rey",CA,04/28/2015,0,0,1.96
"Seidler Equity Partners VI, L.P. Marina Del Rey",CA,05/23/2018,0,0,2.43
"Seidler Equity Partners VII, L.P. Marina Del Rey",CA,11/12/2020,0,0,5.0
"Seidler Equity Partners VIII, L.P. Marina Del Rey",CA,10/12/2023,0,0,1.6
"Seidler Equity Partners Diamond Fund, L.P. Marina Del Rey",CA,06/25/2024,0,0,2.0
"SkyKnight Capital Fund IV, L.P. San Francisco",CA,11/13/2023,0,0,0.24
"Sun Capital Partners VIII, L.P. Boca Raton",FL,12/27/2022,0,0,1.42
"Torquest Partners Fund (U.S.) IV, L.P. Toronto",CAN,08/31/2016,0,0,1.22
"TSG6, L.P. San Francisco",CA,07/03/2012,0,0,1.15
"TSG7-A, L.P. San Francisco",CA,03/29/2016,0,0,0.31
"TSG7-B, L.P. San Francisco",CA,01/15/2016,0,0,0.49
"TSG8, L.P. San Francisco",CA,01/07/2019,0,0,0.88
"TSG9, L.P. San Francisco",CA,01/03/2023,0,0,0.3
"STATEMENT AS OF JUNE 30, 2024 OF THE JACKSON NATIONAL LIFE INSURANCE COMPANY Veritas Capital Fund VIII, L.P. New York",NY,07/01/2022,0,0,0.34
"Veritas Capital Vantage Fund, L.P. New York",NY,07/01/2021,0,0,0.34
"Wind Point Partners IX-A, L.P. Chicago",IL,09/05/2019,0,0,1.08
"PPM America Private Equity Fund VIII-A, L.P. Chicago",IL,06/08/2022,0,0,57.0
"Mesa West Real Estate Income Fund IV, L.P. Los Angeles",CA,03/16/2017,0,0,2.31
"Square Mile Credit Partners II, L.P. New York",NY,02/27/2019,0,0,2.0
PPMA Line of Credit Chicago,IL,09/09/2008,0,0,0.0
"Core Senior Lending Fund II Feeder, L.P. New York",NY,12/23/2021,0,0,0.63
"PPM Loan Management Company 2, LLC, Retention Series 7 Chicago",IL,03/20/2024,0,0,100.0
PPMC 2024-7A JP Morgan Securities,,05/28/2024,0,0,31.9
