name,state,date_acquired,book_value,investment_income,ownership_pct
p002360 ML Hudson River Waterfront - MTL Whippany,NJ,12/01/2021,0,0,100.0
ADVENT INTERNATIONAL GPE X-A SCSP Boston,MA,04/28/2022,0,0,0.06
ADVENT INTERNATIONAL GPE X-D SCSP Boston,MA,04/28/2022,0,0,0.24
"APOLLO IMPACT MISSION FUND, L.P. New York",NY,07/08/2021,0,0,0.63
"APOLLO INFRASTRUCTURE OPPORTUNITIES FUND II, L.P. New York",NY,06/01/2021,0,0,1.73
"Accel India VI, L.P. Bangalore",IND,11/11/2019,0,0,0.19
"Accel London VI, L.P. London",GBR,05/06/2019,0,0,0.15
Accel London VII L.P. London,GBR,06/15/2021,0,0,0.11
"Accion Quona Inclusion Fund, L.P. Washington",DC,07/26/2018,0,0,1.79
Affinity Asia Pacific Fund V L.P. Hong Kong,CHN,01/15/2018,0,0,0.21
Alchemy Special Opportunities Fund IV L.P. London,GBR,01/05/2018,0,0,0.52
Altor Fund V (No. 1) AB Stockholm,SWE,12/17/2018,0,0,0.23
Altor Fund VI (No. 1) AB Stockholm,SWE,09/30/2022,0,0,0.59
"E03 American Industrial Partners Capital Fund VII, L.P. New York",NY,03/26/2019,0,0,0.09
"Andreessen Horowitz Fund VII, L.P. Menlo Park",CA,11/17/2020,0,0,0.13
"Andreessen Horowitz Fund VIII, L.P. Menlo Park",CA,11/30/2021,0,0,0.1
"Andreessen Horowitz LSV Fund III, L.P. Menlo Park",CA,11/30/2021,0,0,0.1
"Andreessen Horowitz Seed Fund I, L.P. Menlo Park",CA,07/23/2021,0,0,0.08
"Apollo Investment Fund X, L.P. New York",NY,07/22/2022,0,0,0.07
"Arctos Sports Partners Fund I, LP New York",NY,08/05/2021,0,0,0.13
"Arctos Sports Partners Fund II, LP New York",NY,05/03/2022,0,0,0.18
"Arlington Capital Partners V, L.P. Chevy Chase",MD,04/29/2019,0,0,0.56
"Arlington Capital Partners VI, L.P. Chevy Chase",MD,05/01/2022,0,0,0.17
Arsenal Capital Partners Growth LP New York,NY,10/21/2021,0,0,0.96
"Audax Private Equity Fund VI, L.P. Boston",MA,08/03/2018,0,0,0.12
"Audax Private Equity Fund VII (Guidepoint Co-Invest), L.P. Boston",MA,08/09/2023,0,0,0.05
"Audax Private Equity Fund VII-A, L.P. Boston",MA,04/15/2022,0,0,0.06
"BDCM Opportunity Fund III, L.P. Greenwich",CT,11/06/2009,0,0,0.51
"BGH Capital Offshore Fund I, L.P. Melbourne",AUS,05/15/2018,0,0,0.61
"BVP Forge Institutional, L.P. Larchmont",NY,06/24/2022,0,0,0.15
"Bayview Opportunity Fund Domestic VII, L.P. Coral Gables",FL,01/19/2023,0,0,0.23
Bessemer Venture Partners X Institutional L.P. Larchmont,NY,10/15/2018,0,0,0.13
"Bessemer Venture Partners XI Institutional, L.P. Larchmont",NY,02/19/2021,0,0,0.15
"Blue Sea Capital Fund III, LP Palm Beach",FL,07/29/2022,0,0,0.8
"Bond Capital Fund I, LP San Francisco",CA,04/15/2019,0,0,0.14
"Bond Capital Fund II, LP San Francisco",CA,01/15/2021,0,0,0.29
"Bond III, L.P. San Francisco",CA,04/01/2022,0,0,0.19
Bridgepoint Development Capital IV London,GBR,03/27/2020,0,0,0.18
"CARLYLE EUROPE TECHNOLOGY PARTNERS V - EU, S.C.Sp. London",GBR,03/17/2022,0,0,0.1
"CHRYSCAPITAL IX, LLC Mumbai",IND,06/03/2022,0,0,0.29
"CIVC Partners Fund VI, L.P. Chicago",IL,11/04/2020,0,0,1.3
"CIVC Partners Fund VII, L.P. Chicago",IL,08/24/2023,0,0,0.1
"CRV Select Fund I, L.P. Palo Alto",CA,04/28/2021,0,0,0.43
"CRV Select Fund II, L.P. Palo Alto",CA,01/27/2022,0,0,0.33
"CRV XIX, L.P. Palo Alto",CA,01/27/2022,0,0,0.33
"Admini- Date Type Actual Cost Additional for CSC ADS Holdings, L.P. Miami",FL,07/12/2021,0,0,0.75
"Carlyle Europe Technology Partners IV, S.C.Sp London",GBR,11/29/2018,0,0,0.17
"Clearlake Capital Partners V, L.P. Los Angeles",CA,10/13/2017,0,0,0.17
"Clearlake Capital Partners VI, L.P. Los Angeles",CA,01/16/2020,0,0,0.07
"Clearlake Capital Partners VII, L.P. Santa Monica",CA,02/11/2022,0,0,0.1
"Construct Capital I, L.P. Washington",DC,01/15/2021,0,0,1.18
"Construct Capital II, L.P. Washington",DC,06/01/2022,0,0,1.67
"Cortec Group Fund VII, L.P. New York",NY,09/16/2019,0,0,0.57
"Cortec Group Fund VIII, L.P. New York",NY,03/01/2023,0,0,0.27
Court Square Capital Partners IV New York,NY,07/03/2018,0,0,0.17
Dover Street X L.P. Boston,MA,04/30/2020,0,0,0.14
Endless V A LP Leeds,GBR,10/16/2020,0,0,0.93
Equistone Partners Europe Fund VI SCSp London,GBR,03/08/2018,0,0,0.2
FCDE Independent Fund II FPCI Paris,FRA,07/07/2022,0,0,1.47
"Fifth Wall Ventures II, L.P. Los Angeles",CA,10/15/2018,0,0,0.67
"E03.1 FirstMark Capital OF III, L.P. New York",NY,12/13/2019,0,0,1.14
"FirstMark Capital OF IV, L.P. New York",NY,04/15/2022,0,0,0.44
"FirstMark Capital V, L.P. New York",NY,12/13/2019,0,0,0.75
"Foundation Capital IX, L.P. San Francisco",CA,08/10/2018,0,0,1.09
"Foundation Capital Leadership Fund III, L.P. San Francisco",CA,06/07/2021,0,0,0.5
"Foundation Capital X, L.P. San Francisco",CA,06/07/2021,0,0,0.36
"Francisco Partners VI, L.P. San Francisco",CA,04/03/2020,0,0,0.09
GGV Capital VIII L.P. Menlo Park,CA,10/29/2020,0,0,0.17
"GGV Discovery III, L.P. Menlo Park",CA,10/29/2020,0,0,0.16
"Genstar Capital Partners IX, L.P. San Francisco",CA,02/19/2019,0,0,0.08
"Genstar Capital Partners X, L.P. San Francisco",CA,04/01/2021,0,0,0.07
"Genstar X Opportunities Fund I, L.P. San Francisco",CA,03/18/2021,0,0,0.07
"Glasswing Ventures II, L.P. Boston",MA,04/15/2021,0,0,1.13
"Glendower Capital Secondary Opportunities Fund V-P, LP New York",NY,06/28/2021,0,0,0.3
"Glendower Capital Strategic Partnership 2021 (B), LP New York",NY,06/28/2021,0,0,2.25
"Global Infrastructure Partners III-A/B, L.P. New York",NY,12/16/2015,0,0,0.1
"Global Infrastructure Partners IV, L.P. New York",NY,07/01/2019,0,0,0.1
"Graham Partners VI, L.P. Philadelphia",PA,05/03/2023,0,0,0.1
"Green Equity Investors IX, L.P. Los Angeles",CA,04/15/2022,0,0,0.1
"Green Equity Investors VII, L.P. Los Angeles",CA,02/16/2016,0,0,0.14
"Gryphon Heritage Partners, L.P. San Francisco",CA,03/16/2020,0,0,0.8
"Harvest Partners IX, L.P. New York",NY,09/29/2021,0,0,0.3
Hg Genesis 10 A L.P. London,GBR,04/14/2022,0,0,0.05
Hg Genesis 9 L.P. London,GBR,02/07/2020,0,0,0.07
Hg Mercury 3 L.P. London,GBR,02/07/2020,0,0,0.26
Hg Mercury 4 A L.P. London,GBR,01/12/2023,0,0,0.28
Hg Saturn 2 A L.P. London,GBR,02/07/2020,0,0,0.07
Hg Saturn 3 A L.P. London,GBR,03/01/2022,0,0,0.1
Hg Saturn L.P. London,GBR,03/07/2018,0,0,0.71
"IMPACT DEVELOPERS FUND, LP New York",NY,07/17/2023,0,0,2.44
INDEX ORIGIN II (JERSEY) L.P. London,GBR,11/17/2022,0,0,0.19
"INDEX VENTURES XI (JERSEY), L.P. London",GBR,06/07/2021,0,0,0.16
Inflexion Buyout Fund V Limited Partnership London,GBR,04/09/2018,0,0,0.32
Admini- Date Type Actual Cost Additional for Inflexion Buyout Fund VI (No. 1) London,GBR,06/30/2021,0,0,0.05
Inflexion Enterprise Fund V London,GBR,04/04/2019,0,0,0.24
Inflexion Partnership Capital Fund II Limited Partnership London,GBR,04/09/2018,0,0,0.36
Inflexion Supplemental Fund V London,GBR,04/04/2019,0,0,0.34
Investindustrial VII L.P. London,GBR,03/25/2019,0,0,0.1
"Jade Equity Investors, L.P. Los Angeles",CA,10/14/2019,0,0,0.52
KKR Dislocation Opportunities (Domestic) Fund L.P. New York,NY,04/09/2020,0,0,1.61
KKR Opportunities (Domestic) Fund II SCSp New York,NY,10/29/2021,0,0,0.31
"KRIV Co-Invest Holdings, L.P. Mt. Kisco",NY,06/29/2023,0,0,0.1
"Kleiner Perkins Caufield & Byers XVIII, LLC New York",NY,01/28/2019,0,0,0.2
"LSC Select II, L.P. Shanghai",CHN,09/09/2021,0,0,0.16
"LSC V, L.P. Shanghai",CHN,09/09/2021,0,0,0.16
"Lightspeed Venture Partners Select V, L.P. Menlo Park",CA,02/28/2022,0,0,0.12
"Lightspeed Venture Partners XIII, L.P. Menlo Park",CA,02/28/2020,0,0,0.09
"Lightspeed Venture Partners XIV-A (Inception), L.P. Menlo Park",CA,02/28/2022,0,0,0.14
"E03.2 Lightspeed Venture Partners XIV-B (Ignite), L.P. Menlo Park",CA,02/28/2022,0,0,0.13
"Linzor Capital Partners II, L.P. Santiago",CHL,07/23/2010,0,0,1.0
MED Platform I SLP Lyon,FRA,07/20/2020,0,0,0.46
MED Platform II SLP Lyon,FRA,12/10/2021,0,0,0.16
Medicxi III LP London,GBR,04/09/2019,0,0,0.93
Medicxi Secondary I LP London,GBR,05/29/2020,0,0,0.53
"Menlo Special Opportunities Fund III, L.P. Menlo Park",CA,08/02/2022,0,0,0.2
"Menlo Ventures XV, L.P. Menlo Park",CA,07/22/2020,0,0,0.27
"Menlo Ventures XVI, L.P. Menlo Park",CA,02/27/2023,0,0,0.26
Meritech Capital Partners VII L.P. Palo Alto,CA,05/07/2020,0,0,0.22
Meritech Franchise Fund L.P. Palo Alto,CA,05/06/2021,0,0,0.34
"Nautic Partners X, L.P. Providence",RI,06/23/2021,0,0,0.25
"New Enterprise Associates 17, L.P. Menlo Park",CA,05/20/2019,0,0,0.07
"New Markets Education Partners III, L.P. Baltimore",MD,09/29/2022,0,0,2.24
"OEP VIII Project Laser Co-Investment Partners, L.P. Chicago",IL,03/29/2023,0,0,0.93
"Odyssey Investment Partners Fund VI, LP New York",NY,12/06/2019,0,0,0.13
"Olympus Growth Fund VII, L.P. Stamford",CT,11/20/2017,0,0,0.25
"One Equity Partners VII, L.P. Chicago",IL,08/07/2018,0,0,0.52
"One Equity Partners VIII, L.P. Chicago",IL,12/08/2021,0,0,0.67
"OpenGate Capital Partners II, L.P. Los Angeles",CA,10/04/2019,0,0,0.7
"PAG Asia III, L.P. Hong Kong",CHN,09/06/2018,0,0,0.1
PAI Europe VII-1 S.L.P. Paris,FRA,11/02/2017,0,0,0.12
PAI Europe VII-1 SCSp Paris,FRA,11/02/2017,0,0,0.13
PAI Partners VIII-1 SCSp Paris,FRA,11/30/2021,0,0,0.08
"Patria - Private Equity Fund VI, L.P. Sao Paulo",BRA,12/18/2017,0,0,0.29
Permira VII L.P.1 London,GBR,05/03/2019,0,0,0.07
"Pretium Single Family Rental Investments V, L.P. New York",NY,10/14/2020,0,0,1.35
Primavera Capital Fund IV L.P. Hong Kong,CHN,05/20/2021,0,0,0.11
"Public Pension Capital, LLC New York",NY,07/10/2014,0,0,0.18
"Quona Accion Inclusion Fund III, L.P. Washington",DC,07/28/2021,0,0,1.09
"Red Arts Capital Opportunity Fund I, L.P. Chicago",IL,12/16/2022,0,0,1.22
Revelstoke Holdings I LP Toronto,CAN,09/22/2021,0,0,0.15
"Scale Venture Partners VI, L.P. Foster City",CA,06/27/2018,0,0,1.32
"Admini- Date Type Actual Cost Additional for Scale Venture Partners VII, L.P. Foster City",CA,11/02/2020,0,0,0.65
Secondary Overflow Fund IV L.P. Boston,MA,04/30/2020,0,0,0.32
"Sequoia Capital US Venture 2010 Fund, LP Menlo Park",CA,03/25/2010,0,0,0.22
Seventh Cinven Fund (No.1) L.P. London,GBR,02/27/2019,0,0,0.05
"Silver Lake Partners VI, L.P. New York",NY,06/02/2020,0,0,0.1
"Spark Capital Growth Fund IV, L.P. Boston",MA,01/25/2022,0,0,0.15
"Spark Capital VI, L.P. Boston",MA,02/12/2019,0,0,0.5
"Spark Capital VII, L.P. Boston",MA,01/25/2022,0,0,0.15
"Sterling Investment Partners IV, L.P. Westport",CT,12/15/2021,0,0,0.54
TPG Asia VIII (A) L.P. Fort Worth,TX,06/22/2023,0,0,0.1
"TRIVEST DISCOVERY FUND II, L.P. Coral Gables",FL,04/19/2022,0,0,0.45
"TRIVEST FUND VII, L.P. Coral Gables",FL,04/19/2022,0,0,0.29
Tailwater Energy Fund IV LP Dallas,TX,06/24/2019,0,0,0.69
"The Baring Asia Private Equity Fund VI, L.P.1 Hong Kong",CHN,07/25/2014,0,0,0.2
"The Veritas Capital Fund VII, L.P. New York",NY,08/09/2019,0,0,0.11
"E03.3 The Veritas Capital Fund VIII, L.P. New York",NY,03/15/2022,0,0,0.05
"Tower Square Capital Partners III, L.P. Springfield",MA,09/29/2008,0,0,0.99
Trace Energy Resources Fund II LP (fka Denham Energy Resources Fund II LP) Boston,MA,10/30/2019,0,0,1.78
"Trident IX, L.P. Greenwich",CT,09/13/2021,0,0,0.11
"Trident VI, L.P. Greenwich",CT,12/20/2013,0,0,0.26
Trilantic Energy Partners II (North America) L.P. Austin,TX,12/14/2018,0,0,2.6
Trive Capital Fund IV LP Dallas,TX,04/08/2021,0,0,0.24
"Trivest Fund VI, L.P. Coral Gables",FL,09/19/2017,0,0,0.59
"Trivest Recognition Fund, L.P. Coral Gables",FL,01/13/2023,0,0,0.31
VIP V S.C.Sp. London,GBR,10/24/2022,0,0,0.08
"WTWH Holdings, LP Cleveland",OH,08/28/2023,0,0,10.67
"WestCap Strategic Operator Fund II, L.P. New York",NY,10/07/2021,0,0,0.23
"Westlake BioPartners Fund II, L.P. Westlake Village",CA,05/07/2020,0,0,0.22
"Westlake BioPartners I, L.P. Westlake Village",CA,08/01/2018,0,0,1.65
"Westlake BioPartners Opportunity Fund I, L.P. Westlake Village",CA,05/07/2020,0,0,0.72
Whitehorse Liquidity Partners Fund III LP Toronto,CAN,05/31/2019,0,0,0.51
Whitehorse Liquidity Partners Fund IV LP Toronto,CAN,04/21/2020,0,0,0.09
"Wind Point Partners IX, L.P. Chicago",IL,01/17/2020,0,0,0.22
"Wind Point Partners X-A, L.P. Chicago",IL,08/01/2022,0,0,0.42
"Wing Three, L.P. Menlo Park",CA,05/29/2020,0,0,0.3
WndrCo Holdings II LP Wilmington,DE,04/14/2023,0,0,0.81
p002479 Terminal 106 Venture LLC Seattle,WA,10/24/2022,0,0,11.609
"p000983 MetLife Camino Ramon Member, LLC San Francisco",CA,12/20/2013,0,0,1.0
"p001148 MetLife Core Property Fund, LP - MTL Whippany",NJ,11/01/2013,0,0,2.37
p002064 ML Armature Member LLC Washington,DC,08/30/2019,0,0,12.66
p002297 1350 Eye Street Owner LLC Washington,DC,03/10/2021,0,0,4.38
"p002335 Metlife Enhanced Core Property Fund, LP - MTL Whippany",NJ,07/01/2021,0,0,100.0
"p002502 ML CW Member, LLC Portland",OR,07/18/2023,0,0,7.197
"p001831 MetLife Commercial Mortgage Income Fund, LP - MTL Whippany",NJ,12/31/2018,0,0,5.17
Admini- Date Type Actual Cost Additional for p002344 Metlife Strategic Hotel Debt Fund LP - MTL Whippany,NJ,07/01/2021,0,0,100.0
"Normal distributions and/or adjustments Battery Ventures IX, L.P. Waltham",MA,12/16/2009,0,0,0.0
"Normal distributions and/or adjustments Bayview Opportunity Domestic VI, L.P. New York",NY,08/28/2020,0,0,0.0
Larchmont,NY,09/13/2019,0,0,0.0
L.P. Larchmont,NY,01/23/2015,0,0,0.0
Normal distributions and/or adjustments Blackstone Capital Partners VI L.P. New York,NY,07/29/2008,0,0,0.0
Normal distributions and/or adjustments CPEC 8 Trust B (fka CHAMP IV Trust B) Sydney,AUS,07/24/2015,0,0,0.0
Normal distributions and/or adjustments CVC European Equity Partners V (C) L.P. Channel Islands,GBR,04/18/2008,0,0,0.0
"Normal distributions and/or adjustments Clearlake Capital Partners V, L.P. Los Angeles",CA,10/13/2017,0,0,0.0
"Normal distributions and/or adjustments Cortec Group Fund VIII, L.P. New York",NY,03/01/2023,0,0,0.0
Normal distributions and/or adjustments Equistone Partners Europe Fund VI SCSp London,GBR,03/08/2018,0,0,0.0
"Normal distributions and/or adjustments FirstMark Capital OF III, L.P. New York",NY,12/13/2019,0,0,0.0
"Normal distributions and/or adjustments GS Mezzanine Partners V, L.P. New York",NY,09/26/2007,0,0,0.0
Normal distributions and/or adjustments Hudson Holdings Cayman I LP Toronto,CAN,07/29/2019,0,0,0.0
KKR Dislocation Opportunities (Domestic) Normal distributions and/or adjustments Fund L.P. New York,NY,04/09/2020,0,0,0.0
"Normal distributions and/or adjustments New Enterprise Associates 13, L.P. Menlo Park",CA,12/19/2008,0,0,0.0
"Normal distributions and/or adjustments Red Arts Capital Opportunity Fund I, L.P. Chicago",IL,12/16/2022,0,0,0.0
"Riverstone Global Energy and Power Fund VI, Normal distributions and/or adjustments L.P. New York",NY,10/31/2014,0,0,0.0
"Normal distributions and/or adjustments Silver Lake Partners VI, L.P. New York",NY,06/02/2020,0,0,0.0
"Southern Cross Latin America Private Equity Normal distributions and/or adjustments Fund IV, L.P. Toronto",CAN,05/14/2010,0,0,0.0
"Normal distributions and/or adjustments Sterling Investment Partners IV, L.P. Westport",CT,12/15/2021,0,0,0.0
"The Baring Asia Private Equity Fund VI, Normal distributions and/or adjustments L.P.1 Hong Kong",CHN,07/25/2014,0,0,0.0
"The Baring Asia Private Equity Fund VII, Normal distributions and/or adjustments E03.5 L.P. Hong Kong",CHN,07/10/2018,0,0,0.0
"Normal distributions and/or adjustments Tower Square Capital Partners III, L.P. Springfield",MA,09/29/2008,0,0,0.0
"Normal distributions and/or adjustments Trident VI, L.P. Greenwich",CT,12/20/2013,0,0,0.0
WSC Holdings Aggregator LLC Birmingham,AL,07/02/2021,0,0,0.0
"Normal distributions and/or adjustments WestCap Strategic Operator Fund II, L.P. New York",NY,10/07/2021,0,0,0.0
Normal distributions and/or adjustments Whitehorse Liquidity Partners Fund III LP Toronto,CAN,05/31/2019,0,0,0.0
Normal distributions and/or adjustments Whitehorse Liquidity Partners Fund IV LP Toronto,CAN,04/21/2020,0,0,0.0
Normal distributions and/or adjustments p002479 Terminal 106 Venture LLC Seattle,WA,10/24/2022,0,0,0.0
Normal distributions and/or adjustments p000978 MetLife 555 12th Member LLC Washington,DC,01/07/2014,0,0,0.0
"Normal distributions and/or adjustments p000981 ML SOUTHMORE, LLC Houston",TX,10/08/2013,0,0,0.0
"p001063 ML-AI MetLife Member 2,LLC Bloomington",MN,11/04/2014,0,0,0.0
"p001148 MetLife Core Property Fund, LP - Normal distributions and/or adjustments MTL Whippany",NJ,11/01/2013,0,0,0.0
Normal distributions and/or adjustments p001593 ML Cerritos TC Member LLC Cerritos,CA,03/08/2018,0,0,0.0
"p002335 Metlife Enhanced Core Property Normal distributions and/or adjustments Fund, LP - MTL Whippany",NJ,07/01/2021,0,0,0.0
"p002379 MetLife Single Family Rental Fund, Normal distributions and/or adjustments LP Whippany",NJ,03/01/2022,0,0,0.0
"p001831 MetLife Commercial Mortgage Income Normal distributions and/or adjustments Fund, LP - MTL Whippany",NJ,12/31/2018,0,0,0.0
p002344 Metlife Strategic Hotel Debt Fund Normal distributions and/or adjustments LP - MTL Whippany,NJ,07/01/2021,0,0,0.0
CUSIP Date Shares of Interest and Designation GOVERNMENT NATIONAL MORTGAGE A 3.5000 20,,09/01/2023,0,0,0.0
GOVERNMENT NATIONAL MORTGAGE A 2.6937 20,,07/05/2023,0,0,0.0
GNMA_14-2 3.5000 2044-01-01,,09/01/2023,0,0,0.0
GOVERNMENT NATIONAL MORTGAGE A 1.5000 20,,06/28/2023,0,0,0.0
GNMA_18-84 3.5000 2048-06-01,,09/01/2023,0,0,0.0
GOVERNMENT NATIONAL MORTGAGE A 3.5000 20,,09/01/2023,0,0,0.0
GOVERNMENT NATIONAL MORTGAGE A 3.5000 20,,09/01/2023,0,0,0.0
GOVERNMENT NATIONAL MORTGAGE A 2.5000 20,,09/01/2023,0,0,0.0
GOVERNMENT NATIONAL MORTGAGE A 2.0000 20,,09/01/2023,0,0,0.0
GOVERNMENT NATIONAL MORTGAGE A 5.0000 20,,09/01/2023,0,0,0.0
GOVERNMENT NATIONAL MORTGAGE A 4.5000 20,,08/01/2023,0,0,0.0
GOVERNMENT NATIONAL MORTGAGE A 5.0000 20,,09/01/2023,0,0,0.0
GOVERNMENT NATIONAL MORTGAGE A 6.5000 20,,08/01/2023,0,0,0.0
E04 38384C-FB-0 GOVERNMENT NATIONAL MORTGAGE A 6.5000 20,,07/27/2023,0,0,0.0
GOVERNMENT NATIONAL MORTGAGE A 6.0000 20,,08/11/2023,0,0,0.0
GOVERNMENT NATIONAL MORTGAGE A 6.0000 20,,09/01/2023,0,0,0.0
GOVERNMENT NATIONAL MORTGAGE A 6.0000 20,,09/01/2023,0,0,0.0
GOVERNMENT NATIONAL MORTGAGE A 6.5000 20,,09/21/2023,0,0,0.0
UNITED STATES TREASURY 0.0000 2039-11-15,,07/31/2023,0,0,0.0
UNITED STATES TREASURY 0.0000 2046-05-15,,09/12/2023,0,0,0.0
UNITED STATES TREASURY 0.0000 2046-08-15,,08/30/2023,0,0,0.0
UNITED STATES TREASURY 3.5000 2039-02-15,,07/27/2023,0,0,0.0
UNITED STATES TREASURY 3.0000 2042-05-15,,07/27/2023,0,0,0.0
UNITED STATES TREASURY 3.1250 2043-02-15,,07/31/2023,0,0,0.0
UNITED STATES TREASURY 4.1250 2053-08-15,,09/29/2023,0,0,0.0
UNITED STATES TREASURY 4.2500 2024-09-30,,08/24/2023,0,0,0.0
UNITED STATES TREASURY 4.5000 2024-11-30,,09/12/2023,0,0,0.0
UNITED STATES TREASURY 3.8750 2033-08-15,,09/29/2023,0,0,0.0
UNITED STATES TREASURY 5.0000 2025-08-31,,09/12/2023,0,0,0.0
UNITED STATES TREASURY 0.0000 2046-02-15,,09/28/2023,0,0,0.0
UNITED STATES TREASURY 0.0000 2046-05-15,,08/30/2023,0,0,0.0
UNITED STATES TREASURY 0.0000 2046-08-15,,08/30/2023,0,0,0.0
UNITED STATES TREASURY 0.0000 2046-11-15,,08/30/2023,0,0,0.0
UNITED STATES TREASURY 0.0000 2047-05-15,,09/01/2023,0,0,0.0
GOVERNMENT NATIONAL MORTGAGE A 6.5000 20,,09/27/2023,0,0,0.0
Government of Canada 1.0000 2027-06-01,,07/06/2023,0,0,0.0
Government of Canada 1.7500 2053-12-01,,07/13/2023,0,0,0.0
CUSIP Date Interest and Designation Province of Nova Scotia 4.7000 2041-06-0,,09/28/2023,0,0,0.0
ONTARIO PROVINCE OF 4.6500 2041-06-02,,09/22/2023,0,0,0.0
ONTARIO PROVINCE OF 3.4500 2045-06-02,,09/21/2023,0,0,0.0
ONTARIO PROVINCE OF 3.7500 2053-12-02,,09/27/2023,0,0,0.0
FREDDIEMAC STRIP FHSTR_329 3.0000 2043-0,,08/15/2023,0,0,0.0
FEDERAL HOME LOAN MORTGAGE COR 6.5000 20,,09/06/2023,0,0,0.0
FEDERAL HOME LOAN MORTGAGE COR 6.5000 20,,07/06/2023,0,0,0.0
FEDERAL HOME LOAN MORTGAGE COR 6.5000 20,,09/01/2023,0,0,0.0
FEDERAL HOME LOAN MORTGAGE COR 6.0000 20,,09/01/2023,0,0,0.0
FANNIE MAE FNMA_12-63A 4.0000 2042-06-01,,09/01/2023,0,0,0.0
FANNIE MAE FNMA_13-9 3.5000 2043-02-01,,09/01/2023,0,0,0.0
FANNIE MAE FNMA_13-40 3.5000 2043-05-01,,07/07/2023,0,0,0.0
E04.1 3136AP-YF-3 FANNIE MAE FNMA_15-62 4.0000 2045-08-01,,09/01/2023,0,0,0.0
FANNIE MAE FNMA_18-4 4.0000 2048-02-01,,09/01/2023,0,0,0.0
FANNIE MAE FNMA_17-105 3.0000 2048-01-01,,09/19/2023,0,0,0.0
FANNIE MAE FNMA_19-15 3.5000 2059-04-01,,09/01/2023,0,0,0.0
FANNIE MAE FNMA_18-73 3.5000 2048-10-01,,09/01/2023,0,0,0.0
FANNIE MAE ACES FNMA_19-33 3.5000 2059-0,,09/01/2023,0,0,0.0
FEDERAL NATIONAL MORTGAGE ASSO 3.0000 20,,09/01/2023,0,0,0.0
FANNIE MAE FNMA_22-72 6.0000 2052-11-01,,09/01/2023,0,0,0.0
FEDERAL NATIONAL MORTGAGE ASSO 6.0000 20,,08/01/2023,0,0,0.0
Number of Paid for Accrued Admini- FEDERAL HOME LOAN MORTGAGE COR 6.0000 20,,09/01/2023,0,0,0.0
FREDDIE MAC FHLMC_5344 6.6150 2053-10-25,,09/13/2023,0,0,0.0
FEDERAL NATIONAL MORTGAGE ASSO 6.5000 20,,09/06/2023,0,0,0.0
FEDERAL NATIONAL MORTGAGE ASSO 6.0000 20,,06/29/2023,0,0,0.0
FEDERAL NATIONAL MORTGAGE ASSO 6.0000 20,,08/25/2023,0,0,0.0
FHMLC - SCRT SCRT_18-3 3.5000 2057-08-01,,09/01/2023,0,0,0.0
SEASONED CREDIT RISK TRANSFER 3.0000 205,,09/01/2023,0,0,0.0
MICHIGAN STATE HOUSING DEVELOP 6.0110 20,,09/08/2023,0,0,0.0
MICHIGAN STATE HOUSING DEVELOP 6.0610 20,,09/08/2023,0,0,0.0
MINNESOTA ST HSG,FIN,09/13/2023,0,0,0.0
OREGON ST HSG & CMNTY SVCS DEP 6.0090 20,,09/13/2023,0,0,0.0
OREGON ST HSG & CMNTY SVCS DEP 6.0890 20,,09/13/2023,0,0,0.0
WASHINGTON STATE HOUSING FINAN 6.0010 20,,09/08/2023,0,0,0.0
WASHINGTON STATE HOUSING FINAN 6.0510 20,,09/08/2023,0,0,0.0
E04.2 00774M-AX-3 AERCAP IRELAND CAPITAL LTD 3.3000 2032-0 D,,09/26/2023,0,0,0.0
ARBOR REALTY COLLATERALIZED LO 6.7633 20 D,,08/18/2023,0,0,0.0
ARES CLO LTD ARES_23-70 7.8062 2035-10-2 D,,09/29/2023,0,0,0.0
BFC-JCGS FEDERAL RECEIVABLES T 3.3140 20,,09/29/2023,0,0,0.0
Becton Dickinson And Co 4.6690 2047-06-0,,09/22/2023,0,0,0.0
BELL CANADA INC 5.6000 2053-08-11 A,,09/26/2023,0,0,0.0
The Boeing Company 5.8050 2050-05-01,,09/19/2023,0,0,0.0
CENTURITY 2023 CITY TRUST CENT 7.9522 20,,09/26/2023,0,0,0.0
CANADIAN IMPERIAL BANK OF COMM 6.0920 20,,09/28/2023,0,0,0.0
CHASE MORTGAGE FINANCE CORPORA 3.4567 20,,07/01/2023,0,0,0.0
CHASE MORTGAGE FINANCE CORPORA 3.4567 20,,09/29/2023,0,0,0.0
CHESAPEAKE FUNDING II LLC CFII 6.4633 20 C,,09/14/2023,0,0,0.0
EXELON GENERATION,CO,09/28/2023,0,0,0.0
EXELON GENERATION,CO,09/25/2023,0,0,0.0
223611-B*-4 COWBOYS STADIUM LP 5.4900 2040-03-31,,07/19/2021,0,0,0.0
CU INC 5.0880 2053-09-20 D,,09/22/2023,0,0,0.0
DELL INTERNATIONAL LLC 5.7500 2033-02-01,,08/16/2023,0,0,0.0
DEVCO ISSUER DEVCO_23-1 7.6910 2053-05-1 D,,08/22/2023,0,0,0.0
Number of Paid for Accrued Admini- JP MORGAN MORTGAGE TRUST JPMMT 3.5049 20,,07/19/2021,0,0,0.0
JP MORGAN MORTGAGE TRUST JPMMT 2.5000 20,,06/29/2023,0,0,0.0
JP MORGAN MORTGAGE TRUST JPMMT 3.0000 20,,09/12/2023,0,0,0.0
JP MORGAN MORTGAGE TRUST JPMMT 3.0000 20,,09/14/2023,0,0,0.0
JP MORGAN MORTGAGE TRUST JPMMT 6.0000 20,,09/21/2023,0,0,0.0
JP MORGAN MORTGAGE TRUST JPMMT 6.0000 20,,09/21/2023,0,0,0.0
JP MORGAN MORTGAGE TRUST JPMMT 6.3245 20,,09/21/2023,0,0,0.0
JP MORGAN MORTGAGE TRUST JPMMT 6.3245 20,,09/21/2023,0,0,0.0
JP MORGAN MORTGAGE TRUST JPMMT 6.3245 20,,09/21/2023,0,0,0.0
LIFE FINANCIAL SERVICES TRUST 7.1261 203,,09/21/2023,0,0,0.0
WARNERMEDIA HOLDINGS INC 4.2790 2032-03-,,09/27/2023,0,0,0.0
MAGNETITE CLO LTD MAGNE_23-37 7.0643 203,,08/31/2023,0,0,0.0
MAGNETITE CLO LTD MAGNE_23-37 7.7143 203,,08/31/2023,0,0,0.0
MORGAN STANLEY RESIDENTIAL MOR 6.5000 20,,07/19/2023,0,0,0.0
MORGAN STANLEY RESIDENTIAL MOR 6.5000 20,,09/15/2023,0,0,0.0
E04.3 61775L-AR-9 MORGAN STANLEY RESIDENTIAL MOR 6.0000 20,,09/15/2023,0,0,0.0
MORGAN STANLEY RESIDENTIAL MOR 6.5568 20,,09/18/2023,0,0,0.0
MORGAN STANLEY RESIDENTIAL MOR 6.5568 20,,09/18/2023,0,0,0.0
MORGAN STANLEY RESIDENTIAL MOR 6.5568 20,,09/18/2023,0,0,0.0
"NYC(BROOKLYN,NY)Lease-Backed P 4.3500 20",,07/17/2023,0,0,0.0
NEXTERA ENERGY CAPITAL HOLDING 5.0500 20,,09/25/2023,0,0,0.0
ORACLE CORPORATION 5.5500 2053-02-06,,09/22/2023,0,0,0.0
PWC US GROUP LLP 3.7300 2035-09-14,,06/30/2023,0,0,0.0
STACK INFRASTRUCTURE ISSUER LL 5.9000 20,,07/24/2023,0,0,0.0
SUNNOVA HELIOS XII ISSUER LLC 5.6000 205,,08/18/2023,0,0,0.0
T-MOBILE US INC 6.0000 2054-06-15,,09/22/2023,0,0,0.0
TELUS CORP 5.9500 2053-09-08,,09/05/2023,0,0,0.0
TOWD POINT MORTGAGE TRUST TPMT 4.5598 20,,07/12/2023,0,0,0.0
TOWD POINT MORTGAGE TRUST TPMT 4.0021 20,,07/12/2023,0,0,0.0
VISTRA OPERATIONS COMPANY LLC 6.9500 203,,09/12/2023,0,0,0.0
WELLINGTON MANAGEMENT CLO 1 LT 7.2062 20 D,,09/15/2023,0,0,0.0
WELLINGTON MANAGEMENT CLO 1 LT 7.8562 20 D,,09/15/2023,0,0,0.0
WELLS FARGO MORTGAGE BACKED SE 3.2169 20,,07/19/2021,0,0,0.0
ORIGINAL WEMPI INC 7.7910 2027-10-04,,09/26/2023,0,0,0.0
SUZANO INTERNATIONAL FINANCE B 5.5000 20 D,,09/05/2023,0,0,0.0
GRAYMONT WESTERN CANADA INC SE 5.9600 20 A,,07/25/2023,0,0,0.0
GCT GLOBAL CONTAINER TERMINALS 6.3000 20,,08/29/2023,0,0,0.0
ELIS SA 5.8200 2035-07-20 D,,07/20/2023,0,0,0.0
ELIS SA 6.4700 2035-07-20 D,,07/20/2023,0,0,0.0
LOXAM SAS 6.3750 2028-05-15 B,,09/06/2023,0,0,0.0
G2447*-AA-8 COSTANERA SUR FINANCE LTD 5.2710 2032-06 C,,08/23/2023,0,0,0.0
GLOBAL PORTS HOLDING PLC 7.8700 2040-03- D,,09/27/2023,0,0,0.0
Q3092*-AJ-4 DBCT FINANCE PTY LTD 8.0300 2033-07-06 B,,07/06/2023,0,0,0.0
ADIENT US LLC 8.6806 2028-04-08,,09/08/2023,0,0,0.0
BARNES GROUP INC 8.4161 2050-01-01,,08/16/2023,0,0,0.0
CITADEL SECURITIES LP 7.9306 2030-07-29,,09/21/2023,0,0,0.0
Number of Paid for Accrued Admini- HESS MIDSTREAM PARTNERS LP 9.9455 2028-0,,08/09/2023,0,0,0.0
FOCUS FINANCIAL PARTNERS LLC 8.5661 2028,,09/18/2023,0,0,0.0
HILTON WORLDWIDE FINANCE LLC 7.1697 2026,,09/28/2023,0,0,0.0
LUCKY BUCKS LLC 15.3336 2028-06-06,,08/10/2023,0,0,0.0
SELECT MEDICAL CORP 8.3161 2027-03-06,,07/31/2023,0,0,0.0
WINDSOR HOLDINGS III LLC 9.8297 2030-08-,,09/01/2023,0,0,0.0
PMH NEWCO LP 8.5401 2027-01-26,,09/29/2023,0,0,0.0
SPR SOLAR FUNDING LLC COMMITME 6.6466 20,,09/29/2023,0,0,0.0
GODADDY INC 7.8161 2029-11-10,,07/19/2023,0,0,0.0
CROCS INC 8.4311 2029-02-19,,08/08/2023,0,0,0.0
QUIKRETE HOLDINGS INC 8.1806 2029-03-19,,08/31/2023,0,0,0.0
KSE STADCO RAMS,CO,09/22/2023,0,0,0.0
DELOS FINANCE SARL 7.2879 2027-10-14 D,,09/19/2023,0,0,0.0
17CAPITAL CREDIT I TERM LOAN I 8.5401 20,,07/21/2023,0,0,0.0
17CAPITAL CREDIT FUND BORROWER 8.5401 20 D,,07/21/2023,0,0,0.0
SETANTA AIRCRAFT LEASING DESIG 7.6517 20 D,,08/21/2023,0,0,0.0
