name,state,date_acquired,book_value,investment_income,ownership_pct
FREDDIE MAC SERIES 4698 CLASS DZ 4.500% 07/15/47,,03/01/2025,0,0,0.0
FREDDIE MAC SERIES 5077 CLASS DI 3.500% 02/25/51,,01/29/2025,0,0,0.0
FREDDIE MAC SERIES 4753 CLASS WP 3.500% 02/15/48,,01/01/2025,0,0,0.0
FREDDIE MAC SERIES 4957 CLASS NB 3.000% 02/25/40,,01/01/2025,0,0,0.0
FREDDIE MAC SERIES 5270 CLASS EW 5.500% 11/25/52,,01/01/2025,0,0,0.0
FREDDIE MAC SERIES 5502 CLASS FD 5.940% 02/25/55,,01/10/2025,0,0,0.0
FNMA POOL AT9660 3.500% 07/01/43,,01/01/2025,0,0,0.0
FANNIE MAE SERIES 2002-6 CLASS L 6.000% 02/25/32,,01/01/2025,0,0,0.0
FREDDIE MAC SERIES 2861 CLASS QG 5.500% 09/15/34,,01/01/2025,0,0,0.0
FREDDIE MAC SERIES 2990 CLASS G0 0.000% 02/15/35,,03/12/2025,0,0,0.0
FREDDIE MAC SERIES 3042 CLASS EA 4.500% 09/15/35,,01/01/2025,0,0,0.0
FANNIE MAE SERIES 2011-15 CLASS B 3.500% 03/25/31,,01/01/2025,0,0,0.0
FANNIE MAE SERIES 2011-33 CLASS PE 4.500% 04/25/41,,01/01/2025,0,0,0.0
FANNIE MAE SERIES 2011-41 CLASS DG 4.500% 05/25/41,,01/01/2025,0,0,0.0
FANNIE MAE SERIES 2011-57 CLASS DL 3.500% 07/25/26,,01/01/2025,0,0,0.0
FANNIE MAE SERIES 2010 123 CLASS BP 4.500% 11/25/40,,01/01/2025,0,0,0.0
FANNIE MAE SERIES 2010-135 CLASS BE 4.500% 12/25/40,,01/01/2025,0,0,0.0
FNMA POOL CB8331 5.500% 04/01/54,,01/06/2025,0,0,0.0
FNMA POOL FN MA5420 5.500% 07/01/54,,03/13/2025,0,0,0.0
COUNTRYWIDE ALTERNATIVE LOAN T SERIES 2007-24 CLASS A1 4.984% 10/25/37,,02/25/2025,0,0,0.0
COUNTRYWIDE ALTERNATIVE LOAN T SERIES 2007 24 CLASS A4 5.135% 10/25/37,,02/25/2025,0,0,0.0
CSMLT TRUST SERIES 2015-2 CLASS A7 144A 3.500% 08/25/45,,01/01/2025,0,0,0.0
CREDIT SUISSE MORTGAGE TRUST SERIES 2013-IVR4 CLASS A9 144A 3.000% 07/25/43,,01/01/2025,0,0,0.0
CREDIT SUISSE MORTGAGE TRUST SERIES 2013-IVR4 CLASS A14 144 3.000% 07/25/43,,01/01/2025,0,0,0.0
CREDIT SUISSE MORTGAGE TRUST SERIES 2013-9R CLASS A2 144A 3.000% 05/27/43,,01/01/2025,0,0,0.0
CREDIT SUISSE MORTGAGE TRUST SERIES 2013-7 CLASS A10 144A 3.500% 08/25/43,,01/01/2025,0,0,0.0
Number of Paid for Accrued Admini- CREDIT SUISSE MORTGAGE TRUST SERIES 2015-WIN1 CLASS A11 144 3.500% 12/25/44,,01/01/2025,0,0,0.0
CREDIT SUISSE MORTGAGE TRUST SERIES 2015-1 CLASS A6 144A 3.500% 01/25/45,,01/01/2025,0,0,0.0
CHASE MORTGAGE FINANCE CORPORA SERIES 2025-2 CLASS A9A 144A 6.000% 12/25/55,,02/20/2025,0,0,0.0
CHASE MORTGAGE FINANCE CORPORA SERIES 2025-3 CLASS A9 144A 6.250% 02/25/56,,03/14/2025,0,0,0.0
CHASE MORTGAGE FINANCE CORPORA SERIES 2025-1 CLASS A5 144A 6.000% 11/25/55,,01/24/2025,0,0,0.0
CITIGROUP MORTGAGE LOAN TRUST SERIES 2006-8 CLASS A2 144A 0.000% 10/25/35,,01/29/2025,0,0,0.0
CITIGROUP MORTGAGE LOAN TRUST SERIES 2025-1 CLASS A13 144A 6.000% 01/25/55,,01/24/2025,0,0,0.0
CITIGROUP MORTGAGE LOAN TRUST SERIES 2025-INV1 CLASS A20 144 6.000% 01/25/55,,02/04/2025,0,0,0.0
FIRSTKEY MORTGAGE TRUST SERIES 2015-1 CLASS A10 144A 3.500% 03/25/45,,01/01/2025,0,0,0.0
FLAGSTAR MORTGAGE TRUST SERIES 2017-1 CLASS 1A3 144A 3.500% 03/25/47,,01/01/2025,0,0,0.0
FLAGSTAR MORTGAGE TRUST SERIES 2018-2 CLASS A14 144A 3.500% 04/25/48,,01/01/2025,0,0,0.0
FLAGSTAR MORTGAGE TRUST SERIES 2021-8INV CLASS AX1 144 0.511% 09/25/51,,01/29/2025,0,0,0.0
GS MORTGAGE BACKED SECURITIES SERIES 2021-PJ9 CLASS AX1 144A 0.277% 02/26/52,,01/29/2025,0,0,0.0
GS MORTGAGE BACKED SECURITIES SERIES 2025-PJ1 CLASS A1 144A 6.000% 06/25/55,,01/21/2025,0,0,0.0
GS MORTGAGE BACKED SECURITIES SERIES 2025-PJ1 CLASS A16 144A 6.000% 06/25/55,,01/21/2025,0,0,0.0
GS MORTGAGE BACKED SECURIRTIES SERIES 2025-PJ3 CLASS A19 144A 6.000% 07/25/55,,03/17/2025,0,0,0.0
JP MORGAN MORTGAGE TRUST SERIES 2017 5 CLASS A1B 144A 4.992% 10/26/48,,01/01/2025,0,0,0.0
JP MORGAN MORTGAGE TRUST SERIES 2025-CCM1 CLASS A7 144A 5.500% 06/25/55,,01/14/2025,0,0,0.0
JP MORGAN MORTGAGE TRUST SERIES 2025-CCM1 CLASS A9 144A 5.500% 06/25/55,,01/14/2025,0,0,0.0
E04.11 46593N-AW-5 JP MORGAN MORTGAGE TRUST SERIES 2025-2 CLASS A9A 144A 6.000% 07/25/55,,02/21/2025,0,0,0.0
JP MORGAN TAXABLE HFA TRUST SERIES 2013-1 CLASS A 144A 3.000% 11/17/41,,01/01/2025,0,0,0.0
JP MORGAN MORTGAGE TRUST SERIES 2013-3 CLASS AM 144A 3.311% 07/25/43,,01/01/2025,0,0,0.0
JP MORGAN TAXABLE HFA TRUST SERIES 2013 2 CLASS A 144A 4.000% 08/26/36,,01/01/2025,0,0,0.0
JP MORGAN MORTGAGE TRUST SERIES 2014-1 CLASS 2A9 144A 3.500% 01/25/44,,01/01/2025,0,0,0.0
JP MORGAN MORTGAGE TRUST SERIES 2014-1 CLASS B1 144A 3.688% 01/25/44,,01/01/2025,0,0,0.0
JP MORGAN TAXABLE HFA TRUST SERIES 2014-1 CLASS A 144A 4.000% 11/27/38,,01/01/2025,0,0,0.0
JP MORGAN MORTGAGE TRUST SERIES 2014-IVR3 CLASS AM 144A 5.584% 09/25/44,,01/01/2025,0,0,0.0
JP MORGAN MORTGAGE TRUST SERIES 2015-A CLASS B1 144A 3.577% 05/25/45,,01/01/2025,0,0,0.0
JP MORGAN MORTGAGE TRUST SERIES 2015-4 CLASS 2A4 144A 3.000% 06/25/45,,01/01/2025,0,0,0.0
JP MORGAN MORTGAGE TRUST SERIES 2016-1 CLASS A9 144A 3.500% 05/25/46,,01/01/2025,0,0,0.0
JP MORGAN MORTGAGE TRUST SERIES 2017-1 CLASS A8 144A 3.447% 01/25/47,,01/01/2025,0,0,0.0
JP MORGAN MORTGAGE TRUST SERIES 2018-4 CLASS A13 144A 3.500% 10/25/48,,01/01/2025,0,0,0.0
JP MORGAN MORTGAGE TRUST SERIES 2017-6 CLASS A13 144A 3.500% 12/25/48,,01/01/2025,0,0,0.0
JP MORGAN MORTGAGE TRUST SERIES 2018-3 CLASS A13 144A 3.500% 09/25/48,,01/01/2025,0,0,0.0
JP MORGAN MORTGAGE TRUST SERIES 2018-8 CLASS A7 144A 4.000% 01/25/49,,01/01/2025,0,0,0.0
JP MORGAN MORTGAGE TRUST SERIES 2022-7 CLASS B1 144A 3.708% 12/25/52,,01/01/2025,0,0,0.0
JP MORGAN MORTGAGE TRUST SERIES 2025-1 CLASS A9A 144A 6.000% 06/25/55,,01/30/2025,0,0,0.0
LEHMAN MORTGAGE TRUST SERIES 2007-5 CLASS 2A2 2.235% 06/25/37,,01/29/2025,0,0,0.0
MORGAN STANLEY RESIDENTIAL,MO,03/12/2025,0,0,0.0
OAKS MORTGAGE TRUST SERIES SERIES 2015-1 CLASS B1 144A 3.808% 04/25/46,,01/01/2025,0,0,0.0
RESIDENTIAL ACCREDIT LOANS INC SERIES 2005-Q04 CLASS 2A2 5.135% 12/25/45,,02/25/2025,0,0,0.0
SEQUOIA MORTGAGE TRUST SERIES 2025-2 CLASS A19 144A 6.000% 03/25/55,,02/10/2025,0,0,0.0
SEQUOIA MORTGAGE TRUST SERIES 2025-3 CLASS A20 144A 5.500% 04/25/55,,03/07/2025,0,0,0.0
SEQUOIA MORTGAGE TRUST SERIES 2025 1 CLASS A7 144A 6.000% 01/25/55,,01/10/2025,0,0,0.0
SEQUOIA MORTGAGE TRUST SERIES 2025 1 CLASS A19 144A 6.000% 01/25/55,,01/10/2025,0,0,0.0
SEQUOIA MORTGAGE TRUST SERIES 2015-1 CLASS A19 3.500% 01/25/45,,01/01/2025,0,0,0.0
WAMU MORTGAGE PASS THROUGH SERIES 2006-AR19 CLASS 2A1B 5.825% 01/25/47,,03/01/2025,0,0,0.0
WINWATER MORTGAGE LOAN TRUST SERIES 2014-1 CLASS A9 144A 3.500% 06/20/44,,01/01/2025,0,0,0.0
WINWATER MORTGAGE LOAN TRUST SERIES 2014-1 CLASS B1 144A 3.928% 06/20/44,,01/01/2025,0,0,0.0
WINWATER MORTGAGE LOAN TRUST 2 SERIES 14-3 CLASS A12 144A 3.500% 11/20/44,,01/01/2025,0,0,0.0
WINWATER MORTGAGE LOAN TRUST SERIES 2015-1 CLASS B1 144A 3.870% 01/20/45,,01/01/2025,0,0,0.0
WINWATER MORTGAGE LOAN TRUST 2 SERIES 2015-1 CLASS B2 144A 3.870% 01/20/45,,01/01/2025,0,0,0.0
WINWATER MORTGAGE LOAN TRUST SERIES 2015-A CLASS B1 144A 3.859% 06/20/45,,01/01/2025,0,0,0.0
HUDSON YARDS SERIES 2025-SPRL CLASS A 144A 5.467% 01/13/40,,01/07/2025,0,0,0.0
IRV TRUST SERIES 2025-200P CLASS A 144A 5.295% 03/14/47,,02/05/2025,0,0,0.0
NEUBERGER BERMAN CLO LTD SERIES 19-334 CLASS BR2 144A 6.008% 04/16/39,,03/14/2025,0,0,0.0
NEUBERGER BERMAN CLO LTD SERIES 2019-33A CLASS CR2 144A 6.308% 04/16/39,,03/14/2025,0,0,0.0
AGL CLO 1 LTD SERIES 2021-14A CLASS CR 144A 6.272% 12/02/34,,03/13/2025,0,0,0.0
BAIN CAPITAL CREDIT CLO LIMITE SERIES 2019-2A CLASS CR3 144A 6.065% 10/17/32,,03/05/2025,0,0,0.0
BALLYROCK LTD SERIES 2021-18A CLASS BR 144A 6.252% 04/15/38,,03/13/2025,0,0,0.0
BALLYROCK LTD SERIES 2021-16A CLASS BR 144A 5.999% 04/20/38,,02/19/2025,0,0,0.0
BIRCH GROVE CLO LTD SERIES 2025-12A CLASS A1 144A 5.460% 04/22/38,,03/20/2025,0,0,0.0
CIFC FUNDING LTD SERIES 2014-4RA CLASS BRR 144A 6.103% 01/17/35,,02/20/2025,0,0,0.0
CARLYLE GLOBAL MARKET STRATEGI SERIES 2021-7A CLASS CR 144A 6.302% 04/15/40,,03/13/2025,0,0,0.0
DRYDEN SENIOR LOAN FUND SERIES 2021-95A CLASS CR 144A 6.322% 08/20/34,,03/03/2025,0,0,0.0
ELEVATION CLO LTD Series 25-18A 6.493% 03/28/38,,03/11/2025,0,0,0.0
JEFFERIES CREDIT PARTNERS BDC SERIES 2025-1A CLASS A 144A 5.822% 04/25/37,,02/28/2025,0,0,0.0
JEFFERIES CREDIT PARTNERS BDC SERIES 2025-1A CLASS B 144A 6.072% 04/25/37,,02/28/2025,0,0,0.0
OCP CLO LTD SERIES 2020-19A C2R2 144A 6.243% 04/20/38,,03/10/2025,0,0,0.0
TWC CLO 2017 1 LTD SERIES 2017-1A CLASS CR3 144A 6.400% 10/29/34,,03/13/2025,0,0,0.0
BCRED MML CLO 2021 1 LLC SERIES 2022 1A CLASS A2 144A 3.410% 04/20/35,,01/01/2025,0,0,0.0
CEDAR FUNDING LTD SERIES 2017-8A CLASS BRR 144A 5.903% 01/17/38,,01/27/2025,0,0,0.0
E04.12 87232B-AH-5 TCI SYMPHONY CLO SERIES 2017-1A CLASS BR 144A 6.114% 07/15/30,,01/01/2025,0,0,0.0
TCI SYMPHONY CLO SERIES 2017 1A CLASS CR 144A 6.364% 07/15/30,,01/01/2025,0,0,0.0
WOODMONT TRUST SERIES 2022 10A CLASS A 144A 7.543% 10/20/34,,01/01/2025,0,0,0.0
AB BSL CLO SERIES 2021-3A CLASS C2R 144A 6.318% 04/20/38,,02/04/2025,0,0,0.0
AMRICAN MONEY MANAGEMENT SERIES 2022-27A CLASS CR 144A 6.093% 01/20/37,,02/07/2025,0,0,0.0
AMERICAN MONEY MANAGEMENT SERIES 2025-31A CLASS C 144A 6.217% 02/20/38,,01/16/2025,0,0,0.0
ANCHORAGE CREDIT FUNDING LTD SERIES 2021-14A CLASS A 144A 3.000% 01/21/40,,01/01/2025,0,0,0.0
ANCHORAGE CREDIT FUNDING LTD SERIES 2015-1A CLASS BR2 144A 3.006% 07/28/37,,01/01/2025,0,0,0.0
ANCHORAGE CREDIT FUNDING LTD SERIES 2016 4A CLASS BR 144A 3.123% 04/27/39,,01/01/2025,0,0,0.0
ATLAS SENIOR LOAN FUND LTD SERIES 2021-17A CLASS B1 144A 6.302% 10/20/34,,01/01/2025,0,0,0.0
BALLYROCK LTD SERIES 2023-25A CLASS A2R 144A 5.800% 01/25/38,,01/24/2025,0,0,0.0
BALLYROCK LTD SERIES 2023-25A CLASS BR 144A 6.050% 01/25/38,,01/24/2025,0,0,0.0
BENIFIT STREET PARTNERS CLO LT SERIES 2022-29A CLASS CR 144A 6.050% 01/25/38,,01/24/2025,0,0,0.0
BLUEMOUNTAIN CLO LTD SERIES 2017-2A CLASS A1B 144A 5.902% 10/20/30,,01/01/2025,0,0,0.0
BLUEMOUNTAIN CLO LTD SERIES 2021-32A CLASS CR 144A 6.192% 10/15/34,,01/14/2025,0,0,0.0
BLUEMOUNTAIN CLO LTD SERIES 2021-32A CLASS DR 144A 7.392% 10/15/34,,01/14/2025,0,0,0.0
BRIQADE DEBT FUNDING I LTD SERIES 2018 1A CLASS BR 144A 3.249% 04/25/36,,01/01/2025,0,0,0.0
CARLYLE US CLO 2020 1 LTD SERIES 2020-1A CLASS BBR 144A 6.043% 01/20/38,,01/17/2025,0,0,0.0
CENTERBRIDGE CREDIT FUNDING LT SERIES 2021-2A CLASS A1 144A 3.050% 01/25/40,,01/01/2025,0,0,0.0
CENTERBRIDGE CREDIT FUNDING LT SERIES 2021 2A CLASS B 144A 3.350% 01/25/40,,01/01/2025,0,0,0.0
CLOVER CLO SERIES 2021-1A CLASS CR 144A 5.967% 04/22/34,,02/03/2025,0,0,0.0
CENT CLO LP SERIES 2018-27A CLASS CR 144A 7.212% 01/25/35,,01/01/2025,0,0,0.0
DIAMETER CREDIT FUNDING SERIES 2021 4A CLASS A 144A 2.940% 01/15/40,,01/01/2025,0,0,0.0
ELEVATION CLO LTD SERIES 2021-13A CLASS C1R 144A 6.317% 07/15/34,,02/04/2025,0,0,0.0
ELEVATION CLO LTD SERIES 2021-14A CLASS C2R 144A 6.473% 01/20/38,,02/07/2025,0,0,0.0
FORTRESS CREDIT BSL LIMITED SERIES 2021 3A CLASS B1 144A 6.355% 07/20/34,,01/01/2025,0,0,0.0
MARANON LOAN FUNDING LTD SERIES 2020 1A CLASS A 144A 6.514% 01/15/34,,01/01/2025,0,0,0.0
NEUBERGER BERMAN CLO LTD SERIES 2015-20A CLASS CR3 144A 6.068% 04/15/39,,02/10/2025,0,0,0.0
NEUBERGER BERMAN CLO LTD SERIES 2021-44A CLASS CR 144A 6.008% 10/16/35,,01/21/2025,0,0,0.0
NEUBERGER BERMAN CLO LTD SERIES 2021-44A CLASS DR 144A 6.958% 10/16/35,,01/21/2025,0,0,0.0
NEUBERGER BERMAN CLO LTD SERIES 2021-46A CLASS DR 144A 6.943% 01/20/37,,01/21/2025,0,0,0.0
OAKTREE CLO LTD SERIES 2020-1A CLASS BRR 144A 5.866% 01/15/38,,01/30/2025,0,0,0.0
OAKTREE CLO LTD SERIES 2020-1A CLASS CRR 144A 6.066% 01/15/38,,01/30/2025,0,0,0.0
OCEAN TRAILS CLO SERIES 2021-11A CLASS C1R 144A 6.143% 07/20/34,,01/24/2025,0,0,0.0
OCEAN TRAILS CLO SERIES 2022 12A CLASS B2 144A 4.642% 07/20/35,,01/01/2025,0,0,0.0
OCEAN TRAILS CLO IX SERIES 2020 9A CLASS CR 144A 7.114% 10/15/34,,01/01/2025,0,0,0.0
OCTAGON 75 LTD SERIES 2025-1A CLASS C2 144A 6.290% 01/22/38,,01/31/2025,0,0,0.0
OCTAGON INVESTMENT PARTNERS XV SERIES 2013-1A CLASS A1R2 144A 5.562% 01/25/31,,01/01/2025,0,0,0.0
Number of Paid for Accrued Admini- OCTAGON INVESTMENT PARTNERS SERIES 2019-1A CLASS CRR 144A 6.053% 01/20/35,,01/22/2025,0,0,0.0
ONE ELEVEN FUNDING LTD SERIES 2019 3A CLASS A2R 144A 2.950% 07/19/37,,01/01/2025,0,0,0.0
RACE POINT CLO LTD SERIES 2015 9A CLASS A1B2 144A 5.764% 10/15/30,,01/01/2025,0,0,0.0
ROCKFORD TOWER CREDIT FUNDING SERIES 2022 1A CLASS A 144A 3.526% 04/20/40,,01/01/2025,0,0,0.0
ROCKFORD TOWER CREDIT FUNDING SERIES 2022 1A CLASS B 144A 3.726% 04/20/40,,01/01/2025,0,0,0.0
SOUND POINT CLO LTD SERIES 2022-35A CLASS C2R 144A 6.321% 04/26/38,,02/13/2025,0,0,0.0
SYMPHONY CLO LTD SERIES 2022-31A CLASS CR 144A 6.040% 01/22/38,,02/07/2025,0,0,0.0
TELOS CLO LTD SERIES 2013-4A CLASS BR 144A 6.365% 01/17/30,,01/01/2025,0,0,0.0
WIND RIVER CLO LTD SERIES 2021-3A CLASS C1R 144A 6.261% 04/20/38,,02/07/2025,0,0,0.0
VOYA CLO LTD SERIES 2021-1A CLASS CR 144A 6.004% 07/15/34,,01/21/2025,0,0,0.0
DOMINOS PIZZA MASTER ISSUER L SERIES 2019-1A CLASS A2 144A 3.668% 10/25/49,,01/01/2025,0,0,0.0
HOTWIRE FUNDING LLC SERIES 2021 1 CLASS C 144A 4.459% 11/20/51,,01/01/2025,0,0,0.0
LEXINGTON NOTES ISSUER II D LEXII 8.390% 12/04/36,,03/27/2025,0,0,0.0
LEXINGTON NOTES ISSUER II LLC LEXII 11.390% 12/04/36,,03/17/2025,0,0,0.0
LEXINGTON NOTES ISSUER II F LEXII 14.819% 12/04/36,,01/16/2025,0,0,0.0
PGIM SENIOR LOAN OPP FUND II C PSLOMF 6.817% 07/07/31,,03/11/2025,0,0,0.0
E04.13 69437#-AB-0 PGIM SENIOR LOAN OPP FUND II C PSLOMF 7.806% 07/07/31,,03/11/2025,0,0,0.0
SONIC CAPITAL LLC SERIES 2020-1A CLASS A2I 144A 3.845% 01/20/50,,01/01/2025,0,0,0.0
SUMMIT ISSUER LLC SERIES 2020 1A CLASS C 144A 5.096% 12/20/50,,01/01/2025,0,0,0.0
TACO BELL FUNDING LLC SERIES 16-1A CLASS A23 144A 4.970% 05/25/46,,01/01/2025,0,0,0.0
TACO BELL FUNDING LLC SERIES 2018-1 CLASS A2II 144A 4.940% 11/25/48,,01/01/2025,0,0,0.0
TEXTAINER MARINE CONTAINERS L SERIES 2021 1A CLASS A 144A 1.680% 02/20/46,,01/01/2025,0,0,0.0
AVIS BUDGET RENTAL CAR FUNDIN SERIES 2021 2A CLASS A 144A 1.660% 02/20/28,,01/01/2025,0,0,0.0
AVIS BUDGET RENTAL CAR FUNDIN SERIES 2021 2A CLASS B 144A 1.900% 02/20/28,,01/01/2025,0,0,0.0
HERTZ VEHICLE FINANCING LLC SERIES 2021-2A CLASS A 144A 1.680% 12/27/27,,01/01/2025,0,0,0.0
APPALACHIAN CONSUMER RATE RELI SERIES 2013-1 CLASS A2 3.772% 08/01/31,,01/01/2025,0,0,0.0
321 HENDERSON RECEIVABLES LLC SERIES 2013-2A CLASS A 144A 4.210% 03/15/62,,01/01/2025,0,0,0.0
SUNRUN ISSUER SERIES 2025-1A CLASS A2A 144A 6.410% 04/30/60,,01/28/2025,0,0,0.0
VB S1 ISSUER LLC SERIES 2020 2A CLASS A 144A 2.636% 09/15/50,,01/01/2025,0,0,0.0
VB S1 ISSUER LLC SERIES 2020-2A CLASS B 144A 3.229% 09/15/50,,01/01/2025,0,0,0.0
VB S1 ISSUER LLC SERIES 2020-2A CLASS C 144A 4.459% 09/15/50,,01/01/2025,0,0,0.0
BLACKBIRD CAPITAL AIRCRAFT SERIES 2016 1A CLASS A 144A 4.213% 12/16/41,,01/01/2025,0,0,0.0
DB MASTER FINANCE LLC SERIES 2017-1A CLASS A2II 144A 4.030% 11/20/47,,01/01/2025,0,0,0.0
DOMINOS PIZZA MASTER ISSUER L SERIES 2015-1A CLASS A2II 144A 4.474% 10/25/45,,01/01/2025,0,0,0.0
DOMINOS PIZZA MASTER ISSUER L SERIES 2017-1A CLASS A23 144A 4.118% 07/25/47,,01/01/2025,0,0,0.0
HOTWIRE FUNDING LLC SERIES 2021-1 CLASS A2 144A 2.311% 11/20/51,,01/01/2025,0,0,0.0
METRONET INFRASTRUCTURE ISSUER SERIES 2022-1A CLASS A2 144A 6.350% 10/20/52,,01/01/2025,0,0,0.0
PLANET FITNESS MASTER ISSUER SERIES 2019-1A CLASS A2 144A 3.858% 12/05/49,,01/01/2025,0,0,0.0
PLANET FITNESS MASTER ISSUER L SERIES 2022-1A CLASS A2I 144A 3.251% 12/05/51,,01/01/2025,0,0,0.0
US AIRWAYS 2012-2A PTT 4.625% 06/03/25,,01/01/2025,0,0,0.0
Number of Paid for Accrued Admini- AMERICAN EXPRESS,CO,01/01/2025,0,0,0.0
BANK OF AMERICA CORP SERIES TT 6.125% Perpet.,,01/01/2025,0,0,0.0
BANK OF NEW YORK MELLON SERIES G 4.700% Perpet.,,01/01/2025,0,0,0.0
BANK OF NEW YORK MELLON SERIES H HYB 3.700% Perpet.,,01/01/2025,0,0,0.0
BANK OF,NY,03/03/2025,0,0,0.0
CITIGROUP INC SERIES W 4.000% Perpet.,,01/01/2025,0,0,0.0
COBANK ACB 7.250% Perpet.,,01/01/2025,0,0,0.0
DEPOSITORY TRUST & CLEAR SERIES D HYB 144A 3.375% Perpet.,,01/01/2025,0,0,0.0
DOMINION ENERGY INC SERIES C HYB 4.350% Perpet.,,01/01/2025,0,0,0.0
FARM CREDIT BK OF TEXAS SERIES 144A 7.750% Perpet.,,01/01/2025,0,0,0.0
HUNTINGTON BANCSHARES SERIES G HYB 4.450% Perpet.,,01/01/2025,0,0,0.0
JPMORGAN CHSE &,CO,01/28/2025,0,0,0.0
JPMORGAN CHASE &,CO,01/01/2025,0,0,0.0
M&T BANK CORPORATION SERIES F 5.125% Perpet.,,01/01/2025,0,0,0.0
M&T BANK CORPORATION 3.500% Perpet.,,01/01/2025,0,0,0.0
PNC FINANCIAL SERVICES SERIES S 5.000% Perpet.,,01/01/2025,0,0,0.0
PNC FINANCIAL SERVICES SERIES T 3.400% Perpet.,,01/01/2025,0,0,0.0
PNC FINANCIAL SERVICES SERIES U 6.000% Perpet.,,01/01/2025,0,0,0.0
PNC FINANCIAL SERVICES SERIES V 6.200% Perpet.,,01/01/2025,0,0,0.0
E04.14 693475-BP-9 PNC FINANCIAL SERVICES SERIES W HYB 6.250% Perpet.,,01/01/2025,0,0,0.0
CHARLES SCHWAB CORP SERIES H 4.000% Perpet.,,01/01/2025,0,0,0.0
SEMPRA ENERGY 4.875% Perpet.,,01/01/2025,0,0,0.0
STATE STREET CORP SERIES I HYB 6.700% Perpet.,,01/01/2025,0,0,0.0
STATE STREET CORP SERIES J HYB 6.700% Perpet.,,01/01/2025,0,0,0.0
STATE STREET CORP 6.450% Perpet.,,01/30/2025,0,0,0.0
TRUIST FINANCIAL CORP 7.023% Perpet.,,01/01/2025,0,0,0.0
TRUIST FINANCIAL CORP SERIES Q 5.100% Perpet.,,01/01/2025,0,0,0.0
US BANCORP 3.700% Perpet.,,01/01/2025,0,0,0.0
WELLS FARGO & COMPANY SERIES U 5.875% Perpet.,,01/01/2025,0,0,0.0
WELLS FARGO & COMPANY 3.900% Perpet.,,01/01/2025,0,0,0.0
PANDA HOLDCO,,01/08/2025,0,0,0.0
NEW PARKING AGGREGATOR LLC,,01/31/2025,0,0,0.0
FEDERAL HOME LOAN BANK - BOSTO BOSTON -COMMON STOCK,,03/31/2025,0,0,0.0
Year's Book/ Exchange Book/ STRIP PRINC 0.000% 02/15/54 .,,01/16/2025,0,0,0.0
STRIP PRINC 0.000% 08/15/54 .,,02/21/2025,0,0,0.0
US TREASURY N B 4.250% 08/15/54 .,,02/20/2025,0,0,0.0
4.500% 11/15/54 .,,03/26/2025,0,0,0.0
US TREASURY N B 4.625% 11/15/44 .,,02/05/2025,0,0,0.0
US TREASURY N B 4.625% 02/15/55 .,,03/31/2025,0,0,0.0
US TREASURY N B 4.750% 02/15/45 .,,03/19/2025,0,0,0.0
"91282C-MG-3 US TREASURY N B 150,000 US TREASURY N B 4.000% 02/15/34 .",,02/04/2025,0,0,0.0
US TREASURY N B 4.375% 05/15/34 .,,02/04/2025,0,0,0.0
US TREASURY N B 3.875% 08/15/34 .,,02/04/2025,0,0,0.0
US TREASURY NB 4.250% 01/31/30 .,,02/04/2025,0,0,0.0
FARM CREDIT BK OF TEXAS SERIES 144A 7.750% Perpet. .,,01/01/2025,0,0,0.0
TENN VALLEY AUTHORITY 5.250% 02/01/55 .,,02/25/2025,0,0,0.0
01/20/33 .,,01/20/2025,0,0,0.0
REPUBLIC OF CHILE 2.750% 01/31/27 .,,01/30/2025,0,0,0.0
REPUBLIC OF CHILE 4.850% 01/22/29 .,,01/30/2025,0,0,0.0
HUNGARY SERIES 144A 5.250% 06/16/29 .,,03/07/2025,0,0,0.0
HUNGARY SERIES 144A 6.125% 05/22/28 .,,01/31/2025,0,0,0.0
HUNGARY SERIES 144A 6.250% 09/22/32 .,,01/31/2025,0,0,0.0
10/12/35 .,,03/06/2025,0,0,0.0
REPUBLIC OF PERU 4.125% 08/25/27 .,,01/30/2025,0,0,0.0
REPUBLIC OF PERU 2.392% 01/23/26 .,,01/30/2025,0,0,0.0
REPUBLIC OF PERU 2.783% 01/23/31 .,,01/30/2025,0,0,0.0
PERUSAHAAN PENERBIT SBSN SERIES 144A 1.500% 06/09/26 .,,01/28/2025,0,0,0.0
PETRONAS CAP LTD SERIES 144A 3.500% 04/21/30 .,,03/06/2025,0,0,0.0
SAUDI INTERNATIONAL BOND SERIES 144A 2.500% 02/03/27 .,,01/28/2025,0,0,0.0
SAUDI INTERNATIONAL BOND SERIES 144A 4.750% 01/16/30 .,,01/28/2025,0,0,0.0
REPUBLIC OF POLAND SERIES EMTN 5.750% 11/16/32 .,,03/06/2025,0,0,0.0
UNITED MEXICAN STATES 6.350% 02/09/35 .,,01/23/2025,0,0,0.0
UNITED MEXICAN STATES 6.000% 05/07/36 .,,01/23/2025,0,0,0.0
HUNGARY GOVERNMENT REPHUN SERIES REGS 6.125% 05/22/28 .,,03/07/2025,0,0,0.0
CONNECTICUT ST 5.632% 12/01/29 .,,03/06/2025,0,0,0.0
DELAWARE ST 4.550% 07/01/29 .,,03/06/2025,0,0,0.0
HAWAII ST SERIES FF 2.902% 10/01/28 .,,03/06/2025,0,0,0.0
5.981% 05/01/27 .,,03/06/2025,0,0,0.0
MICHIGAN ST SERIES A 3.500% 05/15/30 .,,03/06/2025,0,0,0.0
OHIO ST 5.462% 09/01/30 .,,03/07/2025,0,0,0.0
PHOENIX,AZ,03/06/2025,0,0,0.0
Year's Book/ Exchange Book/ .,,03/06/2025,0,0,0.0
BASIN ELEC PWR ND COOPERTIVE SERIES A SERIES 144A 6.127% 06/01/41 .,,01/29/2025,0,0,0.0
DIST OF COLUMBIA WTR & SWR AUT SERIES A 5.422% 10/01/28 .,,01/28/2025,0,0,0.0
INDIANA ST MUNI PWR AGY 5.594% 01/01/42 .,,02/24/2025,0,0,0.0
JOBSOHIO BEVERAGE SYSTEM 4.532% 01/01/35 .,,03/07/2025,0,0,0.0
KENTUCKY ST ECON DEV FIN AUTH SERIES B 3.921% 12/01/28 .,,03/06/2025,0,0,0.0
KENTUCKY ST ECON DEV FIN AUTH SERIES B 4.021% 12/01/29 .,,03/06/2025,0,0,0.0
LOUISIANA ST LOCAL GOVT ENVRNM SERIES A 4.275% 02/01/36 .,,01/30/2025,0,0,0.0
LOUISIANA ST LOCAL GOVT ENVRNM SERIES A 4.475% 08/01/39 .,,01/28/2025,0,0,0.0
MESA CO ST CLG AUXILIARY FACS 5.800% 05/15/40 .,,03/06/2025,0,0,0.0
NEW JERSEY ST EDUCTNL FACS AUT SERIES C 3.636% 09/01/29 .,,03/06/2025,0,0,0.0
NEW JERSEY ST EDUCTNL FACS AUT SERIES G 3.219% 07/01/29 .,,03/07/2025,0,0,0.0
NEW YORK CITY TRANSITIONAL FIN 5.572% 11/01/38 .,,03/06/2025,0,0,0.0
NEW YORK CITY NY TRANSITIONAL SERIES E-2 3.300% 02/01/29 .,,03/06/2025,0,0,0.0
ORANGE COUNTY LOCAL TRANSPORTA 6.908% 02/15/41 .,,03/06/2025,0,0,0.0
PORT OF MORROW OR TRANSMISSION 3.521% 09/01/27 .,,03/06/2025,0,0,0.0
RIVERSIDE CNTY CA REDEV SUCCES SERIES A-T 3.625% 10/01/32 .,,03/06/2025,0,0,0.0
SAN ANTONIO TX WTR REVENUE SERIES B 3.206% 05/15/30 .,,03/07/2025,0,0,0.0
SEATTLE WA MUNI LIGHT PWR RE 5.570% 02/01/40 .,,01/28/2025,0,0,0.0
SEATTLE WA WTR SYS REVENUE SERIES A 5.520% 08/01/28 .,,03/06/2025,0,0,0.0
SNOHOMISH CNTY WA PUBLIC UTILI 5.630% 12/01/35 .,,01/28/2025,0,0,0.0
SOUTH CAROLINA ST PUBLIC SVC A SERIES F 5.740% 01/01/30 .,,03/06/2025,0,0,0.0
SOUTH CAROLINA ST PUBLIC SVC 4.551% 12/01/30 .,,03/07/2025,0,0,0.0
TENNESSEE ST SCH BOND AUTH 4.848% 09/15/27 .,,03/06/2025,0,0,0.0
07/01/32 .,,03/06/2025,0,0,0.0
TULSA,OK,03/06/2025,0,0,0.0
TULSA,OK,03/06/2025,0,0,0.0
TULSA,OK,03/06/2025,0,0,0.0
TULSA,OK,03/06/2025,0,0,0.0
TULSA,OK,03/07/2025,0,0,0.0
UNIV OF MINNESOTA MN SERIES B 4.039% 08/01/31 .,,03/06/2025,0,0,0.0
UNIV OF NORTH CAROLINA NC AT C 3.847% 12/01/34 .,,03/07/2025,0,0,0.0
VIRGINIA ST PORT AUTH PORT FAC SERIES A 3.494% 07/01/29 .,,03/06/2025,0,0,0.0
VIRGINIA ST PORT AUTH PORT FAC SERIES A 3.594% 07/01/30 .,,03/06/2025,0,0,0.0
VIRGINIA ST PORT AUTH PORT FAC SERIES A 3.694% 07/01/31 .,,03/07/2025,0,0,0.0
AMC EAST COMM LLC 144A 5.740% 01/15/28 .,,01/15/2025,0,0,0.0
AMF FLORENCE LLC 3.210% 12/31/35 .,,03/31/2025,0,0,0.0
ALAMO 6 LLC 4.170% 03/31/42 .,,03/31/2025,0,0,0.0
ATLANTA FALCONS CO STADIUM LLC 3.590% 09/01/42 .,,03/01/2025,0,0,0.0
ATLANTA FALCONS CO STADIUM LLC 3.590% 09/01/42 .,,03/01/2025,0,0,0.0
CHICAGO PARKING METERS LLC 5.070% 12/30/33 167885-A#-9 .,,03/30/2025,0,0,0.0
8POINT3 SOLAR INVESTCO 1 LLC 4.680% 11/30/35 .,,02/28/2025,0,0,0.0
8POINT3 SOLAR INVESTCO 1 LLC 4.680% 11/30/35 .,,02/28/2025,0,0,0.0
KKR PINE BROOKE ISSUER LLC 3.000% 03/15/51 .,,03/15/2025,0,0,0.0
LA STADIUM FINANCE,CO,03/31/2025,0,0,0.0
LERADO INVESTMENTS LLC 6.290% 03/31/36 .,,03/31/2025,0,0,0.0
MAPLELEAF MIDSTREAM INVESTMENT 4.560% 09/30/25 .,,01/05/2025,0,0,0.0
PIO PICO HOLDCO ISSUER LLC 4.920% 08/31/41 .,,02/28/2025,0,0,0.0
RENEWABLE POWER GENERATION LLC 4.110% 03/31/35 .,,03/31/2025,0,0,0.0
04/30/32 .,,01/30/2025,0,0,0.0
TERRAFORM UTILITY SOLAR X 4.590% 08/31/40 .,,03/31/2025,0,0,0.0
92980*-AB-7 VISTA RIDGE LLC 2.570% 10/14/49 .,,03/31/2025,0,0,0.0
W2W FINANCE LLC 4.600% 01/31/32 .,,03/31/2025,0,0,0.0
WESTERN VISTA SOLAR HOLDINGS LLC 3.460% 95984*-AA-8 03/31/40 .,,01/31/2025,0,0,0.0
MERIDIAN SPIRIT APS SPIRIT APS 4.110% . K7017#-AA-8 08/01/30 .,,03/31/2025,0,0,0.0
ERGON PERU SAC 4.870% 06/30/34 .,,01/23/2025,0,0,0.0
EOLICA MESA LA PAZ S DE RL DE 5.980% 12/20/44 .,,03/20/2025,0,0,0.0
GREENFIELD SPV I SAPI DE CV SPV I SAPI DE CV 5.550% 12/31/32 .,,01/23/2025,0,0,0.0
BROOKFIELD WA RAIL PTY LTD WA RAIL PTY LTD 4.380% 03/27/25 .,,03/27/2025,0,0,0.0
GIP TITANIUM FINCO PTY LTD 2.800% 03/31/36 .,,03/31/2025,0,0,0.0
Q6489*-AA-7 NHK PTY LTD 7.130% 11/15/32 .,,02/15/2025,0,0,0.0
R6236*-AA-2 NORSPAN LNG VIII,AS,03/30/2025,0,0,0.0
AT&T INC SERIES,WI,03/05/2025,0,0,0.0
AT&T INC 6.200% 03/15/40 .,,03/05/2025,0,0,0.0
AT&T INC 6.250% 03/29/41 .,,03/05/2025,0,0,0.0
00229*-AA-3 AP TUNDRA HOLDINGS LLC 4.750% 02/15/42 .,,02/18/2025,0,0,0.0
ABBVIE INC 4.300% 05/14/36 .,,02/14/2025,0,0,0.0
03/22/35 .,,03/22/2025,0,0,0.0
01185*-AA-3 AETNA INC 4.750% 03/15/44 .,,03/07/2025,0,0,0.0
ALASKA VENTURES LLC 4.670% 06/30/33 .,,03/31/2025,0,0,0.0
ALLEGHANY CORP 4.900% 09/15/44 .,,02/26/2025,0,0,0.0
ALLEGHANY CORP 3.250% 08/15/51 .,,02/26/2025,0,0,0.0
03/17/35 .,,03/12/2025,0,0,0.0
AMERICAN EXPRESS,CO,01/01/2025,0,0,0.0
ELEVANCE HEALTH INC 6.100% 10/15/52 .,,03/26/2025,0,0,0.0
APACHE CORP 4.750% 04/15/43 .,,01/01/2025,0,0,0.0
APACHE CORPORATION 4.250% 01/15/44 .,,01/01/2025,0,0,0.0
APACHE CORP 5.350% 07/01/49 .,,01/01/2025,0,0,0.0
APA CORP SERIES 144A 6.750% 02/15/55 .,,01/23/2025,0,0,0.0
ASSURANT INC 2.650% 01/15/32 .,,03/06/2025,0,0,0.0
ATMOS ENERGY CORP 5.950% 10/15/34 .,,03/04/2025,0,0,0.0
ATMOS ENERGY CORP 5.000% 12/15/54 .,,03/04/2025,0,0,0.0
AVIATION CAPITAL GROUP SERIES 144A 6.375% 07/15/30 .,,03/14/2025,0,0,0.0
BAT CAPITAL CORP 7.079% 08/02/43 .,,02/11/2025,0,0,0.0
12189L-AG-6 Year's Book/ Exchange Book/ BAT CAPITAL CORP 7.081% 08/02/53 .,,02/19/2025,0,0,0.0
19075Q-AF-9 BANK OF AMERICA NA SERIES BKNT 6.000% 10/15/36 .,,02/25/2025,0,0,0.0
BANK OF AMERICA CORP 5.511% 01/24/36 .,,01/21/2025,0,0,0.0
20826F-AF-3 BANK OF AMERICA CORP SERIES TT 6.125% Perpet. .,,01/01/2025,0,0,0.0
249670-AB-6 BANK OF NY MELLON CORP SERIES G 4.700% 255123-A*-2 Perpet. .,,01/01/2025,0,0,0.0
25746U-DM-8 BANK OF NY MELLON CORP SERIES H HYB 3.700% Perpet. .,,01/01/2025,0,0,0.0
30040W-AF-5 BASIN ELECTRIC POWER COOPERATI POWER COOP 3.740% 06/15/27 .,,02/20/2025,0,0,0.0
07/01/28 .,,03/06/2025,0,0,0.0
BURLINGTN NORTH SANTA,FE,02/26/2025,0,0,0.0
CC TUGS LLC TUGS LLC 6.400% 09/30/30 .,,03/31/2025,0,0,0.0
CSX CORP 5.500% 04/15/41 .,,02/25/2025,0,0,0.0
CSX CORP 4.500% 08/01/54 .,,02/06/2025,0,0,0.0
CVS HEALTH CORP 5.875% 06/01/53 .,,03/13/2025,0,0,0.0
CAPITAL ONE FINANCIAL,CO,01/06/2025,0,0,0.0
CAPITAL ONE FINANCIAL,CO,03/07/2025,0,0,0.0
CARLISLE COS INC 3.750% 12/01/27 .,,01/28/2025,0,0,0.0
CARRIER GLOBAL CORP SERIES WI 6.200% 03/15/54 .,,02/06/2025,0,0,0.0
CLASS A 6.500% 07/31/36 .,,03/15/2025,0,0,0.0
CATERPILLAR INC 5.200% 05/27/41 .,,02/25/2025,0,0,0.0
CELANESE US HOLDINGS LLC 6.700% 11/15/33 . .,,02/13/2025,0,0,0.0
CHOICE HOTELS INTL INC 3.700% 01/15/31 .,,03/06/2025,0,0,0.0
03/15/41 .,,03/15/2025,0,0,0.0
COBANK ACB 7.250% Perpet. .,,01/01/2025,0,0,0.0
