name,state,date_acquired,book_value,investment_income,ownership_pct
CLIQUET|A|C|PS|1Y|U6|D10|GF0 Equity/I CREDIT SUISSE BHF29CYC3 Fixed Annuities Exh 5 ndex INTERNATIONAL E58DKGMJYYYJLN8C3868,,09/17/2020,0,0,0.0
CLIQUET|A|C|PS|1Y|U6.25|D10|GF Equity/I CREDIT SUISSE BHF29CYG4 Fixed Annuities Exh 5 ndex INTERNATIONAL E58DKGMJYYYJLN8C3868,,09/17/2020,0,0,0.0
CLIQUET|A|C|PS|1Y|U6.75|D10|GF Equity/I CREDIT SUISSE BHF29CYJ8 Fixed Annuities Exh 5 ndex INTERNATIONAL E58DKGMJYYYJLN8C3868,,09/17/2020,0,0,0.0
CLIQUET|A|C|PS|1Y|U7.25|D10|GF Equity/I CREDIT SUISSE BHF29CYN9 Fixed Annuities Exh 5 ndex INTERNATIONAL E58DKGMJYYYJLN8C3868,,09/17/2020,0,0,0.0
AUG26RTYC@1581 BHF29CZB4 Fixed Annuities Exh 5 ndex INTERNATIONAL W22LROWP2IHZNBB6K528,,09/14/2020,0,0,0.0
MAR19TSLAUSC@380 Equity/I BANK OF AUG26SPXC@3391 BHF29CZC2 Fixed Annuities Exh 5 ndex AMERICA NA B4TYDEB6GKMZO031MB27,,09/14/2020,0,0,0.0
10Mx20SWAPTIONSYNTH Interest BHF2ABEF8 Macro Interest Rate Hedge Exh 5 Rate AMERICA NA B4TYDEB6GKMZO031MB27,,09/29/2020,0,0,0.0
BHF2AHH39 Macro Interest Rate Hedge Exh 5 Rate SERVICES I7331LVCZKQKX5T7XV54,,10/05/2020,0,0,0.0
CLIQUET|A|P|PS|1Y|U50|D10|GF0 Equity/I BANK OF BHF2AMTN1 Fixed Annuities Exh 5 ndex AMERICA NA B4TYDEB6GKMZO031MB27,,10/13/2020,0,0,0.0
BHF2AMTP6 Fixed Annuities Exh 5 ndex BNP PARIBAS R0MUWSFPU8MPRO8K5P83,,10/14/2020,0,0,0.0
CLIQUET|A|C|PS|1Y|U5.5|D10|GF0 Equity/I CHASE BANK BHF2AMTQ4 Fixed Annuities Exh 5 ndex N.A. 7H6GLXDRUGQFU57RNE97.,,10/13/2020,0,0,0.0
CLIQUET|A|C|PS|1Y|U6|D10|GF0 Equity/I CHASE BANK BHF2AMTR2 Fixed Annuities Exh 5 ndex N.A. 7H6GLXDRUGQFU57RNE97.,,10/13/2020,0,0,0.0
CLIQUET|A|C|PS|1Y|U6.75|D10|GF Equity/I CHASE BANK BHF2AMTS0 Fixed Annuities Exh 5 ndex N.A. 7H6GLXDRUGQFU57RNE97.,,10/13/2020,0,0,0.0
CLIQUET|A|P|PS|1Y|U40|D10|GF0 Equity/I BANK OF BHF2AMTT8 Fixed Annuities Exh 5 ndex AMERICA NA B4TYDEB6GKMZO031MB27,,10/14/2020,0,0,0.0
CLIQUET|A|P|PS|1Y|U35|D10|GF0 Equity/I BANK OF BHF2AMTU5 Fixed Annuities Exh 5 ndex AMERICA NA B4TYDEB6GKMZO031MB27,,10/13/2020,0,0,0.0
CLIQUET|A|P|PS|1Y|U45|D10|GF0 Equity/I BANK OF BHF2AMTV3 Fixed Annuities Exh 5 ndex AMERICA NA B4TYDEB6GKMZO031MB27,,10/13/2020,0,0,0.0
CLIQUET|A|P|PS|1Y|U50|D10|GF0 Equity/I BANK OF BHF2AMTX9 Fixed Annuities Exh 5 ndex AMERICA NA B4TYDEB6GKMZO031MB27,,10/13/2020,0,0,0.0
CLIQUET|A|P|PS|1Y|U55|D10|GF0 Equity/I BANK OF BHF2AMTY7 Fixed Annuities Exh 5 ndex AMERICA NA B4TYDEB6GKMZO031MB27,,10/13/2020,0,0,0.0
BHF2AMTZ4 Fixed Annuities Exh 5 ndex BNP PARIBAS R0MUWSFPU8MPRO8K5P83,,10/14/2020,0,0,0.0
BHF2AMU09 Fixed Annuities Exh 5 ndex BNP PARIBAS R0MUWSFPU8MPRO8K5P83,,10/14/2020,0,0,0.0
CLIQUET|A|C|PS|1Y|U5.5|D10|GF0 Equity/I CHASE BANK BHF2AMU17 Fixed Annuities Exh 5 ndex N.A. 7H6GLXDRUGQFU57RNE97.,,10/13/2020,0,0,0.0
CLIQUET|A|C|PS|1Y|U6|D10|GF0 Equity/I CHASE BANK BHF2AMU25 Fixed Annuities Exh 5 ndex N.A. 7H6GLXDRUGQFU57RNE97.,,10/13/2020,0,0,0.0
CLIQUET|A|C|PS|1Y|U6.25|D10|GF Equity/I CHASE BANK BHF2AMU33 Fixed Annuities Exh 5 ndex N.A. 7H6GLXDRUGQFU57RNE97.,,10/13/2020,0,0,0.0
CLIQUET|A|P|PS|1Y|U30|D10|GF0 Equity/I BANK OF BHF2AMU41 Fixed Annuities Exh 5 ndex AMERICA NA B4TYDEB6GKMZO031MB27,,10/14/2020,0,0,0.0
CLIQUET|A|P|PS|1Y|U40|D10|GF0 Equity/I BANK OF BHF2AMU58 Fixed Annuities Exh 5 ndex AMERICA NA B4TYDEB6GKMZO031MB27,,10/14/2020,0,0,0.0
CLIQUET|A|P|PS|1Y|U45|D10|GF0 Equity/I BANK OF BHF2AMU66 Fixed Annuities Exh 5 ndex AMERICA NA B4TYDEB6GKMZO031MB27,,10/14/2020,0,0,0.0
CLIQUET|A|P|PS|1Y|U35|D10|GF0 Equity/I BANK OF BHF2AMU74 Fixed Annuities Exh 5 ndex AMERICA NA B4TYDEB6GKMZO031MB27,,10/13/2020,0,0,0.0
CLIQUET|A|P|PS|1Y|U45|D10|GF0 Equity/I BANK OF BHF2AMU82 Fixed Annuities Exh 5 ndex AMERICA NA B4TYDEB6GKMZO031MB27,,10/13/2020,0,0,0.0
CLIQUET|A|P|PS|1Y|U50|D10|GF0 Equity/I BANK OF BHF2AMU90 Fixed Annuities Exh 5 ndex AMERICA NA B4TYDEB6GKMZO031MB27,,10/13/2020,0,0,0.0
SEP26RTYC@1475 BHF2APA61 Fixed Annuities Exh 5 ndex BANK PLC G5GSEF7VJP5I7OUK5573,,10/12/2020,0,0,0.0
MAR19TSLAUSC@380 Equity/I CHASE BANK SEP26SPXC@3344 BHF2APA87 Fixed Annuities Exh 5 ndex N.A. 7H6GLXDRUGQFU57RNE97.,,10/12/2020,0,0,0.0
BHF2AUNC3 Macro Interest Rate Hedge Exh 5 Rate MARKETS LLC OV6W8S6QX2D1J857QP30,,10/13/2020,0,0,0.0
BHF2AUNW9 Macro Interest Rate Hedge Exh 5 Rate SERVICES I7331LVCZKQKX5T7XV54,,10/13/2020,0,0,0.0
6Mx20SWAPTIONSYNTH Interest BHF2AW8R3 Macro Interest Rate Hedge Exh 5 Rate N.A. 7H6GLXDRUGQFU57RNE97.,,10/14/2020,0,0,0.0
BHF2AY1L9 Macro Interest Rate Hedge Exh 5 Rate SERVICES I7331LVCZKQKX5T7XV54,,10/15/2020,0,0,0.0
BHF2AY1M7 Macro Interest Rate Hedge Exh 5 Rate CITIBANK NA E57ODZWZ7FF32TWEFA76,,10/15/2020,0,0,0.0
BHF2B0BW7 Macro Interest Rate Hedge Exh 5 Rate SERVICES I7331LVCZKQKX5T7XV54,,10/16/2020,0,0,0.0
BHF2BA932 Macro Interest Rate Hedge Exh 5 Rate SERVICES I7331LVCZKQKX5T7XV54,,10/22/2020,0,0,0.0
BHF2BB8Q0 Macro Interest Rate Hedge Exh 5 Rate SERVICES I7331LVCZKQKX5T7XV54,,10/23/2020,0,0,0.0
MAR19TSLAUSC@380 Equity/I BANK OF OCT21MXEAC@1855 BHF2BL615 Variable Annuities Exh 5 ndex AMERICA NA B4TYDEB6GKMZO031MB27,,10/29/2020,0,0,0.0
MAR19TSLAUSC@380 Equity/I CHASE BANK OCT21RTYC@1508 BHF2BL672 Variable Annuities Exh 5 ndex N.A. 7H6GLXDRUGQFU57RNE97.,,10/29/2020,0,0,0.0
8Mx20SWAPTIONSYNTH Interest BHF2BYZC1 Macro Interest Rate Hedge Exh 5 Rate AMERICA NA B4TYDEB6GKMZO031MB27,,11/05/2020,0,0,0.0
BHF2BYZF4 Macro Interest Rate Hedge Exh 5 Rate SERVICES I7331LVCZKQKX5T7XV54,,11/05/2020,0,0,0.0
BHF2C9PF9 Fixed Annuities Exh 5 ndex INTERNATIONAL W22LROWP2IHZNBB6K528,,11/17/2020,0,0,0.0
CLIQUET|A|P|PS|1Y|U40|D10|GF0 Equity/I CHASE BANK BHF2C9PJ1 Fixed Annuities Exh 5 ndex N.A. 7H6GLXDRUGQFU57RNE97.,,11/18/2020,0,0,0.0
BHF2C9PK8 Fixed Annuities Exh 5 ndex INTERNATIONAL W22LROWP2IHZNBB6K528,,11/17/2020,0,0,0.0
CLIQUET|A|C|PS|1Y|U5|D10|GF0 Equity/I CHASE BANK BHF2C9PX0 Fixed Annuities Exh 5 ndex N.A. 7H6GLXDRUGQFU57RNE97.,,11/18/2020,0,0,0.0
CLIQUET|A|C|PS|1Y|U5.5|D10|GF0 Equity/I CHASE BANK BHF2C9Q27 Fixed Annuities Exh 5 ndex N.A. 7H6GLXDRUGQFU57RNE97.,,11/18/2020,0,0,0.0
CLIQUET|A|C|PS|1Y|U5.75|D10|GF Equity/I CHASE BANK BHF2C9Q35 Fixed Annuities Exh 5 ndex N.A. 7H6GLXDRUGQFU57RNE97.,,11/18/2020,0,0,0.0
CLIQUET|A|P|PS|1Y|U40|D10|GF0 Equity/I CHASE BANK BHF2C9QF8 Fixed Annuities Exh 5 ndex N.A. 7H6GLXDRUGQFU57RNE97.,,11/18/2020,0,0,0.0
BHF2C9QH4 Fixed Annuities Exh 5 ndex INTERNATIONAL W22LROWP2IHZNBB6K528,,11/17/2020,0,0,0.0
BHF2C9QK7 Fixed Annuities Exh 5 ndex INTERNATIONAL W22LROWP2IHZNBB6K528,,11/17/2020,0,0,0.0
BHF2C9QL5 Fixed Annuities Exh 5 ndex INTERNATIONAL W22LROWP2IHZNBB6K528,,11/17/2020,0,0,0.0
MAR19TSLAUSC@380 Equity/I CHASE BANK SEP26SPXC@3277 BHF2CFGQ1 Fixed Annuities Exh 5 ndex N.A. 7H6GLXDRUGQFU57RNE97.,,11/17/2020,0,0,0.0
MAR19TSLAUSC@380 Equity/I BANK OF OCT26RTYC@1583 BHF2CFGR9 Fixed Annuities Exh 5 ndex AMERICA NA B4TYDEB6GKMZO031MB27,,11/17/2020,0,0,0.0
MAR19TSLAUSC@380 Equity/I CHASE BANK OCT26SPXC@3396 BHF2CFGS7 Fixed Annuities Exh 5 ndex N.A. 7H6GLXDRUGQFU57RNE97.,,11/17/2020,0,0,0.0
BHF2CUJJ1 Macro Interest Rate Hedge Exh 5 Rate CITIBANK NA E57ODZWZ7FF32TWEFA76,,11/24/2020,0,0,0.0
BHF2D4W12 Macro Interest Rate Hedge Exh 5 Rate CITIBANK NA E57ODZWZ7FF32TWEFA76,,11/30/2020,0,0,0.0
BHF2D4W20 Macro Interest Rate Hedge Exh 5 Rate BNP PARIBAS R0MUWSFPU8MPRO8K5P83,,11/30/2020,0,0,0.0
CLIQUET|A|C|PS|1Y|U5.5|D10|GF0 Equity/I CHASE BANK BHF2DHV22 Fixed Annuities Exh 5 ndex N.A. 7H6GLXDRUGQFU57RNE97.,,12/11/2020,0,0,0.0
BHF2DHVM8 Fixed Annuities Exh 5 ndex INTERNATIONAL W22LROWP2IHZNBB6K528,,12/11/2020,0,0,0.0
BHF2DHVS5 Fixed Annuities Exh 5 ndex INTERNATIONAL W22LROWP2IHZNBB6K528,,12/10/2020,0,0,0.0
BHF2DHVV8 Fixed Annuities Exh 5 ndex INTERNATIONAL W22LROWP2IHZNBB6K528,,12/10/2020,0,0,0.0
CLIQUET|A|C|PS|1Y|U5.5|D10|GF0 Equity/I CHASE BANK BHF2DHVY2 Fixed Annuities Exh 5 ndex N.A. 7H6GLXDRUGQFU57RNE97.,,12/11/2020,0,0,0.0
CLIQUET|A|C|PS|1Y|U5.75|D10|GF Equity/I CHASE BANK BHF2DHW21 Fixed Annuities Exh 5 ndex N.A. 7H6GLXDRUGQFU57RNE97.,,12/11/2020,0,0,0.0
BHF2DHWN5 Fixed Annuities Exh 5 ndex INTERNATIONAL W22LROWP2IHZNBB6K528,,12/11/2020,0,0,0.0
BHF2DHWP0 Fixed Annuities Exh 5 ndex INTERNATIONAL W22LROWP2IHZNBB6K528,,12/10/2020,0,0,0.0
BHF2DHWQ8 Fixed Annuities Exh 5 ndex INTERNATIONAL W22LROWP2IHZNBB6K528,,12/10/2020,0,0,0.0
BHF2DHWR6 Fixed Annuities Exh 5 ndex INTERNATIONAL W22LROWP2IHZNBB6K528,,12/10/2020,0,0,0.0
MAR19TSLAUSC@380 Equity/I WELLS FARGO NOV26RTYC@1756 BHF2DHYA1 Fixed Annuities Exh 5 ndex BANK NA KB1H1DSPRFMYMCUFXT09.,,12/10/2020,0,0,0.0
MAR19TSLAUSC@380 Equity/I STANLEY & CO NOV26SPXC@3526 BHF2DHYB9 Fixed Annuities Exh 5 ndex INTL. PLC 4PQUHN3JPFGFNF3BB653,,12/10/2020,0,0,0.0
DEC21MXEAC@2198 Equity/I CHASE BANK BHF2DYDA7 Variable Annuities Exh 5 ndex N.A. 7H6GLXDRUGQFU57RNE97.,,12/18/2020,0,0,0.0
MAR19TSLAUSC@380 Equity/I BANK OF DEC21SPXC@3887 BHF2DYDK5 Variable Annuities Exh 5 ndex AMERICA NA B4TYDEB6GKMZO031MB27,,12/29/2020,0,0,0.0
BHF2E00S5 Macro Interest Rate Hedge Exh 5 Rate BANK AG 7LTWFZYICNSX8D621K86,,12/17/2020,0,0,0.0
BHF2E7JP6 Macro Interest Rate Hedge Exh 5 Rate BNP PARIBAS R0MUWSFPU8MPRO8K5P83,,12/22/2020,0,0,0.0
BHF2E9AA4 Macro Interest Rate Hedge Exh 5 Rate SERVICES I7331LVCZKQKX5T7XV54,,12/23/2020,0,0,0.0
DEC21SPXC@3887 BHF2EEFS9 Variable Annuities Exh 5 ndex CITIBANK NA E57ODZWZ7FF32TWEFA76,,12/29/2020,0,0,0.0
BHF2EZD88 Fixed Annuities Exh 5 ndex INTERNATIONAL W22LROWP2IHZNBB6K528,,01/13/2021,0,0,0.0
CLIQUET|A|C|PS|1Y|U5.5|D10|GF0 Equity/I CHASE BANK BHF2EZD96 Fixed Annuities Exh 5 ndex N.A. 7H6GLXDRUGQFU57RNE97.,,01/14/2021,0,0,0.0
BHF2EZDK1 Fixed Annuities Exh 5 ndex BNP PARIBAS R0MUWSFPU8MPRO8K5P83,,01/14/2021,0,0,0.0
BHF2EZDM7 Fixed Annuities Exh 5 ndex BNP PARIBAS R0MUWSFPU8MPRO8K5P83,,01/14/2021,0,0,0.0
BHF2EZDT2 Fixed Annuities Exh 5 ndex INTERNATIONAL W22LROWP2IHZNBB6K528,,01/13/2021,0,0,0.0
BHF2EZDU9 Fixed Annuities Exh 5 ndex INTERNATIONAL W22LROWP2IHZNBB6K528,,01/13/2021,0,0,0.0
BHF2EZDV7 Fixed Annuities Exh 5 ndex INTERNATIONAL W22LROWP2IHZNBB6K528,,01/13/2021,0,0,0.0
MAR19TSLAUSC@380 Equity/I CHASE BANK NOV26SPXC@3636 BHF2EZDW5 Fixed Annuities Exh 5 ndex N.A. 7H6GLXDRUGQFU57RNE97.,,01/19/2021,0,0,0.0
MAR19TSLAUSC@380 Equity/I CHASE BANK DEC26SPXC@3716 BHF2EZDX3 Fixed Annuities Exh 5 ndex N.A. 7H6GLXDRUGQFU57RNE97.,,01/19/2021,0,0,0.0
CLIQUET|A|C|PS|1Y|U6|D10|GF0 Equity/I CHASE BANK BHF2GVBB0 Fixed Annuities Exh 5 ndex N.A. 7H6GLXDRUGQFU57RNE97.,,02/12/2021,0,0,0.0
BHF2GVBD6 Fixed Annuities Exh 5 ndex GENERALE SA O2RNE8IBXP4R0TD8PU41,,02/12/2021,0,0,0.0
CLIQUET|A|C|PS|1Y|U5.5|D10|GF0 Equity/I CHASE BANK BHF2GVBF1 Fixed Annuities Exh 5 ndex N.A. 7H6GLXDRUGQFU57RNE97.,,02/12/2021,0,0,0.0
CLIQUET|A|C|PS|1Y|U6|D10|GF0 Equity/I CHASE BANK BHF2GVBG9 Fixed Annuities Exh 5 ndex N.A. 7H6GLXDRUGQFU57RNE97.,,02/12/2021,0,0,0.0
CLIQUET|A|C|PS|1Y|U6|D10|GF0 Equity/I CHASE BANK BHF2GVBM6 Fixed Annuities Exh 5 ndex N.A. 7H6GLXDRUGQFU57RNE97.,,02/12/2021,0,0,0.0
BHF2GVBR5 Fixed Annuities Exh 5 ndex BNP PARIBAS R0MUWSFPU8MPRO8K5P83,,02/16/2021,0,0,0.0
BHF2GVBT1 Fixed Annuities Exh 5 ndex BNP PARIBAS R0MUWSFPU8MPRO8K5P83,,02/16/2021,0,0,0.0
BHF2GVBU8 Fixed Annuities Exh 5 ndex BNP PARIBAS R0MUWSFPU8MPRO8K5P83,,02/16/2021,0,0,0.0
BHF2GVBX2 Fixed Annuities Exh 5 ndex GENERALE SA O2RNE8IBXP4R0TD8PU41,,02/12/2021,0,0,0.0
BHF2GVBY0 Fixed Annuities Exh 5 ndex GENERALE SA O2RNE8IBXP4R0TD8PU41,,02/12/2021,0,0,0.0
BHF2GVCA1 Fixed Annuities Exh 5 ndex GENERALE SA O2RNE8IBXP4R0TD8PU41,,02/12/2021,0,0,0.0
BHF2GVCB9 Fixed Annuities Exh 5 ndex GENERALE SA O2RNE8IBXP4R0TD8PU41,,02/12/2021,0,0,0.0
MAR19TSLAUSC@380 Equity/I CHASE BANK JAN27SPXC@3821 BHF2GVM85 Fixed Annuities Exh 5 ndex N.A. 7H6GLXDRUGQFU57RNE97.,,02/12/2021,0,0,0.0
MAR19TSLAUSC@380 Equity/I CHASE BANK DEC26SPXC@3715 BHF2GVMD4 Fixed Annuities Exh 5 ndex N.A. 7H6GLXDRUGQFU57RNE97.,,02/12/2021,0,0,0.0
12Mx20SWAPTIONSYNTH Interest BHF2HGF93 Macro Interest Rate Hedge Exh 5 Rate BANK NA KB1H1DSPRFMYMCUFXT09.,,02/22/2021,0,0,0.0
BHF2HJ7Q8 Macro Interest Rate Hedge Exh 5 Rate BANK AG 7LTWFZYICNSX8D621K86,,02/23/2021,0,0,0.0
CLIQUET|A|C|PS|1Y|U5.5|D10|GF0 Equity/I BANK OF BHF2JH327 Fixed Annuities Exh 5 ndex AMERICA NA B4TYDEB6GKMZO031MB27,,03/16/2021,0,0,0.0
BHF2JH350 Fixed Annuities Exh 5 ndex GENERALE SA O2RNE8IBXP4R0TD8PU41,,03/16/2021,0,0,0.0
CLIQUET|A|C|PS|1Y|U5.5|D10|GF0 Equity/I CHASE BANK BHF2JH368 Fixed Annuities Exh 5 ndex N.A. 7H6GLXDRUGQFU57RNE97.,,03/15/2021,0,0,0.0
CLIQUET|A|C|PS|1Y|U6|D10|GF0 Equity/I CHASE BANK BHF2JH376 Fixed Annuities Exh 5 ndex N.A. 7H6GLXDRUGQFU57RNE97.,,03/15/2021,0,0,0.0
CLIQUET|A|C|PS|1Y|U6.25|D10|GF Equity/I CHASE BANK BHF2JH384 Fixed Annuities Exh 5 ndex N.A. 7H6GLXDRUGQFU57RNE97.,,03/15/2021,0,0,0.0
BHF2JH392 Fixed Annuities Exh 5 ndex GENERALE SA O2RNE8IBXP4R0TD8PU41,,03/15/2021,0,0,0.0
BHF2JH3B7 Fixed Annuities Exh 5 ndex GENERALE SA O2RNE8IBXP4R0TD8PU41,,03/15/2021,0,0,0.0
BHF2JH3D3 Fixed Annuities Exh 5 ndex GENERALE SA O2RNE8IBXP4R0TD8PU41,,03/15/2021,0,0,0.0
BHF2JH3F8 Fixed Annuities Exh 5 ndex GENERALE SA O2RNE8IBXP4R0TD8PU41,,03/15/2021,0,0,0.0
BHF2JH3L5 Fixed Annuities Exh 5 ndex GENERALE SA O2RNE8IBXP4R0TD8PU41,,03/15/2021,0,0,0.0
MAR19TSLAUSC@380 Equity/I CHASE BANK FEB27RTYC@2271 BHF2JH5V1 Fixed Annuities Exh 5 ndex N.A. 7H6GLXDRUGQFU57RNE97.,,03/10/2021,0,0,0.0
FEB27SPXC@3890 BHF2JH5W9 Fixed Annuities Exh 5 ndex INTERNATIONAL W22LROWP2IHZNBB6K528,,03/10/2021,0,0,0.0
JAN27SPXC@3800 BHF2JH5X7 Fixed Annuities Exh 5 ndex INTERNATIONAL W22LROWP2IHZNBB6K528,,03/10/2021,0,0,0.0
Year(s) Initial Current Year Hedge BHF2JVAG7 Macro Interest Rate Hedge Exh 5 Rate BANK PLC G5GSEF7VJP5I7OUK5573,,03/15/2021,0,0,0.0
12Mx20SWAPTIONSYNTH Interest BHF2JVAJ1 Macro Interest Rate Hedge Exh 5 Rate BANK NA KB1H1DSPRFMYMCUFXT09.,,03/15/2021,0,0,0.0
BHF2JVAK8 Macro Interest Rate Hedge Exh 5 Rate BANK AG 7LTWFZYICNSX8D621K86,,03/15/2021,0,0,0.0
BHF2JWN89 Macro Interest Rate Hedge Exh 5 Rate AGRICOLE CIB 1VUV7VQFKUOQSJ21A208,,03/16/2021,0,0,0.0
12Mx20SWAPTIONSYNTH Interest BHF2JWTL4 Macro Interest Rate Hedge Exh 5 Rate BANK NA KB1H1DSPRFMYMCUFXT09.,,03/16/2021,0,0,0.0
BHF2JWW63 Macro Interest Rate Hedge Exh 5 Rate BANK AG 7LTWFZYICNSX8D621K86,,03/16/2021,0,0,0.0
MAR19TSLAUSC@380 FEB23 Equity/I SACHS SPX C @ 1508.46 BME0LWK75 Variable Annuities Exh 5 ndex INTERNATIONAL W22LROWP2IHZNBB6K528,,02/05/2013,0,0,0.0
08-AUG-2022 Interest DEUTSCHE BME29FFG8 Macro Interest Rate Hedge N/A Rate BANK AG 7LTWFZYICNSX8D621K86,,08/08/2017,0,0,0.0
10-AUG-2021 Interest DEUTSCHE BME29M665 Macro Interest Rate Hedge N/A Rate BANK AG 7LTWFZYICNSX8D621K86,,08/10/2017,0,0,0.0
BME29PAA4 Premium at Maturity Interest Macro Interest Rate Hedge N/A Rate BANK AG 7LTWFZYICNSX8D621K86,,08/15/2017,0,0,0.0
BME2A19S8 Premium at Maturity Interest Macro Interest Rate Hedge N/A Rate BANK AG 7LTWFZYICNSX8D621K86,,08/23/2017,0,0,0.0
BME2A19U3 Premium at Maturity Interest Macro Interest Rate Hedge N/A Rate BANK AG 7LTWFZYICNSX8D621K86,,08/23/2017,0,0,0.0
MAR19TSLAUSC@380 FEB23 Equity/I SACHS SPX C @ 1508.46 BRSK3VKR3 Variable Annuities Exh 5 ndex INTERNATIONAL W22LROWP2IHZNBB6K528,,02/05/2013,0,0,0.0
MAR19TSLAUSC@380 FEB23 Equity/I SACHS SPX C @ 1520.27 BRSK3VKW2 Variable Annuities Exh 5 ndex INTERNATIONAL W22LROWP2IHZNBB6K528,,02/12/2013,0,0,0.0
2x20SWAPTIONSYNTH Interest BHF204QA3 Macro Interest Rate Hedge Exh 5 Rate N.A. 7H6GLXDRUGQFU57RNE97.,,03/04/2020,0,0,0.0
CLIQUET|A|C|PS|1Y|U7.0|D10.0|G Equity/I CREDIT SUISSE BHF21RPC8 Fixed Annuities Exh 5 ndex INTERNATIONAL E58DKGMJYYYJLN8C3868,,04/15/2020,0,0,0.0
BHF2299R2 Fixed Annuities Exh 5 ndex INTERNATIONAL W22LROWP2IHZNBB6K528,,04/23/2020,0,0,0.0
BHF22Q5K3 Macro Interest Rate Hedge Exh 5 Rate SERVICES I7331LVCZKQKX5T7XV54,,05/06/2020,0,0,0.0
PUT OPTION JUN21SPXP@2850 Equity/I SACHS BHF25A3T8 Variable Annuities Exh 5 ndex INTERNATIONAL W22LROWP2IHZNBB6K528,,07/01/2020,0,0,0.0
PUT OPTION JAN22SPXP@2950 Equity/I STANLEY & CO BHF25A3U5 Variable Annuities Exh 5 ndex INTL. PLC 4PQUHN3JPFGFNF3BB653,,07/08/2020,0,0,0.0
PUT OPTION JUN21SPXP@2850 Equity/I BHF25J1Q7 Variable Annuities Exh 5 ndex CITIBANK NA E57ODZWZ7FF32TWEFA76,,07/01/2020,0,0,0.0
PUT OPTION JUN21SPXP@2850 Equity/I CHASE BANK BHF25J1R5 Variable Annuities Exh 5 ndex N.A. 7H6GLXDRUGQFU57RNE97.,,07/01/2020,0,0,0.0
PUT OPTION JUN21SPXP@2850 Equity/I HSBC BANK USA BHF25K6C0 Variable Annuities Exh 5 ndex N.A. 1IE8VN30JCEQV1H4R804,,07/02/2020,0,0,0.0
PUT OPTION AUG21SPXP@3000 Equity/I BHF25T9B0 Variable Annuities Exh 5 ndex CITIBANK NA E57ODZWZ7FF32TWEFA76,,07/07/2020,0,0,0.0
PUT OPTION JUN21SPXP@2850 Equity/I STANLEY & CO BHF25TCE0 Variable Annuities Exh 5 ndex INTL. PLC 4PQUHN3JPFGFNF3BB653,,07/07/2020,0,0,0.0
PUT OPTION OCT21SPXP@2850 Equity/I STANLEY & CO BHF25XR47 Variable Annuities Exh 5 ndex INTL. PLC 4PQUHN3JPFGFNF3BB653,,07/08/2020,0,0,0.0
PUT OPTION OCT21SPXP@2850 Equity/I BHF25XSD6 Variable Annuities Exh 5 ndex BNP PARIBAS R0MUWSFPU8MPRO8K5P83,,07/08/2020,0,0,0.0
PUT OPTION AUG21SPXP@3000 Equity/I STANLEY & CO BHF26H4M6 Variable Annuities Exh 5 ndex INTL. PLC 4PQUHN3JPFGFNF3BB653,,07/07/2020,0,0,0.0
PUT OPTION SEP21SPXP@3397 Equity/I BARCLAYS BHF29CV28 Variable Annuities Exh 5 ndex BANK PLC G5GSEF7VJP5I7OUK5573,,09/11/2020,0,0,0.0
PUT OPTION SEP21SPXP@3057 Equity/I BARCLAYS BHF29CV44 Variable Annuities Exh 5 ndex BANK PLC G5GSEF7VJP5I7OUK5573,,09/11/2020,0,0,0.0
PUT OPTION SEP21RTYP@1397 Equity/I BARCLAYS BHF29CV51 Variable Annuities Exh 5 ndex BANK PLC G5GSEF7VJP5I7OUK5573,,09/11/2020,0,0,0.0
CLIQUET|A|C|PS|1Y|U6|D10|GF0 Equity/I CHASE BANK BHF2C9PG7 Fixed Annuities Exh 5 ndex N.A. 7H6GLXDRUGQFU57RNE97.,,11/17/2020,0,0,0.0
CLIQUET|A|C|PS|1Y|U5.5|D10|GF0 Equity/I CHASE BANK BHF2C9Q92 Fixed Annuities Exh 5 ndex N.A. 7H6GLXDRUGQFU57RNE97.,,11/17/2020,0,0,0.0
CLIQUET|A|C|PS|1Y|U6|D10|GF0 Equity/I CHASE BANK BHF2C9QB7 Fixed Annuities Exh 5 ndex N.A. 7H6GLXDRUGQFU57RNE97.,,11/17/2020,0,0,0.0
CLIQUET|A|C|PS|1Y|U6.25|D10|GF Equity/I CHASE BANK BHF2C9QD3 Fixed Annuities Exh 5 ndex N.A. 7H6GLXDRUGQFU57RNE97.,,11/17/2020,0,0,0.0
CLIQUET|A|C|PS|1Y|U6|D10|GF0 Equity/I CHASE BANK BHF2DHVC0 Fixed Annuities Exh 5 ndex N.A. 7H6GLXDRUGQFU57RNE97.,,12/10/2020,0,0,0.0
CLIQUET|A|C|PS|1Y|U5.5|D10|GF0 Equity/I CHASE BANK BHF2DHW47 Fixed Annuities Exh 5 ndex N.A. 7H6GLXDRUGQFU57RNE97.,,12/10/2020,0,0,0.0
CLIQUET|A|C|PS|1Y|U6|D10|GF0 Equity/I CHASE BANK BHF2DHWJ4 Fixed Annuities Exh 5 ndex N.A. 7H6GLXDRUGQFU57RNE97.,,12/10/2020,0,0,0.0
CLIQUET|A|C|PS|1Y|U6.25|D10|GF Equity/I CHASE BANK BHF2DHWL9 Fixed Annuities Exh 5 ndex N.A. 7H6GLXDRUGQFU57RNE97.,,12/10/2020,0,0,0.0
PUT OPTION DEC21SPXP@2592 Equity/I BARCLAYS BHF2DYDX7 Variable Annuities Exh 5 ndex BANK PLC G5GSEF7VJP5I7OUK5573,,12/17/2020,0,0,0.0
PUT OPTION DEC21SPXP@3147 Equity/I BANK OF BHF2DYE08 Variable Annuities Exh 5 ndex AMERICA NA B4TYDEB6GKMZO031MB27,,12/29/2020,0,0,0.0
PUT OPTION DEC21SPXP@3147 Equity/I BHF2EEFT7 Variable Annuities Exh 5 ndex CITIBANK NA E57ODZWZ7FF32TWEFA76,,12/29/2020,0,0,0.0
BHF2EZAS7 Fixed Annuities Exh 5 ndex INTERNATIONAL W22LROWP2IHZNBB6K528,,01/13/2021,0,0,0.0
BHF2EZCE6 Fixed Annuities Exh 5 ndex INTERNATIONAL W22LROWP2IHZNBB6K528,,01/13/2021,0,0,0.0
BHF2EZDF2 Fixed Annuities Exh 5 ndex INTERNATIONAL W22LROWP2IHZNBB6K528,,01/13/2021,0,0,0.0
BHF2EZDH8 Fixed Annuities Exh 5 ndex INTERNATIONAL W22LROWP2IHZNBB6K528,,01/13/2021,0,0,0.0
Year(s) Initial Current Year Hedge BHF2EZDJ4 Fixed Annuities Exh 5 ndex INTERNATIONAL W22LROWP2IHZNBB6K528,,01/13/2021,0,0,0.0
PUT OPTION SEP21SPXP@2829 Equity/I WELLS FARGO BHF2GTMX5 Variable Annuities Exh 5 ndex BANK NA KB1H1DSPRFMYMCUFXT09.,,02/10/2021,0,0,0.0
PUT OPTION SEP21SPXP@3657 Equity/I WELLS FARGO BHF2GTMZ0 Variable Annuities Exh 5 ndex BANK NA KB1H1DSPRFMYMCUFXT09.,,02/10/2021,0,0,0.0
PUT OPTION SEP21SPXP@2829 Equity/I BHF2GV8B4 Variable Annuities Exh 5 ndex CITIBANK NA E57ODZWZ7FF32TWEFA76,,02/11/2021,0,0,0.0
PUT OPTION SEP21SPXP@3657 Equity/I BHF2GV8F5 Variable Annuities Exh 5 ndex CITIBANK NA E57ODZWZ7FF32TWEFA76,,02/11/2021,0,0,0.0
PUT OPTION JUL21 SPX P @ Equity/I 1336.7 BME0LWJW2 Variable Annuities Exh 5 ndex CITIBANK NA E57ODZWZ7FF32TWEFA76,,07/01/2011,0,0,0.0
PUT OPTION OCT21 SPX P @ Equity/I SACHS 1226.88 BME0LWJY8 Variable Annuities Exh 5 ndex INTERNATIONAL W22LROWP2IHZNBB6K528,,10/21/2011,0,0,0.0
PUT OPTION JAN22 SPX P @ Equity/I SACHS 1312.35 BME0LWK42 Variable Annuities Exh 5 ndex INTERNATIONAL W22LROWP2IHZNBB6K528,,02/01/2017,0,0,0.0
PUT OPTION APR22 SPX P @ Equity/I SACHS 1387.85 BME0LWK59 Variable Annuities Exh 5 ndex INTERNATIONAL W22LROWP2IHZNBB6K528,,04/13/2012,0,0,0.0
PUT OPTION MAY22 SPX P @ Equity/I SACHS 1370.37 BME0LWK67 Variable Annuities Exh 5 ndex INTERNATIONAL W22LROWP2IHZNBB6K528,,05/04/2012,0,0,0.0
BME0UFF52 Premium at Equity/I Maturity 2024-12-27 Variable Annuities Exh 5 ndex GENERALE SA O2RNE8IBXP4R0TD8PU41,,10/24/2014,0,0,0.0
BME18WAN4 Premium at Equity/I Maturity 2022-06-29 Variable Annuities Exh 5 ndex INTL. PLC 4PQUHN3JPFGFNF3BB653,,06/26/2015,0,0,0.0
BME18WAP9 Premium at Equity/I Maturity 2022-06-28 Variable Annuities Exh 5 ndex INTL. PLC 4PQUHN3JPFGFNF3BB653,,06/26/2015,0,0,0.0
PUT OPTION NOV22 RTY P @ Equity/I SACHS 1170.12 BME1HS8U0 Variable Annuities Exh 5 ndex INTERNATIONAL W22LROWP2IHZNBB6K528,,11/19/2015,0,0,0.0
BME1LUZX4 Premium at Equity/I Maturity 2023-01-25 Variable Annuities Exh 5 ndex INTERNATIONAL W22LROWP2IHZNBB6K528,,02/01/2017,0,0,0.0
BME1QMA97 Premium at Equity/I Maturity 2021-04-14 Variable Annuities Exh 5 ndex INTERNATIONAL W22LROWP2IHZNBB6K528,,04/12/2016,0,0,0.0
BME1QMMJ2 Premium at Equity/I Maturity 2023-04-17 Variable Annuities Exh 5 ndex INTL. PLC 4PQUHN3JPFGFNF3BB653,,04/13/2016,0,0,0.0
BME1QSEW9 Premium at Equity/I Maturity 2021-04-21 Variable Annuities Exh 5 ndex INTERNATIONAL W22LROWP2IHZNBB6K528,,04/19/2016,0,0,0.0
BME1QUUG1 Premium at Equity/I Maturity 2021-04-23 Variable Annuities Exh 5 ndex CITIBANK NA E57ODZWZ7FF32TWEFA76,,04/21/2016,0,0,0.0
BME1RCH00 Premium at Equity/I Maturity 2021-05-17 Variable Annuities Exh 5 ndex INTL. PLC 4PQUHN3JPFGFNF3BB653,,05/13/2016,0,0,0.0
BME1SSUL3 Premium at Equity/I Maturity 2021-07-12 Variable Annuities Exh 5 ndex N.A. 1IE8VN30JCEQV1H4R804,,07/08/2016,0,0,0.0
BME1SXGV6 Premium at Equity/I Maturity 2021-07-16 Variable Annuities Exh 5 ndex GENERALE SA O2RNE8IBXP4R0TD8PU41,,07/14/2016,0,0,0.0
BME1UA776 Premium at Equity/I Maturity 2021-08-25 Variable Annuities Exh 5 ndex N.A. 7H6GLXDRUGQFU57RNE97.,,08/23/2016,0,0,0.0
BME1VH7U9 Premium at Equity/I Maturity 2021-10-12 Variable Annuities Exh 5 ndex INTL. PLC 4PQUHN3JPFGFNF3BB653,,10/07/2016,0,0,0.0
@ 1676 BME1VKR48 Premium at Equity/I Maturity 2021-10-13 Variable Annuities Exh 5 ndex N.A. 7H6GLXDRUGQFU57RNE97.,,10/11/2016,0,0,0.0
BME1VKR55 Premium at Equity/I Maturity 2021-10-13 Variable Annuities Exh 5 ndex N.A. 7H6GLXDRUGQFU57RNE97.,,10/11/2016,0,0,0.0
BME1X3X39 Premium at Equity/I Maturity 2021-11-05 Variable Annuities Exh 5 ndex INTL. PLC 4PQUHN3JPFGFNF3BB653,,11/03/2016,0,0,0.0
BME1Z6AU5 Premium at Equity/I Maturity 2021-12-08 Variable Annuities Exh 5 ndex INTL. PLC 4PQUHN3JPFGFNF3BB653,,12/06/2016,0,0,0.0
BME21P526 Premium at Equity/I Maturity 2022-02-04 Variable Annuities Exh 5 ndex INTERNATIONAL E58DKGMJYYYJLN8C3868,,02/02/2017,0,0,0.0
BME21P5E0 Premium at Equity/I Maturity 2021-09-24 Variable Annuities Exh 5 ndex INTL. PLC 4PQUHN3JPFGFNF3BB653,,02/01/2017,0,0,0.0
BME23RRR1 Premium at Equity/I Maturity 2022-03-23 Variable Annuities Exh 5 ndex N.A. 7H6GLXDRUGQFU57RNE97.,,03/20/2017,0,0,0.0
PUT OPTION MAR22 SPX P @ Equity/I SACHS 2378.75 BME23SD45 Variable Annuities Exh 5 ndex INTERNATIONAL W22LROWP2IHZNBB6K528,,03/20/2017,0,0,0.0
BME249HW0 Premium at Equity/I Maturity 2022-04-01 Variable Annuities Exh 5 ndex INTERNATIONAL W22LROWP2IHZNBB6K528,,03/30/2017,0,0,0.0
BME249HZ3 Premium at Equity/I Maturity 2022-04-01 Variable Annuities Exh 5 ndex GENERALE SA O2RNE8IBXP4R0TD8PU41,,03/30/2017,0,0,0.0
BME24DLY2 Premium at Equity/I Maturity 2022-04-05 Variable Annuities Exh 5 ndex BANK PLC G5GSEF7VJP5I7OUK5573,,04/03/2017,0,0,0.0
BME24DM21 Premium at Equity/I Maturity 2022-04-05 Variable Annuities Exh 5 ndex BNP PARIBAS R0MUWSFPU8MPRO8K5P83,,04/03/2017,0,0,0.0
PUT OPTION SEP22 SPX P @ Equity/I CHASE BANK 1469.75 BME2T9CD0 Variable Annuities Exh 5 ndex N.A. 7H6GLXDRUGQFU57RNE97.,,09/10/2018,0,0,0.0
PUT OPTION MAR23 RTY P @ Equity/I SACHS 930.07 BRSK3V6M0 Variable Annuities Exh 5 ndex INTERNATIONAL W22LROWP2IHZNBB6K528,,03/06/2013,0,0,0.0
BRSK3VFQ1 Periodical Equity/I Variable Annuities Exh 5 ndex N.A. 7H6GLXDRUGQFU57RNE97.,,04/21/2011,0,0,0.0
PUT OPTION APR21 SPX P @ Equity/I SACHS 1335.66 BRSK3VFR9 Variable Annuities Exh 5 ndex INTERNATIONAL W22LROWP2IHZNBB6K528,,04/21/2011,0,0,0.0
PUT OPTION JUN21 SPX P @ Equity/I BARCLAYS 1282.9 BRSK3VGL1 Variable Annuities Exh 5 ndex BANK PLC G5GSEF7VJP5I7OUK5573,,06/27/2011,0,0,0.0
PUT OPTION JUL21 SPX P @ Equity/I CHASE BANK 1336.7 BRSK3VGN7 Variable Annuities Exh 5 ndex N.A. 7H6GLXDRUGQFU57RNE97.,,07/01/2011,0,0,0.0
PUT OPTION AUG21 SPX P @ Equity/I SACHS 1184.48 BRSK3VGQ0 Variable Annuities Exh 5 ndex INTERNATIONAL W22LROWP2IHZNBB6K528,,08/12/2011,0,0,0.0
PUT OPTION OCT21 SPX P @ Equity/I SACHS 1211.41 BRSK3VGU1 Variable Annuities Exh 5 ndex INTERNATIONAL W22LROWP2IHZNBB6K528,,10/12/2011,0,0,0.0
PUT OPTION OCT21 SPX P @ Equity/I SACHS 1226.88 BRSK3VGW7 Variable Annuities Exh 5 ndex INTERNATIONAL W22LROWP2IHZNBB6K528,,10/21/2011,0,0,0.0
PUT OPTION OCT21 SPX P @ Equity/I SACHS 1252.43 BRSK3VGX5 Variable Annuities Exh 5 ndex INTERNATIONAL W22LROWP2IHZNBB6K528,,10/24/2011,0,0,0.0
PUT OPTION NOV21 SPX P @ Equity/I SACHS 1226.2 BRSK3VH48 Variable Annuities Exh 5 ndex INTERNATIONAL W22LROWP2IHZNBB6K528,,11/17/2011,0,0,0.0
PUT OPTION NOV21 SPX P @ Equity/I SACHS 1245.55 BRSK3VH71 Variable Annuities Exh 5 ndex INTERNATIONAL W22LROWP2IHZNBB6K528,,11/30/2011,0,0,0.0
PUT OPTION JAN22 SPX P @ Equity/I SACHS 1315.79 BRSK3VHC0 Variable Annuities Exh 5 ndex INTERNATIONAL W22LROWP2IHZNBB6K528,,01/23/2012,0,0,0.0
PUT OPTION JAN22 SPX P @ Equity/I SACHS 1312.35 BRSK3VHD8 Variable Annuities Exh 5 ndex INTERNATIONAL W22LROWP2IHZNBB6K528,,01/24/2012,0,0,0.0
