name,state,date_acquired,book_value,investment_income,ownership_pct
Admini- Date Type Actual Cost Additional for ACCEL LONDON VI L.P. LONDON,GBR,06/18/2019,0,0,0.436
ADVENT INTERNATIONAL GPE X LP BOSTON,MA,09/26/2022,0,0,0.298
AEA MEZZANINE FUND IV LP NEW YORK,NY,07/23/2018,0,0,5.075
AFFINITY ASIA PACI FUND IV LP SINGAPORE,SGP,03/20/2013,0,0,0.951
AFFINITY ASIA PACIFIC FD V LP HONG KONG,CHN,12/10/2018,0,0,0.585
ALCHEMY SPECIAL OPP FUND IV LP LONDON,GBR,12/11/2019,0,0,1.097
AMERICAN INDUSTRIAL CAP VII LP NEW YORK,NY,10/22/2019,0,0,0.567
AMERICAN SECURITIES VII LP NEW YORK,NY,12/10/2014,0,0,0.439
AMERICAN SECURITIES VIII LP NEW YORK,NY,03/15/2019,0,0,0.334
APOLLO INVESTMENT FUND X LP NEW YORK,NY,08/14/2023,0,0,0.243
AQUILINE FIN SERVICES FD V LP NEW YORK,NY,06/23/2023,0,0,1.018
AUDAX PRIVATE EQUITY FUND VI BOSTON,MA,08/21/2019,0,0,0.624
BALANCE POINT CAP PARTNERS V WESTPORT,CT,06/29/2021,0,0,4.233
BARING ASIA PE FUND VI LP HONG KONG,CHN,07/25/2014,0,0,0.088
BDCM OPPORTUNITY FUND IV LP GREENWICH,CT,02/04/2015,0,0,0.286
BESSEMER VENTR PTS XI INSTL LP SAN FRANCISCO,CA,03/22/2021,0,0,0.462
BESSEMER VENTURE PARTNERS X IN LARCHMONT,NY,11/30/2018,0,0,0.933
BLACKSTONE CAP OPPS FD IV LP NEW YORK,NY,03/15/2021,0,0,0.632
BOND CAPITAL FUND I LP SAN FRANCISCO,CA,05/30/2019,0,0,0.934
BRENTWOOD ASSOCIATES PE V LP LOS ANGELES,CA,06/12/2013,0,0,1.306
BRENTWOOD ASSOCIATES PE VI LP LOS ANGELES,CA,12/06/2016,0,0,0.629
CAPITAL INTERNATIONAL PE VI LP LOS ANGELES,CA,03/24/2011,0,0,0.644
CARLYLE EUR TECH PRTRS IV SCSP WASHINGTON,DC,01/02/2020,0,0,0.786
CCMP CAPITAL INVESTORS III LP NEW YORK,NY,07/02/2014,0,0,0.26
CINVEN FIFTH FUND L.P. LONDON,GBR,11/15/2011,0,0,0.081
CINVEN SEVENTH FUND LONDON,GBR,04/07/2020,0,0,0.621
CLEARLAKE CAPITAL V LP LOS ANGELES,CA,02/01/2018,0,0,0.315
CLEARLAKE CAPITAL PARTNERS VI SANTA MONICA,CA,05/22/2020,0,0,0.193
CLEARLAKE CAPITAL PARTNERS VII SANTA MONICA,CA,04/26/2022,0,0,0.178
COURT SQUARE CAPITAL III LP NEW YORK,NY,12/27/2011,0,0,0.405
CRESCENT DIRECT LENDING FD LP NEW YORK,NY,03/08/2022,0,0,1.724
CRV SELECT FUND I LP PALO ALTO,CA,05/19/2021,0,0,1.466
CRV SELECT II LP PALO ALTO,CA,03/29/2022,0,0,1.184
CRV XIX LP PALO ALTO,CA,06/10/2022,0,0,0.893
CVC CAP ASIA PACIFIC IV LP GEORGE TOWN,CYM,05/13/2014,0,0,0.349
CVC CAP ASIA PACIFIC V LP JERSEY,CYM,12/08/2020,0,0,0.443
CVC CAPITAL PARTNERS VI L.P. LONDON,GBR,06/28/2013,0,0,0.067
ENCAP ENERGY CAPITAL XI LP HOUSTON,TX,12/12/2016,0,0,0.276
EPIC FUND I-B SLP LUXEMBURG,LUX,05/19/2021,0,0,0.055
EQUISTONE EUROPE FUND VI LP LONDON,GBR,07/09/2018,0,0,0.526
ETHOS CAPITAL INVESTMENTS LP NEWTON,MA,10/25/2021,0,0,3.996
FOUNDATION CAP LEADERSHIP III NORRISTOWN,PA,10/18/2021,0,0,0.877
FOUNDATION CAPITAL IX L.P. SAN FRANCISCO,CA,01/30/2019,0,0,2.578
FOUNDATION CAPITAL X L.P. EAST NORRITON,PA,08/20/2021,0,0,1.574
FRANCISCO PARTNERS VI L.P. MENLO PARK,CA,06/30/2022,0,0,0.356
FURTHER GLOBAL CAP PTNRS II LP NEW YORK,NY,08/17/2022,0,0,5.978
FURTHER GLOBAL CAP PTNRS L.P. NEW YORK,NY,01/29/2020,0,0,7.364
GEN CATALYST GRP X GROWTH VENT PALO ALTO,CA,06/30/2022,0,0,0.61
GEN CATALYST GRP XI-CREATION CAMBRIDGE,MA,03/30/2022,0,0,0.258
GEN CATALYST GRP XI-ENDURANCE CAMBRIDGE,MA,03/18/2022,0,0,0.269
GEN CATALYST GRP XI-FEEDER CAMBRIDGE,MA,03/18/2022,0,0,0.651
GLOBAL INFRASTRUCTURE DEBT FUN NEW YORK,NY,06/30/2021,0,0,4.112
GLOBAL INFRASTRUCTURE PT IV LP NEW YORK,NY,10/10/2019,0,0,0.432
GREEN EQUITY INVESTORS IX LP LOS ANGELES,CA,08/15/2023,0,0,0.083
GREEN EQUITY INVESTORS VI LP LOS ANGELES,CA,10/18/2011,0,0,0.263
GREEN EQUITY INVESTORS VII LP LOS ANGELES,CA,02/16/2016,0,0,0.063
Admini- Date Type Actual Cost Additional for GSO CAP OPPS FD III CO-INV LP NEW YORK,NY,01/09/2020,0,0,0.033
HAMILTONLANESECONDARYFUND VI-A CONSHOHOCKEN,PA,12/30/2022,0,0,9.855
HG SATURN L.P. LONDON,GBR,05/04/2018,0,0,0.954
HPS STRATEGIC INV PTNRS V LP NEW YORK,NY,08/04/2022,0,0,0.461
ICG N AMERICAN PVT DEBT II LP NEW YORK,NY,02/25/2019,0,0,3.187
ICONIQ STRATEGIC PRTNRS VI LP SAN FRANCISCO,CA,09/09/2021,0,0,0.185
INDUSTRIAL GROWTH IV LP SAN FRANCISCO,CA,05/17/2011,0,0,1.707
INDUSTRIAL GROWTH V LP SAN FRANCISCO,CA,04/08/2016,0,0,1.509
INFLEXION BUYOUT FUND V LP LONDON,GBR,06/18/2018,0,0,0.573
INFLEXION CAPITAL FUND II LP LONDON,GBR,06/18/2018,0,0,0.536
INTEGRUM CAPITAL PARTNERS LP NEW YORK,NY,09/28/2022,0,0,0.513
JADE EQUITY INVESTORS II LP LOS ANGELES,CA,09/01/2023,0,0,0.438
KPCB DIGITAL GROWTH III LLC NEW YORK,NY,06/13/2016,0,0,0.787
L CATTERTON IX L.P. GREENWICH,CT,04/14/2021,0,0,0.474
LINZOR CAPITAL PARTNERS II LP SANTIAGO,CHL,07/23/2010,0,0,4.224
LUMINATE CAPITAL PARTNERS III SAN FRANCISCO,CA,06/09/2021,0,0,0.964
MARANON MEZZANINE FUND II LP CHICAGO,IL,04/30/2013,0,0,2.68
MERITECH FRANCHISE FUND LP PALO ALTO,CA,06/08/2021,0,0,3.006
METLIFE MID MKT PVT DBT FD LP WHIPPANY,NJ,07/24/2018,0,0,35.834
MIDDLEGROUND PARTNERS II L.P. LEXINGTON,KY,11/15/2021,0,0,0.675
NB CREDIT OPPORTUNITIES FD II NEW YORK,NY,04/12/2023,0,0,0.129
NB MEMORIAL LP NEW YORK,NY,12/31/2021,0,0,0.445
NEW ENTERPRISE ASSOC 18 LP CHEVY CHASE,MD,02/14/2022,0,0,0.328
NEW ENTERPRISE ASSOCIATES 17LP MENLO PARK,CA,07/19/2019,0,0,0.393
NORTH HAVEN CREDIT PTNRS III NEW YORK,NY,08/19/2021,0,0,1.538
OAK HC/FT PARTNERS V LP GREENWICH,CT,07/22/2022,0,0,0.495
ODYSSEY INVESTMENT V LP NEW YORK,NY,06/24/2014,0,0,0.477
OLYMPUS GROWTH FUND VII L.P. STAMFORD,CT,01/15/2019,0,0,0.73
PA DIRECT CREDIT OPPORT II LP DARIEN,CT,10/04/2016,0,0,1.583
PAG ASIA III L.P. HONG KONG,CHN,09/17/2019,0,0,0.2
PAI EUROPE VII-1 S.L.P. PARIS,FRA,09/23/2019,0,0,0.243
PAI EUROPE VII-1 SCSP LP PARIS,FRA,09/23/2019,0,0,0.276
PATRIA-BRAZILIAN PE FD VI LP SAO PAULO,BRA,12/14/2018,0,0,0.371
PERMIRA VII L.P. LONDON,GBR,02/05/2020,0,0,0.245
PLATINUM EQUITY CAPITAL II LP LOS ANGELES,CA,08/15/2007,0,0,0.608
POLISH ENTERPRISE FUND VIII LP WARSAW POL ENTERPRISE INVESTORS .,,09/08/2017,0,0,1.963
PPC III LP NEW YORK,NY,03/24/2021,0,0,1.098
PUBLIC PENSION CAPITAL LLC NEW YORK,NY,07/10/2014,0,0,0.687
QUAD-C PARTNERS X L.P. CHARLOTTESVILLE,VA,12/27/2021,0,0,1.199
QUANTUM ENERGY PARTNERS VII LP HOUSTON,TX,09/01/2017,0,0,0.364
QUANTUM ENERGY VII CO INVT LP HOUSTON,TX,09/01/2017,0,0,0.298
RECOGNIZE PARTNERS I L.P NEW YORK,NY,10/01/2021,0,0,0.785
REDPOINT VENTURES IX LP MENLO PARK,CA,10/03/2022,0,0,1.217
SCALE VENTURE PARTNERS VI L.P. FOSTER,CA,09/21/2018,0,0,2.181
SELECT OPPS V NEW YORK,NY,05/03/2022,0,0,4.977
SEQUOIA CAP US VENTURE 2010 LP MENLO PARK,CA,03/25/2010,0,0,0.699
SILVER LAKE PARTNERS III LP MENLO PARK,CA,02/28/2007,0,0,0.138
SILVER LAKE PARTNERS IV LP MENLO PARK,CA,09/07/2012,0,0,0.058
SILVER LAKE PARTNERS V LP MENLO PARK,CA,06/12/2018,0,0,0.141
SILVER LAKE PARTNERS VI LP MENLO PARK,CA,01/06/2021,0,0,0.1
TCV XI L.P. NEW YORK,NY,02/01/2021,0,0,0.413
THE RESOLUTE FUND V LP NEW YORK,NY,09/07/2021,0,0,0.373
THE RESOLUTE II CONTIN. FUND NEW YORK,NY,06/28/2022,0,0,0.357
THE VERITAS CAP FUND VIII LP NEW YORK,NY,07/01/2022,0,0,0.188
THOMAS H LEE EQ FD IX LP BOSTON,MA,01/21/2022,0,0,0.288
THOMAS H LEE EQ FD IX LP-SCND BOSTON,MA,01/21/2022,0,0,0.192
Admini- Date Type Actual Cost Additional for TOWER SQUARE CAPITAL III LP SPRINGFIELD,MA,09/29/2008,0,0,1.198
TOWERBROOK INVESTORS IV LP GEORGE TOWN,CYM,02/05/2013,0,0,0.311
TPG ASIA VI LP FORT WORTH,TX,02/01/2013,0,0,0.374
TRIVEST FUND VI L.P. CORAL GABLES,FL,02/08/2019,0,0,0.926
VERITAS CAP VANTAGE FUND LP NEW YORK,NY,07/01/2021,0,0,1.289
VERITAS CAPITAL FUND VII L.P. NEW YORK,NY,04/15/2020,0,0,0.433
VIP III LP LONDON,GBR,06/20/2017,0,0,0.313
WCAS XIII L.P. NEW YORK,NY,03/12/2019,0,0,0.695
METLIFE CORE PROP FUND LP MORRISTOWN,NJ,11/01/2013,0,0,0.063
BLIC PROPERTY VENTURES LLC WILMINGTON,DE,04/08/2022,0,0,100.0
ML COMMERCIAL MORTGE INC FD MORRISTOWN,NJ,10/02/2015,0,0,0.055
PCCP CREDIT X LP LOS ANGELES,CA,03/30/2022,0,0,2.936
