name,state,date_acquired,book_value,investment_income,ownership_pct
Admini- Date Type Actual Cost Additional for ACCEL INDIA V LP BANGALORE,IND,11/07/2016,0,0,0.189
ADVENT INTL GPE IX-A SCSP BOSTON,MA,10/22/2019,0,0,0.525
ADVENT INTL GPE IX-D SCSP BOSTON,MA,10/15/2019,0,0,1.677
AEA MEZZANINE FUND III LP NEW YORK,NY,03/15/2013,0,0,1.499
AEA MEZZANINE FUND IV LP NEW YORK,NY,07/23/2018,0,0,6.045
AFFINITY ASIA PACI FUND IV LP SINGAPORE,SGP,03/20/2013,0,0,0.951
AFFINITY ASIA PACIFIC FD V LP HONG KONG,CHN,12/10/2018,0,0,0.585
AMERICAN INDUSTRIAL CAP IV LP SAN FRANCISCO,CA,04/25/2008,0,0,4.388
AMERICAN INDUSTRIAL CAP VII LP NEW YORK,NY,10/22/2019,0,0,0.618
AMERICAN SECURITIES VII LP NEW YORK,NY,12/10/2014,0,0,0.484
AMERICAN SECURITIES VIII LP NEW YORK,NY,03/15/2019,0,0,0.278
AUDAX DIR LENDING SOLN FD LP NEW YORK,NY,10/26/2018,0,0,6.597
AUDAX PRIVATE EQUITY FUND VI BOSTON,MA,08/21/2019,0,0,0.507
BALANCE POINT CAP PARTNERS V WESTPORT,CT,06/29/2021,0,0,8.322
BATTERY VENTURES XIII SIDE FD BOSTON,MA,04/27/2020,0,0,0.518
"BATTERY VENTURES XIII, LP BOSTON",MA,04/27/2020,0,0,0.521
BC EUROPEAN CAPITAL IX L.P. ST. PETER PORT,GBR,11/23/2010,0,0,0.177
BEHRMAN CAPITAL IV LP NEW YORK,NY,06/29/2007,0,0,24.15
BESSEMER VENTR PTS CNTRY FD II SAN FRANCISCO,CA,11/01/2021,0,0,0.554
BESSEMER VENTR PTS XI INSTL LP SAN FRANCISCO,CA,03/22/2021,0,0,0.294
BESSEMER VENTURE PARTNERS X IN LARCHMONT,NY,11/30/2018,0,0,0.795
BLACKROCK DLF IX ICAV-BLACKROC DUBLIN,IRL,06/28/2021,0,0,6.37
BLACKSTONE CAPITAL OPPORTUNITI NEW YORK,NY,03/15/2021,0,0,0.4
BRENTWOOD ASSOCIATES PE V LP LOS ANGELES,CA,06/12/2013,0,0,0.247
BRIDGEPOINT EUROPE VI L.P. LONDON GBR BE,VI,03/28/2019,0,0,0.281
CAPITAL INTERNATIONAL PE VI LP LOS ANGELES,CA,03/24/2011,0,0,0.712
CARLYLE EUR TECH PTNRS IV S.C WASHINGTON,DC,01/02/2020,0,0,0.829
CARLYLE PARTNERS VI LP WASHINGTON,DC,02/19/2013,0,0,0.005
CARLYLE PARTNERS VII L.P. WASHINGTON,DC,12/19/2018,0,0,0.209
CHRYSCAPITAL VIII LLC PORT LOUIS,MUS,03/30/2020,0,0,1.902
CINVEN SEVENTH FUND LONDON,GBR,04/07/2020,0,0,0.18
CLEARLAKE CAPITAL V LP LOS ANGELES,CA,02/01/2018,0,0,0.326
COURT SQUARE CAPITAL III LP NEW YORK,NY,12/27/2011,0,0,0.366
CRESCENT DIRECT LENDING FD LP NEW YORK,NY,03/08/2022,0,0,1.724
CRV SELECT II LP PALO ALTO,CA,03/29/2022,0,0,1.2
DENHAM OIL & GAS FUND LP BOSTON,MA,04/28/2017,0,0,2.365
DYAL CAPITAL PARTNERS IV LP NEW YORK,NY,06/11/2018,0,0,1.982
ENCAP ENERGY CAPITAL XI LP HOUSTON,TX,12/12/2016,0,0,0.296
ENCAP ENERGY CAPITAL FUND X LP HOUSTON,TX,02/05/2015,0,0,0.248
ENCAP ENERGY CAPITAL IX HOUSTON,TX,01/04/2013,0,0,0.254
EQUISTONE EUROPE FUND V LP LONDON,GBR,01/22/2015,0,0,0.432
EQUISTONE PTNRS EUR FD IV B LP LONDON,GBR,11/14/2011,0,0,0.745
FFL CAPITAL PARTNERS IV LP SAN FRANCISCO,CA,12/03/2013,0,0,1.554
FOUNDATION CAP LEADERSHIP III NORRISTOWN,PA,10/18/2021,0,0,0.955
FOUNDATION CAPITAL IX L.P. SAN FRANCISCO,CA,01/30/2019,0,0,2.545
FOUNDATION CAPITAL X L.P. EAST NORRITON,PA,08/20/2021,0,0,1.585
FRIEDMAN FLEISCHER LOWE III LP SAN FRANCISCO,CA,12/06/2007,0,0,1.544
FURTHER GLOBAL CAP PTNRS L.P. NEW YORK,NY,01/29/2020,0,0,6.322
GEN CATALYST GRP XI-CREATION CAMBRIDGE,MA,03/30/2022,0,0,0.3
GEN CATALYST GRP XI-ENDURANCE CAMBRIDGE,MA,03/18/2022,0,0,0.3
GEN CATALYST GRP XI-FEEDER CAMBRIDGE,MA,03/18/2022,0,0,12.987
GEN CATALYST GRP XI-IGNITION CAMBRIDGE,MA,03/29/2022,0,0,0.3
GLOBAL INFRASTRUCTURE DEBT FUN NEW YORK,NY,06/30/2021,0,0,4.112
GLOBAL INFRASTRUCTURE PT II LP NEW YORK,NY,09/15/2011,0,0,0.299
GLOBAL INFRASTRUCTURE PT IV LP NEW YORK,NY,10/10/2019,0,0,0.429
GREEN EQUITY INVESTORS VI LP LOS ANGELES,CA,10/18/2011,0,0,0.256
GREEN EQUITY INVESTORS VII LP LOS ANGELES,CA,02/16/2016,0,0,0.064
Admini- Date Type Actual Cost Additional for GRYPHON HERITAGE PARTNERS L.P. ARLINGTON,VA,12/15/2020,0,0,4.763
GSO CAP OPPORTUNITIESIII COINV NEW YORK,NY,04/26/2016,0,0,0.202
GSO CAP OPPS FD III CO-INV LP NEW YORK,NY,01/09/2020,0,0,0.037
HARVEST PARTNERS VI LP NEW YORK,NY,10/05/2011,0,0,1.29
HG CAPITAL 8 D L.P. LONDON,GBR,04/03/2018,0,0,0.372
HG SATURN L.P. LONDON,GBR,05/04/2018,0,0,0.97
ICG EUROPE FUND VIII SCSP LONDON,GBR,09/24/2021,0,0,0.333
ICG N AMERICAN PVT DEBT II LP NEW YORK,NY,02/25/2019,0,0,3.185
ICG N AMERICAN PVT DEBT LP NEW YORK,NY,08/22/2014,0,0,2.373
INCLINE ASCENT FUND LP PITTSBURGH,PA,03/01/2022,0,0,2.0
INDUSTRIAL GROWTH IV LP SAN FRANCISCO,CA,05/17/2011,0,0,1.71
INDUSTRIAL GROWTH V LP SAN FRANCISCO,CA,04/08/2016,0,0,1.569
INFLEXION BUYOUT FUND V LP LONDON,GBR,06/18/2018,0,0,0.593
INSIGHT PARTNERS XII L.P. NEW YORK,NY,07/15/2021,0,0,0.183
KOHLBERG INVESTORS VIII LP MOUNT KISCO,NY,07/25/2016,0,0,0.915
KPCB DIGITAL GROWTH III LLC NEW YORK,NY,06/13/2016,0,0,0.914
L CATTERTON IX L.P. GREENWICH,CT,04/14/2021,0,0,0.28
LANDMARK EQU PARTNERS XVI LP SIMSBURY,CT,12/07/2018,0,0,0.6
LIGHTSPEEDVENTUREPTSSEL III LP MENLO PARK,CA,06/25/2018,0,0,0.518
LINZOR CAPITAL PARTNERS III LP SANTIAGO,CHL,02/26/2015,0,0,0.948
LUMINATE CAPITAL PARTNERS III SAN FRANCISCO,CA,06/09/2021,0,0,1.42
MARANON MEZZANINE FUND II LP CHICAGO,IL,04/30/2013,0,0,2.645
MARTELLO RE LP CHARLOTTE,NC,12/30/2021,0,0,6.203
MERITECH FRANCHISE FUND LP PALO ALTO,CA,06/08/2021,0,0,2.995
MIDDLEGROUND MOBILITY OPPFD LP LEXINGTON,KY,08/09/2021,0,0,1.25
MIDDLEGROUND PARTNERS II L.P. LEXINGTON,KY,11/15/2021,0,0,0.909
NAUTIC PARTNERS IX LP PROVIDENCE,RI,02/21/2020,0,0,1.449
NB MEMORIAL LP NEW YORK,NY,12/31/2021,0,0,9.852
NB SELECT OPPS FUND IV LP NEW YORK,NY,05/04/2021,0,0,10.319
NEW ENTERPRISE ASSOC 16 LP MENLO PARK,CA,04/05/2017,0,0,0.254
NEW ENTERPRISE ASSOC 18 LP CHEVY CHASE,MD,02/14/2022,0,0,0.345
NEW ENTERPRISE ASSOCIATES 17LP MENLO PARK,CA,07/19/2019,0,0,0.329
NEWVIEW CAPITAL FUND II L.P. BURLINGAME,CA,10/23/2020,0,0,6.366
NORTH HAVEN CREDIT PTNRS III NEW YORK,NY,08/19/2021,0,0,1.552
OAK HC/FT PARTNERS IV L.P. GREENWICH,CT,04/27/2021,0,0,1.327
OAKTREE OPPORTUNITIES FD XI LP LOS ANGELES,CA,08/21/2020,0,0,0.162
ODYSSEY INVESTMENT V LP NEW YORK,NY,06/24/2014,0,0,0.465
PA DIRECT CREDIT OPPORT II LP DARIEN,CT,10/04/2016,0,0,1.933
PAG ASIA III L.P. HONG KONG,CHN,09/17/2019,0,0,0.157
PAI EUROPE VI PARIS,FRA,07/24/2013,0,0,0.55
PAI EUROPE VII-1 S.L.P. PARIS,FRA,09/23/2019,0,0,0.235
PAI EUROPE VII-1 SCSP LP PARIS,FRA,09/23/2019,0,0,0.19
PATRIA BRAZILIAN PE IV LP SAO PAULO,BRA,07/26/2011,0,0,0.69
PATRIA BRAZILIAN PE V LP SAO PAULO,BRA,05/19/2014,0,0,1.127
PATRIA-BRAZILIAN PE FD VI LP SAO PAULO,BRA,12/14/2018,0,0,0.253
PERMIRA VII L.P. LONDON,GBR,02/05/2020,0,0,0.235
POLISH ENTERPRISE FUND VIII LP WARSAW POL ENTERPRISE INVESTORS .,,09/08/2017,0,0,2.106
PPC III LP NEW YORK,NY,03/24/2021,0,0,1.148
PRIMAVERA CAPITAL GROUP II LP HONG KONG,CHN,10/14/2014,0,0,1.269
PUBLIC PENSION CAPITAL LLC NEW YORK,NY,07/10/2014,0,0,0.923
QUANTUM ENERGY PARTNERS VII LP HOUSTON,TX,09/01/2017,0,0,0.407
QUANTUM ENERGY VII CO INVT LP HOUSTON,TX,09/01/2017,0,0,0.361
RECOGNIZE PARTNERS I L.P NEW YORK,NY,10/01/2021,0,0,0.845
RIVERSIDE FUND V CF L.P. BOSTON,MA,03/18/2021,0,0,1.014
RIVERSTONE GLOB ENER &PWR V LP NEW YORK,NY,01/12/2012,0,0,0.357
SCALE VENTURE PARTNERS VI L.P. FOSTER,CA,09/21/2018,0,0,2.129
SILVER LAKE PARTNERS III LP MENLO PARK,CA,02/28/2007,0,0,0.878
Admini- Date Type Actual Cost Additional for SILVER LAKE PARTNERS IV LP MENLO PARK,CA,09/07/2012,0,0,0.057
SILVER LAKE PARTNERS V LP MENLO PARK,CA,06/12/2018,0,0,0.137
SILVER LAKE PARTNERS VI LP MENLO PARK,CA,01/06/2021,0,0,0.095
TCV XI L.P. NEW YORK,NY,02/01/2021,0,0,0.252
THE RESOLUTE FUND V LP NEW YORK,NY,09/07/2021,0,0,0.36
THE VERITAS CAPITAL FUND VI LP NEW YORK,NY,12/08/2016,0,0,0.283
THOMA BRAVO FUND XIV L.P. SAN FRANCISCO,CA,04/15/2021,0,0,0.245
THOMAS H LEE EQ FD IX LP BOSTON,MA,01/21/2022,0,0,0.175
THOMAS H LEE EQ FD IX LP-SCND BOSTON,MA,01/21/2022,0,0,0.2
TOWER SQUARE CAPITAL III LP SPRINGFIELD,MA,09/29/2008,0,0,1.085
TOWERBROOK INVESTORS IV LP GEORGE TOWN,CYM,02/05/2013,0,0,0.306
TPG ASIA VI LP FORT WORTH,TX,02/01/2013,0,0,0.358
TRIDENT VII LP GREENWICH,CT,09/12/2016,0,0,0.296
VERITAS CAP VANTAGE FUND LP NEW YORK,NY,07/01/2021,0,0,1.288
VERITAS CAPITAL FUND VII L.P. NEW YORK,NY,04/15/2020,0,0,0.43
VISTRIA FUND IV LP CHICAGO,IL,10/14/2021,0,0,0.5
WCAS XIII L.P. NEW YORK,NY,03/12/2019,0,0,0.666
BROOKFIELDBRAZIL AGRILND 1 LLC RIO DE JANEIRO,BRA,04/10/2010,0,0,1.515
BROOKFIELDBRAZIL AGRILND 2 LLC RIO DE JANEIRO,BRA,04/10/2010,0,0,1.515
BROOKFIELDBRAZIL AGRILND 3 LLC RIO DE JANEIRO,BRA,04/10/2010,0,0,1.515
BROOKFIELDBRAZIL AGRILND 4 LLC RIO DE JANEIRO,BRA,04/10/2010,0,0,1.515
METLIFE CORE PROP FUND LP MORRISTOWN,NJ,11/01/2013,0,0,0.066
ML COMMERCIAL MORTGE INC FD MORRISTOWN,NJ,10/02/2015,0,0,0.055
MORTGAGE FUND IVC LP CORAL GABLES,FL,12/12/2012,0,0,15.842
PCCP CREDIT X LP LOS ANGELES,CA,03/30/2022,0,0,2.5
US REAL ESTATE MEZZ DEBT FD LP NEW YORK,NY,02/23/2022,0,0,7.5
Value Year’s Than Capital- Book/ Exchange Value Foreign COLONIAL ESTATES HOMEOWNERS AS TAUNTON,MA,09/27/2016,0,0,0.0
HILLCREST COMMUNITY COOPERATIV FREEBORN,MN,01/29/2016,0,0,0.0
Value Year’s Than Capital- Book/ Exchange Value Foreign PARK PLACE COOPERATIVE INC.RE ROCHESTER,MN,11/20/2017,0,0,0.0
PARK PLACE COOPERATIVE INC. PEABODY,MA,05/25/2017,0,0,0.0
RESIDENT OWNERSHIP CAPITAL LLC TAUNTON,MA,04/13/2016,0,0,0.0
TOWN & COUNTRY KINGSTON ESTATE PLYMOUTH,MA,04/28/2017,0,0,0.0
ACCEL GROWTH FUND LP PALO ALTO,CA,12/10/2008,0,0,0.0
ACCEL GROWTH V L.P. PALO ALTO,CA,03/11/2019,0,0,0.0
ACCEL LEADERS FUND II L.P. PALO ALTO,CA,06/06/2019,0,0,0.0
ACCOMPLICE FUND II LP CAMBRIDGE,MA,03/28/2018,0,0,0.0
ADVENT INTNL GPE VII B LP WILMINGTON,DE,08/20/2012,0,0,0.0
AEA MEZZANINE FUND III LP NEW YORK,NY,03/15/2013,0,0,0.0
AEA MEZZANINE FUND IV LP NEW YORK,NY,07/23/2018,0,0,0.0
AFFINITY ASIA PACI FUND IV LP SINGAPORE,SGP,03/20/2013,0,0,0.0
AFFINITY ASIA PACIFIC FD V LP HONG KONG,CHN,12/10/2018,0,0,0.0
AH PARALLEL FUND IV LP MENLO PARK,CA,05/08/2014,0,0,0.0
ALCHEMY SPECIAL OPP FUND IV LP LONDON,GBR,12/11/2019,0,0,0.0
AMERICAN INDUSTRIAL CAP V LP NEW YORK,NY,12/19/2011,0,0,0.0
AMERICAN INDUSTRIAL CAP IV LP SAN FRANCISCO,CA,04/25/2008,0,0,0.0
AMERICAN SECURITIES VII LP NEW YORK,NY,12/10/2014,0,0,0.0
ANDREESSEN HOROWITZ III LP MENLO PARK,CA,01/31/2012,0,0,0.0
AP TUNDRA HOLDINGS LLC PURCHASE,NY,12/29/2020,0,0,0.0
ASTORG VI SLP PARIS,FRA,09/25/2015,0,0,0.0
ATLAS VENTURE FUND IX LP WILMINGTON,DE,12/12/2012,0,0,0.0
AUDAX DIR LENDING SOLN FD LP NEW YORK,NY,10/26/2018,0,0,0.0
AUDAX MEZZANINE FUND III LP NEW YORK,NY,12/10/2009,0,0,0.0
AUDAX PRIVATE EQUITY FUND VI BOSTON,MA,08/21/2019,0,0,0.0
BALANCE POINT CAP PARTNERS V WESTPORT,CT,06/29/2021,0,0,0.0
BARING ASIA PE FUND VI LP HONG KONG,CHN,07/25/2014,0,0,0.0
BARING ASIA PE FUND VII LP HONG KONG,CHN,04/30/2019,0,0,0.0
BATTERY VENTURES XII LP BOSTON,MA,03/26/2018,0,0,0.0
BATTERY VENTURES XII SIDE FUND BOSTON,MA,03/26/2018,0,0,0.0
BAYVIEW OPPORT DOMESTIC V LP NEW YORK,NY,02/01/2017,0,0,0.0
BC EUROPEAN CAPITAL IX L.P. ST. PETER PORT,GBR,11/23/2010,0,0,0.0
BDCM OPPORTUNITY FUND III LP GREENWICH,CT,11/06/2009,0,0,0.0
BEHRMAN CAPITAL IV LP NEW YORK,NY,06/29/2007,0,0,0.0
BESSEMER VENTURE PARTNERS X IN LARCHMONT,NY,11/30/2018,0,0,0.0
BLACKROCK DLF IX ICAV-BLACKROC DUBLIN,IRL,06/28/2021,0,0,0.0
BLACKSTONE CAPITAL VI LP NEW YORK,NY,07/29/2008,0,0,0.0
BLACKSTONE CAPITAL VII LP NEW YORK,NY,04/07/2015,0,0,0.0
BLACKSTONE CAPITAL OPPORTUNITI NEW YORK,NY,03/15/2021,0,0,0.0
BLACKSTONE STRAT ALLIANC II LP NEW YORK,NY,11/23/2010,0,0,0.0
BLUE SEA CAPITAL FUND I LP PALM BEACH,FL,10/18/2013,0,0,0.0
BRENTWOOD ASSOCIATES PE V LP LOS ANGELES,CA,06/12/2013,0,0,0.0
BRIDGEPOINT EUROPE V L.P. LONDON,GBR,09/03/2014,0,0,0.0
CAPITAL INTERNATIONAL PE VI LP LOS ANGELES,CA,03/24/2011,0,0,0.0
CARLYLE GLOBAL PARTNERS LP WASHINGTON,DC,09/01/2016,0,0,0.0
CARLYLE PARTNERS VI LP WASHINGTON,DC,02/19/2013,0,0,0.0
CARLYLE PARTNERS VII L.P. WASHINGTON,DC,12/19/2018,0,0,0.0
C-BRIDGE HEALTHCARE FUND II LP NEW YORK,NY,12/04/2020,0,0,0.0
CCMP CAPITAL INVESTORS III LP NEW YORK,NY,07/02/2014,0,0,0.0
CHAMP IV TRUST B SYDNEY,AUS,07/24/2015,0,0,0.0
CHARLES RIVER XV LP MENLO PARK,CA,02/15/2012,0,0,0.0
CLEARLAKE CAPITAL V LP LOS ANGELES,CA,02/01/2018,0,0,0.0
CORTEC GROUP FUND V LP NEW YORK,NY,12/15/2010,0,0,0.0
COURT SQUARE CAPITAL III LP NEW YORK,NY,12/27/2011,0,0,0.0
CVC CAPITAL PARTNERS VII L.P. LONDON,GBR,12/05/2018,0,0,0.0
Value Year’s Than Capital- Book/ Exchange Value Foreign DYAL CAPITAL PARTNERS III LP NEW YORK,NY,09/09/2016,0,0,0.0
DYAL CAPITAL PARTNERS IV LP NEW YORK,NY,06/11/2018,0,0,0.0
EIG ENERGY FUND XV LP LOS ANGELES,CA,11/30/2010,0,0,0.0
ENCAP ENERGY CAPITAL XI LP HOUSTON,TX,12/12/2016,0,0,0.0
ENCAP ENERGY CAPITAL FUND X LP HOUSTON,TX,02/05/2015,0,0,0.0
ENCAP ENERGY CAPITAL IX HOUSTON,TX,01/04/2013,0,0,0.0
EQUISTONE EUROPE FUND V LP LONDON,GBR,01/22/2015,0,0,0.0
EQUISTONE EUROPE FUND VI LP LONDON,GBR,07/09/2018,0,0,0.0
EQUISTONE PTNRS EUR FD IV B LP LONDON,GBR,11/14/2011,0,0,0.0
FALCON STRATEGIC III LP BOSTON,MA,10/20/2008,0,0,0.0
FFL CAPITAL PARTNERS IV LP SAN FRANCISCO,CA,12/03/2013,0,0,0.0
FRANCISCO PARTNERS AGILITY LP SAN FRANCISCO,CA,09/08/2016,0,0,0.0
FRANCISCO PARTNERS IV LP SAN FRANCISCO,CA,12/08/2014,0,0,0.0
FRANCISCO PARTNERS V LP SAN FRANCISCO,CA,05/29/2018,0,0,0.0
FRIEDMAN FLEISCHER LOWE III LP SAN FRANCISCO,CA,12/06/2007,0,0,0.0
FURTHER GLOBAL CAP PTNRS L.P. NEW YORK,NY,01/29/2020,0,0,0.0
GLOBAL INFRASTRUCTURE PT II LP NEW YORK,NY,09/15/2011,0,0,0.0
GRYPHON PARTNERS V L.P. SAN FRANCISCO,CA,08/29/2018,0,0,0.0
GSO CAP OPPORTUNITIES II LP NEW YORK,NY,05/09/2011,0,0,0.0
GSO CAP OPPORTUNITIESIII COINV NEW YORK,NY,04/26/2016,0,0,0.0
GSO CAP OPPS FD III CO-INV LP NEW YORK,NY,01/09/2020,0,0,0.0
GSO SPECIAL SITUATIONS FUND LP NEW YORK,NY,09/01/2006,0,0,0.0
HARVEST PARTNERS VI LP NEW YORK,NY,10/05/2011,0,0,0.0
HG CAPITAL MERCURY 2 LP LONDON,GBR,04/03/2018,0,0,0.0
ICG N AMERICAN PVT DEBT II LP NEW YORK,NY,02/25/2019,0,0,0.0
ICG N AMERICAN PVT DEBT LP NEW YORK,NY,08/22/2014,0,0,0.0
INDUSTRIAL GROWTH V LP SAN FRANCISCO,CA,04/08/2016,0,0,0.0
KING STREET CAPITAL LP NEW YORK,NY,06/01/2008,0,0,0.0
LANDMARK EQUITY XIV LP SIMSBURY,CT,12/19/2008,0,0,0.0
LINZOR CAPITAL PARTNERS III LP SANTIAGO,CHL,02/26/2015,0,0,0.0
MARANON MEZZANINE FUND II LP CHICAGO,IL,04/30/2013,0,0,0.0
MERITECH CAPITAL IV LP PALO ALTO,CA,09/29/2010,0,0,0.0
MERITECH CAPITAL VI LP PALO ALTO,CA,06/07/2018,0,0,0.0
METLIFE MID MKT PVT DBT FD LP WHIPPANY,NJ,07/24/2018,0,0,0.0
MIDDLEGROUND MOBILITY OPPFD LP LEXINGTON,KY,08/09/2021,0,0,0.0
MIDDLEGROUND PARTNERS II L.P. LEXINGTON,KY,11/15/2021,0,0,0.0
NAUTIC PARTNERS VII LP PROVIDENCE,RI,10/15/2014,0,0,0.0
NAVIS ASIA FUND VII LP KUALA LUMPUR MYS CAPITAL DISTRIBUTION,,09/17/2014,0,0,0.0
NB CROSSROADS PRIVATE MARKETS NEW YORK,NY,01/12/2021,0,0,0.0
NB MEMORIAL LP NEW YORK,NY,12/31/2021,0,0,0.0
NB SELECT OPPS FUND II LP NEW YORK,NY,05/01/2019,0,0,0.0
NB SELECT OPPS FUND III LP NEW YORK,NY,02/03/2020,0,0,0.0
NEW ENTERPRISE ASSOCIATES 17LP MENLO PARK,CA,07/19/2019,0,0,0.0
NEWVIEW CAPITAL FUND I LP SAN FRANCISCO,CA,11/20/2018,0,0,0.0
NEXUS SPECIAL SITUATIONS II LP MENLO PARK,CA,09/10/2021,0,0,0.0
NORTH HAVEN CREDIT PTNRS III NEW YORK,NY,08/19/2021,0,0,0.0
OAK HILL CAPITAL III LP FORT WORTH,TX,11/02/2007,0,0,0.0
OAKTREE OPPORTUNITIES IX LP LOS ANGELES,CA,05/16/2012,0,0,0.0
OAKTREE OPPORTUNITIES VIII LP LOS ANGELES,CA,12/10/2009,0,0,0.0
OAKTREE OPPORTUNITIES FD XI LP LOS ANGELES,CA,08/21/2020,0,0,0.0
OAKTREE OPPS FD VIII-B LP LOS ANGELES,CA,12/24/2009,0,0,0.0
ODYSSEY INVESTMENT V LP NEW YORK,NY,06/24/2014,0,0,0.0
PA DIRECT CREDIT OPPORT II LP DARIEN,CT,10/04/2016,0,0,0.0
PAI EUROPE VI PARIS,FRA,07/24/2013,0,0,0.0
PAI EUROPE VII-1 S.L.P. PARIS,FRA,09/23/2019,0,0,0.0
PARTNERS GRP ASIA PAC 2007 LP CHANNEL ISLANDS,GBR,05/31/2007,0,0,0.0
Value Year’s Than Capital- Book/ Exchange Value Foreign PATRIA BRAZILIAN PE V LP SAO PAULO,BRA,05/19/2014,0,0,0.0
PE RESIDUAL LIQUIDATION CASH TAMPA,FL,12/31/2017,0,0,0.0
PERMIRA V LP LONDON,GBR,04/24/2013,0,0,0.0
PERMIRA VII L.P. LONDON,GBR,02/05/2020,0,0,0.0
PIMCO BRAVO FD OFF FEED II LP NEWPORT BEACH,CA,04/16/2013,0,0,0.0
PRIMAVERA CAPITAL GROUP II LP HONG KONG,CHN,10/14/2014,0,0,0.0
PTNRS GRP SECONDARY 2008 SICAR ST. PETER PORT,GBR,05/09/2008,0,0,0.0
PUBLIC PENSION CAPITAL LLC NEW YORK,NY,07/10/2014,0,0,0.0
QUANTUM ENERGY PARTNERS V LP HOUSTON,TX,09/30/2008,0,0,0.0
RECOGNIZE PARTNERS I L.P NEW YORK,NY,10/01/2021,0,0,0.0
RIVERSTONE CARLYLE ENER&PWR IV NEW YORK,NY,05/02/2008,0,0,0.0
RIVERSTONE GLOB ENER &PWR V LP NEW YORK,NY,01/12/2012,0,0,0.0
SEQUOIA CAP CHINA VENT 2010 LP MENLO PARK,CA,03/25/2010,0,0,0.0
SEQUOIA CAP US GROWTH V LP MENLO PARK,CA,10/06/2011,0,0,0.0
SEQUOIA CAP US GROWTH VI LP PALO ALTO,CA,04/03/2014,0,0,0.0
SEQUOIACAPCHINA GROWTH 2010 LP MENLO PARK,CA,03/25/2010,0,0,0.0
SIGMA PRIME PARTNERS IX LP BOSTON,MA,05/30/2011,0,0,0.0
SILVER LAKE PARTNERS IV LP MENLO PARK,CA,09/07/2012,0,0,0.0
SILVER LAKE PARTNERS V LP MENLO PARK,CA,06/12/2018,0,0,0.0
THE RESOLUTE FUND III LP NEW YORK,NY,01/17/2014,0,0,0.0
THE RESOLUTE FUND IV L.P. NEW YORK,NY,12/07/2018,0,0,0.0
THE RESOLUTE FUND V LP NEW YORK,NY,09/07/2021,0,0,0.0
THE VERITAS CAPITAL FUND VI LP NEW YORK,NY,12/08/2016,0,0,0.0
TOWER SQUARE CAPITAL III LP SPRINGFIELD,MA,09/29/2008,0,0,0.0
TOWERBROOK INVESTORS IV LP GEORGE TOWN,CYM,02/05/2013,0,0,0.0
TPG ASIA V LP FORT WORTH,TX,12/17/2007,0,0,0.0
TPG ASIA VI LP FORT WORTH,TX,02/01/2013,0,0,0.0
TRIDENT VII LP GREENWICH,CT,09/12/2016,0,0,0.0
TRUEBRIDGE KAUFFMAN FELLOWS II DURHAM,NC,06/12/2009,0,0,0.0
WAYZATA OPPORTUNITIES II LP WAYZATA,MN,10/31/2007,0,0,0.0
WAYZATA OPPORTUNITIES III LP WAYZATA,MN,09/11/2012,0,0,0.0
WELSH CARSON ANDERSON STOWE XI NEW YORK,NY,05/29/2008,0,0,0.0
YORKTOWN ENERGY PARTNERS V LP NEW YORK,NY,12/18/2001,0,0,0.0
BRIGHTHOUSE RENEW HOLDING LLC NEW YORK,NY,02/05/2010,0,0,0.0
EURO TL INVESTMENTS LLC HARTFORD,CT,12/01/2004,0,0,0.0
BLACKSTONE RE PARTNERS VI LP NEW YORK,NY,06/27/2007,0,0,0.0
BLACKSTONE REPRT VI GLIC ROFR NEW YORK,NY,06/30/2010,0,0,0.0
BROOKFIELD BRAZIL TIMBER FD II RIO DE JANEIRO,BRA,12/13/2012,0,0,0.0
BROOKFIELDBRAZIL AGRILND 1 LLC RIO DE JANEIRO,BRA,04/10/2010,0,0,0.0
BROOKFIELDBRAZIL AGRILND 2 LLC RIO DE JANEIRO,BRA,04/10/2010,0,0,0.0
BROOKFIELDBRAZIL AGRILND 3 LLC RIO DE JANEIRO,BRA,04/10/2010,0,0,0.0
BROOKFIELDBRAZIL AGRILND 4 LLC RIO DE JANEIRO,BRA,04/10/2010,0,0,0.0
CARLYLE EUROPE PARTNERS III LP DISTRICT OF COLUMBIA,GBR,10/09/2007,0,0,0.0
METLIFE CORE PROP FUND LP MORRISTOWN,NJ,11/01/2013,0,0,0.0
ML COMMERCIAL MORTGE INC FD MORRISTOWN,NJ,10/02/2015,0,0,0.0
PCCP CREDIT X LP LOS ANGELES,CA,03/30/2022,0,0,0.0
TLA HOLDINGS LLC HARTFORD,CT,03/15/2002,0,0,0.0
Number of Paid for Accrued Admini- GOVERNMENT NATIONAL MORTGAGE A POOL#MA78,,01/10/2022,0,0,0.0
GOVERNMENT NATIONAL MORTGAGE A POOL#MA78,,01/10/2022,0,0,0.0
GOVERNMENT NATIONAL MORTGAGE A SENIOR AG,,03/01/2022,0,0,0.0
GOVERNMENT NATIONAL MORTGAGE A SENIOR AG,,03/01/2022,0,0,0.0
GOVERNMENT NATIONAL MORTGAGE A SENIOR AG,,03/01/2022,0,0,0.0
GOVERNMENT NATIONAL MORTGAGE A SENIOR AG,,03/01/2022,0,0,0.0
GOVERNMENT NATIONAL MORTGAGE A SENIOR AG,,01/01/2022,0,0,0.0
GOVERNMENT NATIONAL MORTGAGE A SENIOR AG,,03/01/2022,0,0,0.0
GOVERNMENT NATIONAL MORTGAGE A SENIOR AG,,03/01/2022,0,0,0.0
GOVERNMENT NATIONAL MORTGAGE A SENIOR AG,,03/01/2022,0,0,0.0
GOVERNMENT NATIONAL MORTGAGE A SENIOR AG,,03/01/2022,0,0,0.0
GOVERNMENT NATIONAL MORTGAGE A SENIOR AG,,03/01/2022,0,0,0.0
GOVERNMENT NATIONAL MORTGAGE A SENIOR AG,,03/01/2022,0,0,0.0
GOVERNMENT NATIONAL MORTGAGE A SENIOR AG,,03/01/2022,0,0,0.0
GOVERNMENT NATIONAL MORTGAGE A SENIOR AG,,03/01/2022,0,0,0.0
GOVERNMENT NATIONAL MORTGAGE A SENIOR AG,,03/01/2022,0,0,0.0
GNMA_18-155 SENIOR AGENCY_CMO _18-155,,03/01/2022,0,0,0.0
GOVERNMENT NATIONAL MORTGAGE A SENIOR AG,,03/01/2022,0,0,0.0
GOVERNMENT NATIONAL MORTGAGE A SENIOR AG,,03/01/2022,0,0,0.0
GOVERNMENT NATIONAL MORTGAGE A SENIOR AG,,03/01/2022,0,0,0.0
GOVERNMENT NATIONAL MORTGAGE A SENIOR AG,,03/01/2022,0,0,0.0
GOVERNMENT NATIONAL MORTGAGE A SENIOR AG,,03/01/2022,0,0,0.0
GOVERNMENT NATIONAL MORTGAGE A SENIOR AG,,03/01/2022,0,0,0.0
GOVERNMENT NATIONAL MORTGAGE A SENIOR AG,,03/01/2022,0,0,0.0
GOVERNMENT NATIONAL MORTGAGE A SENIOR AG,,03/01/2022,0,0,0.0
UNITEDSTATESTREASURY SENIOR GOVT BND 1,,02/10/2022,0,0,0.0
UNITEDSTATESTREASURY SENIOR GOVT_BND 0,,01/11/2022,0,0,0.0
UNITEDSTATESTREASURY SENIOR GOVT BND 0,,01/11/2022,0,0,0.0
UNITEDSTATESTREASURY SENIOR GOVT BND 1,,01/11/2022,0,0,0.0
UNITEDSTATESTREASURY SENIOR GOVT BND 1,,01/18/2022,0,0,0.0
UNITEDSTATESTREASURY SENIOR GOVT BND 0,,01/26/2022,0,0,0.0
UNITEDSTATESTREASURY SENIOR GOVT BND 1,,01/28/2022,0,0,0.0
UNITEDSTATESTREASURY SENIORGOVTBND 0.8,,02/23/2022,0,0,0.0
UNITEDSTATESTREASURY SENIOR GOVT BND 1,,03/10/2022,0,0,0.0
UNITEDSTATESTREASURY SENIOR GOVT BND 1,,03/16/2022,0,0,0.0
CAS_22-R03 WHOLE CMO 3-1M1 144A 2.237%,,03/21/2022,0,0,0.0
FREMFMORTGAGETRUSTFREMF_14- SUBSUBCMBS14,,03/15/2022,0,0,0.0
FREDDIE MAC FHLMC_K020 POOL#SD8190 3.0,,01/10/2022,0,0,0.0
FREDDIE MAC FHLMC_K020 POOL#SD8196 3.5,,01/10/2022,0,0,0.0
FREDDIE MAC FHLMC_K020 POOL#QD3201 3.0,,01/06/2022,0,0,0.0
FREDDIE MAC FHLMC_K020 POOL#QD6297 3.5,,01/24/2022,0,0,0.0
FREDDIE MAC FHLMC_K020 POOL#RA2457 3.0,,02/23/2022,0,0,0.0
FANNIE MAE FNMA_13-41 SENIOR AGENCY_CMO,,03/01/2022,0,0,0.0
FANNIE MAE FNMA_14-85 SENIOR AGENCY_CMO,,03/01/2022,0,0,0.0
FANNIE MAE FNMA_15-21 SENIOR AGENCY_CMO,,03/01/2022,0,0,0.0
FANNIE MAE FNMA_15-83 SENIOR AGENCY_CMO,,03/01/2022,0,0,0.0
FANNIE MAE FNMA_16-43 SENIOR AGENCY_CMO,,03/01/2022,0,0,0.0
FANNIE MAE FNMA_16-59A SENIOR AGENCY_CMO,,03/01/2022,0,0,0.0
FANNIE MAE FNMA_17-83 SENIOR AGENCY_CMO,,03/01/2022,0,0,0.0
FANNIE MAE FNMA_18-1 SENIOR AGENCY_CMO _,,03/01/2022,0,0,0.0
FANNIE MAE FNMA_18-30 SENIOR AGENCY_CMO,,03/01/2022,0,0,0.0
FANNIE MAE FNMA_18-66 SENIOR AGENCY_CMO,,03/01/2022,0,0,0.0
FANNIE MAE FNMA_18-67 SENIOR AGENCY_CMO,,03/01/2022,0,0,0.0
FANNIE MAE FNMA_18-73 SENIOR AGENCY_CMO,,03/01/2022,0,0,0.0
FANNIE MAE FNMA_18-73 SENIOR AGENCY_CMO,,03/01/2022,0,0,0.0
Number of Paid for Accrued Admini- FANNIE MAE FNMA_18-78 SENIOR AGENCY_CMO,,03/01/2022,0,0,0.0
FANNIE MAE FNMA_18-76 SENIOR AGENCY_CMO,,03/01/2022,0,0,0.0
FANNIE MAE FNMA_18-76 SENIOR AGENCY_CMO,,03/01/2022,0,0,0.0
FANNIE MAE FNMA_18-89 SENIOR AGENCY_CMO,,03/01/2022,0,0,0.0
FANNIE MAE FNMA_19-41 SENIOR AGENCY_CMO,,03/01/2022,0,0,0.0
FREDDIE MAC FHLMC_3763 SENIOR AGENCY_CMO,,03/01/2022,0,0,0.0
FREDDIE MAC FHLMC_4443 SENIOR AGENCY_CMO,,03/01/2022,0,0,0.0
FREDDIE MAC FHLMC_4526 SENIOR AGENCY_CMO,,03/01/2022,0,0,0.0
FHLMC_45-41 SENIOR AGENCY_CMO _45-41 3,,03/01/2022,0,0,0.0
FREDDIE MAC FHLMC_4548 SENIOR AGENCY_CMO,,03/01/2022,0,0,0.0
FREDDIE MAC FHLMC_4548 SENIOR AGENCY_CMO,,03/01/2022,0,0,0.0
FREDDIE MAC FHLMC_4573 SENIOR AGENCY_CMO,,03/01/2022,0,0,0.0
FREDDIE MAC FHLMC_4590 SENIOR AGENCY_CMO,,03/01/2022,0,0,0.0
FREDDIE MAC FHLMC_4596 SENIOR AGENCY_CMO,,03/01/2022,0,0,0.0
FEDERAL HOME LOAN MORTGAGE COR SENIOR AG,,03/01/2022,0,0,0.0
FREDDIE MAC FHLMC_4817 SENIOR AGENCY_CMO,,03/01/2022,0,0,0.0
FREDDIE MAC FHLMC_4825 SENIOR AGENCY_CMO,,03/01/2022,0,0,0.0
FREDDIE MAC FHLMC_4825 SENIOR AGENCY_CMO,,03/01/2022,0,0,0.0
FREDDIE MAC FHLMC_4821 SENIOR AGENCY_CMO,,03/01/2022,0,0,0.0
FREDDIE MAC FHLMC_4821 SENIOR AGENCY_CMO,,03/01/2022,0,0,0.0
FREDDIE MAC FHLMC_4821 SENIOR AGENCY_CMO,,03/01/2022,0,0,0.0
FEDERAL HOME LOAN MORTGAGE COR SENIOR AG,,03/01/2022,0,0,0.0
FHLMC MULTIFAMILY STRUCTURED P SENIOR AG,,03/01/2022,0,0,0.0
FREDDIE MAC FHLMC_4830 SENIOR AGENCY_CMO,,03/01/2022,0,0,0.0
FHLMC MULTIFAMILY STRUCTURED P SENIOR AG,,03/01/2022,0,0,0.0
FEDERAL HOME LOAN MORTGAGE COR SENIOR AG,,03/01/2022,0,0,0.0
FEDERAL NATIONAL MORTGAGE ASSO POOL#FM39,,01/10/2022,0,0,0.0
FEDERAL NATIONAL MORTGAGE ASSO POOL#MA45,,01/10/2022,0,0,0.0
FEDERAL NATIONAL MORTGAGE ASSO POOL#MA45,,02/28/2022,0,0,0.0
FEDERAL NATIONAL MORTGAGE ASSO POOL#MA45,,02/28/2022,0,0,0.0
FEDERAL NATIONAL MORTGAGE ASSO POOL#MA45,,02/28/2022,0,0,0.0
FREDDIE MAC FHLMC_18-1SC SENIOR AGENCY_C,,03/01/2022,0,0,0.0
SEASONED CREDIT RISK TRANSFER SENIOR AGE,,03/01/2022,0,0,0.0
SEASONED CREDIT RISK TRANSFER SENIOR AGE,,03/01/2022,0,0,0.0
STRUCTURED AGENCY CREDIT RISK WHOLE CMO,,02/07/2022,0,0,0.0
ALLIANCEBERNSTEINBSLCLO1L ABS 0-1A-BR 14,,01/14/2022,0,0,0.0
ABPCIDIRECTLENDINGFUNDABS ABS F_22-2A 14,,02/15/2022,0,0,0.0
ADT SECURITY CORP SECURED CORP_BND 144A,,03/10/2022,0,0,0.0
AIMCOAIMCO_20-12A ABS -12A-CR 144A 2.2,,02/02/2022,0,0,0.0
ADVANCE AUTO PARTS INC SENIOR CORP BND,,03/02/2022,0,0,0.0
AFFIRM ASSET SECURITIZATION TR ABS 22-X1,,02/01/2022,0,0,0.0
ALEXANDRIA REAL ESTATE EQUITIE SENIOR,CO,03/30/2022,0,0,0.0
ALEXANDRIA REAL ESTATE EQUITIE SENIOR,CO,02/03/2022,0,0,0.0
023586-D#-4 AMERCO SENIOR CORP BND 2.600% 01/27/31,,01/27/2022,0,0,0.0
AMERICAN EXPRESS COMPANY SENIOR CORP BND,,03/01/2022,0,0,0.0
AMERICAN WATER CAPITAL CORP SENIOR CORP,,01/31/2022,0,0,0.0
AMGEN INC SENIOR CORP BND 3.000% 01/15,,02/15/2022,0,0,0.0
AMGEN INC SENIORCORPBND 4.200% 02/22/5,,02/17/2022,0,0,0.0
ANGEL OAK MORTGAGE TRUST AOMT WHOLE CMO,,02/08/2022,0,0,0.0
ANTERO MIDSTREAM PARTNERS LP SENIOR CORP,,01/10/2022,0,0,0.0
ARBOR REALTY COLLATERALIZED LO SENIOR SE,,03/03/2022,0,0,0.0
ARBOR REALTY COLLATERALIZED LO LCFABS22-,,01/26/2022,0,0,0.0
ARROYOMORTGAGETRUSTARRW_22- WHOLE CMO -1,,02/09/2022,0,0,0.0
AVANTOR FUNDING INC SENIOR CORP_BND 144A,,03/11/2022,0,0,0.0
AVISTA CORPORATION SECURED CORP BND 4.,,03/08/2022,0,0,0.0
Number of Paid for Accrued Admini- BHG_22-A SUBABS22-A144A 3.080% 02/20/3,,01/25/2022,0,0,0.0
BSPRT ISSUER LTD BSPRT_21-FL7 LCF SENIOR,,03/01/2022,0,0,0.0
BWX TECHNOLOGIES INC SENIOR CORP BND 144,,03/16/2022,0,0,0.0
BX_22-VAMF SUB CMBS MF-B 144A 1.581% 0,,01/20/2022,0,0,0.0
BX_22-VAMF SUB CMBS MF-C 144A 1.628% 0,,01/20/2022,0,0,0.0
BX COMMERCIAL MORTGAGE TRUST B SUB SUB_C,,03/17/2022,0,0,0.0
BX COMMERCIAL MORTGAGE TRUST B SUB_CMBS,,03/10/2022,0,0,0.0
BX_22-AHP SENIOR CMBS P-AS 144A 1.540%,,02/02/2022,0,0,0.0
BX_22-AHP SENIOR CMBS HP-B 144A 1.890%,,02/02/2022,0,0,0.0
BXTRUSTBX_22-MVRK SENIOR CMBS RK-A 144A,,03/10/2022,0,0,0.0
BX_22-MVRK SUB CMBS RK-B 144A 1.816% 0,,03/10/2022,0,0,0.0
BIFIITPAGGREGATOR(DELAWARE SECURED CORP,,03/10/2022,0,0,0.0
BALL CORPORATION SENIOR CORP BND 2.875,,03/10/2022,0,0,0.0
BALLYROCK CLO LTD BALLY_20-2A MEZZANIN A,,02/18/2022,0,0,0.0
