name,state,date_acquired,book_value,investment_income,ownership_pct
SAXON ASSET SECURITIES TRUST S SUB ABS_A,,03/25/2022,0,0,0.0
SAXON ASSET SECURITIES TRUST 2 SENIOR AB,,03/25/2022,0,0,0.0
SCOTTS MIRACLE-GRO CO/THE SENIOR CORP_BN,,02/09/2022,0,0,0.0
SABR_04-O1 SUB ABS_ABS _04-O1 1.222% 0,,03/25/2022,0,0,0.0
SELECT MEDICAL CORPORATION SENIOR CORP_B,,03/10/2022,0,0,0.0
DIVERSIFIED HEALTHCARE TRUST SENIOR CORP,,03/10/2022,0,0,0.0
SEQUOIA MORTGAGE TRUST SEMT_15 SUPSEN WH,,03/01/2022,0,0,0.0
SEQUOIA MORTGAGE TRUST SEMT_13 SENIOR WH,,03/01/2022,0,0,0.0
SEQUOIA MORTGAGE TRUST SEMT_13 SENIOR WH,,03/01/2022,0,0,0.0
SEQUOIA MORTGAGE TRUST SEMT_18 SUPSEN WH,,03/01/2022,0,0,0.0
SEQUOIA MORTGAGE TRUST SEMT_18 SUB WHOLE,,03/01/2022,0,0,0.0
SEQUOIA MORTGAGE TRUST SEMT_21 SUPSEN WH,,03/01/2022,0,0,0.0
Year's Book/ Exchange Book/ Interest/ Modifier SEQUOIA MORTGAGE TRUST SEMT_21 SUPSEN WH,,03/01/2022,0,0,0.0
SERVICE EXPERTS ISSUER SE_21-1 ABS_ABS _,,03/20/2022,0,0,0.0
SHACKLETON CLO LTD SHACK_14-6R MEZZANIN,,02/14/2022,0,0,0.0
SHELLPOINT ASSET FUNDING TRUST SENIOR WH,,03/01/2022,0,0,0.0
SHERWIN-WILLIAMS COMPANY THE SENIOR COR,,03/21/2022,0,0,0.0
SIERRA TIMESHARE RECEIVABLES F MEZZANIN,,03/20/2022,0,0,0.0
SIERRA TIMESHARE RECEIVABLES F SUB ABS_A,,03/20/2022,0,0,0.0
SIERRA RECEIVABLES FUNDING COM SUB ABS_A,,03/20/2022,0,0,0.0
SIERRA TIMESHARE RECEIVABLES F SUB ABS_A,,03/20/2022,0,0,0.0
SIERRA TIMESHARE RECEIVABLES F SUB ABS_A,,03/20/2022,0,0,0.0
SIERRA RECEIVABLES FUNDING COM SUB ABS_A,,03/20/2022,0,0,0.0
SIERRA RECEIVABLES FUNDING,CO,03/20/2022,0,0,0.0
SIERRA RECEIVABLES FUNDING,CO,03/20/2022,0,0,0.0
SRL SRL_21-1 ABS_ABS _21-1 144A 2.230%,,03/17/2022,0,0,0.0
SINCLAIR TELEVISION GROUP INC SENIOR COR,,03/14/2022,0,0,0.0
CITIGROUP GLOBAL MKT INC SNAP-ON INCORPORATED SENIOR CORP_BND 3,,02/24/2022,0,0,0.0
SOFI CONSUMER LOAN PROGRAM TRU SUB ABS_A,,03/25/2022,0,0,0.0
SOLAR STAR FUNDING LLC SECURED CORP_BND,,02/10/2022,0,0,0.0
SPECTRUM BRANDS INC SENIOR CORP_BND 144A,,03/15/2022,0,0,0.0
SPECTRUM BRANDS INC SENIOR CORP_BND 144A,,03/15/2022,0,0,0.0
84857L-A@-0 SPIRE INC SENIOR CORP_BND 3.130% 09/01,,02/10/2022,0,0,0.0
84860*-AB-9 SPIRITS OF ST LOUIS BASKETBALL SENIOR,CO,03/31/2022,0,0,0.0
SPIRITS NEWCO LLC SENIOR CORP_BND 5.30,,03/31/2022,0,0,0.0
SPRINGCASTLE SPV SCFT_20-AA SENIOR ABS_A,,03/25/2022,0,0,0.0
SPIRIT AEROSYSTEMS INC SECURED CORP_BND,,03/10/2022,0,0,0.0
STACK INFRASTRUCTURE ISSUER LL SENIOR AB,,03/25/2022,0,0,0.0
STAPLES INC SECURED CORP_BND 144A 7.50,,03/10/2022,0,0,0.0
STARLI_20-1 SENIOR WHOLE_CMO _20-1 144A,,03/01/2022,0,0,0.0
STARWOOD MORTGAGE RESIDENTIAL SUPSEN WHO,,03/01/2022,0,0,0.0
STARWOOD MORTGAGE RESIDENTIAL WHOLE_CMO,,03/01/2022,0,0,0.0
STARWOOD MORTGAGE RESIDENTIAL WHOLE_CMO,,03/01/2022,0,0,0.0
STARWOOD MORTGAGE RESIDENTIAL WHOLE_CMO,,03/01/2022,0,0,0.0
STARWOODMORTGAGERESIDENTIAL WHOLECMO22-1,,03/01/2022,0,0,0.0
STARWOOD MORTGAGE RESIDENTIAL WHOLE CMO,,03/29/2022,0,0,0.0
STATION PLACE SECURITIZATION T WHOLE_CMO,,01/25/2022,0,0,0.0
STATION PLACE SECURITIZATION T WHOLE_CMO,,01/25/2022,0,0,0.0
STATION PLACE SECURITIZATION T WHOLE_CMO,,02/16/2022,0,0,0.0
STATION PLACE SECURITIZATION T WHOLE_CMO,,02/16/2022,0,0,0.0
858271-A*-0 TRANSMISSION SERVICES HOLDINGS SECURED C,,03/30/2022,0,0,0.0
STELLAR JAY IRELAND DAC STELR ABS_ABS _2,,03/15/2022,0,0,0.0
STORE MASTER FUNDING LLC STR_1 SENIOR AB,,03/20/2022,0,0,0.0
STRUCTURED ASSET INVESTMENT LO MEZZANIN,,03/25/2022,0,0,0.0
STRUCTURED ASSET INVESTMENT SA SUB ABS_A,,03/25/2022,0,0,0.0
STRUCTURED ASSET MORTGAGE INVE SUPSEN WH,,03/01/2022,0,0,0.0
STRUCTURED ASSET SECURITIES,CO,03/25/2022,0,0,0.0
STRUCTURED ASSET SECURITIES,CO,03/25/2022,0,0,0.0
STRUCTURED ASSET SECURITIES,CO,03/25/2022,0,0,0.0
STRUCTURED ASSET MORTGAGE INVE SUPSEN WH,,03/25/2022,0,0,0.0
STRUCTURED ASSET MORTGAGE INVE SUPSEN WH,,03/25/2022,0,0,0.0
STRUCTURED ASSET SECURITIES,CO,03/25/2022,0,0,0.0
Year's Book/ Exchange Book/ Interest/ Modifier STRUCTURED ASSET MORTGAGE INVE SUPSEN WH,,03/25/2022,0,0,0.0
STRUCTURED ASSET MORTGAGE INVE SUPSEN WH,,03/25/2022,0,0,0.0
STRUCTURED ASSET SECURITIES,CO,03/25/2022,0,0,0.0
SUNNOVA HELIOS VIII ISSUER LLC SENIORABS,,03/20/2022,0,0,0.0
SWEETWATER ROYALTIES LLC SECURED CORP_BN,,03/31/2022,0,0,0.0
TBW MORTGAGE BACKED PASS THROU SUPSEN WH,,03/25/2022,0,0,0.0
TBW MORTGAGE BACKED PASS THROU SENIOR WH,,03/01/2022,0,0,0.0
TOORAK MORTGAGE TRUST TRK_22-I WHOLE CMO,,03/01/2022,0,0,0.0
T-MOBILE USA INC SECURED CORP_BND 3.30,,01/21/2022,0,0,0.0
TPC UNIVERSITY LC FBI MANASSAS SECURED C,,03/05/2022,0,0,0.0
87278*-AD-4 TRUMBULL PROPERTY FUND SENIOR CORP_BND,,02/10/2022,0,0,0.0
TTX COMPANY SECURED CORP_BND 144A 5.45,,01/02/2022,0,0,0.0
TTX COMPANY SECURED CORP_BND 144A 5.50,,01/02/2022,0,0,0.0
TTX COMPANY SENIOR CORP_BND 144A 4.600,,02/10/2022,0,0,0.0
TACO BELL FUNDING LLC BELL_18 SENIOR ABS,,02/25/2022,0,0,0.0
TAL ADVANTAGE VII LLC TAL_20-1 SENIOR AB,,03/20/2022,0,0,0.0
TALEN ENERGY SUPPLY LLC SECURED CORP_BND,,03/15/2022,0,0,0.0
TARGA RESOURCES PARTNERS LP SENIOR CORP_,,03/30/2022,0,0,0.0
TARGA RESOURCES PARTNERS LP SENIOR CORP_,,02/04/2022,0,0,0.0
TBW MORTGAGE BACKED PASS THROU SUPSEN WH,,03/01/2022,0,0,0.0
TENET HEALTHCARE CORPORATION SECURED COR,,03/11/2022,0,0,0.0
TENET HEALTHCARE CORPORATION SECURED COR,,02/23/2022,0,0,0.0
88105*-AA-7 TERRAFORM OSPREY I LLC SECURED CORP_BND,,02/10/2022,0,0,0.0
TERWIN MORTGAGE TRUST TMTS_04 SUB ABS_AB,,03/25/2022,0,0,0.0
WIND RIVER CLO LTD WINDR_15-2A SENIOR AB,,01/18/2022,0,0,0.0
WIND RIVER CLO LTD WINDR_15-2A MEZZANIN,,01/18/2022,0,0,0.0
CITIGROUP GLOBAL MKT INC 3M,CO,03/21/2022,0,0,0.0
TOPAZ SOLAR FARMS LLC SECURED CORP_BND 1,,03/30/2022,0,0,0.0
TOWD POINT MORTGAGE TRUST TPMT SENIOR AB,,03/01/2022,0,0,0.0
TOWD POINT MORTGAGE TRUST TPMT SENIOR WH,,01/01/2022,0,0,0.0
TOWD POINT MORTGAGE TRUST TPMT SENIOR AB,,01/26/2022,0,0,0.0
TOWD POINT MORTGAGE TRUST TPMT SENIOR WH,,03/01/2022,0,0,0.0
TOWD POINT MORTGAGE TRUST TPMT SENIOR AB,,03/01/2022,0,0,0.0
TOWD POINT MORTGAGE TRUST TPMT SENIOR AB,,03/01/2022,0,0,0.0
TOWD POINT MORTGAGE TRUST TPMT SENIOR AB,,03/01/2022,0,0,0.0
TOWD POINT MORTGAGE TRUST TPMT SENIOR AB,,03/25/2022,0,0,0.0
TOWD POINT MORTGAGE TRUST TPMT LCF ABS_A,,03/25/2022,0,0,0.0
TOWD POINT MORTGAGE TRUST TPMT ABS_ABS _,,03/01/2022,0,0,0.0
TOWD POINT MORTGAGE TRUST TPMT SENIOR AB,,03/25/2022,0,0,0.0
TOWD POINT MORTGAGE TRUST TPMT SENIOR WH,,03/01/2022,0,0,0.0
TOWD POINT MORTGAGE TRUST TPMT SENIOR AB,,03/01/2022,0,0,0.0
TRANSDIGM INC SRSUB CORP_BND 6.375% 06,,03/11/2022,0,0,0.0
TRITON CONTAINER FINANCE LLC T SUB ABS_A,,03/20/2022,0,0,0.0
MORGAN STANLEY & CO. INC TRIUMPH GROUP INC SECURED CORP_BND 144A,,03/10/2022,0,0,0.0
90229*-AA-4 2015 ESA PROJECT COMPANY LLC SECURED COR,,03/31/2022,0,0,0.0
Year's Book/ Exchange Book/ Interest/ Modifier TYSON FOODS INC SENIOR CORP_BND 4.500%,,03/15/2022,0,0,0.0
UFI-NOR NAVY JAPAN FEDERAL REC SECURED C,,03/01/2022,0,0,0.0
US FOODS INC SECURED CORP_BND 144A 6.2,,03/15/2022,0,0,0.0
USTA NATIONAL TENNIS CENTER IN SENIOR,CO,01/08/2022,0,0,0.0
USTA NATIONAL TENNIS CENTER,IN,01/08/2022,0,0,0.0
USTA NATIONAL TENNIS CENTER,IN,01/08/2022,0,0,0.0
US ACUTE CARE SOLUTIONS LLC SECURED CORP,,02/11/2022,0,0,0.0
90370*-AA-1 ONE TOWN CENTER LLC SECURED CORP_BND 4,,03/15/2022,0,0,0.0
90380*-AA-9 ULLICO INFRASTRUCTURE SOUTHLAN SECURED C,,03/31/2022,0,0,0.0
UNION PACIFIC RAILROAD COMPANY SECURED C,,01/02/2022,0,0,0.0
UNITED AIR LINES INC 2007 1,PA,01/02/2022,0,0,0.0
UNIVERSITY OF CHICAGO SENIOR CORP_BND,,02/10/2022,0,0,0.0
UNIVERSITY OF CHICAGO SENIOR CORP_BND,,02/10/2022,0,0,0.0
UNIVISION COMMUNICATIONS INC SECURED COR,,03/10/2022,0,0,0.0
UPSTART SECURITIZATION TRUST U SENIOR AB,,03/20/2022,0,0,0.0
BAUSCH HEALTH AMERICAS INC SENIOR CORP_B,,03/10/2022,0,0,0.0
BAUSCH HEALTH AMERICAS INC SENIOR CORP_B,,03/09/2022,0,0,0.0
VELOCITY COMMERCIAL CAPITAL LO SENIOR SE,,03/01/2022,0,0,0.0
VELOCITY COMMERCIAL CAPITAL LO SUB SENIO,,03/01/2022,0,0,0.0
VELOCITY COMMERCIAL CAPITAL LO SENIOR SE,,03/01/2022,0,0,0.0
VELOCITY COMMERCIAL CAPITAL LO SUB SENIO,,03/01/2022,0,0,0.0
VELOCITY COMMERCIAL CAPITAL LO SENIOR SE,,03/01/2022,0,0,0.0
VELOCITY COMMERCIAL CAPITAL LO SENIOR SE,,03/01/2022,0,0,0.0
VELOCITY COMMERCIAL CAPITAL LO SENIOR_CM,,03/01/2022,0,0,0.0
VELOCITY COMMERCIAL CAPITAL LO SENIOR_CM,,03/25/2022,0,0,0.0
VELOCITY COMMERCIAL CAPITAL LO WHOLE CMO,,03/01/2022,0,0,0.0
VELOCITY COMMERCIAL CAPITAL LO SENIOR SE,,03/01/2022,0,0,0.0
VELOCITY COMMERCIAL CAPITAL LO SUB SUB_C,,03/01/2022,0,0,0.0
VELOCITY COMMERCIAL CAPITAL LO SENIOR SE,,03/01/2022,0,0,0.0
VELOCITY COMMERCIAL CAPITAL LO SENIOR_CM,,03/01/2022,0,0,0.0
VELOCITY COMMERCIAL CAPITAL LO SUB SUB_C,,03/01/2022,0,0,0.0
VELOCITY COMMERCIAL CAPITAL LO SUB SUB_C,,03/01/2022,0,0,0.0
VERIZON COMMUNICATIONS INC SENIOR CORP_B,,03/24/2022,0,0,0.0
VERUS SECURITIZATION TRUST VER SENIOR WH,,03/01/2022,0,0,0.0
VERUS SECURITIZATION TRUST VER SENIOR WH,,03/01/2022,0,0,0.0
VERUS SECURITIZATION TRUST VER SENIOR WH,,03/01/2022,0,0,0.0
VERUS SECURITIZATION TRUST VER WHOLE_CMO,,03/01/2022,0,0,0.0
VERUS SECURITIZATION TRUST VER SENIOR WH,,03/01/2022,0,0,0.0
VERUS SECURITIZATION TRUST VER SENIOR WH,,03/01/2022,0,0,0.0
VERUS SECURITIZATION TRUST VER WHOLE_CMO,,03/01/2022,0,0,0.0
VERUS SECURITIZATION TRUST VER WHOLE_CMO,,03/01/2022,0,0,0.0
VERUS SECURITIZATION TRUST VER WHOLE_CMO,,03/01/2022,0,0,0.0
VERUS SECURITIZATION TRUST VER WHOLE_CMO,,03/01/2022,0,0,0.0
VERUS SECURITIZATION TRUST VER SENIOR WH,,03/01/2022,0,0,0.0
VERUS SECURITIZATION TRUST VER WHOLE_CMO,,03/01/2022,0,0,0.0
Year's Book/ Exchange Book/ Interest/ Modifier VERUS SECURITIZATION TRUST VER SENIOR WH,,03/25/2022,0,0,0.0
VERUS SECURITIZATION TRUST VER SENIOR WH,,03/01/2022,0,0,0.0
VERUS SECURITIZATION TRUST VER SENIOR WH,,03/01/2022,0,0,0.0
VERUS SECURITIZATION TRUST VER WHOLE_CMO,,03/01/2022,0,0,0.0
VERUS SECURITIZATION TRUST VER WHOLE_CMO,,03/01/2022,0,0,0.0
VERUS SECURITIZATION TRUST VER WHOLE CMO,,03/01/2022,0,0,0.0
VIRGINIA ELECTRIC AND POWER CO SENIOR,CO,02/10/2022,0,0,0.0
MORGAN STANLEY & CO. INC VISA INC SENIOR CORP_BND 3.650% 09/15/,,03/23/2022,0,0,0.0
WAMU MORTGAGE PASS-THROUGH CER SENIOR WH,,03/01/2022,0,0,0.0
WF-RBS COMMERCIAL MORTGAGE TRU SUB SUB_C,,02/01/2022,0,0,0.0
WRKCO INC SENIOR CORP_BND 4.200% 06/01,,03/22/2022,0,0,0.0
CITIGROUP GLOBAL MKT INC WRGRACEHOLDINGSLLC SECURED CORP_BND 144A,,03/10/2022,0,0,0.0
92977B-A*-2 HOME DEPOT INC SENIOR CORP_BND 6.000%,,03/15/2022,0,0,0.0
WACHOVIA MORTGAGE LOAN TRUST L SUPSEN WH,,03/01/2022,0,0,0.0
WACHOVIA MORTGAGE LOAN TRUST L SENIOR AB,,03/25/2022,0,0,0.0
WALGREEN CO LEASE PASS THROUGH SENIOR,CO,03/15/2022,0,0,0.0
WAGNER EQUIPMENT,CO,02/15/2022,0,0,0.0
WALMART INC SENIOR CORP_BND 3.950% 06/,,03/16/2022,0,0,0.0
WAMU MORTGAGE PASS-THROUGH CER SUPSEN WH,,03/01/2022,0,0,0.0
WAMU ASSET-BACKED CERTIFICATES SENIOR AB,,03/25/2022,0,0,0.0
WAMU ASSET-BACKED CERTIFICATES SENIOR AB,,03/25/2022,0,0,0.0
WASHINGTON MUTUAL MORTGAGE PAS SENIOR AB,,03/01/2022,0,0,0.0
WASHINGTON MUTUAL MORTGAGE PAS SENIOR WH,,03/01/2022,0,0,0.0
WASHINGTON UNIVERSITY SENIOR CORP_BND,,03/22/2022,0,0,0.0
941848-F*-9 WATERS CORPORATION SENIOR CORP_BND 3.5,,02/10/2022,0,0,0.0
942682-B*-5 WATSON LAND COMPANY SENIOR CORP_BND 4.,,03/29/2022,0,0,0.0
WELLS FARGO & COMPANY SUB CORP_BND 4.1,,02/10/2022,0,0,0.0
CVS HEALTH CORP CORP_BND 5.610% 08/10/,,03/10/2022,0,0,0.0
FIRST UNION RAIL CORP SECURED CORP_BND,,01/02/2022,0,0,0.0
FIRST UNION RAIL CORP SECURED CORP_BND,,01/02/2022,0,0,0.0
FIRST UNION RAIL CORP SECURED CORP_BND,,01/02/2022,0,0,0.0
FIRST UNION RAIL CORP SECURED CORP_BND,,01/02/2022,0,0,0.0
FIRST UNION RAIL CORP SECURED CORP_BND,,01/02/2022,0,0,0.0
WELLS FARGO COMMERCIAL MORTGAG LCF SENIO,,03/01/2022,0,0,0.0
WELLS FARGO MORTGAGE BACKED SE SUPSEN WH,,03/01/2022,0,0,0.0
WELLS FARGO MORTGAGE BACKED SE SUPSEN WH,,03/01/2022,0,0,0.0
WEST POINT MILITARY HOUSING MUNITAX_BND,,01/01/2022,0,0,0.0
EVERGY KANSAS CENTRAL INC SECURED CORP_B,,01/21/2022,0,0,0.0
95984*-AA-8 WESTERN VISTA SOLAR HOLDINGS L SECURED C,,01/31/2022,0,0,0.0
WETT HOLDINGS LLC SECURED CORP_BND 4.3,,03/31/2022,0,0,0.0
Year's Book/ Exchange Book/ Interest/ Modifier 96928*-BK-2 WALGREEN,CO,03/15/2022,0,0,0.0
WISCONSIN PUBLIC SERVICE CORPO SENIOR,CO,03/16/2022,0,0,0.0
97806*-AG-7 WOLVERINE POWER SUPPLY COOP IN SENIOR,CO,03/10/2022,0,0,0.0
WW INTERNATIONAL INC SECURED CORP_BND 14,,03/08/2022,0,0,0.0
XPO LOGISTICS INC SENIOR CORP_BND 144A,,03/16/2022,0,0,0.0
ZAYO GROUP HOLDINGS INC SECURED CORP_BND,,03/15/2022,0,0,0.0
ZOOMINFOTECHNOLOGIESLLC SENIOR CORP_BND,,03/15/2022,0,0,0.0
DIAMOND SPORTS GROUP LLC CORP BND 9.0,,03/15/2022,0,0,0.0
CED NEVADA VIRGINIA FINANCING SECURED,CO,01/25/2022,0,0,0.0
CED NEVADA VIRGINIA FINANCING SECURED,CO,01/25/2022,0,0,0.0
AP ARISTOTLE HOLDINGS LLC SECURED CORP_B,,01/01/2022,0,0,0.0
AP ARISTOTLE HOLDINGS LLC SECURED CORP_B,,03/30/2022,0,0,0.0
AP ARISTOTLE HOLDINGS LLC SECURED CORP_B,,03/30/2022,0,0,0.0
G3659*-AE-1 FRANKE FINANCE INTERNATIONAL L SENIOR,CO,03/15/2022,0,0,0.0
SUMMARY ADJUSTMENT,,03/31/2022,0,0,0.0
BAYVIEW OPPORTUNITY MASTER FUN SENIOR AB,,03/28/2022,0,0,0.0
ATS AUTOMATION TOOLING SYSTEMS SENIOR,CO,03/16/2022,0,0,0.0
BANK OF MONTREAL SUB CORP BND 3.088% 0 A,,02/10/2022,0,0,0.0
BANK OF MONTREAL SENIOR CORP BND MTN A,,03/15/2022,0,0,0.0
CANADIAN NATIONAL RAILWAY COMP SENIOR,CO,02/10/2022,0,0,0.0
CANADIAN NATURAL RESOURCES LTD SENIOR,CO,03/15/2022,0,0,0.0
CLOVER LP SECURED CORP_BND 4.216% 03/3,,03/31/2022,0,0,0.0
FTG FRASER TRANSPORTATION GP SENIOR CORP,,03/31/2022,0,0,0.0
GARDA WORLD SECURITY CORP SECURED CORP_B A,,03/15/2022,0,0,0.0
CENOVUS ENERGY INC PRE-MERGER SENIOR,CO,02/09/2022,0,0,0.0
KINGSTON SOLAR LP INC SECURED CORP_BND,,01/31/2022,0,0,0.0
MERCER INTERNATIONAL INC SENIOR CORP_BND,,03/11/2022,0,0,0.0
MOUNTAIN VIEW PARTNERS GP SECURED CORP_B,,03/31/2022,0,0,0.0
NOUVELLE AUTOROUTE 30 FINANCEM SECURED C,,03/31/2022,0,0,0.0
PLENARY PROPERTIES NDC GP SECURED CORP_B,,03/07/2022,0,0,0.0
RESOLUTEFORESTPRODUCTS SENIOR CORP_BND 1,,03/16/2022,0,0,0.0
SEA TO SKY HIGHWAY INVESTMENT SECURED,CO,02/28/2022,0,0,0.0
87277*-AA-1 TM1505 LLC SECURED CORP_BND 5.350% 04/,,03/05/2022,0,0,0.0
CITIGROUP GLOBAL MKT INC TELESAT CANADA SECURED CORP_BND 144A 5 A,,03/21/2022,0,0,0.0
TELUS CORPORATION SENIOR CORP BND 3.40 A,,03/08/2022,0,0,0.0
COMPUTERSHARE INVESTOR SERVICE SENIOR,CO,02/09/2022,0,0,0.0
PLENARY HEALTH NORTH BAY FINCO SECURED C,,03/13/2022,0,0,0.0
ANNO 2017 JOINT HOLDING UK L SENIOR,CO,01/01/2022,0,0,0.0
Year's Book/ Exchange Book/ Interest/ Modifier ADANI PORTS AND SPECIAL ECONOM SENIOR,CO,02/02/2022,0,0,0.0
ADANI PORTS AND SPECIAL ECONOM SENIOR,CO,02/02/2022,0,0,0.0
ADANI ELECTRICITY MUMBAI LTD SECURED COR D,,01/13/2022,0,0,0.0
ALFA DESARROLLO SPA SECURED CORP_BND 144 D,,03/27/2022,0,0,0.0
CITIGROUP GLOBAL MKT INC ALTICE FRANCE SA FRANCE SECURED CORP_BN D,,03/10/2022,0,0,0.0
ANADOLU EFES BIRACILIK VE MALT SENIOR,CO,02/10/2022,0,0,0.0
APIDOS CLO APID_15-21A SENIOR ABS_ABS _1 D,,02/15/2022,0,0,0.0
APIDOS CLO APID_15-21A MEZZANIN ABS_ABS D,,02/15/2022,0,0,0.0
05330K-A@-4 AUTOPISTAS METROPOLITANAS,DE,03/31/2022,0,0,0.0
AUTOPISTAS METROPOLITANAS,DE,03/31/2022,0,0,0.0
BANCO BBVA PERU SA SENIOR CORP_BND 144A D,,02/14/2022,0,0,0.0
BAIN CAPITAL CREDIT CLO LTD BC MEZZANIN D,,03/14/2022,0,0,0.0
BAIN CAPITAL CREDIT CLO LTD BC ABS_ABS _ D,,03/14/2022,0,0,0.0
BARCLAYS PLC SENIOR CORP_BND 4.375% 01 D,,02/10/2022,0,0,0.0
BHARTI AIRTEL LTD SENIOR CORP_BND 144A D,,01/13/2022,0,0,0.0
BNP PARIBAS SA SUB CORP_BND 144A 2.824 D,,02/08/2022,0,0,0.0
CBOM FINANCE PLC SENIOR CORP_BND 144A D,,01/21/2022,0,0,0.0
CBOM FINANCE PLC SENIOR CORP_BND 144A D,,01/27/2022,0,0,0.0
CIFC FUNDING LTD CIFC_15-3A SENIOR ABS_A D,,01/19/2022,0,0,0.0
CIFC FUNDING LTD CIFC_15-4A ABS_ABS _15- D,,01/20/2022,0,0,0.0
CIFC FUNDING LTD CIFC_17-1A SENIOR ABS_A D,,01/21/2022,0,0,0.0
CARLYLE GLOBAL MARKET STRATEGI ABS_ABS _ D,,01/20/2022,0,0,0.0
KALLPA GENERACION SA SENIOR CORP_BND 144 D,,02/02/2022,0,0,0.0
CITIGROUP GLOBAL MKT INC DH EUROPE FINANCE II SARL SENIOR CORP_BN D,,03/16/2022,0,0,0.0
DKT FINANCE APS SENIOR CORP_BND 144A 9 D,,03/15/2022,0,0,0.0
DRYDEN SENIOR LOAN FUND DRSLF MEZZANIN A D,,02/16/2022,0,0,0.0
DRYDEN SENIOR LOAN FUND DRSLF SECURED AB D,,01/18/2022,0,0,0.0
DRYDEN SENIOR LOAN FUND DRSLF SENIOR ABS D,,01/18/2022,0,0,0.0
ENEL GENERACION CHILE SA SENIOR CORP_BND D,,03/14/2022,0,0,0.0
ENEL CHILE SA SENIOR CORP_BND 4.875% 0 D,,03/29/2022,0,0,0.0
GCATTRUSTGCAT_22-NQM1 WHOLE CMO M1-A1A 1 C,,03/25/2022,0,0,0.0
GNL QUINTERO SA SENIOR CORP_BND 144A 4 D,,02/09/2022,0,0,0.0
GNL QUINTERO SA SENIOR CORP_BND 144A 4 D,,01/31/2022,0,0,0.0
GALAXY PIPELINE ASSETS BIDCO L SECURED C D,,03/31/2022,0,0,0.0
GALAXY PIPELINE ASSETS BIDCO L SECURED C D,,03/31/2022,0,0,0.0
GLOBAL,SC,03/17/2022,0,0,0.0
GLOBAL,SC,03/01/2022,0,0,0.0
SEACO_21-2A SUB ABS_ABS _21-2A 144A 1. D,,03/17/2022,0,0,0.0
GOLD FIELDS OROGEN HOLDINGS B SENIOR,CO,01/20/2022,0,0,0.0
GRUMA SAB,DE,02/16/2022,0,0,0.0
GRUPO TELEVISA SAB SENIOR CORP_BND 6.6 D,,03/30/2022,0,0,0.0
MORGAN STANLEY & CO. INC HAWAIIAN BRAND INTELLECTUAL,PR,03/11/2022,0,0,0.0
IHS MARKIT LTD SENIOR CORP_BND 4.750% D,,03/02/2022,0,0,0.0
INEOS QUATTRO FINANCE 2 PLC SECURED CORP D,,03/16/2022,0,0,0.0
Year's Book/ Exchange Book/ Interest/ Modifier INVERSIONES CMPC SA CAYMAN IS SENIOR,CO,01/14/2022,0,0,0.0
LCM LTD PARTNERSHIP LCM_25A SENIOR ABS_A D,,02/28/2022,0,0,0.0
LLPL CAPITAL PTE LTD SECURED CORP_BND 1 D,,02/09/2022,0,0,0.0
LLPL CAPITAL PTE LTD SECURED CORP_BND 1 D,,02/04/2022,0,0,0.0
LIMA METRO LINE 2 FINANCE LTD SECURED,CO,01/05/2022,0,0,0.0
LIMA METRO LINE 2 FINANCE LTD SECURED,CO,01/05/2022,0,0,0.0
LLOYDS BANKING GROUP PLC SENIOR CORP_BND D,,02/10/2022,0,0,0.0
LUKOIL INTERNATIONAL FINANCE B SENIOR,CO,02/07/2022,0,0,0.0
LUKOIL SECURITIES BV SENIOR CORP_BND 144 D,,03/08/2022,0,0,0.0
MAGNETITE CLO LTD MAGNE_12-7A SENIOR ABS D,,01/18/2022,0,0,0.0
MEXICO GENERADORA,DE,02/09/2022,0,0,0.0
ORBIA ADVANCE CORPORATION SAB SENIOR COR D,,01/27/2022,0,0,0.0
ORBIA ADVANCE CORPORATION SAB SENIOR COR D,,01/14/2022,0,0,0.0
ORBIA ADVANCE CORPORATION SAB SENIOR COR D,,02/02/2022,0,0,0.0
MIZUHO FINANCIAL GROUP INC SENIORCORPBND D,,03/07/2022,0,0,0.0
MONG DUONG FINANCE HOLDINGS BV SECURED C D,,01/21/2022,0,0,0.0
NBK SPC LTD SENIOR CORP_BND 144A 2.750 D,,02/14/2022,0,0,0.0
NIELSEN COMPANY LUXEMBOURG SAR SENIOR,CO,03/10/2022,0,0,0.0
NOMURA HOLDINGS INC SENIOR CORP_BND 2. D,,02/08/2022,0,0,0.0
PKO FINANCE AB SENIOR CORP_BND 144A 4. D,,02/09/2022,0,0,0.0
PSTAT_20-1A SENIOR ABS_ABS _20-1A 144A D,,02/22/2022,0,0,0.0
QATAR AIRWAYS CORP_BND 2.950% 05/14/31 C,,02/14/2022,0,0,0.0
RESIMAC MBS TRUST RESI_18-1A SENIOR WHOL D,,03/10/2022,0,0,0.0
RESIMAC PREMIER SERIES RESI_19 SENIOR WH D,,03/10/2022,0,0,0.0
NATWEST GROUP PLC SENIOR CORP_BND 3.07 D,,02/10/2022,0,0,0.0
786584-A@-1 SAFRAN SA SENIOR CORP_BND 4.280% 02/09 D,,02/09/2022,0,0,0.0
SANTANDER UK GROUP HOLDINGS PL SENIOR,CO,02/10/2022,0,0,0.0
SEQUOIA INFRASTRUCTURE FUNDING ABS_ABS _ D,,01/15/2022,0,0,0.0
SHELL INTERNATIONAL FINANCE BV SENIOR,CO,03/23/2022,0,0,0.0
CITIGROUP GLOBAL MKT INC SHELL INTERNATIONAL FINANCE BV SENIOR,CO,03/16/2022,0,0,0.0
SIEMENS FINANCIERINGSMAATSCHAP SENIOR,CO,03/15/2022,0,0,0.0
CITIGROUP GLOBAL MKT INC SIGMA FINANCE NETHERLANDS BV SENIOR CORP D,,01/14/2022,0,0,0.0
SIGMA HOLDCO BV SENIOR CORP_BND 144A 7 D,,03/11/2022,0,0,0.0
STANDARD CHARTERED PLC SRP CORP_BND 144A D,,02/10/2022,0,0,0.0
STEEL FUNDING DAC SENIOR CORP_BND 144A D,,01/27/2022,0,0,0.0
TPG REAL ESTATE FINANCE ISSUER SENIOR SE D,,03/11/2022,0,0,0.0
TELECOM ITALIA SPA SENIOR CORP_BND 144A D,,03/21/2022,0,0,0.0
TELEFONICA EMISIONES SAU SENIOR CORP_BND D,,03/23/2022,0,0,0.0
TENGIZCHEVROIL FINANCE COMPANY SECURED C D,,03/25/2022,0,0,0.0
TENGIZCHEVROIL FINANCE COMPANY SECURED C D,,01/25/2022,0,0,0.0
TENGIZCHEVROIL FINANCE COMPANY SECURED C D,,01/25/2022,0,0,0.0
Year's Book/ Exchange Book/ Interest/ Modifier TEXTAINER MARINE CONTAINERS LI SENIOR AB C,,03/20/2022,0,0,0.0
TEXTAINER MARINE CONTAINERS LI SUB ABS_A C,,03/20/2022,0,0,0.0
THAYER PARK CLO LTD THAYR_17-1 MEZZANIN D,,01/20/2022,0,0,0.0
TOTALENERGIESCAPITALINTERNAT SENIOR CORP D,,03/07/2022,0,0,0.0
TRIVIUM PACKAGING FINANCE BV SECURED COR D,,03/08/2022,0,0,0.0
CITIGROUP GLOBAL MKT INC UBS AG LONDON BRANCH SENIOR CORP_BND 14 D,,02/24/2022,0,0,0.0
VIRGIN MEDIA FINANCE PLC SENIOR CORP_BND D,,03/15/2022,0,0,0.0
VOYA CLO LTD VOYA_14-3A SENIOR ABS_ABS _ D,,03/31/2022,0,0,0.0
VOYA CLO LTD VOYA_15-2A MEZZANIN ABS_ABS D,,03/18/2022,0,0,0.0
ZIGGO BV SECURED CORP_BND 144A 5.500% D,,01/21/2022,0,0,0.0
AI CANDELARIA SPAIN SA SECURED CORP_BND D,,01/20/2022,0,0,0.0
G1981*-AA-2 CAYMAN UNIVERSE HOLDINGS LLC SECURED COR D,,03/31/2022,0,0,0.0
G2735*-AA-9 GREAT ROLLING STOCK COMPANY PL SECURED C B,,03/31/2022,0,0,0.0
GOHL CAPITAL LTD SENIOR CORP_BND 4.250 D,,01/13/2022,0,0,0.0
GALAXY PIPELINE ASSETS BIDCO L SECURED C D,,03/31/2022,0,0,0.0
G4445*-AG-3 HIGH SPEED RAIL FINANCE PLC SENIOR CORP_ B,,03/31/2022,0,0,0.0
ROCK RAIL SOUTH WESTERN PLC SENIOR CORP_ B,,03/31/2022,0,0,0.0
SAGE GROUP PLC SENIOR CORP_BND 1.890% B,,01/26/2022,0,0,0.0
ST JAMESS ONCOLOGY FINANCING P SECURED C B,,03/31/2022,0,0,0.0
TENGIZCHEVROIL FINANCE COMPANY SECURED C D,,03/18/2022,0,0,0.0
WEIR GROUP PLC SENIOR CORP_BND 4.270% D,,02/16/2022,0,0,0.0
YORKSHIRE BUILDING SOCIETY SRP CORP_BND B,,03/17/2022,0,0,0.0
MERIDIAN SPIRIT APS SENIOR CORP_BND 4. D,,03/31/2022,0,0,0.0
L8038*-AA-4 SBM BALEIA AZUL SARL SENIOR CORP_BND 5 D,,03/15/2022,0,0,0.0
ENERGEAN ISRAEL FINANCE LTD SECURED CORP D,,01/21/2022,0,0,0.0
ICL GROUP LTD SENIOR CORP_BND 6.375% 0 D,,03/30/2022,0,0,0.0
LEVIATHAN BOND LTD SECURED CORP_BND 6. D,,01/20/2022,0,0,0.0
LEVIATHAN BOND LTD SECURED CORP_BND 6. D,,01/20/2022,0,0,0.0
LUKOIL INTERNATIONAL FINANCE B SENIOR,CO,03/08/2022,0,0,0.0
LUKOIL SECURITIES BV SENIOR CORP_BND 3 D,,02/16/2022,0,0,0.0
MINEJESA CAPITAL BV SECURED CORP_BND 4 D,,01/13/2022,0,0,0.0
EOLICA MESA LA PAZ S DE RL DE SECURED,CO,03/20/2022,0,0,0.0
GNL QUINTERO SA SENIOR CORP_BND 4.634% D,,01/31/2022,0,0,0.0
P7003*-AA-3,LA,03/31/2022,0,0,0.0
NASSAU AIRPORT DEVELOPMENT,CO,03/31/2022,0,0,0.0
NASSAU AIRPORT DEVELOPMENT,CO,03/30/2022,0,0,0.0
NASSAU AIRPORT DEVELOPMENT,CO,03/30/2022,0,0,0.0
Q0458*-AF-6 AQUASURE FINANCE PTY LTD SECURED CORP_BN D,,01/12/2022,0,0,0.0
GIPTITANIUMFINCOPTYLTD SECURED CORP BND D,,03/31/2022,0,0,0.0
Year's Book/ Exchange Book/ Interest/ Modifier SVENSKA HANDELSBANKEN AB SENIOR CORP_BND B,,01/18/2022,0,0,0.0
ADANI TRANSMISSION LTD SECURED CORP_BND D,,01/13/2022,0,0,0.0
LLPL CAPITAL PTE LTD SECURED CORP_BND D,,01/21/2022,0,0,0.0
ADANI TRANSMISSION LTD CORP_BND 5.200% D,,03/11/2022,0,0,0.0
ADANI TRANSMISSION LTD CORP_BND 5.200% D,,03/11/2022,0,0,0.0
ELECTRICITE,DE,03/03/2022,0,0,0.0
AHP HEALTH PARTNERS INC SECURED TERM_LOA,,03/16/2022,0,0,0.0
AHP HEALTH PARTNERS INC SECURED TERM_LOA,,03/31/2022,0,0,0.0
API GROUP,DE,03/31/2022,0,0,0.0
API GROUP,DE,03/31/2022,0,0,0.0
APX GROUP INC SECURED TERM_LOAN 4.506%,,03/18/2022,0,0,0.0
APX GROUP INC SECURED TERM_LOAN 4.506%,,03/31/2022,0,0,0.0
TRIDENT TPI HOLDINGS INC SECURED TERM_LO,,03/14/2022,0,0,0.0
TRIDENT TPI HOLDINGS INC SECURED TERM_LO,,03/31/2022,0,0,0.0
ADIENT US LLC SECURED TERM_LOAN 4.256%,,03/31/2022,0,0,0.0
ADMI CORP SECURED TERM_LOAN 4.381% 12/,,03/18/2022,0,0,0.0
ADMI CORP SECURED TERM_LOAN 4.381% 12/,,03/31/2022,0,0,0.0
AECOM SECURED TERM_LOAN 2.756% 04/13/2,,03/31/2022,0,0,0.0
ADVANCED DRAINAGE SYSTEMS INC SECURED TE,,01/04/2022,0,0,0.0
ALIXPARTNERS LLP SECURED TERM_LOAN 3.7,,03/23/2022,0,0,0.0
ALIXPARTNERS LLP SECURED TERM_LOAN 3.7,,03/31/2022,0,0,0.0
ALLIANCE LAUNDRY SYSTEMS LLC SECURED TER,,03/31/2022,0,0,0.0
ALLIANT HOLDINGS INTERMEDIATE SECURED TE,,03/18/2022,0,0,0.0
ALLIANT HOLDINGS INTERMEDIATE SECURED TE,,03/31/2022,0,0,0.0
ALLIANT HOLDINGS INTERMEDIATE SECURED TE,,03/18/2022,0,0,0.0
ALLIANT HOLDINGS INTERMEDIATE SECURED TE,,03/31/2022,0,0,0.0
FINASTRA USA INC SECURED TERM_LOAN 4.5,,02/28/2022,0,0,0.0
AMERICAN AIRLINES INC SECURED TERM_LOAN,,03/21/2022,0,0,0.0
AMERICAN AIRLINES INC SECURED TERM_LOAN,,03/15/2022,0,0,0.0
AMERICAN AXLE & MANUFACTURING SECURED TE,,03/25/2022,0,0,0.0
AMERICAN BUILDERS & CONTRACTOR SECURED T,,03/31/2022,0,0,0.0
Year's Book/ Exchange Book/ Interest/ Modifier AMWINS GROUP INC SECURED TERM_LOAN 3.2,,03/31/2022,0,0,0.0
PRIME SECURITY SERVICES BORROW SECURED T,,03/31/2022,0,0,0.0
APPLIED SYSTEMS INC SECURED TERM_LOAN,,03/16/2022,0,0,0.0
APPLOVIN CORP SECURED TERM_LOAN 3.500%,,03/17/2022,0,0,0.0
APPLOVIN CORP SECURED TERM_LOAN 3.500%,,01/01/2022,0,0,0.0
MERCURY BORROWER INC SECURED TERM_LOAN,,03/10/2022,0,0,0.0
ARC FALCON I INC SECURED TERM_LOAN 4.2,,03/31/2022,0,0,0.0
ASCEND LEARNING LLC SECURED TERM LOAN,,03/31/2022,0,0,0.0
ASCEND PERFORMANCE MATERIALS O SECURED T,,03/31/2022,0,0,0.0
ASPLUNDH TREE EXPERT LLC SECURED TERM_LO,,03/31/2022,0,0,0.0
ASSUREDPARTNERS INC SECURED TERM_LOAN,,03/22/2022,0,0,0.0
ASSUREDPARTNERS INC SECURED TERM_LOAN,,03/31/2022,0,0,0.0
ASURION LLC SECURED TERM_LOAN 3.457% 1,,03/23/2022,0,0,0.0
ASURION LLC SECURED TERM_LOAN 3.457% 1,,03/31/2022,0,0,0.0
ASURION LLC SECURED TERM_LOAN 3.707% 1,,03/18/2022,0,0,0.0
ASURION LLC SECURED TERM_LOAN 3.707% 1,,03/31/2022,0,0,0.0
ASURION LLC SECURED TERM_LOAN 6.256% 0,,03/25/2022,0,0,0.0
ATHENAHEALTH INC SECURED TERM_LOAN 4.6,,02/15/2022,0,0,0.0
AVANTOR FUNDING INC SECURED TERM_LOAN,,03/31/2022,0,0,0.0
AVANTOR INC SECURED TERM_LOAN 2.750% 1,,03/31/2022,0,0,0.0
AVIS BUDGET CAR RENTAL LLC SECURED TERM_,,03/31/2022,0,0,0.0
AVOLON TLB BORROWER 1 US LLC SECURED T,,03/31/2022,0,0,0.0
FIRST EAGLE HOLDINGS INC SECURED TERM_LO,,03/31/2022,0,0,0.0
BALLYS CORP SECURED TERM_LOAN 3.750% 1,,03/31/2022,0,0,0.0
BOXER PARENT,CO,03/17/2022,0,0,0.0
BOXER PARENT,CO,03/31/2022,0,0,0.0
GREAT AMERICAN OUTDOORS GROUP SECURED TE,,03/31/2022,0,0,0.0
BELRON FINANCE US LLC SECURED TERM_LOAN,,03/31/2022,0,0,0.0
Year's Book/ Exchange Book/ Interest/ Modifier BELRON FINANCE 2019 LLC SECURED TERM_LOA,,03/31/2022,0,0,0.0
BELRON FINANCE US LLC SECURED TERM_LOAN,,03/31/2022,0,0,0.0
BLUCORA INC SECURED TERM_LOAN 5.000% 0,,03/31/2022,0,0,0.0
BOYD GAMING CORPORATION SECURED TERM_LOA,,03/02/2022,0,0,0.0
