name,state,date_acquired,book_value,investment_income,ownership_pct
Market Originally Type and Actual Cost at Time of Additional Investment Amount of Commitment for Percentage of ACCEL GROWTH V L.P. Palo Alto,CA,03/11/2019,0,0,0.41
ACCEL INDIA V LP Bangalore,IND,11/07/2016,0,0,0.35
Accel London VI L.P. London GBR ACCEL LONDON,VI,06/18/2019,0,0,0.46
ACCEL XIV L.P. Palo Alto,CA,03/21/2019,0,0,0.44
Advent Intl GPE IX-A SCSP Boston,MA,10/22/2019,0,0,0.57
ADVENT INTL GPE IX-D SCSP Boston,MA,10/15/2019,0,0,1.8
AEA MEZZANINE FUND II LP New York,NY,08/28/2008,0,0,2.45
AEA MEZZANINE FUND III LP New York,NY,03/15/2013,0,0,1.21
AEA MEZZANINE FUND IV LP New York,NY,07/23/2018,0,0,5.07
Affinity Asia Paci Fund IV LP Singapore,SGP,03/20/2013,0,0,0.45
Affinity Asia Pacific Fd V LP Hong Kong,CHN,12/10/2018,0,0,0.23
AH PARALLEL FUND V LP Menlo Park,CA,05/31/2016,0,0,0.22
AH PARALLEL FUND V Q LP Menlo Park,CA,05/31/2016,0,0,0.59
Alchemy Special Opp Fund IV LP London,GBR,12/11/2019,0,0,1.16
American Industrial Cap IV LP San Francisco,CA,04/25/2008,0,0,4.76
American Industrial Cap VII LP New York,NY,10/22/2019,0,0,0.62
American Securities VII LP New York,NY,12/10/2014,0,0,0.5
Andreessen Horowitz V Q LP Menlo Park,CA,05/31/2016,0,0,0.66
Andreessen Horowitz Fd VI LP Menlo Park,CA,06/05/2019,0,0,0.37
Andreessen Horowitz Fund V LP Menlo Park,CA,05/31/2016,0,0,0.25
AndreessenHorowitz LSV Fd I LP Menlo Park,CA,05/07/2019,0,0,0.26
Arlington Capital IV LP Chevy Chase,MD,07/28/2016,0,0,2.12
ARSENAL CAPITAL PARTNERS V LP New York,NY,07/08/2019,0,0,0.83
Astorg VII L.P. Paris,FRA,06/17/2019,0,0,0.4
ATLAS VENTURE FUND IX LP Wilmington,DE,12/12/2012,0,0,2.36
Audax Mezzanine Fund III LP New York,NY,12/10/2009,0,0,2.0
Baring Asia PE Fund VII LP Hong Kong,CHN,04/30/2019,0,0,0.44
BATTERY VENTURES XII LP Boston,MA,03/26/2018,0,0,1.02
BATTERY VENTURES XII SIDE FUND Boston,MA,03/26/2018,0,0,1.04
BATTERY VENTURES XIII L.P Boston,MA,04/27/2020,0,0,0.72
BATTERY VENTURES XIII SdeFd LP Boston,MA,04/27/2020,0,0,0.73
BC European Capital IX L.P. St. Peter Port,GBR,11/23/2010,0,0,0.18
BDC III L.P. London,GBR,04/25/2016,0,0,2.055
BDCM OPPORTUNITY FUND IV LP Greenwich,CT,02/04/2015,0,0,0.33
BEHRMAN CAPITAL IV LP New York,NY,06/29/2007,0,0,10.08
Bessemer Ventr Pts X Instl LP Larchmont,NY,11/30/2018,0,0,1.08
Market Originally Type and Actual Cost at Time of Additional Investment Amount of Commitment for Percentage of Bessemer Ventr Pts XI Instl LP San Francisco,CA,03/22/2021,0,0,0.31
Blackstone Capital VII LP New York,NY,04/07/2015,0,0,0.1
BLUE SEA CAPITAL FUND I LP Palm Beach,FL,10/18/2013,0,0,4.18
BOND CAPITAL FUND I LP San Francisco,CA,05/30/2019,0,0,0.95
Brentwood Associates PE V LP Los Angeles,CA,06/12/2013,0,0,1.46
Brentwood Associates PE VI LP Los Angeles,CA,12/06/2016,0,0,0.7
Bridgepoint Europe V L.P. London,GBR,09/03/2014,0,0,0.11
Capital International PE VI LP Los Angeles,CA,03/24/2011,0,0,0.65
Carlyle Eur Tech Ptnrs IV S.C Washington,DC,01/02/2020,0,0,0.89
CARLYLE GLOBAL PARTNERS LP Washington,DC,09/01/2016,0,0,3.29
CARLYLE PARTNERS VII L.P. Washington,DC,12/19/2018,0,0,0.21
C-BRIDGE HEALTHCARE FUND II LP New York,NY,12/04/2020,0,0,0.43
CCMP CAPITAL INVESTORS III LP New York,NY,07/02/2014,0,0,0.26
CHRYSCAPITAL VIII LLC Port Louis,IND,03/30/2020,0,0,1.83
CIP CAPITAL FUND II LP New York,NY,02/04/2016,0,0,2.31
CIVC PARTNERS FUND V LP Chicago,IL,03/31/2017,0,0,4.6
CLEARLAKE CAPITAL PARTNERS VI Santa Monica,CA,05/22/2020,0,0,0.11
Cortec Group Fund V LP New York,NY,12/15/2010,0,0,2.21
Court Square Capital III LP New York,NY,12/27/2011,0,0,0.89
Crescent Mezzanine VII LP Los Angeles,CA,06/28/2016,0,0,0.58
CRV XVII LP Cambridge,MA,03/28/2018,0,0,1.5
CRV XVIII LP Palo Alto,CA,02/12/2021,0,0,1.67
DENHAM OIL & GAS FUND LP Boston,MA,04/28/2017,0,0,2.18
DYAL CAPITAL PARTNERS III LP New York,NY,09/09/2016,0,0,1.3
DYAL CAPITAL PARTNERS IV LP New York,NY,06/11/2018,0,0,1.98
EnCap Energy Capital XI LP Houston,TX,12/12/2016,0,0,0.36
ENCAP ENERGY CAPITAL FUND X LP Houston,TX,02/05/2015,0,0,0.29
EnCap Energy Capital IX Houston,TX,01/04/2013,0,0,0.24
Falcon Mezzanine II LP Needham,MA,04/12/2005,0,0,7.07
FFL CAPITAL PARTNERS IV LP San Francisco,CA,12/03/2013,0,0,1.55
FOUNDATION CAPITAL IX L.P. San Francisco,CA,01/30/2019,0,0,2.63
FountainVest China Cap III LP Shanghai,CHN,06/30/2016,0,0,0.35
FRANCISCO PARTNERS V LP San Francisco,CA,05/29/2018,0,0,0.47
FURTHER GLOBAL CAP PTNRS L.P. New York,NY,01/29/2020,0,0,7.16
Global Infrastructure Pt II LP New York,NY,09/15/2011,0,0,0.25
Global Infrastructure Pt IV LP New York,NY,10/10/2019,0,0,0.48
Market Originally Type and Actual Cost at Time of Additional Investment Amount of Commitment for Percentage of GREAT HILL EQUITY PARTNERS VII Boston,MA,09/01/2020,0,0,0.73
GREEN EQUITY INVESTORS V LP Los Angeles,CA,01/30/2007,0,0,0.52
GREEN EQUITY INVESTORS VI LP Los Angeles,CA,10/18/2011,0,0,0.42
GREEN EQUITY INVESTORS VII LP Los Angeles,CA,02/16/2016,0,0,0.14
GREEN EQUITY INVESTORS VIII L. Los Angeles,CA,10/21/2020,0,0,0.17
GRYPHON HERITAGE PARTNERS L.P. Arlington,VA,12/15/2020,0,0,6.04
GSO Cap Opportunities II LP New York,NY,05/09/2011,0,0,0.77
GSO Cap Opportunities IV LP New York,NY,03/15/2021,0,0,0.4
GSO Cap OpportunitiesIII CoInv New York,NY,01/09/2020,0,0,0.08
GSO Cap Opportunities III LP New York,NY,04/26/2016,0,0,0.29
Hg Capital 8 D L.P. London,GBR,04/03/2018,0,0,0.37
HG Capital Mercury 2 LP London,GBR,04/03/2018,0,0,1.12
HG SATURN L.P. London,GBR,05/04/2018,0,0,1.1
Hony Capital Fund V LP Beijing,CHN,10/19/2011,0,0,0.63
ICG N American Pvt Debt II LP New York,NY,02/25/2019,0,0,3.23
ICG N American Pvt Debt LP New York,NY,08/22/2014,0,0,2.58
IK VII No I LP Jersey,GBR,11/18/2011,0,0,0.24
INDEX VENTURES GROWTH IV London,GBR,11/08/2018,0,0,1.14
Index Ventures IX L.P. London,GBR,08/30/2018,0,0,0.58
Industri Kapital 2007 Fund L.P London,GBR,05/03/2007,0,0,0.52
Industrial Growth IV LP San Francisco,CA,05/17/2011,0,0,1.71
Industrial Growth V LP San Francisco,CA,04/08/2016,0,0,1.67
INFLEXION BUYOUT FUND V LP London,GBR,06/18/2018,0,0,0.64
Inflexion Capital Fund II LP London,GBR,06/18/2018,0,0,0.6
KOHLBERG INVESTORS VIII LP Mount Kisco,NY,07/25/2016,0,0,2.3
KPCB Digital Growth III LLC New York,NY,06/13/2016,0,0,0.82
Landmark Equity XIV LP Simsbury,CT,12/19/2008,0,0,0.45
Lightspeed China Ptnrs IV LP Shanghai,CHN,10/18/2019,0,0,0.82
Lightspeed China Pts Sel I LP Shanghai,CHN,04/17/2019,0,0,1.11
Lightspeed Venture Ptrn XII LP Menlo Park,CA,04/16/2018,0,0,0.55
MARANON MEZZANINE FUND II LP Chicago,IL,04/30/2013,0,0,3.22
Meritech Capital VI LP Palo Alto,CA,06/07/2018,0,0,0.96
MetLife Mid Mkt Pvt Dbt Fd LP Whippany,NJ,07/24/2018,0,0,36.9
NB CROSSROADS PRIVATE MARKETS New York,NY,01/12/2021,0,0,24.04
New Enterprise Assoc 16 LP Menlo Park,CA,04/05/2017,0,0,0.26
New Enterprise Associates 17LP Menlo Park,CA,07/19/2019,0,0,0.39
Market Originally Type and Actual Cost at Time of Additional Investment Amount of Commitment for Percentage of NEWVIEW CAPITAL FUND II L.P. Burlingame,CA,10/23/2020,0,0,8.24
Oaktree Opportunities Fd XI LP Los Angeles,CA,08/21/2020,0,0,0.26
Oaktree Opportunities Xb LP Los Angeles,CA,06/18/2018,0,0,0.28
Odyssey Investment V LP New York,NY,06/24/2014,0,0,0.48
OLYMPUS GROWTH FUND VII L.P. Stamford,CT,01/15/2019,0,0,1.1
PA Direct Credit Opport II LP Darien,CT,10/04/2016,0,0,2.22
PAG Asia III L.P. Hong Kong,CHN,09/17/2019,0,0,0.21
PAI Europe VI Paris,FRA,07/24/2013,0,0,0.75
Patria Brazilian PE IV LP Sao Paulo,BRA,07/26/2011,0,0,0.64
Patria Brazilian PE V LP Sao Paulo,BRA,05/19/2014,0,0,1.25
Patria-Brazilian PE Fd VI LP Sao Paulo,BRA,12/14/2018,0,0,0.37
PERMIRA VII L.P. London,GBR,02/05/2020,0,0,0.24
Polish Enterprise Fund VIII LP Warsaw POL Enterprise Investors,,09/08/2017,0,0,2.22
PPC III LP New York,NY,03/24/2021,0,0,1.25
PRIMAVERA CAPITAL FUND III LP Hong Kong,CHN,06/01/2018,0,0,0.74
Primavera Capital Group II LP Hong Kong,CHN,10/14/2014,0,0,1.27
PUBLIC PENSION CAPITAL LLC New York,NY,07/10/2014,0,0,0.97
RIVERSIDE FUND V CF L.P. Boston,MA,03/18/2021,0,0,0.77
Riverstone Glob Ener &Pwr V LP New York,NY,01/12/2012,0,0,0.36
SCALE VENTURE PARTNERS VI L.P. Foster,CA,09/21/2018,0,0,2.31
SILVER LAKE PARTNERS III LP Menlo Park,CA,02/28/2007,0,0,0.24
SILVER LAKE PARTNERS IV LP Menlo Park,CA,09/07/2012,0,0,0.06
SILVER LAKE PARTNERS V LP Menlo Park,CA,06/12/2018,0,0,0.14
SILVER LAKE PARTNERS VI LP Menlo Park,CA,01/06/2021,0,0,0.1
TCV XI L.P. New York,NY,02/01/2021,0,0,0.46
THE RESOLUTE FUND IV L.P. New York,NY,12/07/2018,0,0,0.62
The Veritas Capital Fund VI LP New York,NY,12/08/2016,0,0,0.3
Towerbrook Investors IV LP George Town,CYM,02/05/2013,0,0,0.31
TPG ASIA VI LP Fort Worth,TX,02/01/2013,0,0,0.39
Trident V LP Greenwich,CT,02/26/2010,0,0,0.72
VERITAS CAPITAL FUND VII L.P. New York,NY,04/15/2020,0,0,0.46
MetLife Core Prop Fund LP Morristown,NJ,11/01/2013,0,0,0.06
Market Originally Type and Actual Cost at Time of Additional Investment Amount of Commitment for Percentage of ML Commercial Mortge Inc Fd Morristown,NJ,10/02/2015,0,0,0.06
Mortgage Fund IVc LP Coral Gables,FL,12/12/2012,0,0,15.84
Surplus Debentures - Unaffiliated,FE,05/04/2020,0,0,0.0
Fixed or Variable Interest Rate Investments That Have Underlying Characteristics of Mortgage Loans - Unaffiliated Colonial Estates Homeowners As Taunton,MA,09/27/2016,0,0,0.0
Hillcrest Community Cooperative Freeborn,MN,01/29/2016,0,0,0.0
Park Place Cooperative Inc.RE Rochester,MN,11/20/2017,0,0,0.0
Park Place Cooperative Inc. Peabody,MA,05/25/2017,0,0,0.0
Resident Ownership Capital LLC Taunton,MA,04/13/2016,0,0,0.0
Town & Country Kingston Estate Plymouth,MA,04/28/2017,0,0,0.0
ACCEL GROWTH FUND II LP Palo Alto,CA,06/15/2011,0,0,0.0
ACCEL GROWTH FUND LP Palo Alto,CA,12/10/2008,0,0,0.0
ACCEL GROWTH V L.P. Palo Alto,CA,03/11/2019,0,0,0.0
Advent Intl GPE IX-A SCSP Boston,MA,10/22/2019,0,0,0.0
ADVENT INTL GPE IX-D SCSP Boston,MA,10/15/2019,0,0,0.0
Advent Intnl GPE VII B LP Wilmington,DE,08/20/2012,0,0,0.0
Advent Latin America PE IVE LP Boston,MA,01/01/2007,0,0,0.0
"Statement as of March 31, 2021 of the Brighthouse Life Insurance Company AEA MEZZANINE FUND II LP New York",NY,08/28/2008,0,0,0.0
AEA MEZZANINE FUND III LP New York,NY,03/15/2013,0,0,0.0
AEA MEZZANINE FUND IV LP New York,NY,07/23/2018,0,0,0.0
Affinity Asia Paci Fund IV LP Singapore,SGP,03/20/2013,0,0,0.0
Affinity Asia Pacific Fd V LP Hong Kong,CHN,12/10/2018,0,0,0.0
AH PARALLEL FUND IV LP Menlo Park,CA,05/08/2014,0,0,0.0
American Industrial Cap IV LP San Francisco,CA,04/25/2008,0,0,0.0
American Industrial Cap VII LP New York,NY,10/22/2019,0,0,0.0
American Securities VII LP New York,NY,12/10/2014,0,0,0.0
American Securities VIII LP New York,NY,03/15/2019,0,0,0.0
Andreessen Horowitz III LP Menlo Park,CA,01/31/2012,0,0,0.0
Arlington Capital IV LP Chevy Chase,MD,07/28/2016,0,0,0.0
ARSENAL CAPITAL PARTNERS V LP New York,NY,07/08/2019,0,0,0.0
ATLAS VENTURE FUND IX LP Wilmington,DE,12/12/2012,0,0,0.0
Audax Dir Lending Soln Fd LP New York,NY,10/26/2018,0,0,0.0
Audax Mezzanine Fund III LP New York,NY,12/10/2009,0,0,0.0
Bain Cap VII Coinvestment Fund Boston,MA,05/31/2001,0,0,0.0
Baring Asia PE Fund VI LP Hong Kong,CHN,07/25/2014,0,0,0.0
Baring Asia PE Fund VII LP Hong Kong,CHN,04/30/2019,0,0,0.0
BATTERY VENTURES IX LP Waltham,MA,12/16/2009,0,0,0.0
Bayview Opport Domestic V LP New York,NY,02/01/2017,0,0,0.0
BDC III L.P. London,GBR,04/25/2016,0,0,0.0
BDCM OPPORTUNITY FUND III LP Greenwich,CT,11/06/2009,0,0,0.0
BDCM OPPORTUNITY FUND IV LP Greenwich,CT,02/04/2015,0,0,0.0
Bessemer Ventr Pts X Instl LP Larchmont,NY,11/30/2018,0,0,0.0
Blackstone Capital VI LP New York,NY,07/29/2008,0,0,0.0
Blackstone Capital VII LP New York,NY,04/07/2015,0,0,0.0
Blackstone Strat Allianc II LP New York,NY,11/23/2010,0,0,0.0
BLUE SEA CAPITAL FUND I LP Palm Beach,FL,10/18/2013,0,0,0.0
Brentwood Associates PE V LP Los Angeles,CA,06/12/2013,0,0,0.0
Bridgepoint Europe V L.P. London,GBR,09/03/2014,0,0,0.0
Brockway Moran & Part II LP Boca Raton,FL,09/13/2001,0,0,0.0
Canaan Equity II LP QP Rowayton,CT,10/20/1999,0,0,0.0
Capital International PE VI LP Los Angeles,CA,03/24/2011,0,0,0.0
CARLYLE GLOBAL PARTNERS LP Washington,DC,09/01/2016,0,0,0.0
CARLYLE PARTNERS V LP Washington,DC,05/30/2007,0,0,0.0
CARLYLE PARTNERS VI LP Washington,DC,02/19/2013,0,0,0.0
"Statement as of March 31, 2021 of the Brighthouse Life Insurance Company CARLYLE PARTNERS VII L.P. Washington",DC,12/19/2018,0,0,0.0
CCMP CAPITAL INVESTORS III LP New York,NY,07/02/2014,0,0,0.0
CHAMP IV TRUST B Sydney,AUS,07/24/2015,0,0,0.0
Charles River XV LP Menlo Park,CA,02/15/2012,0,0,0.0
CIP CAPITAL FUND II LP New York,NY,02/04/2016,0,0,0.0
CIVC PARTNERS FUND V LP Chicago,IL,03/31/2017,0,0,0.0
Cortec Group Fund V LP New York,NY,12/15/2010,0,0,0.0
Court Square Capital III LP New York,NY,12/27/2011,0,0,0.0
Crescent Mezzanine VI LP Los Angeles,CA,12/27/2011,0,0,0.0
Crescent Mezzanine VII LP Los Angeles,CA,06/28/2016,0,0,0.0
CVC Cap Asia Pacific IV LP George Town,CYM,05/13/2014,0,0,0.0
CVC Capital Partners VI L.P. London,GBR,06/28/2013,0,0,0.0
CVC CAPITAL PARTNERS VII L.P. London,GBR,12/05/2018,0,0,0.0
DYAL CAPITAL PARTNERS III LP New York,NY,09/09/2016,0,0,0.0
DYAL CAPITAL PARTNERS IV LP New York,NY,06/11/2018,0,0,0.0
ENCAP ENERGY CAPITAL FUND X LP Houston,TX,02/05/2015,0,0,0.0
EnCap Energy Capital IX Houston,TX,01/04/2013,0,0,0.0
Equistone Ptnrs Eur Fd IV B LP London,GBR,11/14/2011,0,0,0.0
Falcon Mezzanine II LP Needham,MA,04/12/2005,0,0,0.0
Falcon Strategic III LP Boston,MA,10/20/2008,0,0,0.0
FFL CAPITAL PARTNERS IV LP San Francisco,CA,12/03/2013,0,0,0.0
FountainVest China Cap III LP Shanghai,CHN,06/30/2016,0,0,0.0
FRANCISCO PARTNERS AGILITY LP San Francisco,CA,09/08/2016,0,0,0.0
FRANCISCO PARTNERS IV LP San Francisco,CA,12/08/2014,0,0,0.0
Global Infrastructure Pt II LP New York,NY,09/15/2011,0,0,0.0
Global Infrastructure Pt IV LP New York,NY,10/10/2019,0,0,0.0
GREAT HILL EQUITY PARTNERS VII Boston,MA,12/18/2020,0,0,0.0
GREEN EQUITY INVESTORS V LP Los Angeles,CA,01/30/2007,0,0,0.0
GREEN EQUITY INVESTORS VI LP Los Angeles,CA,10/18/2011,0,0,0.0
GREEN EQUITY INVESTORS VII LP Los Angeles,CA,02/16/2016,0,0,0.0
GRYPHON HERITAGE PARTNERS L.P. Arlington,VA,12/15/2020,0,0,0.0
GS Mezzanine Partners V LP New York,NY,09/26/2007,0,0,0.0
GSO Cap Opportunities II LP New York,NY,05/09/2011,0,0,0.0
GSO Cap OpportunitiesIII CoInv New York,NY,04/26/2016,0,0,0.0
GSO CAP OPPS FD III CO-INV LP New York,NY,01/09/2020,0,0,0.0
Hony Capital Fund V LP Beijing,CHN,10/19/2011,0,0,0.0
"Statement as of March 31, 2021 of the Brighthouse Life Insurance Company ICG N American Pvt Debt II LP New York",NY,02/25/2019,0,0,0.0
ICG N American Pvt Debt LP New York,NY,08/22/2014,0,0,0.0
IDG-Accel China Capital II FDN Palo Alto,CA,03/29/2011,0,0,0.0
IK VII No I LP Jersey,GBR,11/18/2011,0,0,0.0
Industri Kapital 2007 Fund L.P London,GBR,05/03/2007,0,0,0.0
INFLEXION BUYOUT FUND V LP London,GBR,06/18/2018,0,0,0.0
King Street Capital LP New York,NY,06/01/2008,0,0,0.0
KOHLBERG INVESTORS VIII LP Mount Kisco,NY,07/25/2016,0,0,0.0
KPCB Digital Growth III LLC New York,NY,06/13/2016,0,0,0.0
LANDMARK EQU PARTNERS XVI LP Simsbury,CT,12/07/2018,0,0,0.0
Landmark Equity XIV LP Simsbury,CT,12/19/2008,0,0,0.0
MARANON MEZZANINE FUND II LP Chicago,IL,04/30/2013,0,0,0.0
Meritech Capital IV LP Palo Alto,CA,09/29/2010,0,0,0.0
Meritech Capital VI LP Palo Alto,CA,06/07/2018,0,0,0.0
MetLife Mid Mkt Pvt Dbt Fd LP Whippany,NJ,07/24/2018,0,0,0.0
MID EUROPA FUND IV LP London,GBR,04/07/2014,0,0,0.0
New Enterprise Assoc 13 LP Menlo Park,CA,12/19/2008,0,0,0.0
NEWVIEW CAPITAL FUND I LP San Francisco,CA,11/20/2018,0,0,0.0
PA Direct Credit Opport II LP Darien,CT,10/04/2016,0,0,0.0
PAI Europe VI Paris,FRA,07/24/2013,0,0,0.0
Partners Grp Asia Pac 2007 LP Channel Islands,GBR,05/31/2007,0,0,0.0
Partners Grp Secondary 2006 LP Guernsey,GBR,03/10/2006,0,0,0.0
PERMIRA V LP London,GBR,04/24/2013,0,0,0.0
Pimco Bravo Fd Off Feed II LP Newport Beach,CA,04/16/2013,0,0,0.0
PIMCO BRAVO Fd Onsh. Feed I LP Newport Beach,CA,05/24/2011,0,0,0.0
PRIMAVERA CAPITAL FUND III LP Hong Kong,CHN,06/01/2018,0,0,0.0
Primavera Capital Group II LP Hong Kong,CHN,10/14/2014,0,0,0.0
PUBLIC PENSION CAPITAL LLC New York,NY,07/10/2014,0,0,0.0
QUANTUM ENERGY PARTNERS V LP Houston,TX,09/30/2008,0,0,0.0
QUANTUM ENERGY PARTNERS VII LP Houston,TX,09/01/2017,0,0,0.0
REDPOINT OMEGA II LP Menlo Park,CA,10/18/2011,0,0,0.0
REDPOINT VENTURES II LP Menlo Park,CA,11/07/2000,0,0,0.0
Riverstone Carlyle Ener&Pwr IV New York,NY,05/02/2008,0,0,0.0
"Statement as of March 31, 2021 of the Brighthouse Life Insurance Company Riverstone Glob Ener &Pwr V LP New York",NY,01/12/2012,0,0,0.0
Sequoia Cap China Venture V LP Menlo Park,CA,09/16/2014,0,0,0.0
Sequoia Cap US Growth VI LP Palo Alto,CA,04/03/2014,0,0,0.0
Sequoia Cap US Venture 2010 LP Menlo Park,CA,03/25/2010,0,0,0.0
SequoiaCapUS Vent 2010-Seed LP Menlo Park,CA,12/01/2012,0,0,0.0
SILVER LAKE PARTNERS III LP Menlo Park,CA,02/28/2007,0,0,0.0
SILVER LAKE PARTNERS IV LP Menlo Park,CA,09/07/2012,0,0,0.0
SILVER LAKE PARTNERS V LP Menlo Park,CA,06/12/2018,0,0,0.0
SJF VENTURES III LP Durham,NC,04/25/2013,0,0,0.0
Summit Ventures VI A LP Boston,MA,12/01/2000,0,0,0.0
The Resolute Fund II LP New York,NY,05/31/2007,0,0,0.0
THE RESOLUTE FUND III LP New York,NY,01/17/2014,0,0,0.0
THE RESOLUTE FUND IV L.P. New York,NY,12/07/2018,0,0,0.0
The Veritas Capital Fund VI LP New York,NY,12/08/2016,0,0,0.0
Towerbrook Investors IV LP George Town,CYM,02/05/2013,0,0,0.0
TPG ASIA V LP Fort Worth,TX,12/17/2007,0,0,0.0
TPG ASIA VI LP Fort Worth,TX,02/01/2013,0,0,0.0
Trident V LP Greenwich,CT,02/26/2010,0,0,0.0
TRIVEST FUND V LP Coral Gables,FL,09/17/2012,0,0,0.0
TrueBridge Kauffman Fellows II Durham,NC,06/12/2009,0,0,0.0
US VENTURE PARTNERS VIII LP Menlo Park,CA,12/01/2000,0,0,0.0
Welsh Carson Anderson Stowe XI New York,NY,05/29/2008,0,0,0.0
YORKTOWN ENERGY PARTNERS V LP New York,NY,12/18/2001,0,0,0.0
Brighthouse Renew Holding LLC New York,NY,02/05/2010,0,0,0.0
Blackstone RE Partners VI LP New York,NY,06/27/2007,0,0,0.0
Blackstone REPrt VI GLIC ROFR New York,NY,06/30/2010,0,0,0.0
Brookfield Brazil Timber Fd II Rio de Janeiro,BRA,12/13/2012,0,0,0.0
Carlyle Europe Partners III LP District of Columbia,DC,10/09/2007,0,0,0.0
MetLife Core Prop Fund LP Morristown,NJ,11/01/2013,0,0,0.0
Tishman Speyer Euro Strat Off New York,NY,08/01/2003,0,0,0.0
ML Commercial Mortge Inc Fd Morristown,NJ,10/02/2015,0,0,0.0
Mortgage Fund IVc LP Coral Gables,FL,12/12/2012,0,0,0.0
Any Other Class of Asset - Affiliated TLA HOLDINGS LLC Hartford,CT,03/15/2002,0,0,0.0
Bonds - U.S. Government 38378P E7 9 GNMA GNMA_14-12 3.000% 01/16/44,,03/01/2021,0,0,0.0
38379E 2J 0 GNMA GNMA_14-131 3.000% 09/16/44,,03/01/2021,0,0,0.0
38379J NL 1 GNMA GNMA_15-28 2.500% 02/20/45,,03/01/2021,0,0,0.0
38379W D9 0 GNMA GNMA_16-61 3.000% 05/20/46,,03/01/2021,0,0,0.0
38379W HL 9 GNMA GNMA_16-49 3.500% 04/20/46,,03/01/2021,0,0,0.0
38380B EV 3 GNMA GNMA_16-134 3.000% 10/20/46,,03/01/2021,0,0,0.0
38380W F8 7 GOVERNMENT NATIONAL MORTGAGE A AGENCY CM,,03/01/2021,0,0,0.0
38380X 5T 0 GOVERNMENT NATIONAL MORTGAGE A SENIORAGE,,03/01/2021,0,0,0.0
38380Y 5T 8 GOVERNMENT NATIONAL MORTGAGE A SENIOR CM,,03/01/2021,0,0,0.0
38380Y M3 6 GOVERNMENT NATIONAL MORTGAGE A AGENCY_CM,,03/01/2021,0,0,0.0
38380Y R8 0 GNMA_18-122 SENIORAGENCYCMO18-122 3.50,,03/01/2021,0,0,0.0
38380Y RD 9 GOVERNMENT NATIONAL MORTGAGE A SENIORAGE,,03/01/2021,0,0,0.0
38380Y W9 2 GNMA SENIORAGENCYCMO18-124 3.500% 09/2,,03/01/2021,0,0,0.0
38380Y YL 3 GOVERNMENT NATIONAL MORTGAGE A AGENCY CM,,03/01/2021,0,0,0.0
38381A 3F 1 GOVERNMENT NATIONAL MORTGAGE A AGENCY CM,,03/01/2021,0,0,0.0
38381A AF 3 GOVERNMENT NATIONAL MORTGAGE A SENIORAGE,,03/01/2021,0,0,0.0
38381A FV 3 GOVERNMENT NATIONAL MORTGAGE A AGENCY CM,,03/01/2021,0,0,0.0
38381A GL 4 GOVERNMENT NATIONAL MORTGAGE A AGENCY CM,,03/01/2021,0,0,0.0
38381A HY 5 GOVERNMENT NATIONAL MORTGAGE A AGENCY CM,,03/01/2021,0,0,0.0
38381A JU 1 GOVERNMENT NATIONAL MORTGAGE A AGENCY CM,,03/01/2021,0,0,0.0
38381A QP 4 GOVERNMENT NATIONAL MORTGAGE A AGENCY CM,,03/01/2021,0,0,0.0
38381A X5 0 GOVERNMENT NATIONAL MORTGAGE A AGENCY CM,,03/01/2021,0,0,0.0
38381T PA 7 GOVT NATNL MRTG,AS,03/01/2021,0,0,0.0
91282C AV 3 UNITED STATES TREASURY SENIOR GOVT BND,,01/07/2021,0,0,0.0
91282C AV 3 UNITED STATES TREASURY SENIOR GOVT BND,,01/12/2021,0,0,0.0
91282C BB 6 UNITED STATES TREASURY SENIOR GOVT BND,,01/08/2021,0,0,0.0
91282C BH 3 UNITED STATES TREASURY SENIOR GOVT BND,,02/19/2021,0,0,0.0
91282C BJ 9 UNITED STATES TREASURY SENIOR GOVT BND,,02/16/2021,0,0,0.0
91282C BL 4 UNITED STATES TREASURY SENIOR GOVT BND,,02/25/2021,0,0,0.0
Bonds - All Other Government,,01/12/2021,0,0,0.0
59284M AD 6 MEXICO CITY AIRPORT TRUST SECURED CORP B D,,02/05/2021,0,0,0.0
68205L,AS,01/14/2021,0,0,0.0
71567R AH 9 PERUSAHAAN PENERBIT SBSN INDON SUKWAK,CO,01/06/2021,0,0,0.0
80413T AF 6 SAUDI ARABIA SENIOR CORP BND 144A 4.62 D,,01/26/2021,0,0,0.0
80413T AV 1 SAUDI ARABIA SENIOR CORP BND 144A MTN D,,01/26/2021,0,0,0.0
91087B AM 2 MEXICO UNITED MEXICAN STATES G SENIOR,CO,01/06/2021,0,0,0.0
P3083S AD 7 CONSORCIO TRANSMANTARO SA SENIOR CORP BN D,,01/19/2021,0,0,0.0
X7330Y,CT,01/20/2021,0,0,0.0
Y048D8 AA 8 AXIATASPV5LABUANLTD SENIOR CORP BND MTN D,,02/19/2021,0,0,0.0
Bonds - U.S. Political Subdivisions of States 54438C,PA,02/17/2021,0,0,0.0
Bonds - U.S. Special Revenue and Special Assessment,NV,02/10/2021,0,0,0.0
13077D KU 5 CALIFORNIA STATE UNIVERSITY MUNITAX BND,,02/23/2021,0,0,0.0
20775D KG 6 CONNECTICUT ST HEALTH & EDL FA MUNITAX,,02/10/2021,0,0,0.0
30711X HT 4 FANNIEMAEFNMA_17-C02 WHOLE CMO -2ED3 144,,03/04/2021,0,0,0.0
3132AC SZ 4 FEDERAL HOME LOAN MORTGAGE COR POOL#ZT05,,01/21/2021,0,0,0.0
3132DW BB 8 FEDERAL HOME LOAN MORTGAGE COR POOL#SD81,,02/26/2021,0,0,0.0
3132DW BH 5 FEDERAL HOME LOAN MORTGAGE COR POOL#SD81,,03/30/2021,0,0,0.0
3133KK 6R 5 FEDERAL HOME LOAN MORTGAGE COR POOL#RA44,,01/22/2021,0,0,0.0
3133LP TF 4 FEDERAL HOME LOAN MORTGAGE COR POOL#RD50,,02/02/2021,0,0,0.0
3136AD S3 4 FANNIE MAE FNMA_13-41 FNMA_13-41 3.500,,03/01/2021,0,0,0.0
3136AL D6 5 FNMA FNMA_14-85 3.000% 12/25/44,,03/01/2021,0,0,0.0
3136AN HP 5 FNMA AGENCY CMO -21-VZ 3.000% 04/25/45,,03/01/2021,0,0,0.0
3136AQ KE 9 FNMA FNMA_15-83B 3.500% 11/25/45,,03/01/2021,0,0,0.0
3136AS XB 7 FN_16-43A FN_16-43A 3.000% 07/25/46,,03/01/2021,0,0,0.0
3136AT PS 7 FNMA FNMA_16-59A 3.250% 09/25/46,,03/01/2021,0,0,0.0
3136AY EW 9 FNMA_17-93A CMO_17-83-CZ 3.000% 10/25/,,03/01/2021,0,0,0.0
3136B0 YE 0 FHLMC SENIORAGENCYCMO18-1 3.500% 02/25,,03/01/2021,0,0,0.0
3136B1 K6 0 FANNIEMAEFNMA_18-30 SENIORAGENCYCMO18-30,,03/01/2021,0,0,0.0
3136B2 6H 0 FNMA_91-6 SENIOR CMO_18-66-MZ 3.500% 0,,03/01/2021,0,0,0.0
3136B2 T3 6 FANNIEMAEFNMA_18-67 SENIOR CMO_18-67-ZN,,03/01/2021,0,0,0.0
3136B3 CZ 1 FNMA_91-6 SENIORAGENCYCMO18-75F 4.000%,,03/01/2021,0,0,0.0
3136B3 DN 7 FHLMC SENIORAGENCYCMO18-73 3.500% 10/2,,03/01/2021,0,0,0.0
3136B3 DW 7 FHLMC SENIORAGENCYCMO18-73 3.500% 10/2,,03/01/2021,0,0,0.0
3136B3 ER 7 FHLMC SENIORAGENCYCMO18-78 3.500% 10/2,,03/01/2021,0,0,0.0
3136B3 FD 7 FANNIEMAEFNMA_18-76 STRU BA-1161 ZA 4,,03/01/2021,0,0,0.0
3136B3 FZ 8 FANNIEMAEFNMA_18-76 SENIORAGENCYCMO 3,,03/01/2021,0,0,0.0
3136B3 RV 4 FNMA_91-6 AGENCY CMO 89C-CZ 4.000% 12/,,03/01/2021,0,0,0.0
3136B5 TV 7 FANNIEMAEFNMA_19-41 AGENCY CMO 41G-ZA,,03/01/2021,0,0,0.0
3137A3 4X 4 FHLMC FHLMC_37-63 4.000% 11/15/40,,03/01/2021,0,0,0.0
3137AJ PJ 7 FHLMC FHLMC_39-72 4.000% 12/15/41,,03/01/2021,0,0,0.0
3137AL XC 8 FHLMC FHLMC_39-96 3.500% 02/15/42,,03/01/2021,0,0,0.0
3137AR M2 9 FHLMC CMO_4057A ZB 3.500% 06/15/42,,03/01/2021,0,0,0.0
3137BG GR 4 FHLMC FHLMC_44-43 3.500% 02/15/45,,03/01/2021,0,0,0.0
3137BM 2Z 8 FHLMC FHLMC_4526C 3.500% 11/15/45,,03/01/2021,0,0,0.0
3137BM,CT,03/01/2021,0,0,0.0
3137BM T7 1 FHLMC FHLMC_45-48 3.500% 01/15/46,,03/01/2021,0,0,0.0
"Statement as of March 31, 2021 of the Brighthouse Life Insurance Company 3137BM",TN,03/01/2021,0,0,0.0
3137BP 6P 9 FHLMC FHLMC_4573A 3.000% 04/15/46,,03/01/2021,0,0,0.0
3137BQ 6W 2 FHLMC FHLMC_4590A 3.500% 06/15/46,,03/01/2021,0,0,0.0
3137BQ PF 8 FHLMC FHLMC_45-96 3.000% 06/15/46,,03/01/2021,0,0,0.0
3137F4 XQ 0 FEDERAL HOME LOAN MORTGAGE COR SENIORAGE,,03/01/2021,0,0,0.0
3137FG S8 9 FREDDIEMACFHLMC_4817 SENIORAGENCYCMO4817,,03/01/2021,0,0,0.0
3137FH 7L 1 FHLMC SENIOR CMO_4825-ZB 4.000% 01/15/,,03/01/2021,0,0,0.0
3137FH 7M 9 FHLMC SENIOR CMO_4825-ZE 3.500% 09/15/,,03/01/2021,0,0,0.0
3137FH DN 0 FREDDIE MAC FHLMC_4821 SENIORAGENCYCMO48,,03/01/2021,0,0,0.0
3137FH G3 1 FREDDIE MAC FHLMC_4821 CMO_4821-MZ 3.5,,03/01/2021,0,0,0.0
3137FH,GA,03/01/2021,0,0,0.0
3137FH HM 8 FREDDIE MAC FHLMC_4821 SENIOR CMO_4821-Z,,03/01/2021,0,0,0.0
3137FH QK 2 STRU_BNP-3848 SENIORAGENCYCMO 3.500% 1,,03/01/2021,0,0,0.0
3137FH RM 7 FHLMC MULTIFAMILY STRUCTURED P SENIORAGE,,03/01/2021,0,0,0.0
3137FH T6 0 FREDDIEMACFHLMC_4830 SENIORAGENCYCMO4830,,03/01/2021,0,0,0.0
3137FJ QY 8 FREDDIEMACFHLMC_4841 AGENCY CMO 4841-ZP,,03/01/2021,0,0,0.0
3137FJ W8 8 FHLMC AGENCY CMO 4838-GZ 4.000% 02/15/,,03/01/2021,0,0,0.0
3137FK AE 6 FEDERAL HOME LOAN MORTGAGE COR AGENCY CM,,03/01/2021,0,0,0.0
3137G0 KQ 1 STRUCTUREDAGENCYCREDITRISK RMBS DNA3-M3,,01/13/2021,0,0,0.0
3137G0 LJ 6 STRUCTURED AGENCY CREDIT RISK RMBS DNA4-,,01/13/2021,0,0,0.0
3137G0 NX 3 STRUCTUREDAGENCYCREDITRISK RMBS DNA2-M2,,01/13/2021,0,0,0.0
3140X9 GM 1 FEDERAL NATIONAL MORTGAGE ASSO POOL#FM56,,01/29/2021,0,0,0.0
31418D W2 4 FEDERAL NATIONAL MORTGAGE ASSO POOL#MA42,,03/03/2021,0,0,0.0
31418D YB 2 FEDERAL NATIONAL MORTGAGE ASSO POOL#MA43,,03/30/2021,0,0,0.0
35563P DX 4 FREDDIEMACFHLMC_18-1SC SENIORWHOLECMO18-,,03/01/2021,0,0,0.0
35563P EC 9 SEASONED CREDIT RISK TRANSFER SENIOR CMO,,03/01/2021,0,0,0.0
35563P GK 9 SEASONED CREDIT RISK TRANSFER WHOLECMO18,,03/01/2021,0,0,0.0
35563T AH 4 STACR_2018-DNA2 WHOLE CMO DNA2-M2 144A,,02/17/2021,0,0,0.0
35563T,AL,03/31/2021,0,0,0.0
35563W AB 0 STRUCTURED AGENCY CREDIT RISK WHOLE CMO,,02/17/2021,0,0,0.0
54628C MX 7 LOUISIANA LOC GOVT ENVIRONMENT SUB MUNIT,,01/14/2021,0,0,0.0
54651R DM 8 LOUISIANA STATE OF MUNITAX BND 2.079%,,02/04/2021,0,0,0.0
54651R DN 6 LOUISIANA STATE OF MUNITAX BND 2.179%,,02/04/2021,0,0,0.0
