name,state,date_acquired,book_value,investment_income,ownership_pct
",D10,GF0 BHF20U5S9 Fixed Annuities Exh 5 Equity/Index CITIBANK NA E57ODZWZ7FF32TWEFA76",,03/19/2020,0,0,0.0
",D10,GF0 BHF20U5U4 Fixed Annuities Exh 5 Equity/Index CITIBANK NA E57ODZWZ7FF32TWEFA76",,03/19/2020,0,0,0.0
"10,GF0, BHF20U609 Fixed Annuities Exh 5 Equity/Index CITIBANK NA E57ODZWZ7FF32TWEFA76",,03/19/2020,0,0,0.0
"D10,GF0, BHF20U617 Fixed Annuities Exh 5 Equity/Index INTERNATIONAL W22LROWP2IHZNBB6K528",,03/19/2020,0,0,0.0
"D10,GF0, BHF20U641 Fixed Annuities Exh 5 Equity/Index INTERNATIONAL W22LROWP2IHZNBB6K528",,03/19/2020,0,0,0.0
CALL OPTION FEB26 RTY MORGAN STANLEY & CO C @ 1688 BHF20VR46 Fixed Annuities Exh 5 Equity/Index INTL. PLC 4PQUHN3JPFGFNF3BB653,,03/26/2020,0,0,0.0
CALL OPTION FEB26 SPX MORGAN STANLEY & CO C @ 3358 BHF20VR53 Fixed Annuities Exh 5 Equity/Index INTL. PLC 4PQUHN3JPFGFNF3BB653,,03/26/2020,0,0,0.0
CALL OPTION FEB26 SPX MORGAN STANLEY & CO C @ 3116 BHF20VRB0 Fixed Annuities Exh 5 Equity/Index INTL. PLC 4PQUHN3JPFGFNF3BB653,,03/26/2020,0,0,0.0
",D10.0,G BHF21RPY0 Fixed Annuities Exh 5 Equity/Index INTERNATIONAL E58DKGMJYYYJLN8C3868",,04/15/2020,0,0,0.0
"D10,GF0 BHF21RQ37 Fixed Annuities Exh 5 Equity/Index INTERNATIONAL E58DKGMJYYYJLN8C3868",,04/15/2020,0,0,0.0
"D10,GF0 BHF21RQ60 Fixed Annuities Exh 5 Equity/Index INTERNATIONAL E58DKGMJYYYJLN8C3868",,04/15/2020,0,0,0.0
"D10,GF0 BHF21RQE3 Fixed Annuities Exh 5 Equity/Index INTERNATIONAL W22LROWP2IHZNBB6K528",,04/23/2020,0,0,0.0
"D10,GF0 BHF21RQG8 Fixed Annuities Exh 5 Equity/Index INTERNATIONAL W22LROWP2IHZNBB6K528",,04/16/2020,0,0,0.0
"CLIQUET,A,C,PS,1Y,U8,D SOCIETE GENERALE SA 10,GF0 BHF21RQM5 Fixed Annuities Exh 5 Equity/Index O2RNE8IBXP4R0TD8PU41",,04/14/2020,0,0,0.0
"CLIQUET,A,C,PS,1Y,U8.2 SOCIETE GENERALE SA 5,D10,GF BHF21RQR4 Fixed Annuities Exh 5 Equity/Index O2RNE8IBXP4R0TD8PU41",,04/14/2020,0,0,0.0
CALL OPTION MAR26 RTY BANK OF AMERICA NA C @ 1518 BHF21RSK7 Fixed Annuities Exh 5 Equity/Index B4TYDEB6GKMZO031MB27,,05/06/2020,0,0,0.0
CALL OPTION MAR26 RTY BANK OF AMERICA NA C @ 1474 BHF21RSL5 Fixed Annuities Exh 5 Equity/Index B4TYDEB6GKMZO031MB27,,05/06/2020,0,0,0.0
CALL OPTION MAR26 SPX WELLS FARGO BANK NA C @ 2920 BHF21RSM3 Fixed Annuities Exh 5 Equity/Index KB1H1DSPRFMYMCUFXT09,,05/06/2020,0,0,0.0
"10,GF0 BHF21RW55 Fixed Annuities Exh 5 Equity/Index INTERNATIONAL E58DKGMJYYYJLN8C3868",,04/15/2020,0,0,0.0
"of Item(s) Strike Initial Cost Cost of Credit Hedge ,D10,GF0 BHF21RWH9 Fixed Annuities Exh 5 Equity/Index INTERNATIONAL E58DKGMJYYYJLN8C3868",,04/15/2020,0,0,0.0
"CLIQUET,A,C,PS,1Y,U7.5 SOCIETE GENERALE SA ,D10,GF0 BHF21RZA1 Fixed Annuities Exh 5 Equity/Index O2RNE8IBXP4R0TD8PU41",,04/14/2020,0,0,0.0
"CLIQUET,A,C,PS,1Y,U8,D SOCIETE GENERALE SA 10,GF0 BHF21RZC7 Fixed Annuities Exh 5 Equity/Index O2RNE8IBXP4R0TD8PU41",,04/14/2020,0,0,0.0
"CLIQUET,A,C,PS,1Y,U8.2 SOCIETE GENERALE SA 5,D10,GF BHF21RZD5 Fixed Annuities Exh 5 Equity/Index O2RNE8IBXP4R0TD8PU41",,04/14/2020,0,0,0.0
"D10,GF0 BHF21RZE3 Fixed Annuities Exh 5 Equity/Index INTERNATIONAL E58DKGMJYYYJLN8C3868",,04/15/2020,0,0,0.0
"D10,GF0 BHF21RZF0 Fixed Annuities Exh 5 Equity/Index INTERNATIONAL E58DKGMJYYYJLN8C3868",,04/15/2020,0,0,0.0
"D10,GF0 BHF21RZG8 Fixed Annuities Exh 5 Equity/Index INTERNATIONAL W22LROWP2IHZNBB6K528",,04/16/2020,0,0,0.0
"D10,GF0 BHF21RZH6 Fixed Annuities Exh 5 Equity/Index INTERNATIONAL W22LROWP2IHZNBB6K528",,04/23/2020,0,0,0.0
"D10,GF0 BHF21RZJ2 Fixed Annuities Exh 5 Equity/Index INTERNATIONAL W22LROWP2IHZNBB6K528",,04/16/2020,0,0,0.0
CALL OPTION MAR26 RTY BANK OF AMERICA NA C @ 1049 BHF21RZL7 Fixed Annuities Exh 5 Equity/Index B4TYDEB6GKMZO031MB27,,05/06/2020,0,0,0.0
CALL OPTION MAR26 RTY BANK OF AMERICA NA C @ 1055 BHF21RZM5 Fixed Annuities Exh 5 Equity/Index B4TYDEB6GKMZO031MB27,,05/06/2020,0,0,0.0
CALL OPTION MAR26 SPX WELLS FARGO BANK NA C @ 2400 BHF21RZN3 Fixed Annuities Exh 5 Equity/Index KB1H1DSPRFMYMCUFXT09,,05/06/2020,0,0,0.0
CALL OPTION MAR26 SPX WELLS FARGO BANK NA C @ 2375 BHF21RZP8 Fixed Annuities Exh 5 Equity/Index KB1H1DSPRFMYMCUFXT09,,05/06/2020,0,0,0.0
CALL OPTION MAR26 SPX WELLS FARGO BANK NA C @ 2508 BHF21RZQ6 Fixed Annuities Exh 5 Equity/Index KB1H1DSPRFMYMCUFXT09,,05/06/2020,0,0,0.0
"CLIQUET,A,C,PS,1Y,U8,D SOCIETE GENERALE SA 10,GF0 BHF21TQW9 Fixed Annuities Exh 5 Equity/Index O2RNE8IBXP4R0TD8PU41",,04/14/2020,0,0,0.0
"D10,GF0 BHF21TQZ2 Fixed Annuities Exh 5 Equity/Index INTERNATIONAL E58DKGMJYYYJLN8C3868",,04/15/2020,0,0,0.0
"D10,GF0 BHF21TR08 Fixed Annuities Exh 5 Equity/Index INTERNATIONAL W22LROWP2IHZNBB6K528",,04/16/2020,0,0,0.0
"D10,GF0 BHF21TR32 Fixed Annuities Exh 5 Equity/Index INTERNATIONAL W22LROWP2IHZNBB6K528",,04/16/2020,0,0,0.0
CALL OPTION FEB26 RTY GOLDMAN SACHS C @ 1553 BHF21TR40 Fixed Annuities Exh 5 Equity/Index INTERNATIONAL W22LROWP2IHZNBB6K528,,04/20/2020,0,0,0.0
CALL OPTION FEB26 SPX C @ 3116 BHF21TR65 Fixed Annuities Exh 5 Equity/Index BARCLAYS BANK PLC G5GSEF7VJP5I7OUK5573,,04/20/2020,0,0,0.0
CALL OPTION FEB26 SPX C @ 2979 BHF21TR73 Fixed Annuities Exh 5 Equity/Index BARCLAYS BANK PLC G5GSEF7VJP5I7OUK5573,,04/20/2020,0,0,0.0
"D10,GF0, BHF226YA7 Fixed Annuities Exh 5 Equity/Index INTERNATIONAL W22LROWP2IHZNBB6K528",,04/21/2020,0,0,0.0
"of Item(s) Strike Initial Cost Cost of Credit Hedge ,D10,GF0 BHF22PRZ8 Fixed Annuities Exh 5 Equity/Index INTERNATIONAL E58DKGMJYYYJLN8C3868",,05/06/2020,0,0,0.0
"CLIQUET,A,C,PS,1Y,U7.5 SOCIETE GENERALE SA ,D10,GF0 BHF22PS12 Fixed Annuities Exh 5 Equity/Index O2RNE8IBXP4R0TD8PU41",,05/07/2020,0,0,0.0
"CLIQUET,A,C,PS,1Y,U8,D SOCIETE GENERALE SA 10,GF0 BHF22PS46 Fixed Annuities Exh 5 Equity/Index O2RNE8IBXP4R0TD8PU41",,05/07/2020,0,0,0.0
"D10,GF0 BHF22PS53 Fixed Annuities Exh 5 Equity/Index INTERNATIONAL E58DKGMJYYYJLN8C3868",,05/11/2020,0,0,0.0
"D10,GF0 BHF22PSB0 Fixed Annuities Exh 5 Equity/Index INTERNATIONAL E58DKGMJYYYJLN8C3868",,05/11/2020,0,0,0.0
"D10,GF0 BHF22PSE4 Fixed Annuities Exh 5 Equity/Index INTERNATIONAL W22LROWP2IHZNBB6K528",,05/12/2020,0,0,0.0
"D10,GF0 BHF22PSM6 Fixed Annuities Exh 5 Equity/Index INTERNATIONAL W22LROWP2IHZNBB6K528",,05/12/2020,0,0,0.0
"D10,GF0 BHF22PSN4 Fixed Annuities Exh 5 Equity/Index INTERNATIONAL W22LROWP2IHZNBB6K528",,05/12/2020,0,0,0.0
CALL OPTION MAR26 SPX WELLS FARGO BANK NA C @ 2539 BHF22PW74 Fixed Annuities Exh 5 Equity/Index KB1H1DSPRFMYMCUFXT09,,05/06/2020,0,0,0.0
CALL OPTION MAR26 SPX WELLS FARGO BANK NA C @ 2537 BHF22PW90 Fixed Annuities Exh 5 Equity/Index KB1H1DSPRFMYMCUFXT09,,05/06/2020,0,0,0.0
"10,GF0 BHF22PWE9 Fixed Annuities Exh 5 Equity/Index INTERNATIONAL E58DKGMJYYYJLN8C3868",,05/06/2020,0,0,0.0
",D10,GF0 BHF22PYT4 Fixed Annuities Exh 5 Equity/Index INTERNATIONAL E58DKGMJYYYJLN8C3868",,05/06/2020,0,0,0.0
"CLIQUET,A,C,PS,1Y,U7.5 SOCIETE GENERALE SA ,D10,GF0 BHF22PYW7 Fixed Annuities Exh 5 Equity/Index O2RNE8IBXP4R0TD8PU41",,05/07/2020,0,0,0.0
"CLIQUET,A,C,PS,1Y,U8,D SOCIETE GENERALE SA 10,GF0 BHF22PZ06 Fixed Annuities Exh 5 Equity/Index O2RNE8IBXP4R0TD8PU41",,05/07/2020,0,0,0.0
"CLIQUET,A,C,PS,1Y,U8.2 SOCIETE GENERALE SA 5,D10,GF BHF22PZ22 Fixed Annuities Exh 5 Equity/Index O2RNE8IBXP4R0TD8PU41",,05/07/2020,0,0,0.0
"D10,GF0 BHF22PZ55 Fixed Annuities Exh 5 Equity/Index INTERNATIONAL E58DKGMJYYYJLN8C3868",,05/11/2020,0,0,0.0
"D10,GF0 BHF22PZ89 Fixed Annuities Exh 5 Equity/Index INTERNATIONAL E58DKGMJYYYJLN8C3868",,05/11/2020,0,0,0.0
"D10,GF0 BHF22PZC0 Fixed Annuities Exh 5 Equity/Index INTERNATIONAL W22LROWP2IHZNBB6K528",,05/12/2020,0,0,0.0
"D10,GF0 BHF22PZE6 Fixed Annuities Exh 5 Equity/Index INTERNATIONAL W22LROWP2IHZNBB6K528",,05/12/2020,0,0,0.0
"D10,GF0 BHF22PZF3 Fixed Annuities Exh 5 Equity/Index INTERNATIONAL W22LROWP2IHZNBB6K528",,05/12/2020,0,0,0.0
CALL OPTION APR26 RTY MORGAN STANLEY & CO C @ 1217 BHF22PZU0 Fixed Annuities Exh 5 Equity/Index INTL. PLC 4PQUHN3JPFGFNF3BB653,,05/07/2020,0,0,0.0
CALL OPTION APR26 RTY MORGAN STANLEY & CO C @ 1228 BHF22PZW6 Fixed Annuities Exh 5 Equity/Index INTL. PLC 4PQUHN3JPFGFNF3BB653,,05/07/2020,0,0,0.0
CALL OPTION APR26 SPX C @ 2811 BHF22PZY2 Fixed Annuities Exh 5 Equity/Index BARCLAYS BANK PLC G5GSEF7VJP5I7OUK5573,,05/07/2020,0,0,0.0
CALL OPTION APR26 SPX C @ 2795 BHF22PZZ9 Fixed Annuities Exh 5 Equity/Index BARCLAYS BANK PLC G5GSEF7VJP5I7OUK5573,,05/07/2020,0,0,0.0
CALL OPTION APR26 SPX C @ 2694 BHF22Q028 Fixed Annuities Exh 5 Equity/Index BARCLAYS BANK PLC G5GSEF7VJP5I7OUK5573,,05/07/2020,0,0,0.0
"5,D10,GF BHF244NZ7 Fixed Annuities Exh 5 Equity/Index INTERNATIONAL E58DKGMJYYYJLN8C3868",,06/11/2020,0,0,0.0
"10,GF0, BHF244P69 Fixed Annuities Exh 5 Equity/Index INTERNATIONAL E58DKGMJYYYJLN8C3868",,06/11/2020,0,0,0.0
",D10,GF0 BHF244P85 Fixed Annuities Exh 5 Equity/Index INTERNATIONAL E58DKGMJYYYJLN8C3868",,06/11/2020,0,0,0.0
"5,D10,GF BHF244PB8 Fixed Annuities Exh 5 Equity/Index INTERNATIONAL W22LROWP2IHZNBB6K528",,06/09/2020,0,0,0.0
"5,D10,GF BHF244PD4 Fixed Annuities Exh 5 Equity/Index INTERNATIONAL W22LROWP2IHZNBB6K528",,06/09/2020,0,0,0.0
",D10,GF0 BHF244PH5 Fixed Annuities Exh 5 Equity/Index INTERNATIONAL W22LROWP2IHZNBB6K528",,06/09/2020,0,0,0.0
"10,GF0, BHF244PJ1 Fixed Annuities Exh 5 Equity/Index INTERNATIONAL W22LROWP2IHZNBB6K528",,06/09/2020,0,0,0.0
"5,D10,GF BHF244PN2 Fixed Annuities Exh 5 Equity/Index INTERNATIONAL W22LROWP2IHZNBB6K528",,06/09/2020,0,0,0.0
"D10,GF0, BHF244PS1 Fixed Annuities Exh 5 Equity/Index INTERNATIONAL E58DKGMJYYYJLN8C3868",,06/08/2020,0,0,0.0
"D10,GF0, BHF244PT9 Fixed Annuities Exh 5 Equity/Index INTERNATIONAL E58DKGMJYYYJLN8C3868",,06/08/2020,0,0,0.0
"D10,GF0, BHF244PU6 Fixed Annuities Exh 5 Equity/Index INTERNATIONAL E58DKGMJYYYJLN8C3868",,06/08/2020,0,0,0.0
"D10,GF0, BHF244PV4 Fixed Annuities Exh 5 Equity/Index INTERNATIONAL E58DKGMJYYYJLN8C3868",,06/08/2020,0,0,0.0
"CLIQUET,A,P,PS,1Y,U40, SOCIETE GENERALE SA D10,GF0, BHF244PW2 Fixed Annuities Exh 5 Equity/Index O2RNE8IBXP4R0TD8PU41",,06/10/2020,0,0,0.0
"CLIQUET,A,P,PS,1Y,U50, SOCIETE GENERALE SA D10,GF0, BHF244PX0 Fixed Annuities Exh 5 Equity/Index O2RNE8IBXP4R0TD8PU41",,06/10/2020,0,0,0.0
"CLIQUET,A,P,PS,1Y,U55, SOCIETE GENERALE SA D10,GF0, BHF244PY8 Fixed Annuities Exh 5 Equity/Index O2RNE8IBXP4R0TD8PU41",,06/10/2020,0,0,0.0
"CLIQUET,A,P,PS,1Y,U65, SOCIETE GENERALE SA D10,GF0, BHF244Q01 Fixed Annuities Exh 5 Equity/Index O2RNE8IBXP4R0TD8PU41",,06/10/2020,0,0,0.0
"of Item(s) Strike Initial Cost Cost of Credit Hedge ,D10,GF0 BHF244Q50 Fixed Annuities Exh 5 Equity/Index INTERNATIONAL E58DKGMJYYYJLN8C3868",,06/11/2020,0,0,0.0
"D10,GF0, BHF244Q68 Fixed Annuities Exh 5 Equity/Index INTERNATIONAL E58DKGMJYYYJLN8C3868",,06/08/2020,0,0,0.0
",D10,GF0 BHF244Q76 Fixed Annuities Exh 5 Equity/Index INTERNATIONAL W22LROWP2IHZNBB6K528",,06/09/2020,0,0,0.0
"10,GF0, BHF244Q84 Fixed Annuities Exh 5 Equity/Index INTERNATIONAL W22LROWP2IHZNBB6K528",,06/09/2020,0,0,0.0
"CLIQUET,A,P,PS,1Y,U50, SOCIETE GENERALE SA D10,GF0, BHF244QA9 Fixed Annuities Exh 5 Equity/Index O2RNE8IBXP4R0TD8PU41",,06/10/2020,0,0,0.0
"CLIQUET,A,P,PS,1Y,U60, SOCIETE GENERALE SA D10,GF0, BHF244QB7 Fixed Annuities Exh 5 Equity/Index O2RNE8IBXP4R0TD8PU41",,06/10/2020,0,0,0.0
"CLIQUET,A,P,PS,1Y,U65, SOCIETE GENERALE SA D10,GF0, BHF244QE1 Fixed Annuities Exh 5 Equity/Index O2RNE8IBXP4R0TD8PU41",,06/10/2020,0,0,0.0
CALL OPTION APR26 RTY MORGAN STANLEY & CO C @ 1282 BHF245P66 Fixed Annuities Exh 5 Equity/Index INTL. PLC 4PQUHN3JPFGFNF3BB653,,06/09/2020,0,0,0.0
CALL OPTION APR26 SPX GOLDMAN SACHS C @ 2848 BHF245P82 Fixed Annuities Exh 5 Equity/Index INTERNATIONAL W22LROWP2IHZNBB6K528,,06/08/2020,0,0,0.0
CALL OPTION MAY26 RTY MORGAN STANLEY & CO C @ 1299 BHF245PM1 Fixed Annuities Exh 5 Equity/Index INTL. PLC 4PQUHN3JPFGFNF3BB653,,06/09/2020,0,0,0.0
CALL OPTION MAY26 RTY MORGAN STANLEY & CO C @ 1302 BHF245PQ2 Fixed Annuities Exh 5 Equity/Index INTL. PLC 4PQUHN3JPFGFNF3BB653,,06/09/2020,0,0,0.0
CALL OPTION MAY26 RTY MORGAN STANLEY & CO C @ 1347 BHF245PS8 Fixed Annuities Exh 5 Equity/Index INTL. PLC 4PQUHN3JPFGFNF3BB653,,06/09/2020,0,0,0.0
CALL OPTION MAY26 SPX GOLDMAN SACHS C @ 2939 BHF245PT6 Fixed Annuities Exh 5 Equity/Index INTERNATIONAL W22LROWP2IHZNBB6K528,,06/08/2020,0,0,0.0
CALL OPTION MAY26 SPX GOLDMAN SACHS C @ 2904 BHF245PV1 Fixed Annuities Exh 5 Equity/Index INTERNATIONAL W22LROWP2IHZNBB6K528,,06/08/2020,0,0,0.0
CALL OPTION MAY26 SPX GOLDMAN SACHS C @ 2970 BHF245PW9 Fixed Annuities Exh 5 Equity/Index INTERNATIONAL W22LROWP2IHZNBB6K528,,06/08/2020,0,0,0.0
CALL OPTION MAY26 SPX GOLDMAN SACHS C @ 2902 BHF245PY5 Fixed Annuities Exh 5 Equity/Index INTERNATIONAL W22LROWP2IHZNBB6K528,,06/08/2020,0,0,0.0
CALL OPTION MAY26 SPX GOLDMAN SACHS C @ 2881 BHF245Q24 Fixed Annuities Exh 5 Equity/Index INTERNATIONAL W22LROWP2IHZNBB6K528,,06/08/2020,0,0,0.0
"CLIQUET,A,P,PS,1Y,U60, SOCIETE GENERALE SA D10,GF0, BHF24EB54 Fixed Annuities Exh 5 Equity/Index O2RNE8IBXP4R0TD8PU41",,06/10/2020,0,0,0.0
"5,D10,GF BHF25T7Z9 Fixed Annuities Exh 5 Equity/Index BNP PARIBAS R0MUWSFPU8MPRO8K5P83",,07/13/2020,0,0,0.0
"10,GF0 BHF25T8Q8 Fixed Annuities Exh 5 Equity/Index BNP PARIBAS R0MUWSFPU8MPRO8K5P83",,07/13/2020,0,0,0.0
",D10,GF0 BHF25T8R6 Fixed Annuities Exh 5 Equity/Index BNP PARIBAS R0MUWSFPU8MPRO8K5P83",,07/13/2020,0,0,0.0
"CLIQUET,A,C,PS,1Y,U6.7 JPMORGAN CHASE BANK 5,D10,GF BHF25T8W5 Fixed Annuities Exh 5 Equity/Index N.A. 7H6GLXDRUGQFU57RNE97",,07/09/2020,0,0,0.0
"CLIQUET,A,C,PS,1Y,U7.2 JPMORGAN CHASE BANK 5,D10,GF BHF25T9N4 Fixed Annuities Exh 5 Equity/Index N.A. 7H6GLXDRUGQFU57RNE97",,07/09/2020,0,0,0.0
"CLIQUET,A,C,PS,1Y,U7.5 JPMORGAN CHASE BANK ,D10,GF0 BHF25T9V6 Fixed Annuities Exh 5 Equity/Index N.A. 7H6GLXDRUGQFU57RNE97",,07/09/2020,0,0,0.0
"CLIQUET,A,C,PS,1Y,U8,D JPMORGAN CHASE BANK 10,GF0 BHF25TA10 Fixed Annuities Exh 5 Equity/Index N.A. 7H6GLXDRUGQFU57RNE97",,07/09/2020,0,0,0.0
"D10,GF0 BHF25TA93 Fixed Annuities Exh 5 Equity/Index CITIBANK NA E57ODZWZ7FF32TWEFA76",,07/10/2020,0,0,0.0
"D10,GF0 BHF25TB35 Fixed Annuities Exh 5 Equity/Index CITIBANK NA E57ODZWZ7FF32TWEFA76",,07/10/2020,0,0,0.0
"D10,GF0 BHF25TBD3 Fixed Annuities Exh 5 Equity/Index INTERNATIONAL W22LROWP2IHZNBB6K528",,07/14/2020,0,0,0.0
"D10,GF0 BHF25TBS0 Fixed Annuities Exh 5 Equity/Index INTERNATIONAL W22LROWP2IHZNBB6K528",,07/14/2020,0,0,0.0
"D10,GF0 BHF25TCD2 Fixed Annuities Exh 5 Equity/Index INTERNATIONAL W22LROWP2IHZNBB6K528",,07/14/2020,0,0,0.0
"D10,GF0 BHF25TCH3 Fixed Annuities Exh 5 Equity/Index INTERNATIONAL W22LROWP2IHZNBB6K528",,07/14/2020,0,0,0.0
"D10,GF0 BHF25TCL4 Fixed Annuities Exh 5 Equity/Index INTERNATIONAL W22LROWP2IHZNBB6K528",,07/14/2020,0,0,0.0
"5,D10,GF BHF25TDR0 Fixed Annuities Exh 5 Equity/Index BNP PARIBAS R0MUWSFPU8MPRO8K5P83",,07/13/2020,0,0,0.0
"5,D10,GF BHF25TE65 Fixed Annuities Exh 5 Equity/Index BNP PARIBAS R0MUWSFPU8MPRO8K5P83",,07/13/2020,0,0,0.0
",D10,GF0 BHF25TE81 Fixed Annuities Exh 5 Equity/Index BNP PARIBAS R0MUWSFPU8MPRO8K5P83",,07/13/2020,0,0,0.0
",D10,GF0 BHF25TE99 Fixed Annuities Exh 5 Equity/Index BNP PARIBAS R0MUWSFPU8MPRO8K5P83",,07/13/2020,0,0,0.0
"CLIQUET,A,C,PS,1Y,U6.7 JPMORGAN CHASE BANK 5,D10,GF BHF25TEG3 Fixed Annuities Exh 5 Equity/Index N.A. 7H6GLXDRUGQFU57RNE97",,07/09/2020,0,0,0.0
"CLIQUET,A,C,PS,1Y,U7.2 JPMORGAN CHASE BANK 5,D10,GF BHF25TER9 Fixed Annuities Exh 5 Equity/Index N.A. 7H6GLXDRUGQFU57RNE97",,07/09/2020,0,0,0.0
"CLIQUET,A,C,PS,1Y,U7.5 JPMORGAN CHASE BANK ,D10,GF0 BHF25TEW8 Fixed Annuities Exh 5 Equity/Index N.A. 7H6GLXDRUGQFU57RNE97",,07/09/2020,0,0,0.0
"CLIQUET,A,C,PS,1Y,U8,D JPMORGAN CHASE BANK 10,GF0 BHF25TF23 Fixed Annuities Exh 5 Equity/Index N.A. 7H6GLXDRUGQFU57RNE97",,07/09/2020,0,0,0.0
"D10,GF0 BHF25TFJ6 Fixed Annuities Exh 5 Equity/Index CITIBANK NA E57ODZWZ7FF32TWEFA76",,07/10/2020,0,0,0.0
"D10,GF0 BHF25TFR8 Fixed Annuities Exh 5 Equity/Index CITIBANK NA E57ODZWZ7FF32TWEFA76",,07/10/2020,0,0,0.0
"of Item(s) Strike Initial Cost Cost of Credit Hedge D10,GF0 BHF25TG06 Fixed Annuities Exh 5 Equity/Index CITIBANK NA E57ODZWZ7FF32TWEFA76",,07/10/2020,0,0,0.0
"D10,GF0 BHF25TG22 Fixed Annuities Exh 5 Equity/Index CITIBANK NA E57ODZWZ7FF32TWEFA76",,07/10/2020,0,0,0.0
"D10,GF0 BHF25TG48 Fixed Annuities Exh 5 Equity/Index CITIBANK NA E57ODZWZ7FF32TWEFA76",,07/10/2020,0,0,0.0
"D10,GF0 BHF25TGG1 Fixed Annuities Exh 5 Equity/Index INTERNATIONAL W22LROWP2IHZNBB6K528",,07/14/2020,0,0,0.0
"D10,GF0 BHF25TGU0 Fixed Annuities Exh 5 Equity/Index INTERNATIONAL W22LROWP2IHZNBB6K528",,07/14/2020,0,0,0.0
"D10,GF0 BHF25TH13 Fixed Annuities Exh 5 Equity/Index INTERNATIONAL W22LROWP2IHZNBB6K528",,07/14/2020,0,0,0.0
"D10,GF0 BHF25TH88 Fixed Annuities Exh 5 Equity/Index INTERNATIONAL W22LROWP2IHZNBB6K528",,07/14/2020,0,0,0.0
"D10,GF0 BHF25THA3 Fixed Annuities Exh 5 Equity/Index INTERNATIONAL W22LROWP2IHZNBB6K528",,07/14/2020,0,0,0.0
CALL OPTION MAY26 RTY GOLDMAN SACHS C @ 1401 BHF25WPK5 Fixed Annuities Exh 5 Equity/Index INTERNATIONAL W22LROWP2IHZNBB6K528,,07/16/2020,0,0,0.0
CALL OPTION MAY26 SPX WELLS FARGO BANK NA C @ 3025 BHF25WPL3 Fixed Annuities Exh 5 Equity/Index KB1H1DSPRFMYMCUFXT09,,07/16/2020,0,0,0.0
CALL OPTION MAY26 SPX WELLS FARGO BANK NA C @ 2967 BHF25WPN9 Fixed Annuities Exh 5 Equity/Index KB1H1DSPRFMYMCUFXT09,,07/16/2020,0,0,0.0
CALL OPTION MAY26 SPX WELLS FARGO BANK NA C @ 3011 BHF25WQ57 Fixed Annuities Exh 5 Equity/Index KB1H1DSPRFMYMCUFXT09,,07/16/2020,0,0,0.0
CALL OPTION JUN26 RTY GOLDMAN SACHS C @ 1472 BHF25WRN7 Fixed Annuities Exh 5 Equity/Index INTERNATIONAL W22LROWP2IHZNBB6K528,,07/16/2020,0,0,0.0
CALL OPTION JUN26 RTY GOLDMAN SACHS C @ 1462 BHF25WSV8 Fixed Annuities Exh 5 Equity/Index INTERNATIONAL W22LROWP2IHZNBB6K528,,07/16/2020,0,0,0.0
CALL OPTION JUN26 RTY GOLDMAN SACHS C @ 1404 BHF25WT13 Fixed Annuities Exh 5 Equity/Index INTERNATIONAL W22LROWP2IHZNBB6K528,,07/16/2020,0,0,0.0
CALL OPTION JUN26 SPX WELLS FARGO BANK NA C @ 3085 BHF25WT39 Fixed Annuities Exh 5 Equity/Index KB1H1DSPRFMYMCUFXT09,,07/16/2020,0,0,0.0
CALL OPTION JUN26 SPX WELLS FARGO BANK NA C @ 3076 BHF25WTG0 Fixed Annuities Exh 5 Equity/Index KB1H1DSPRFMYMCUFXT09,,07/16/2020,0,0,0.0
CALL OPTION JUN26 SPX WELLS FARGO BANK NA C @ 3092 BHF25WTM7 Fixed Annuities Exh 5 Equity/Index KB1H1DSPRFMYMCUFXT09,,07/16/2020,0,0,0.0
CALL OPTION JUN26 SPX WELLS FARGO BANK NA C @ 3069 BHF25WTQ8 Fixed Annuities Exh 5 Equity/Index KB1H1DSPRFMYMCUFXT09,,07/16/2020,0,0,0.0
CALL OPTION JUN26 SPX WELLS FARGO BANK NA C @ 3115 BHF25WTR6 Fixed Annuities Exh 5 Equity/Index KB1H1DSPRFMYMCUFXT09,,07/16/2020,0,0,0.0
"CLIQUET,A,C,PS,1Y,U5.5 JPMORGAN CHASE BANK ,D10,GF0 BHF27ZKW5 Fixed Annuities Exh 5 Equity/Index N.A. 7H6GLXDRUGQFU57RNE97",,08/25/2020,0,0,0.0
"CLIQUET,A,C,PS,1Y,U5.7 JPMORGAN CHASE BANK 5,D10,GF BHF27ZKX3 Fixed Annuities Exh 5 Equity/Index N.A. 7H6GLXDRUGQFU57RNE97",,08/25/2020,0,0,0.0
"CLIQUET,A,C,PS,1Y,U5,D JPMORGAN CHASE BANK 10,GF0 BHF27ZKZ8 Fixed Annuities Exh 5 Equity/Index N.A. 7H6GLXDRUGQFU57RNE97",,08/25/2020,0,0,0.0
"CLIQUET,A,C,PS,1Y,U6.2 JPMORGAN CHASE BANK 5,D10,GF BHF27ZL04 Fixed Annuities Exh 5 Equity/Index N.A. 7H6GLXDRUGQFU57RNE97",,08/25/2020,0,0,0.0
"CLIQUET,A,C,PS,1Y,U6.2 JPMORGAN CHASE BANK 5,D10,GF BHF27ZL12 Fixed Annuities Exh 5 Equity/Index N.A. 7H6GLXDRUGQFU57RNE97",,08/25/2020,0,0,0.0
"CLIQUET,A,P,PS,1Y,U30, BANK OF AMERICA NA D10,GF0 BHF27ZMT0 Fixed Annuities Exh 5 Equity/Index B4TYDEB6GKMZO031MB27",,08/21/2020,0,0,0.0
"CLIQUET,A,P,PS,1Y,U35, BANK OF AMERICA NA D10,GF0 BHF27ZMU7 Fixed Annuities Exh 5 Equity/Index B4TYDEB6GKMZO031MB27",,08/21/2020,0,0,0.0
"CLIQUET,A,P,PS,1Y,U35, BANK OF AMERICA NA D10,GF0 BHF27ZMW3 Fixed Annuities Exh 5 Equity/Index B4TYDEB6GKMZO031MB27",,08/21/2020,0,0,0.0
"CLIQUET,A,P,PS,1Y,U40, BANK OF AMERICA NA D10,GF0 BHF27ZMX1 Fixed Annuities Exh 5 Equity/Index B4TYDEB6GKMZO031MB27",,08/21/2020,0,0,0.0
"CLIQUET,A,P,PS,1Y,U45, BANK OF AMERICA NA D10,GF0 BHF27ZN02 Fixed Annuities Exh 5 Equity/Index B4TYDEB6GKMZO031MB27",,08/21/2020,0,0,0.0
"CLIQUET,A,P,PS,1Y,U55, BANK OF AMERICA NA D10,GF0 BHF27ZN28 Fixed Annuities Exh 5 Equity/Index B4TYDEB6GKMZO031MB27",,08/21/2020,0,0,0.0
",D10,GF0 BHF27ZN44 Fixed Annuities Exh 5 Equity/Index INTERNATIONAL E58DKGMJYYYJLN8C3868",,08/24/2020,0,0,0.0
"5,D10,GF BHF27ZN85 Fixed Annuities Exh 5 Equity/Index INTERNATIONAL E58DKGMJYYYJLN8C3868",,08/24/2020,0,0,0.0
"5,D10,GF BHF27ZNM4 Fixed Annuities Exh 5 Equity/Index INTERNATIONAL E58DKGMJYYYJLN8C3868",,08/24/2020,0,0,0.0
"10,GF0 BHF27ZNN2 Fixed Annuities Exh 5 Equity/Index INTERNATIONAL E58DKGMJYYYJLN8C3868",,08/24/2020,0,0,0.0
"5,D10,GF BHF27ZNQ5 Fixed Annuities Exh 5 Equity/Index INTERNATIONAL E58DKGMJYYYJLN8C3868",,08/24/2020,0,0,0.0
"5,D10,GF BHF27ZNS1 Fixed Annuities Exh 5 Equity/Index INTERNATIONAL E58DKGMJYYYJLN8C3868",,08/24/2020,0,0,0.0
"5,D10,GF BHF27ZNT9 Fixed Annuities Exh 5 Equity/Index INTERNATIONAL E58DKGMJYYYJLN8C3868",,08/24/2020,0,0,0.0
"D10,GF0 BHF27ZNU6 Fixed Annuities Exh 5 Equity/Index INTERNATIONAL W22LROWP2IHZNBB6K528",,08/20/2020,0,0,0.0
"D10,GF0 BHF27ZNV4 Fixed Annuities Exh 5 Equity/Index INTERNATIONAL W22LROWP2IHZNBB6K528",,08/20/2020,0,0,0.0
"D10,GF0 BHF27ZNW2 Fixed Annuities Exh 5 Equity/Index INTERNATIONAL W22LROWP2IHZNBB6K528",,08/20/2020,0,0,0.0
"D10,GF0 BHF27ZNX0 Fixed Annuities Exh 5 Equity/Index INTERNATIONAL W22LROWP2IHZNBB6K528",,08/20/2020,0,0,0.0
"of Item(s) Strike Initial Cost Cost of Credit Hedge D10,GF0 BHF27ZNY8 Fixed Annuities Exh 5 Equity/Index INTERNATIONAL W22LROWP2IHZNBB6K528",,08/20/2020,0,0,0.0
"D10,GF0 BHF27ZNZ5 Fixed Annuities Exh 5 Equity/Index INTERNATIONAL W22LROWP2IHZNBB6K528",,08/20/2020,0,0,0.0
"D10,GF0 BHF27ZP00 Fixed Annuities Exh 5 Equity/Index INTERNATIONAL W22LROWP2IHZNBB6K528",,08/20/2020,0,0,0.0
"D10,GF0 BHF27ZP18 Fixed Annuities Exh 5 Equity/Index INTERNATIONAL W22LROWP2IHZNBB6K528",,08/20/2020,0,0,0.0
"D10,GF0 BHF27ZP34 Fixed Annuities Exh 5 Equity/Index INTERNATIONAL W22LROWP2IHZNBB6K528",,08/20/2020,0,0,0.0
CALL OPTION JUN26 RTY BANK OF AMERICA NA C @ 1441 BHF281S19 Fixed Annuities Exh 5 Equity/Index B4TYDEB6GKMZO031MB27,,08/20/2020,0,0,0.0
CALL OPTION JUL26 RTY BANK OF AMERICA NA C @ 1453 BHF281S27 Fixed Annuities Exh 5 Equity/Index B4TYDEB6GKMZO031MB27,,08/20/2020,0,0,0.0
CALL OPTION JUL26 RTY BANK OF AMERICA NA C @ 1485 BHF281S43 Fixed Annuities Exh 5 Equity/Index B4TYDEB6GKMZO031MB27,,08/20/2020,0,0,0.0
CALL OPTION JUL26 SPX MORGAN STANLEY & CO C @ 3216 BHF281S50 Fixed Annuities Exh 5 Equity/Index INTL. PLC 4PQUHN3JPFGFNF3BB653,,08/21/2020,0,0,0.0
CALL OPTION JUL26 SPX MORGAN STANLEY & CO C @ 3222 BHF281S68 Fixed Annuities Exh 5 Equity/Index INTL. PLC 4PQUHN3JPFGFNF3BB653,,08/21/2020,0,0,0.0
CALL OPTION JUN26 SPX MORGAN STANLEY & CO C @ 3055 BHF281S76 Fixed Annuities Exh 5 Equity/Index INTL. PLC 4PQUHN3JPFGFNF3BB653,,08/21/2020,0,0,0.0
CALL OPTION JUL26 SPX MORGAN STANLEY & CO C @ 3239 BHF281S92 Fixed Annuities Exh 5 Equity/Index INTL. PLC 4PQUHN3JPFGFNF3BB653,,08/21/2020,0,0,0.0
"CLIQUET,A,P,PS,1Y,U35, BANK OF AMERICA NA D10,GF0, BHF29CVD4 Fixed Annuities Exh 5 Equity/Index B4TYDEB6GKMZO031MB27",,09/16/2020,0,0,0.0
"CLIQUET,A,P,PS,1Y,U40, BANK OF AMERICA NA D10,GF0, BHF29CVF9 Fixed Annuities Exh 5 Equity/Index B4TYDEB6GKMZO031MB27",,09/16/2020,0,0,0.0
"CLIQUET,A,P,PS,1Y,U30, BANK OF AMERICA NA D10,GF0, BHF29CVG7 Fixed Annuities Exh 5 Equity/Index B4TYDEB6GKMZO031MB27",,09/16/2020,0,0,0.0
"CLIQUET,A,P,PS,1Y,U40, BANK OF AMERICA NA D10,GF0, BHF29CVH5 Fixed Annuities Exh 5 Equity/Index B4TYDEB6GKMZO031MB27",,09/16/2020,0,0,0.0
"CLIQUET,A,P,PS,1Y,U45, BANK OF AMERICA NA D10,GF0, BHF29CVJ1 Fixed Annuities Exh 5 Equity/Index B4TYDEB6GKMZO031MB27",,09/16/2020,0,0,0.0
"5,D10,GF BHF29CVM4 Fixed Annuities Exh 5 Equity/Index BNP PARIBAS R0MUWSFPU8MPRO8K5P83",,09/16/2020,0,0,0.0
"5,D10,GF BHF29CVR3 Fixed Annuities Exh 5 Equity/Index BNP PARIBAS R0MUWSFPU8MPRO8K5P83",,09/16/2020,0,0,0.0
"10,GF0, BHF29CVT9 Fixed Annuities Exh 5 Equity/Index BNP PARIBAS R0MUWSFPU8MPRO8K5P83",,09/16/2020,0,0,0.0
",D10,GF0 BHF29CVW2 Fixed Annuities Exh 5 Equity/Index BNP PARIBAS R0MUWSFPU8MPRO8K5P83",,09/16/2020,0,0,0.0
"5,D10,GF BHF29CW27 Fixed Annuities Exh 5 Equity/Index BNP PARIBAS R0MUWSFPU8MPRO8K5P83",,09/16/2020,0,0,0.0
"CLIQUET,A,P,PS,1Y,U60, BANK OF AMERICA NA D10,GF0 BHF29CW76 Fixed Annuities Exh 5 Equity/Index B4TYDEB6GKMZO031MB27",,09/15/2020,0,0,0.0
"CLIQUET,A,P,PS,1Y,U65, BANK OF AMERICA NA D10,GF0 BHF29CWT8 Fixed Annuities Exh 5 Equity/Index B4TYDEB6GKMZO031MB27",,09/15/2020,0,0,0.0
"CLIQUET,A,P,PS,1Y,U45, BANK OF AMERICA NA D10,GF0 BHF29CWV3 Fixed Annuities Exh 5 Equity/Index B4TYDEB6GKMZO031MB27",,09/15/2020,0,0,0.0
"CLIQUET,A,P,PS,1Y,U50, BANK OF AMERICA NA D10,GF0 BHF29CX26 Fixed Annuities Exh 5 Equity/Index B4TYDEB6GKMZO031MB27",,09/15/2020,0,0,0.0
"CLIQUET,A,P,PS,1Y,U65, BANK OF AMERICA NA D10,GF0 BHF29CX83 Fixed Annuities Exh 5 Equity/Index B4TYDEB6GKMZO031MB27",,09/15/2020,0,0,0.0
"CLIQUET,A,P,PS,1Y,U35, BANK OF AMERICA NA D10,GF0 BHF29CXF7 Fixed Annuities Exh 5 Equity/Index B4TYDEB6GKMZO031MB27",,09/15/2020,0,0,0.0
"CLIQUET,A,P,PS,1Y,U40, BANK OF AMERICA NA D10,GF0 BHF29CXG5 Fixed Annuities Exh 5 Equity/Index B4TYDEB6GKMZO031MB27",,09/15/2020,0,0,0.0
"CLIQUET,A,P,PS,1Y,U45, BANK OF AMERICA NA D10,GF0 BHF29CXH3 Fixed Annuities Exh 5 Equity/Index B4TYDEB6GKMZO031MB27",,09/15/2020,0,0,0.0
"CLIQUET,A,P,PS,1Y,U50, BANK OF AMERICA NA D10,GF0 BHF29CXK6 Fixed Annuities Exh 5 Equity/Index B4TYDEB6GKMZO031MB27",,09/15/2020,0,0,0.0
"CLIQUET,A,P,PS,1Y,U55, BANK OF AMERICA NA D10,GF0 BHF29CXS9 Fixed Annuities Exh 5 Equity/Index B4TYDEB6GKMZO031MB27",,09/15/2020,0,0,0.0
",D10,GF0 BHF29CXU4 Fixed Annuities Exh 5 Equity/Index INTERNATIONAL E58DKGMJYYYJLN8C3868",,09/17/2020,0,0,0.0
"5,D10,GF BHF29CXY6 Fixed Annuities Exh 5 Equity/Index INTERNATIONAL E58DKGMJYYYJLN8C3868",,09/17/2020,0,0,0.0
",D10,GF0 BHF29CY90 Fixed Annuities Exh 5 Equity/Index INTERNATIONAL E58DKGMJYYYJLN8C3868",,09/17/2020,0,0,0.0
"10,GF0 BHF29CYC3 Fixed Annuities Exh 5 Equity/Index INTERNATIONAL E58DKGMJYYYJLN8C3868",,09/17/2020,0,0,0.0
"5,D10,GF BHF29CYG4 Fixed Annuities Exh 5 Equity/Index INTERNATIONAL E58DKGMJYYYJLN8C3868",,09/17/2020,0,0,0.0
"5,D10,GF BHF29CYJ8 Fixed Annuities Exh 5 Equity/Index INTERNATIONAL E58DKGMJYYYJLN8C3868",,09/17/2020,0,0,0.0
