name,state,date_acquired,book_value,investment_income,ownership_pct
CGA LEASE BACKED PASS THROUGH 15722* AA 3 CORP BND,,03/10/2020.,0,0,0.0
CHAMBERLAIN GROUP INC SENIOR 15769# AM 7 CORP BND,,02/25/2020.,0,0,0.0
CHASE FUNDING MORTGAGE LOAN AS,,03/01/2020.,0,0,0.0
CHASE FUNDING MORTGAGE LOAN AS,,03/25/2020.,0,0,0.0
CHEVY CHASE FUND CCMFC_05-1A 16678R,CT,03/25/2020.,0,0,0.0
CHEVY CHASE MORTGAGE FUNDING C 16678R CU 9 CCMFC_05-,,03/25/2020.,0,0,0.0
CISCO SYSTEMS INC CORP BND 17275R AH 5 4.450% 01/1,,01/15/2020.,0,0,0.0
CITIGROUP MORTGAGE LOAN TRUST,,03/01/2020.,0,0,0.0
CREDIT-BASED ASSET SERVICING A 17307G LP 1 CBASS_04-,,03/25/2020.,0,0,0.0
CITIGROUP MORTGAGE LOAN TRUST 17311F AF 1 CML_07-OX1,,03/01/2020.,0,0,0.0
17311L AB 7 04/25,,03/01/2020.,0,0,0.0
CREDIT BASED ASSET SERVICING A 17311Y AA 1 CBASS_07-,,03/01/2020.,0,0,0.0
17313B AA 9 1.122% 05/,,03/25/2020.,0,0,0.0
CITIGROUP MORTGAGE LOAN TRUST 17313J AB 0 CMLTI_07-W,,03/25/2020.,0,0,0.0
CITIGROUP MORTGAGE LOAN TRUST 17313J AD 6 CMLTI_07-W,,03/25/2020.,0,0,0.0
17315N AD 5 CMLTI_09-8,,03/01/2020.,0,0,0.0
CLEARBRIDGE ENERGY MLP FUND IN,CO,03/27/2020.,0,0,0.0
CLIFFS NATURAL RESOURCES INC 18683K AM 3 CLIFFS NATU,,01/13/2020.,0,0,0.0
18974B AH 2 RMBS 06-A5,,03/01/2020.,0,0,0.0
20267U AB 5 10/25/40,,03/25/2020.,0,0,0.0
COX COMMUNICATIONS INC SENIOR 22357@ AA 9 CORP BND,,03/01/2020.,0,0,0.0
COWBOYS STADIUM LP SECURED,,03/31/2020.,0,0,0.0
HOME EQUITY ASSET TRUST HEAT_0 22541N AG 4 HEAT_02-1,,03/25/2020.,0,0,0.0
TBW MORTGAGE BACKED PASS,,03/01/2020.,0,0,0.0
"Statement as of March 31, 2020 of the Brighthouse Life Insurance Company",AL,02/20/2020.,0,0,0.0
DBUBS MORTGAGE TRUST DBUBS_11- 23305Y AD 1 DBUBS_11-,,03/01/2020.,0,0,0.0
DULLES DISCOVERY IV SENIOR CORP 23317* AC 4 BND 3.,,03/05/2020.,0,0,0.0
23332U DB 7 03/19/4,,03/19/2020.,0,0,0.0
DSLA MTGE LOAN TRUST DSLA_05-A4 23332U EL 4 1.270%,,03/19/2020.,0,0,0.0
DELTA AIR LINES CORP BND 6.718%,,01/02/2020.,0,0,0.0
DTE ELECTRIC CO CORP BND 4.890%,,03/01/2020.,0,0,0.0
DEUTSCHE ALT-A SECURITIES INC,,03/25/2020.,0,0,0.0
DBALT_07-OA4 WHOLE CMO 07-OA4 25151X AA 9 1.137% 0,,03/25/2020.,0,0,0.0
DEUTSCHE ALT-A SECURITIES INC 25151X AB 7 DBALT_07-O,,03/25/2020.,0,0,0.0
DH CANAL LLC WALGREEN CORP BND 25240* AA 5 5.350%,,03/15/2020.,0,0,0.0
DIAMOND SPORTS GROUP LLC 25277L AC 0 SENIOR CORP BND,,03/23/2020.,0,0,0.0
DODGER TICKETS LLC CORP BND 25654# AA 0 5.660% 03,,03/31/2020.,0,0,0.0
DPABS_15-1A SUB ABS_15-1A A2II 144A 25755T AE 0 4.,,01/25/2020.,0,0,0.0
25755T AG 5 DPABS_12-1A 3.082% 07/25/47,,01/25/2020.,0,0,0.0
DOMINOS PIZZA MASTER ISSUER LL 25755T,AK,01/25/2020.,0,0,0.0
DOW CHEMICAL COMPANY THE,,01/15/2020.,0,0,0.0
DRIVEN BRANDS FUNDING LLC HONK 26208L AD 0 ABS -1A-A,,01/20/2020.,0,0,0.0
VISTRA ENERGY CORP SENIOR CORP 26817R,AS,01/15/2020.,0,0,0.0
EAGLE HOLDING COMPANY II LLC 26959X AC 7 SENIOR CORP,,02/15/2020.,0,0,0.0
29365K AC 7 ETI ABS 09 A3 4.380% 11/01/23,,02/01/2020.,0,0,0.0
"Statement as of March 31, 2020 of the Brighthouse Life Insurance Company 29379V AF 0 CORP BND",,01/31/2020.,0,0,0.0
EQUINIX INC. SENIOR CORP BND 29444U AN 6 5.375% 01,,01/01/2020.,0,0,0.0
FLNG LIQUEFACTION 2 LLC SENIOR 30288* AA 8 CORP BND,,03/31/2020.,0,0,0.0
FLNG LIQUEFACTION 2 LLC SENIOR 30288* AB 6 CORP BND,,03/31/2020.,0,0,0.0
FWD_20-INV1 ABS V1-A1 144A 2.240%,,03/01/2020.,0,0,0.0
FEDERAL EXPRESS CORP 1999 PASS 31331F BB 6 FEDERAL E,,01/15/2020.,0,0,0.0
FEDEX CORP SENIOR CORP BND 31428X BV 7 3.100% 08/0,,01/15/2020.,0,0,0.0
31620M AQ 9 CORP BND,,01/02/2020.,0,0,0.0
31620M AU 0 SENIOR COR,,01/15/2020.,0,0,0.0
31620M,AZ,01/15/2020.,0,0,0.0
31846L BW 5 09/20/29,,01/01/2020.,0,0,0.0
32027N VV 0 10/25/35,,03/25/2020.,0,0,0.0
FIRST HORIZON ALTERNATIVE MORT 32051G TD 7 FHAMS_05-,,03/01/2020.,0,0,0.0
32051G YH 2 5.500% 11/,,03/01/2020.,0,0,0.0
FIRST HORIZON ALTERNATIVE MORT 32052F,AR,03/01/2020.,0,0,0.0
FIRST NLC TRUST FNLC_05-1 FNLC_05- 32113J AA 3 1 1.,,03/25/2020.,0,0,0.0
CVS PASSTHROUGH TRUST CORP 33632* UQ 8 BND 7.280%,,03/10/2020.,0,0,0.0
FISERV INC SENIOR CORP BND,,01/15/2020.,0,0,0.0
33851J AC 3 WHOLECMO18-3,,03/01/2020.,0,0,0.0
FSMT_18-4 WHOLE CMO 8-4-A4 33851L AD 6 4.000% 07/2,,03/01/2020.,0,0,0.0
33851Y AC 0 RMBS INV-A3,,03/01/2020.,0,0,0.0
FLNG LIQUEFACTION 2 LLC FLNG 33972P AA 7 LIQUEFACTIO,,03/31/2020.,0,0,0.0
FORT HOOD FAMILY HOUSING TRUST,,03/15/2020.,0,0,0.0
FORT HOOD FAMILY HOUSING TRUST,,03/15/2020.,0,0,0.0
35671D AU 9 CORP BND 3,,02/25/2020.,0,0,0.0
35671D AU 9 CORP BND 3,,03/05/2020.,0,0,0.0
ANGELO GORDON MORTGAGE TRUST 36167C AA 4 G RMBS PL1-,,03/01/2020.,0,0,0.0
36167F AA 7 144A 2.32,,03/01/2020.,0,0,0.0
GCAT_19-NQM3 RMBS QM3-A1 144A 36167V AA 2 2.686% 1,,03/25/2020.,0,0,0.0
GLP CAPITAL LP SENIOR CORP BND,,03/08/2020.,0,0,0.0
36185P AB 1 ASSET GMACN_07-,,03/10/2020.,0,0,0.0
36186Y AF 2 ASSET LCF SENIO,,03/10/2020.,0,0,0.0
GSAA HOME EQUITY TRUST GSAA_06,,03/25/2020.,0,0,0.0
36228F 6M 3 2.147% 06/25,,03/25/2020.,0,0,0.0
GSMPS MORTGAGE LOAN TRUST 36228F AA 4 GSMPS_98-1 8,,03/01/2020.,0,0,0.0
GSAA HOME EQUITY TRUST GSAA_07 3622EQ AE 5 GSAA_07-1,,03/25/2020.,0,0,0.0
GSAA HOME EQUITY TRUST GSAA_06,ME,03/01/2020.,0,0,0.0
GSR MORTGAGE LOAN TRUST 2005-8,,03/01/2020.,0,0,0.0
GSR MORTGAGE LOAN TRUST 2005-8,,02/01/2020.,0,0,0.0
GSAA HOME EQUITY TRUST GSAA_06,,03/25/2020.,0,0,0.0
"Statement as of March 31, 2020 of the Brighthouse Life Insurance Company 36242D 3W 1 GSAA_05-5 GSAA_05-6 1.687% 06/25/35",,03/25/2020.,0,0,0.0
GSR MORTGAGE LOAN TRUST GSR_05 36242D,VA,03/01/2020.,0,0,0.0
GSAA HOME EQUITY TRUST GSAA_06 36244S AC 2 GSAA_06-1,,03/01/2020.,0,0,0.0
36248T AA 0 04/28/37,,03/25/2020.,0,0,0.0
36248V AA 5 02/26/37,,03/25/2020.,0,0,0.0
36250T AA 5 1.797% 04,,03/25/2020.,0,0,0.0
GSMT_15-8R RMBS 5-8R-A 1.731% 36254W AA 4 04/26/37,,03/01/2020.,0,0,0.0
36255C AA 7 LCFSENIORCMBS,,01/15/2020.,0,0,0.0
GSPA MONETIZATION TRUST GS CORP 36298G AA 7 BND 144A,,03/09/2020.,0,0,0.0
GSAA HOME EQUITY TRUST GSAA_06 36298Y AA 8 ABS_06-14,,03/25/2020.,0,0,0.0
TEGNA INC GANNETT CO INC 5.125%,,01/08/2020.,0,0,0.0
GENESIS ENERGY LP/ GENESIS ENE 37185L AJ 1 SENIOR,CO,01/06/2020.,0,0,0.0
38012N AA 3 ASSET GMACN_06-,,03/10/2020.,0,0,0.0
GREAT LAKES GAS TRANSMISSION C 39063@ AG 5 CORP BND,,03/25/2020.,0,0,0.0
GREEN COUNTRY ENERGY LLC 39278* AA 1 SECURED CORP BN,,02/10/2020.,0,0,0.0
39538V AA 8 TRUST GMLT_04-1,,03/25/2020.,0,0,0.0
GPMF WHOLE CMO 06-AR2 1.407% 39538W,GA,03/25/2020.,0,0,0.0
39538W HA 9 GPMF GPM_06-AR3 1.367% 05/25/36,,03/25/2020.,0,0,0.0
39539F,AK,03/25/2020.,0,0,0.0
39539M AA 7 06/25/3,,03/25/2020.,0,0,0.0
GRIDFLEX GENERATION LLC CORP 39813# AA 9 BND 5.21,,03/31/2020.,0,0,0.0
HCA HOLDINGS INC SENIOR CORP 40412C AC 5 BND 6.250,,03/13/2020.,0,0,0.0
40436V AA 9 05/0,,02/27/2020.,0,0,0.0
FORT POLK EQUIPMENT TRUST CORP 40470# AA 1 BND 4.7,,03/06/2020.,0,0,0.0
41161M AC 4 TRUST HVMLT_06-,,03/19/2020.,0,0,0.0
HARBORVIEW MTG TR HVML_05-1 41161P LC 5 1.390% 03/,,03/19/2020.,0,0,0.0
HARBORVIEW MTG TR HVML_05-3 41161P MF 7 1.270% 06/,,03/19/2020.,0,0,0.0
41161P MG 5 06/19/,,03/19/2020.,0,0,0.0
41162D AF 6 TRUST CMO_06-12,,03/19/2020.,0,0,0.0
41164Y AB 7 TRUST CMO 2007-,,03/19/2020.,0,0,0.0
WALGREEN CO LEASE PASS THROUGH 43457# AA 2 CORP BND,,03/15/2020.,0,0,0.0
HOLLY ENERGY PARTNERS LP SENIOR,,03/03/2020.,0,0,0.0
43710L AC 8 HEAT_07-1 HEAT_07-1 1.167% 05/25/37,,03/25/2020.,0,0,0.0
HOME PARTNERS OF AMERICA TRUST 43730T AA 1 SENIOR CM,,03/13/2020.,0,0,0.0
HUDSON TRANSMISSION PARTNERS L 44416* AB 2 CORP BND,,01/01/2020.,0,0,0.0
HUDSON TRANSMISSION PARTNERS L 44416* AB 2 CORP BND,,02/29/2020.,0,0,0.0
I-595 EXPRESS LLC SECURED CORP 2 IMCH_98-3,,03/31/2020.,0,0,0.0
IMT_17-APTS SENIOR CMBS TS-AF 44974A AA 5 144A 1.4,,01/15/2020.,0,0,0.0
ICAHN ENTERPRISES LP SENIOR CORP,,03/13/2020.,0,0,0.0
45660L 3X 5 RAST_05-A,,03/01/2020.,0,0,0.0
45660L D9 7 RAST_05-A,,03/01/2020.,0,0,0.0
45670L AA 5 07/25,,03/25/2020.,0,0,0.0
JP MORGAN MORTGAGE TRUST,,03/01/2020.,0,0,0.0
JP MORGAN MORTGAGE TRUST,,03/01/2020.,0,0,0.0
JP MORGAN MORTGAGE ACQUISITION 46626L JQ 4 ABS 2006,,03/25/2020.,0,0,0.0
46628Y AX 8 07/25/3,,03/01/2020.,0,0,0.0
JP MORGAN MORTGAGE ACQUISITION 46629B AC 3 JPMAC_06-,,03/01/2020.,0,0,0.0
46629Q AC 0 4.863% 10/25,,03/01/2020.,0,0,0.0
46629S AE 2 JPMMT_ JPMMT_06-,,03/01/2020.,0,0,0.0
JP MORGAN MORTGAGE ACQUISITION 46630M AF 9 SENIOR AB,,03/01/2020.,0,0,0.0
46630W AJ 9 06/25/3,,03/01/2020.,0,0,0.0
JP MORGAN CHASE COMMERCIAL 46635W AA 3 MOR JPMCC_11-,,03/01/2020.,0,0,0.0
JACK IN THE BOX FUNDING LLC JA ABS,,02/25/2020.,0,0,0.0
JACK IN THE BOX FUNDING LLC JA ABS,,02/25/2020.,0,0,0.0
JP MORGAN REREMIC JPMRR_14-1 46641T AA 2 JPMRR_14-1,,03/01/2020.,0,0,0.0
JP MORGAN REREMIC JPMRR_14-1 46641T AF 1 JPMRR_14-1,,03/01/2020.,0,0,0.0
JP MORGAN REREMIC JPMRR_14-1 46641T,AR,03/01/2020.,0,0,0.0
JP MORGAN REMERIC JPMRR_14-5 46642V AJ 7 JPMRT_14-5,,03/01/2020.,0,0,0.0
46644B AM 2 JPMR_15-1,,03/25/2020.,0,0,0.0
JPMMT_2019-1 WHOLE CMO 9-1-A11 46650H,AL,03/25/2020.,0,0,0.0
46650J AD 6 3.500% 12/,,03/01/2020.,0,0,0.0
JP MORGAN MORTGAGE TRUST 46651D AC 0 JPMMT RMBS INV2,,03/01/2020.,0,0,0.0
JP MORGAN MORTGAGE TRUST 46651X AG 7 JPMMT RMBS 0-1-,,03/01/2020.,0,0,0.0
JOHN SEVIER COMBINED CYCLE GEN,,01/15/2020.,0,0,0.0
JRD HOLDINGS INC SENIOR CORP BND 48121@ AC 5 3.470,,03/27/2020.,0,0,0.0
WALGREEN CO LEASE PASS THROUGH 48239@ AB 6 CORP BND,,03/15/2020.,0,0,0.0
KWIK TRIP SENIOR CORP BND 3.900% 48274@ AA 4 02/24,,02/24/2020.,0,0,0.0
KIMCO REALTY CORPORATION CORP 49446R AN 9 BND 3.40,,01/15/2020.,0,0,0.0
KNOLLWOOD COTTAGE HILL DEVELOP 49917# AB 1 CORP BND,,03/15/2020.,0,0,0.0
MONDELEZ INTERNATIONAL INC CORP 50075N BA 1 BND 5.,,02/10/2020.,0,0,0.0
KRAFT HEINZ FOODS CO SENIOR 50076Q AE 6 CORP BND 5,,02/18/2020.,0,0,0.0
KRAFT HEINZ FOODS CO SENIOR 50077L,AK,03/27/2020.,0,0,0.0
KT REAL ESTATE HOLDINGS LLC 50152# AC 1 SENIOR CORP,,02/24/2020.,0,0,0.0
KWIK TRIP SENIOR CORP BND 3.320% 50152# AF 4 11/24,,02/24/2020.,0,0,0.0
KWIK TRIP KWIK TRIP INC 4.080% 50152#,AL,02/24/2020.,0,0,0.0
LKQ CORP SENIOR CORP BND 4.750%,,01/10/2020.,0,0,0.0
LADDER CAPITAL FINANCE HOLDING,CO,03/25/2020.,0,0,0.0
LAMAR MEDIA CORP. CORP BND,,02/20/2020.,0,0,0.0
DRB PRIME STUDENT LOAN TRUST D,,03/25/2020.,0,0,0.0
DRB PRIME STUDENT LOAN TRUST D,,03/25/2020.,0,0,0.0
LEA POWER PARTNERS LLC LEA,,03/15/2020.,0,0,0.0
LEAR CORPORATION LEAR CORP,,03/21/2020.,0,0,0.0
TRINITY NEPONSET LLC CORP BND 52467@ AU 9 6.380%,,03/01/2020.,0,0,0.0
52518R CC 8 LSSC LSSC_05-1 1.265% 09/26/45,,03/25/2020.,0,0,0.0
LEHMAN XS TRUST LXS_06-12N,,03/25/2020.,0,0,0.0
LEHMAN XS TRUST LXS_06-GP2,,03/25/2020.,0,0,0.0
"Statement as of March 31, 2020 of the Brighthouse Life Insurance Company 52522D AQ 4 11/25/46",,03/25/2020.,0,0,0.0
LEHMAN XS TRUST LXS_06-17 LXS_06- 52523K BH 6 17 1.,,03/25/2020.,0,0,0.0
LEHMAN XS TRUST LXS_06-13 LXS_06- 52523L AD 4 13 1.,,03/25/2020.,0,0,0.0
52524G AA 0 06/25,,03/25/2020.,0,0,0.0
52524V AD 1 08/25/,,03/25/2020.,0,0,0.0
52524V AQ 2 08/25,,03/25/2020.,0,0,0.0
52525B AD 4 09/25,,03/25/2020.,0,0,0.0
LIBERTY PROPERTY LP SENIOR CORP 53117C,AS,02/10/2020.,0,0,0.0
L BRANDS INC CORP BND 5.625% MERRILL LYNCH PIERCE FNNR,,01/14/2020.,0,0,0.0
LIVE NATION ENTERTAINMENT INC,AK,03/06/2020.,0,0,0.0
LIVE NATION ENTERTAINMENT INC,AR,03/03/2020.,0,0,0.0
54251P AA 5 LBMLT LBMLT_06-5 1.087% 06/25/36,,03/25/2020.,0,0,0.0
MASTR ASSET SECURITIZATION TRU 55274Q AN 5 MASTR_06-,,03/01/2020.,0,0,0.0
MGE POWER ELM ROAD LLC CORP 55296@ AB 1 BND 4.740,,03/25/2020.,0,0,0.0
55303X AG 0 OPERATIN SENIOR,CO,01/07/2020.,0,0,0.0
57643L CJ 3 2.597% 02/25,,03/25/2020.,0,0,0.0
MLMI_04-A1 SENIOR WHOLE CMO 04- 59020U AB 1 A1 2A1,,03/01/2020.,0,0,0.0
"Statement as of March 31, 2020 of the Brighthouse Life Insurance Company 59023W AC 2 08/25/3",,03/25/2020.,0,0,0.0
MILL CITY MORTGAGE LOAN TRUST 59980C AE 3 3.250% 0,,03/01/2020.,0,0,0.0
MORGAN STANLEY ABS CAPITAL I 61744C NT 9 MSAB_05-W2,,03/25/2020.,0,0,0.0
MORGAN STANLEY CAPITAL MSCI_11-,,03/01/2020.,0,0,0.0
MORGAN STANLEY CAPITAL I MSCI_ 61745M P6 4 MSC_04-IQ,,03/01/2020.,0,0,0.0
61745M QE 6 05/15/40,,03/01/2020.,0,0,0.0
61745M ZM 8 MSC MSC_04-IQ7 5.249% 06/15/38,,03/01/2020.,0,0,0.0
61745M ZN 6 MSC MSC_04-IQ7 5.800% 06/15/38,,03/01/2020.,0,0,0.0
61745M ZP 1 MSC MSC_04-IQ7 5.800% 06/15/38,,03/01/2020.,0,0,0.0
MORGAN STANLEY MORTGAGE LOAN 61748J AA 5 T CMO MSM_0,,03/25/2020.,0,0,0.0
MORGAN STANLEY BAML TRUST MSBA 61762M BV 2 CMBS_13-C,,01/01/2020.,0,0,0.0
MORGAN STANLEY REREMIC TRUST M 61762Q AA 0 MSRR_13-R,,03/25/2020.,0,0,0.0
MORGAN STANLEY REREMIC TRUST M 61764Q AG 5 MSMR_14-R,,03/25/2020.,0,0,0.0
MORGAN STANLEY REREMIC TRUST M 61765N AA 4 MSMR_15-R,,03/25/2020.,0,0,0.0
MORTGAGEIT TRUST MHL_05-5 RMBS - 61915R AU 0 5-A1 1,,03/25/2020.,0,0,0.0
MORTGAGEIT TRUST MHL_05-5 RMBS - 61915R AU 0 5-A1 1,,01/01/2020.,0,0,0.0
63860H AD 1 NTSR_07-A NTSR_07-A 1.177% 03/25/37,,03/25/2020.,0,0,0.0
63861H,AL,03/01/2020.,0,0,0.0
NAVIENTSTUDENTLOANTRUSTNAV BANC OF AMERICA SECURITIES 63940L AC 8 NAVSL_16-6A,,02/03/2020.,0,0,0.0
NEW CENTURY ALTERNATIVE MORTGA,,03/01/2020.,0,0,0.0
NEW CENTURY HOME EQUITY LOAN T 64352V ES 6 NCHET_03-,,03/25/2020.,0,0,0.0
NEW CENTURY HOME EQUITY TRUST 64352V,NJ,03/25/2020.,0,0,0.0
NEW CENTURY HOME EQUITY LOAN T 64352V,NY,03/25/2020.,0,0,0.0
NEW RESIDENTIAL MORTGAGE LOAN 64830H AA 2 RMBS PL2-A,,03/01/2020.,0,0,0.0
NEXTERA ENERGY OPERATING PARTN 65342Q AL 6 SENIOR,CO,02/11/2020.,0,0,0.0
NOMURA HOME EQUITY LOAN INC NH 65537K AB 6 NHELI_07-,,03/25/2020.,0,0,0.0
65540X AY 3 NMRR_15-5R,,03/25/2020.,0,0,0.0
NORTHERN UTILITIES INC SENIOR,,03/02/2020.,0,0,0.0
NOVASTAR HOME EQUITY LOAN NHEL 66988V AA 6 NFHE_06-2,,03/25/2020.,0,0,0.0
OBX_19-INV2 RMBS 2-A11 144A 1.897% 67112V,AL,03/25/2020.,0,0,0.0
67113A,AZ,03/25/2020.,0,0,0.0
67113K AJ 7 RMBS -2A1A 14,,03/25/2020.,0,0,0.0
OHIO VALLEY ELECTRIC CORP CORP 67773# AD 2 BND 5.,,02/15/2020.,0,0,0.0
ORANGE COGEN CO ORANGE COGEN,,03/15/2020.,0,0,0.0
PNC FINC SERV GROUP INC THE CORP,,02/08/2020.,0,0,0.0
70069F DM 6 12/25,,03/25/2020.,0,0,0.0
71336W AA 3 1.585% 0,,03/16/2020.,0,0,0.0
PHILLIES FUNDING LP CORP BND 71839# AA 2 6.210% 07,,01/10/2020.,0,0,0.0
PIONEER NATURAL RESOURCES CO,,01/15/2020.,0,0,0.0
PRAIRIE BREEZE CLASS B HOLDING 73943# AD 5 SECURED C,,01/01/2020.,0,0,0.0
PRAIRIE BREEZE CLASS B HOLDING 73943# AD 5 SECURED C,,03/31/2020.,0,0,0.0
PUBLIC SERVICE COMPANY OF NORT,,03/30/2020.,0,0,0.0
QEP RESOURCES INC SENIOR CORP 74733V AD 2 BND 5.62,,03/03/2020.,0,0,0.0
74834L AP 5 CORP BND,,01/15/2020.,0,0,0.0
RAAC SERIES RAAC_06-RP3 ABS 06- 74919R AA 3 RP3 144A,,03/25/2020.,0,0,0.0
RESIDENTIAL ACCREDIT LOANS INC 74922A AA 5 SUPSEN WH,,03/25/2020.,0,0,0.0
RESIDENTIAL ACCREDIT LOANS RAL 74922R AC 4 RALI_06-Q,,03/01/2020.,0,0,0.0
RESIDENTIAL ACCREDIT LOANS RAL 74922R AH 3 RALI_06-Q,,03/25/2020.,0,0,0.0
RESIDENTIAL FUNDING MORTGAGE S 74958D AH 1 CMO_06-S1,,03/01/2020.,0,0,0.0
SMBC RAIL SERVICES LLC 74979U AA 3 SECUREDCORPBND,,03/20/2020.,0,0,0.0
RESIDENTIAL ACCREDIT LOANS IN,,03/01/2020.,0,0,0.0
RESIDENTIAL ACCREDIT LOANS IN,,03/01/2020.,0,0,0.0
RESIDENTIAL ACCREDIT LOANS INC 75115H AB 2 SENIOR AB,,03/25/2020.,0,0,0.0
RENRE NORTH AMERICA HLDGS,,03/15/2020.,0,0,0.0
RASC_04-KS10 ABS S10-M1 1.847% 76110W G3 4 11/25/3,,03/25/2020.,0,0,0.0
RESIDENTIAL ASSET SECURITIES C 76110W YM 2 RASC_04-K,,03/25/2020.,0,0,0.0
76110W ZX 7 07/25/3,,03/25/2020.,0,0,0.0
RESIDENTIAL ASSET MORTGAGE PRO 76112B AM 2 RAMP_04-R,,03/25/2020.,0,0,0.0
76114G AA 5 RAST_06-A,,03/01/2020.,0,0,0.0
RESMAE MORTGAGE LOAN TRUST 76116R AA 9 RSMLT_06-1,,03/25/2020.,0,0,0.0
76119C AA 9 02/2,,03/01/2020.,0,0,0.0
RESIMAC BASTILLE TRUST IN RESP 76119U AA 9 RMBS NCA-,,03/05/2020.,0,0,0.0
REYNOLDS GROUP ISSUER INC / RE,,02/04/2020.,0,0,0.0
SESAC INC ABS 19-1-A2 144A 5.216% 78396Y AA 1 07/2,,01/25/2020.,0,0,0.0
78442G RA 6 SLMA ABS -9-A7A 2.394% 01/25/41,,01/27/2020.,0,0,0.0
SLM STUDENT LOAN TRUST SLMA_06 78443H AJ 2 SLMA_06-8,,01/27/2020.,0,0,0.0
SLM STUDENT LOAN TRUST 2007-1 78443V AJ 1 SLMA_07-1,,01/27/2020.,0,0,0.0
"Statement as of March 31, 2020 of the Brighthouse Life Insurance Company",,03/01/2020.,0,0,0.0
81375W AB 2 02/25/34,,03/25/2020.,0,0,0.0
81747W AG 2 4.000% 09/,,03/01/2020.,0,0,0.0
SHELLPOINT ASSET FUNDING TRUST,,03/01/2020.,0,0,0.0
82280Q AJ 0 WHOLECMO1,,03/01/2020.,0,0,0.0
Sierra Receivables Funding Com 82653G AA 0 SRFC_18-3,,03/20/2020.,0,0,0.0
Sierra Receivables Funding Com 82653G AB 8 SRFC_18-3,,03/20/2020.,0,0,0.0
SOFI CONSUMER LOAN PROGRAM TRU 83402V AA 9 SFLP_16-4,,03/25/2020.,0,0,0.0
SOFI CONSUMER LOAN PROGRAM TRU 83404J AA 4 ABS_17-3-,,03/25/2020.,0,0,0.0
SOFI CONSUMER LOAN PROGRAM TRU 83405P AA 9 SCLP_2017,,03/25/2020.,0,0,0.0
SPIRITS OF ST LOUIS BASKETBALL 84860* AB 9 SENIOR,CO,03/31/2020.,0,0,0.0
SPIRITS NEWCO LLC CORP BND,,03/31/2020.,0,0,0.0
SPRINGLEAF FINANCE CORP SENIOR 85172F,AK,03/12/2020.,0,0,0.0
SIDC_19-1A ABS -1A-A2 4.540% 85236K AA 0 02/25/44,,03/25/2020.,0,0,0.0
STARLI_20-1 RMBS _20-1-A1 144A 85573A AA 3 2.275%,,03/01/2020.,0,0,0.0
STEEL DYNAMICS SENIOR CORP BND,,01/10/2020.,0,0,0.0
STR_14-1A WHOLE CMO _14-1A-A2 86213B AB 3 144A 5.0,,03/20/2020.,0,0,0.0
STRUCTURED ADJUSTABLE RATE MOR,,03/25/2020.,0,0,0.0
SAILT MEZZANIN ABS 05-HE3 M1 86358E WX 0 1.667% 09,,03/25/2020.,0,0,0.0
STRUCTURED ASSET MORTGAGE INVE 86359L QM 4 CMO_05-AR,,03/01/2020.,0,0,0.0
STRUCTURED ASSET SECURITIES CO 86360L AE 6 SASC_06-W,,03/25/2020.,0,0,0.0
STRUCTURED ASSET MORTGAGE INVE 86361H AA 2 CMO_06-AR,,03/25/2020.,0,0,0.0
STRUCTURED ASSET MORTGAGE INVE 86361W AA 9 CMO_06-AR,,03/25/2020.,0,0,0.0
STRUCTURED ASSET SECURITIES CO 86362P AD 7 ABS_07-BC,,03/25/2020.,0,0,0.0
SAMI_07-AR1 SUPSEN WHOLE CMO 86362X AP 3 _07-AR1-2A1,,03/25/2020.,0,0,0.0
STRUCTURED ASSET MORTGAGE INVE 86363D AA 9 SUPSEN WH,,03/25/2020.,0,0,0.0
STRUCTURED ASSET SECURITIES CO 86363W AG 4 SASC_07-B,,03/25/2020.,0,0,0.0
TBW MORTGAGE BACKED PASS,,03/25/2020.,0,0,0.0
TBW MORTGAGE BACKED PASS 87222E AH 1 THROU WHOLE CMO,,03/01/2020.,0,0,0.0
TPC UNIVERSITY LC FBI MANASSAS 87277# AA 7 CORP BND,,03/05/2020.,0,0,0.0
TTX COMPANY TTX COMPANY 5.453% 87305N AV 0 01/02/2,,01/02/2020.,0,0,0.0
TTX COMPANY TTX COMPANY 5.503% 87305N AW 8 01/02/2,,01/02/2020.,0,0,0.0
TACO BELL FUNDING LLC BELL_18- 87342R AD 6 ABS -1-A2,,02/25/2020.,0,0,0.0
TACO BELL FUNDING LLC BELL_18- 87342R AE 4 ABS 1-A2I,,02/25/2020.,0,0,0.0
TARGA RESOURCES PARTNERS LP 87612B BM 3 SENIOR CORP,,01/22/2020.,0,0,0.0
TARGET CORPORATION SENIOR CORP CREDIT SUISSE FIRST BOSTON 87612E BG 0 BND 3.9,,01/22/2020.,0,0,0.0
TBW MORTGAGE BACKED PASS 87804A AB 8 THROU TBW_06-3,,03/01/2020.,0,0,0.0
TECO FINANCE INC CORP BND 87875U,AK,03/15/2020.,0,0,0.0
TERRAFORM OSPREY I LLC SECURED 88105* AA 7 CORP BND,,03/31/2020.,0,0,0.0
TERWIN MORTGAGE TRUST TMTS_04-,PA,03/25/2020.,0,0,0.0
TERWIN MORTGAGE TRUST TMT_05-,,03/25/2020.,0,0,0.0
88156P AA 9 TMTS_06-7 TMTS_06-7 1.107% 07/25/37,,03/25/2020.,0,0,0.0
TERWIN MORTGAGE TRUST TMTS_06- 88156T AB 9 TMTS_06-9,,03/25/2020.,0,0,0.0
WIND RIVER CLO LTD WINDR_15-2A 88432G,AL,01/15/2020.,0,0,0.0
CO SENIOR CORP BND 3.250% 88579Y BK 6 08/26/49,,01/15/2020.,0,0,0.0
TIME WARNER CABLE LLC SENIOR 88732J AW 8 CORP BND,,02/01/2020.,0,0,0.0
89147L N* 7 SENIOR,CO,03/30/2020.,0,0,0.0
TORTOISE MLP FUND INC 89148B E# 4 SENIORCORPBND 3.,,03/31/2020.,0,0,0.0
89169D,AL,03/01/2020.,0,0,0.0
89173U AA 5 06/25,,03/01/2020.,0,0,0.0
TOWD POINT MORTGAGE TRUST TPMT 89175M AA 1 ABS18-314,,03/01/2020.,0,0,0.0
TOWD POINT MORTGAGE TRUST TPMT 89177H AA 0 ABS HY2-A,,03/25/2020.,0,0,0.0
TOWD POINT MORTGAGE TRUST TPMT 89177X AA 5 ABS Y3-A1,,03/25/2020.,0,0,0.0
TOWD POINT MORTGAGE TRUST TPMT 89178B AA 2 WHOLECMO1,,03/01/2020.,0,0,0.0
UDR INC SENIOR CORP BND MTN 90265E,AR,01/15/2020.,0,0,0.0
USTA NATIONAL TENNIS CENTER IN 90363@ AA 8 SENIOR,CO,01/08/2020.,0,0,0.0
USTA NATIONAL TENNIS CENTER IN 90363@ AB 6 SENIOR,CO,01/08/2020.,0,0,0.0
UNION PAC RAILROAD CO 2003-1 90783S AA 0 CORP BND,,01/02/2020.,0,0,0.0
UAL PASS THROUGH TRUST SERIES,,01/02/2020.,0,0,0.0
QWEST CORP CORP BND 6.875%,,01/15/2020.,0,0,0.0
VELOCITY COMMERCIAL CAPITAL LO 92257A AB 0 SENIORWHO,,03/01/2020.,0,0,0.0
VELOCITY COMMERCIAL CAPITAL LO 92257H AA 7 SENIOR CM,,01/01/2020.,0,0,0.0
VELOCITY COMMERCIAL CAPITAL LO 92257H AA 7 SENIOR CM,,03/01/2020.,0,0,0.0
VELOCITY COMMERCIAL CAPITAL LO 92257H AA 7 SENIOR CM,,01/01/2020.,0,0,0.0
VELOCITY COMMERCIAL CAPITAL LO 92257H AB 5 SUB CMBS,,03/01/2020.,0,0,0.0
VELOCITY COMMERCIAL CAPITAL LO 92257N AA 4 SENIOR CM,,03/01/2020.,0,0,0.0
VCC_15-1 SUB CMBS -1-M2 144A 92258M AC 1 5.880% 06,,03/01/2020.,0,0,0.0
92258N AC 9 VCC_16-1 VCC_16-1 4.572% 04/25/46,,03/01/2020.,0,0,0.0
92258V AA 5 11/25/47,,03/25/2020.,0,0,0.0
92259B AA 8 VCC_18-2 4,,03/01/2020.,0,0,0.0
92259B AD 2 CMBS_18-2-M1,,03/01/2020.,0,0,0.0
VELOCITY COMMERCIAL CAPITAL LO 92259L AB 4 SENIOR CM,,02/25/2020.,0,0,0.0
VELOCITY COMMERCIAL CAPITAL LO 92259L AB 4 SENIOR CM,,03/01/2020.,0,0,0.0
VERUS SECURITIZATION TRUST VER 92536P AA 2 RMBS 20-1,,03/01/2020.,0,0,0.0
VERUS SECURITIZATION TRUST VER 92537H AA 9 RMBS INV2,,03/01/2020.,0,0,0.0
VERUS_19-INV3 RMBS INV3-A1 144A 92537M AA 8 2.692%,,03/01/2020.,0,0,0.0
92935V AG 3 TRU SENIOR CM,,03/01/2020.,0,0,0.0
HOME DEPOT INC CORP BND 6.000% 92977B A* 2 01/15/,,03/15/2020.,0,0,0.0
92977Y BW 0 WMLT CMO_05-B 2A4 4.284% 10/20/35.,,03/01/2020.,0,0,0.0
WACHOVIA MORTGAGE LOAN TRUST L 92978E AA 2 WMLT_06-A,,03/25/2020.,0,0,0.0
WALGREEN CO LEASE PASS THROUGH 93041# AA 0 CORP BND,,03/15/2020.,0,0,0.0
WAGNER EQUIPMENT CO CORP BND 93045# AF 5 3.510% 0,,02/15/2020.,0,0,0.0
"Statement as of March 31, 2020 of the Brighthouse Life Insurance Company 93363C AB 5 CER WHOLE CMO",,03/01/2020.,0,0,0.0
93364E AE 4 1.237% 05/25/,,03/25/2020.,0,0,0.0
93364E AF 1 WMHE_07-H,,03/25/2020.,0,0,0.0
93935W AF 1 10/25/36,,03/01/2020.,0,0,0.0
93936N AC 7 PAS WMALT_07-,,03/01/2020.,0,0,0.0
WATSON LAND CO SENIOR CORP BND,,03/29/2020.,0,0,0.0
WELLS FARGO & COMPANY SUB CORP 94974B,GU,01/15/2020.,0,0,0.0
HOME DEPOT INC CORP BND 5.370% 94978# BV 8 01/15/,,01/15/2020.,0,0,0.0
CVS PASSTHROUGH TRUST CORP 94978# CQ 8 BND 5.610%,,03/10/2020.,0,0,0.0
FIRST UNION RAIL CORP CORP BND 94978# CY 1 5.480%,,01/02/2020.,0,0,0.0
FIRST UNION RAIL CORP CORP BND 94978# CZ 8 5.480%,,01/02/2020.,0,0,0.0
FIRST UNION RAIL CORP CORP BND 94978# DA 2 5.480%,,01/02/2020.,0,0,0.0
FIRST UNION RAIL CORP CORP BND 94978# DB 0 5.480%,,01/02/2020.,0,0,0.0
FIRST UNION RAIL CORP CORP BND 94978#,DC,03/02/2020.,0,0,0.0
94980G BF 7 05/25/34,,03/25/2020.,0,0,0.0
WELLS FARGO REREMIC TRUST WRFF 94987G AA 2 WRFF_11-R,,03/01/2020.,0,0,0.0
WELLS FARGO MORTGAGE BACKED 95002F AA 2 SE RMBS BS_1,,03/01/2020.,0,0,0.0
WELLS FARGO MORTGAGE BACKED 95002F AA 2 SE RMBS BS_1,,01/01/2020.,0,0,0.0
WESTERN MIDSTREAM OPERATING LP,,01/08/2020.,0,0,0.0
WETT HOLDINGS LLC SECURED CORP 96188# AA 6 BND 4.3,,03/31/2020.,0,0,0.0
WALGREEN CO LEASE PASS THROUGH 96928* BK 2 CORP BND,,03/15/2020.,0,0,0.0
WILLIAMS COMPANIES INC CORP BND 96950F AD 6 5.250%,,03/15/2020.,0,0,0.0
"Statement as of March 31, 2020 of the Brighthouse Life Insurance Company 97181# EU 3 CORP BND 6.",,01/02/2020.,0,0,0.0
97181#,GA,01/30/2020.,0,0,0.0
WOLVERINE POWER SUPPLY SENIOR 97806* AG 7 CORP BND,,03/10/2020.,0,0,0.0
WYNN LAS VEGAS LLC / WYNN LAS,,03/12/2020.,0,0,0.0
YUM! BRANDS INC. SENIOR CORP BND,AL,02/03/2020.,0,0,0.0
BAUSCH HEALTH COMPANIES INC,,02/28/2020.,0,0,0.0
18914L AA 8 CLOVER LIMITE,,03/31/2020.,0,0,0.0
FTG FRASER TRANSPORTATION GROU 35952S AA 0 FRASER TR,,03/31/2020.,0,0,0.0
KINGSTON SOLAR LP SECURED CORP,,01/31/2020.,0,0,0.0
NATIONAL BANK OF CANADA SENIOR NATIONAL BANK OF CANADA 63307C AG 6 CORP BND A,,01/15/2020.,0,0,0.0
NOUVELLE AUTOROUTE 30 FINANCEM 66980C AB 4 SENIORCOR,,03/31/2020.,0,0,0.0
OPEN TEXT CORP SENIOR CORP BND,,03/05/2020.,0,0,0.0
PLENARY PROPERTIES NDC GP 72908L AB 1 PLENARY PROPER,,03/07/2020.,0,0,0.0
SEA TO SKY HIGHWAY INVESTMENT,,03/02/2020.,0,0,0.0
TM1505 LLC CORP BND 5.350% 87277* AA 1 04/05/23,,03/05/2020.,0,0,0.0
BAUSCH HEALTH COMPANIES INC 91911K AE 2 SENIOR CORP A,,03/12/2020.,0,0,0.0
PLENARY HEALTH NORTH BAY FINCO PP1T1F YI 4 PLENARY H,,03/13/2020.,0,0,0.0
AESANDRES SENIOR CORP BND 144A 00809Y AB 4 7.950% D,,02/06/2020.,0,0,0.0
AHOLD FIN USA INC CORP BND,,01/02/2020.,0,0,0.0
AMERICA MOVIL SAB DE CV CORP BND 02364W AV 7 5.000 D,,03/30/2020.,0,0,0.0
AUTOPISTAS METROPOLITANAS DE P 05330K AA 3 SECURED C D,,03/31/2020.,0,0,0.0
BANCO DE CREDITO E INVERSIONES 05890M AA 1 SENIOR,CO,01/14/2020.,0,0,0.0
BANCO GENERAL SA SENIOR CORP,,01/28/2020.,0,0,0.0
BCO INTER PERU SENIOR CORP BND 05968D AC 4 144A 3. D,,01/27/2020.,0,0,0.0
BANCOLOMBIA SA CORP BND 5.950% 05968L AG 7 06/03/2 D,,03/02/2020.,0,0,0.0
BARCLAYS BANK PLC CORP BND 06739G,AR,01/08/2020.,0,0,0.0
CELULOSA ARAUCO Y CONSTITUCION,,01/27/2020.,0,0,0.0
CEMEX SAB DE C.V. SECURED CORP,,01/27/2020.,0,0,0.0
CIBANCO SA INSTITUCION DE BANC BCO BILBAO VIZCAYA ARG 17162L AB 7 SENIOR,CO,01/27/2020.,0,0,0.0
ENA SUR TRUST ENA SUR TRUST 26876H AA 6 5.750% 05/ D,,02/25/2020.,0,0,0.0
ENTEL CHILE SA ENTEL CHILE SA 29245V AB 1 4.750% 0 D,,01/27/2020.,0,0,0.0
29277R AA 3 TRUST 5.875% D,,01/27/2020.,0,0,0.0
GLOBAL AIRCRAFT LEASING CO LTD 37960J AA 6 SENIOR,CO,03/10/2020.,0,0,0.0
GRUPO TELEVISA SA CORP BND 40049J AV 9 6.625% 03/1 D,,01/06/2020.,0,0,0.0
GUANAY FINANCE LIMITED GUANAY 40066N AA 4 FINANCE LI D,,03/15/2020.,0,0,0.0
HPHT FINANCE (15) LTD SENIOR CORP 40433Q AB 1 BND 14 D,,03/17/2020.,0,0,0.0
HIGHBRIDGE LOAN MANAGEMENT LTD 40436V AB 7 HPSL_17-1 D,,02/06/2020.,0,0,0.0
KLABIN AUSTRIA GMBH Bond Corp 49836A AA 2 5.750% 0 D,,01/27/2020.,0,0,0.0
LLPL CAPITAL PTE LTD SECURED 50201P AA 4 CORP BND 14 D,,02/04/2020.,0,0,0.0
LIMA METRO LINE 2 FINANCE LTD,CO,01/05/2020.,0,0,0.0
71337H AB 3 PEPR_17 D,,03/10/2020.,0,0,0.0
76119H AA 8 11/10/4 D,,03/10/2020.,0,0,0.0
"Statement as of March 31, 2020 of the Brighthouse Life Insurance Company 76120L AA 6 RMBS -2A-A1 D",,03/10/2020.,0,0,0.0
SACI FALABELLA SENIOR CORP BND 78386F AA 4 144A 3. D,,01/06/2020.,0,0,0.0
SACI FALABELLA SACI FALABELLA MERRILL LYNCH PIERCE FNNR 78386F AC 0 4.375% 0 D,,01/10/2020.,0,0,0.0
SANDS CHINA LTD SENIOR CORP BND 80007R AE 5 5.400% D,,01/28/2020.,0,0,0.0
SANDS CHINA LTD SENIOR CORP BND 80007R AF 2 5.125% D,,01/28/2020.,0,0,0.0
SOCIEDAD QUIMICA Y MINERA DE C,CO,01/13/2020.,0,0,0.0
