name,state,date_acquired,book_value,investment_income,ownership_pct
PUT OPTION OCT23SPXP@3441 MORGAN STANLEY & CO BHF3WS2U5 Variable Annuities Exh 5 Equity/Index INTL. PLC 4PQUHN3JPFGFNF3BB653,,10/02/2023,3441,0,0.0
BHF3WS9B0 Premium at Maturity 2026-01-21 . Variable Annuities Exh 5 Equity/Index INTL. PLC 4PQUHN3JPFGFNF3BB653 .,,10/02/2023,3439,0,0.0
BHF3WSCU4; CALL OPTION MORGAN STANLEY & CO OCT23SPXC@5229 BHF3WS6U1 Variable Annuities Exh 5 Equity/Index INTL. PLC 4PQUHN3JPFGFNF3BB653,,10/02/2023,3433,0,0.0
BHF3WSAC6 Premium at Maturity 2029-07-24 . Variable Annuities Exh 5 Equity/Index INTL. PLC 4PQUHN3JPFGFNF3BB653 .,,10/02/2023,3429,0,0.0
BHF3WS995 Premium at Maturity 2025-10-21 . Variable Annuities Exh 5 Equity/Index INTL. PLC 4PQUHN3JPFGFNF3BB653 .,,10/02/2023,3333,0,0.0
BHF3WS6V9 Premium at Maturity 2024-01-23 . Variable Annuities Exh 5 Equity/Index INTL. PLC 4PQUHN3JPFGFNF3BB653 .,,10/02/2023,3266,0,0.0
BHF3WS813 Premium at Maturity 2026-01-21 . Variable Annuities Exh 5 Equity/Index INTL. PLC 4PQUHN3JPFGFNF3BB653 .,,10/02/2023,3247,89735,0.0
BHF3WS8H8 Premium at Maturity 2026-07-21 . Variable Annuities Exh 5 Equity/Index INTL. PLC 4PQUHN3JPFGFNF3BB653 .,,10/02/2023,3224,145788,0.0
BHF3WS9D6 Premium at Maturity 2028-07-25 . Variable Annuities Exh 5 Equity/Index INTL. PLC 4PQUHN3JPFGFNF3BB653 .,,10/02/2023,3210,0,0.0
BHF3WS870 Premium at Maturity 2027-04-20 . Variable Annuities Exh 5 Equity/Index INTL. PLC 4PQUHN3JPFGFNF3BB653 .,,10/02/2023,3156,0,0.0
BHF3WS9P9 Premium at Maturity 2029-04-24 . Variable Annuities Exh 5 Equity/Index INTL. PLC 4PQUHN3JPFGFNF3BB653 .,,10/02/2023,3148,0,0.0
BHF3WS9G9 Premium at Maturity 2029-01-23 . Variable Annuities Exh 5 Equity/Index INTL. PLC 4PQUHN3JPFGFNF3BB653 .,,10/02/2023,3073,0,0.0
QUALCOMM INCORPORATED SENIOR CORP_BND,,12/05/2023,3046,0,0.0
BHF3WS8E5 Premium at Maturity 2025-10-21 . Variable Annuities Exh 5 Equity/Index INTL. PLC 4PQUHN3JPFGFNF3BB653 .,,10/02/2023,3020,80930,0.0
PUT OPTION OCT23SPXP@2987 MORGAN STANLEY & CO BHF3WS698 Variable Annuities Exh 5 Equity/Index INTL. PLC 4PQUHN3JPFGFNF3BB653,,10/02/2023,2987,0,0.0
BHF3WS7Y2 Premium at Maturity 2028-10-24 . Variable Annuities Exh 5 Equity/Index INTL. PLC 4PQUHN3JPFGFNF3BB653 .,,10/02/2023,2985,0,0.0
BRISTOL-MYERS SQUIBB,CO,11/28/2023,2951,0,0.0
BHF3WS920 Premium at Maturity 2025-07-22 . Variable Annuities Exh 5 Equity/Index INTL. PLC 4PQUHN3JPFGFNF3BB653 .,,10/02/2023,2928,78799,0.0
BHF3WS888 Premium at Maturity 2027-01-20 . Variable Annuities Exh 5 Equity/Index INTL. PLC 4PQUHN3JPFGFNF3BB653 .,,10/02/2023,2927,0,0.0
BHF2S8CZ4 Premium at Maturity 2024-10-02 Variable Annuities Exh 5 Equity/Index N.A. 7H6GLXDRUGQFU57RNE97,,07/29/2021,2914,0,0.0
BHF38KDY9 Premium at Maturity Variable Annuities Exh 5 Equity/Index BNP PARIBAS R0MUWSFPU8MPRO8K5P83,,06/23/2022,2914,0,0.0
CALL BHF1N6H80 Premium at Maturity 2024-10-02 Variable Annuities Exh 5 Equity/Index N.A. 7H6GLXDRUGQFU57RNE97,,06/27/2019,2914,0,0.0
CALL OPTION SEP24 SPX C @ 2914 BHF2QN8C9 Variable Annuities Exh 5 Equity/Index BANK OF AMERICA NA B4TYDEB6GKMZO031MB27,,06/30/2021,2914,0,0.0
ONEMAIN FINANCIAL ISSUANCE TRU SENIOR AB,,11/07/2023,2865,0,0.0
BHF3WS7N6 Premium at Maturity 2025-04-21 . Variable Annuities Exh 5 Equity/Index INTL. PLC 4PQUHN3JPFGFNF3BB653 .,,10/02/2023,2855,64688,0.0
BHF3WS6P2 Premium at Maturity 2024-07-23 . Variable Annuities Exh 5 Equity/Index INTL. PLC 4PQUHN3JPFGFNF3BB653 .,,10/02/2023,2803,17951,0.0
BHF3WS6N7 Premium at Maturity 2024-10-22 . Variable Annuities Exh 5 Equity/Index INTL. PLC 4PQUHN3JPFGFNF3BB653 .,,10/02/2023,2781,29399,0.0
BHF3WS7V8 Premium at Maturity 2026-04-21 . Variable Annuities Exh 5 Equity/Index INTL. PLC 4PQUHN3JPFGFNF3BB653 .,,10/02/2023,2734,121481,0.0
BHF3WS6X5 Premium at Maturity 2024-01-23 . Variable Annuities Exh 5 Equity/Index INTL. PLC 4PQUHN3JPFGFNF3BB653 .,,10/02/2023,2714,5476,0.0
BAKER HUGHES HOLDINGS LLC SENIOR CORP_BN,,12/20/2023,2709,0,0.0
BHF3WS7L0 Premium at Maturity 2024-04-23 . Variable Annuities Exh 5 Equity/Index INTL. PLC 4PQUHN3JPFGFNF3BB653 .,,10/02/2023,2689,12014,0.0
STRUCTURED ASSET MORTGAGE INVE SUPSEN WH,,12/26/2023,2671,0,0.0
BHF3WS7T3 Premium at Maturity 2026-10-20 . Variable Annuities Exh 5 Equity/Index INTL. PLC 4PQUHN3JPFGFNF3BB653 .,,10/02/2023,2664,0,0.0
BHF3WS755 Premium at Maturity 2025-01-22 . Variable Annuities Exh 5 Equity/Index INTL. PLC 4PQUHN3JPFGFNF3BB653 .,,10/02/2023,2629,37891,0.0
BHF3WS821 Premium at Maturity 2026-01-21 . Variable Annuities Exh 5 Equity/Index INTL. PLC 4PQUHN3JPFGFNF3BB653 .,,10/02/2023,2602,0,0.0
BHF3WSCX8; CALL OPTION MORGAN STANLEY & CO OCT23SPXC@4170 BHF3WSCQ3 Variable Annuities Exh 5 Equity/Index INTL. PLC 4PQUHN3JPFGFNF3BB653,,10/02/2023,2552,0,0.0
BHF3WS847 Premium at Maturity 2026-07-21 . Variable Annuities Exh 5 Equity/Index INTL. PLC 4PQUHN3JPFGFNF3BB653 .,,10/02/2023,2506,0,0.0
BHF3WS961 Premium at Maturity 2025-10-21 . Variable Annuities Exh 5 Equity/Index INTL. PLC 4PQUHN3JPFGFNF3BB653 .,,10/02/2023,2401,0,0.0
BHF3WS789 Premium at Maturity 2024-07-23 . Variable Annuities Exh 5 Equity/Index INTL. PLC 4PQUHN3JPFGFNF3BB653 .,,10/02/2023,2363,0,0.0
BHF3WS8V7 Premium at Maturity 2025-07-22 . Variable Annuities Exh 5 Equity/Index INTL. PLC 4PQUHN3JPFGFNF3BB653 .,,10/02/2023,2338,0,0.0
BHF3WSCW0 Premium at Maturity 2027-11-23 . Variable Annuities Exh 5 Equity/Index INTL. PLC 4PQUHN3JPFGFNF3BB653 .,,10/02/2023,2303,40390,0.0
BHF3WSB68 Premium at Maturity 2024-05-21 . Variable Annuities Exh 5 Equity/Index INTL. PLC 4PQUHN3JPFGFNF3BB653 .,,10/02/2023,2300,1113,0.0
BHF3WS7P1 Premium at Maturity 2025-04-21 . Variable Annuities Exh 5 Equity/Index INTL. PLC 4PQUHN3JPFGFNF3BB653 .,,10/02/2023,2296,0,0.0
BHF3WSCE0 Premium at Maturity 2024-11-19 . Variable Annuities Exh 5 Equity/Index INTL. PLC 4PQUHN3JPFGFNF3BB653 .,,10/02/2023,2295,1825,0.0
BHF3WSCR1 Premium at Maturity 2027-05-25 . Variable Annuities Exh 5 Equity/Index INTL. PLC 4PQUHN3JPFGFNF3BB653 .,,10/02/2023,2291,35853,0.0
BHF3WS7C0 Premium at Maturity 2024-01-23 . Variable Annuities Exh 5 Equity/Index INTL. PLC 4PQUHN3JPFGFNF3BB653 .,,10/02/2023,2287,0,0.0
BHF3WS6W7 Premium at Maturity 2024-10-22 . Variable Annuities Exh 5 Equity/Index INTL. PLC 4PQUHN3JPFGFNF3BB653 .,,10/02/2023,2285,0,0.0
BHF3WS7G1 Premium at Maturity 2024-04-23 . Variable Annuities Exh 5 Equity/Index INTL. PLC 4PQUHN3JPFGFNF3BB653 .,,10/02/2023,2266,0,0.0
BHF3WS9X2 Premium at Maturity 2024-06-25 . Variable Annuities Exh 5 Equity/Index INTL. PLC 4PQUHN3JPFGFNF3BB653 .,,10/02/2023,2251,3011,0.0
BHF3WS9V6 Premium at Maturity 2027-05-25 . Variable Annuities Exh 5 Equity/Index INTL. PLC 4PQUHN3JPFGFNF3BB653 .,,10/02/2023,2240,36423,0.0
BHF3WS8K1 Premium at Maturity 2026-04-21 . Variable Annuities Exh 5 Equity/Index INTL. PLC 4PQUHN3JPFGFNF3BB653 .,,10/02/2023,2196,0,0.0
BHF3WS9Q7 Premium at Maturity 2024-11-19 . Variable Annuities Exh 5 Equity/Index INTL. PLC 4PQUHN3JPFGFNF3BB653 .,,10/02/2023,2192,3843,0.0
PUT OPTION OCT23SPXP@2159 MORGAN STANLEY & CO BHF3WS7K2 Variable Annuities Exh 5 Equity/Index INTL. PLC 4PQUHN3JPFGFNF3BB653,,10/02/2023,2159,0,0.0
BHF3WS6Q0 Premium at Maturity 2025-01-22 . Variable Annuities Exh 5 Equity/Index INTL. PLC 4PQUHN3JPFGFNF3BB653 .,,10/02/2023,2137,0,0.0
BHF3WSC18 Premium at Maturity 2024-06-25 . Variable Annuities Exh 5 Equity/Index INTL. PLC 4PQUHN3JPFGFNF3BB653 .,,10/02/2023,2115,5310,0.0
BHF3WSCZ3 Premium at Maturity 2029-06-20 . Variable Annuities Exh 5 Equity/Index INTL. PLC 4PQUHN3JPFGFNF3BB653 .,,10/02/2023,2110,37158,0.0
BHF3WSD25 Premium at Maturity 2026-05-19 . Variable Annuities Exh 5 Equity/Index INTL. PLC 4PQUHN3JPFGFNF3BB653 .,,10/02/2023,2096,3753,0.0
BHF3WSB76 Periodical MORGAN STANLEY & CO Variable Annuities Exh 5 Equity/Index INTL. PLC 4PQUHN3JPFGFNF3BB653 .,,10/02/2023,2074,13821,0.0
BHF3WSCP5 Premium at Maturity 2026-12-22 . Variable Annuities Exh 5 Equity/Index INTL. PLC 4PQUHN3JPFGFNF3BB653 .,,10/02/2023,2066,16026,0.0
BHF31T5Y6 Variable Annuities Exh 5 Equity/Index BANK OF AMERICA NA B4TYDEB6GKMZO031MB27,,02/02/2022,2063,0,0.0
BHF31T5R1 Variable Annuities Exh 5 Equity/Index BANK OF AMERICA NA B4TYDEB6GKMZO031MB27,,02/02/2022,2063,0,0.0
BHF3WSAV4; CALL OPTION MORGAN STANLEY & CO DEC23MXEAC@3413 BHF3WSBB7 Variable Annuities Exh 5 Equity/Index INTL. PLC 4PQUHN3JPFGFNF3BB653,,10/02/2023,2037,0,0.0
BHF3WSCA8 Premium at Maturity 2024-11-19 . Variable Annuities Exh 5 Equity/Index INTL. PLC 4PQUHN3JPFGFNF3BB653 .,,10/02/2023,2011,0,0.0
BHF3WSBX9 Premium at Maturity 2024-05-21 . Variable Annuities Exh 5 Equity/Index INTL. PLC 4PQUHN3JPFGFNF3BB653 .,,10/02/2023,2009,0,0.0
BHF3WSC00 Premium at Maturity 2024-05-21 . Variable Annuities Exh 5 Equity/Index INTL. PLC 4PQUHN3JPFGFNF3BB653 .,,10/02/2023,2004,8036,0.0
BHF3WS300; CALL OPTION MORGAN STANLEY & CO NOV23MXEAC@3099 BHF3WSBG6 Variable Annuities Exh 5 Equity/Index INTL. PLC 4PQUHN3JPFGFNF3BB653,,10/02/2023,2001,0,0.0
BHF3WSCG5 Premium at Maturity 2025-05-20 . Variable Annuities Exh 5 Equity/Index INTL. PLC 4PQUHN3JPFGFNF3BB653 .,,10/02/2023,1991,2846,0.0
BHF3WSD33 Premium at Maturity 2028-05-23 . Variable Annuities Exh 5 Equity/Index INTL. PLC 4PQUHN3JPFGFNF3BB653 .,,10/02/2023,1978,35403,0.0
BHF3WSBR2 Premium at Maturity 2025-12-23 . Variable Annuities Exh 5 Equity/Index INTL. PLC 4PQUHN3JPFGFNF3BB653 .,,10/02/2023,1960,18921,0.0
BHF3WS987 Premium at Maturity 2024-06-25 . Variable Annuities Exh 5 Equity/Index INTL. PLC 4PQUHN3JPFGFNF3BB653 .,,10/02/2023,1955,0,0.0
BHF3WSD41 Premium at Maturity 2027-11-23 . Variable Annuities Exh 5 Equity/Index INTL. PLC 4PQUHN3JPFGFNF3BB653 .,,10/02/2023,1937,0,0.0
BHF3WSB19 Premium at Maturity 2024-11-19 . Variable Annuities Exh 5 Equity/Index INTL. PLC 4PQUHN3JPFGFNF3BB653 .,,10/02/2023,1908,0,0.0
BHF3WSC42 Premium at Maturity 2024-06-25 . Variable Annuities Exh 5 Equity/Index INTL. PLC 4PQUHN3JPFGFNF3BB653 .,,10/02/2023,1903,0,0.0
BHF3WS2W1; CALL OPTION MORGAN STANLEY & CO NOV23MXEAC@2147 BHF3WS326 Variable Annuities Exh 5 Equity/Index INTL. PLC 4PQUHN3JPFGFNF3BB653,,10/02/2023,1900,0,0.0
BHF3WSCV2 Premium at Maturity 2028-11-21 . Variable Annuities Exh 5 Equity/Index INTL. PLC 4PQUHN3JPFGFNF3BB653 .,,10/02/2023,1898,32881,0.0
BHF3WSC26 Premium at Maturity 2024-05-21 . Variable Annuities Exh 5 Equity/Index INTL. PLC 4PQUHN3JPFGFNF3BB653 .,,10/02/2023,1896,0,0.0
BHF3WSAH5 Premium at Maturity 2025-06-24 . Variable Annuities Exh 5 Equity/Index INTL. PLC 4PQUHN3JPFGFNF3BB653 .,,10/02/2023,1892,6809,0.0
BHF3WSAQ5 Premium at Maturity 2026-12-22 . Variable Annuities Exh 5 Equity/Index INTL. PLC 4PQUHN3JPFGFNF3BB653 .,,10/02/2023,1886,18937,0.0
BHF3WSB01 Premium at Maturity 2028-05-23 . Variable Annuities Exh 5 Equity/Index INTL. PLC 4PQUHN3JPFGFNF3BB653 .,,10/02/2023,1884,45677,0.0
BHF3WSCC4 Premium at Maturity 2025-05-20 . Variable Annuities Exh 5 Equity/Index INTL. PLC 4PQUHN3JPFGFNF3BB653 .,,10/02/2023,1880,16245,0.0
FREDDIE MAC FHLMC_2640 SENIOR AGENCY_CMO,,03/28/2023,1875,0,0.0
BHF3WSBW1 Premium at Maturity 2027-11-23 . Variable Annuities Exh 5 Equity/Index INTL. PLC 4PQUHN3JPFGFNF3BB653 .,,10/02/2023,1865,0,0.0
BHF3WSBP6 Premium at Maturity 2025-11-25 . Variable Annuities Exh 5 Equity/Index INTL. PLC 4PQUHN3JPFGFNF3BB653 .,,10/02/2023,1851,2245,0.0
BHF3WSCK6 Premium at Maturity 2027-05-25 . Variable Annuities Exh 5 Equity/Index INTL. PLC 4PQUHN3JPFGFNF3BB653 .,,10/02/2023,1848,0,0.0
BHF3WSD09 Premium at Maturity 2026-05-19 . Variable Annuities Exh 5 Equity/Index INTL. PLC 4PQUHN3JPFGFNF3BB653 .,,10/02/2023,1848,0,0.0
BHF3WS9U8 Periodical MORGAN STANLEY & CO Variable Annuities Exh 5 Equity/Index INTL. PLC 4PQUHN3JPFGFNF3BB653 .,,10/02/2023,1844,10080,0.0
BHF3WSAU6 Premium at Maturity 2029-06-20 . Variable Annuities Exh 5 Equity/Index INTL. PLC 4PQUHN3JPFGFNF3BB653 .,,10/02/2023,1838,57680,0.0
BHF3WS9Y0 Premium at Maturity 2027-05-25 . Variable Annuities Exh 5 Equity/Index INTL. PLC 4PQUHN3JPFGFNF3BB653 .,,10/02/2023,1838,0,0.0
BHF3WSBK7 Premium at Maturity 2024-11-19 . Variable Annuities Exh 5 Equity/Index INTL. PLC 4PQUHN3JPFGFNF3BB653 .,,10/02/2023,1836,9710,0.0
BHF3WSC91 Premium at Maturity 2026-05-19 . Variable Annuities Exh 5 Equity/Index INTL. PLC 4PQUHN3JPFGFNF3BB653 .,,10/02/2023,1827,6788,0.0
BHF3WS334; CALL OPTION MORGAN STANLEY & CO NOV23RTYC@ 2133 BHF3WS2Z4 Variable Annuities Exh 5 Equity/Index INTL. PLC 4PQUHN3JPFGFNF3BB653,,10/02/2023,1816,0,0.0
BHF3WS9L8 Premium at Maturity 2025-11-25 . Variable Annuities Exh 5 Equity/Index INTL. PLC 4PQUHN3JPFGFNF3BB653 .,,10/02/2023,1808,5707,0.0
BHF3WSAB8; CALL OPTION MORGAN STANLEY & CO NOV23RTYC@2633 BHF3WSAY8 Variable Annuities Exh 5 Equity/Index INTL. PLC 4PQUHN3JPFGFNF3BB653,,10/02/2023,1807,0,0.0
BHF3WSAX0 Premium at Maturity 2028-11-21 . Variable Annuities Exh 5 Equity/Index INTL. PLC 4PQUHN3JPFGFNF3BB653 .,,10/02/2023,1804,49920,0.0
PUT OPTION NOV23MXEAP@1764 MORGAN STANLEY & CO BHF3WSBC5 Variable Annuities Exh 5 Equity/Index INTL. PLC 4PQUHN3JPFGFNF3BB653,,10/02/2023,1764,0,0.0
BHF3Q6CL9 Variable Annuities Exh 5 Equity/Index CITIBANK NA E57ODZWZ7FF32TWEFA76,,05/25/2023,1762,0,0.0
PUT OPTION DEC23MXEAP@1740 MORGAN STANLEY & CO BHF3WSBM3 Variable Annuities Exh 5 Equity/Index INTL. PLC 4PQUHN3JPFGFNF3BB653,,10/02/2023,1740,0,0.0
BHF3WSBJ0 Premium at Maturity 2025-05-20 . Variable Annuities Exh 5 Equity/Index INTL. PLC 4PQUHN3JPFGFNF3BB653 .,,10/02/2023,1729,0,0.0
PUT OPTION DEC23MXEAP@1713 MORGAN STANLEY & CO BHF3WSBN1 Variable Annuities Exh 5 Equity/Index INTL. PLC 4PQUHN3JPFGFNF3BB653,,10/02/2023,1713,0,0.0
PUT OPTION NOV23MXEAP@1710 MORGAN STANLEY & CO BHF3WS318 Variable Annuities Exh 5 Equity/Index INTL. PLC 4PQUHN3JPFGFNF3BB653,,10/02/2023,1710,0,0.0
BHF3WSB50 Premium at Maturity 2024-05-21 . Variable Annuities Exh 5 Equity/Index INTL. PLC 4PQUHN3JPFGFNF3BB653 .,,10/02/2023,1691,0,0.0
BHF3WSBS0 Premium at Maturity 2029-06-20 . Variable Annuities Exh 5 Equity/Index INTL. PLC 4PQUHN3JPFGFNF3BB653 .,,10/02/2023,1684,0,0.0
BHF3WSC34 Premium at Maturity 2026-05-19 . Variable Annuities Exh 5 Equity/Index INTL. PLC 4PQUHN3JPFGFNF3BB653 .,,10/02/2023,1669,15108,0.0
BHF3WS8M7 Premium at Maturity 2024-05-21 . Variable Annuities Exh 5 Equity/Index INTL. PLC 4PQUHN3JPFGFNF3BB653 .,,10/02/2023,1665,0,0.0
BHF3WSAL6 Premium at Maturity 2024-06-25 . Variable Annuities Exh 5 Equity/Index INTL. PLC 4PQUHN3JPFGFNF3BB653 .,,10/02/2023,1660,0,0.0
BHF3WSCF7 Premium at Maturity 2028-05-23 . Variable Annuities Exh 5 Equity/Index INTL. PLC 4PQUHN3JPFGFNF3BB653 .,,10/02/2023,1644,0,0.0
BHF3WSA93 Premium at Maturity 2025-06-24 . Variable Annuities Exh 5 Equity/Index INTL. PLC 4PQUHN3JPFGFNF3BB653 .,,10/02/2023,1642,0,0.0
BHF3WSCT7 Premium at Maturity 2026-12-22 . Variable Annuities Exh 5 Equity/Index INTL. PLC 4PQUHN3JPFGFNF3BB653 .,,10/02/2023,1640,0,0.0
PUT OPTION DEC23RTYP@1640 MORGAN STANLEY & CO BHF3WSAP7 Variable Annuities Exh 5 Equity/Index INTL. PLC 4PQUHN3JPFGFNF3BB653,,10/02/2023,1640,0,0.0
PUT OPTION NOV23RTYP@1634 MORGAN STANLEY & CO BHF3WS2Y7 Variable Annuities Exh 5 Equity/Index INTL. PLC 4PQUHN3JPFGFNF3BB653,,10/02/2023,1634,0,0.0
BHF3WSCB6 Premium at Maturity 2024-05-21 . Variable Annuities Exh 5 Equity/Index INTL. PLC 4PQUHN3JPFGFNF3BB653 .,,10/02/2023,1626,13569,0.0
BHF3WSC59 Premium at Maturity 2025-11-25 . Variable Annuities Exh 5 Equity/Index INTL. PLC 4PQUHN3JPFGFNF3BB653 .,,10/02/2023,1613,0,0.0
BHF3WSAR3 Premium at Maturity 2026-05-19 . Variable Annuities Exh 5 Equity/Index INTL. PLC 4PQUHN3JPFGFNF3BB653 .,,10/02/2023,1600,0,0.0
BHF3WSAM4 Premium at Maturity 2025-11-25 . Variable Annuities Exh 5 Equity/Index INTL. PLC 4PQUHN3JPFGFNF3BB653 .,,10/02/2023,1595,23823,0.0
BHF3WSCN0 Premium at Maturity 2025-12-23 . Variable Annuities Exh 5 Equity/Index INTL. PLC 4PQUHN3JPFGFNF3BB653 .,,10/02/2023,1595,0,0.0
PUT OPTION NOV23RTYP@1581 MORGAN STANLEY & CO BHF3WS9W4 Variable Annuities Exh 5 Equity/Index INTL. PLC 4PQUHN3JPFGFNF3BB653,,10/02/2023,1581,0,0.0
BHF3WSAZ5 Premium at Maturity 2028-05-23 . Variable Annuities Exh 5 Equity/Index INTL. PLC 4PQUHN3JPFGFNF3BB653 .,,10/02/2023,1571,0,0.0
BHF3WSBD3 Premium at Maturity 2025-11-25 . Variable Annuities Exh 5 Equity/Index INTL. PLC 4PQUHN3JPFGFNF3BB653 .,,10/02/2023,1567,0,0.0
BHF3WSAT9 Premium at Maturity 2024-11-19 . Variable Annuities Exh 5 Equity/Index INTL. PLC 4PQUHN3JPFGFNF3BB653 .,,10/02/2023,1546,0,0.0
BHF3WSC83 Premium at Maturity 2025-05-20 . Variable Annuities Exh 5 Equity/Index INTL. PLC 4PQUHN3JPFGFNF3BB653 .,,10/02/2023,1540,0,0.0
BHF3WSAD4 Premium at Maturity 2025-06-24 . Variable Annuities Exh 5 Equity/Index INTL. PLC 4PQUHN3JPFGFNF3BB653 .,,10/02/2023,1538,23778,0.0
BHF3WSAE2 Premium at Maturity 2024-12-24 . Variable Annuities Exh 5 Equity/Index INTL. PLC 4PQUHN3JPFGFNF3BB653 .,,10/02/2023,1526,18732,0.0
BHF3WSA69 Premium at Maturity 2026-12-22 . Variable Annuities Exh 5 Equity/Index INTL. PLC 4PQUHN3JPFGFNF3BB653 .,,10/02/2023,1518,0,0.0
BHF3WSA85; CALL OPTION MORGAN STANLEY & CO DEC23RTYC@2616 BHF3WS9C8 Variable Annuities Exh 5 Equity/Index INTL. PLC 4PQUHN3JPFGFNF3BB653,,10/02/2023,1515,0,0.0
BHF3WSCL4 Premium at Maturity 2028-11-21 . Variable Annuities Exh 5 Equity/Index INTL. PLC 4PQUHN3JPFGFNF3BB653 .,,10/02/2023,1508,0,0.0
BHF3WSBH4 Premium at Maturity 2029-06-20 . Variable Annuities Exh 5 Equity/Index INTL. PLC 4PQUHN3JPFGFNF3BB653 .,,10/02/2023,1497,0,0.0
BHF3WSB84 Premium at Maturity 2028-11-21 . Variable Annuities Exh 5 Equity/Index INTL. PLC 4PQUHN3JPFGFNF3BB653 .,,10/02/2023,1432,0,0.0
BHF3WS8L9 Premium at Maturity 2024-05-21 . Variable Annuities Exh 5 Equity/Index INTL. PLC 4PQUHN3JPFGFNF3BB653 .,,10/02/2023,1381,0,0.0
BHF3WSBZ4 Premium at Maturity 2026-05-19 . Variable Annuities Exh 5 Equity/Index INTL. PLC 4PQUHN3JPFGFNF3BB653 .,,10/02/2023,1370,0,0.0
TYSN_23-CRNR LCF SENIOR_CMBS _23-CRNR,,11/29/2023,1350,0,0.0
TAMPA ELECTRIC COMPANY SENIOR CORP_BND,,12/21/2023,1331,0,0.0
BHF3WS9Z7 Premium at Maturity 2025-11-25 . Variable Annuities Exh 5 Equity/Index INTL. PLC 4PQUHN3JPFGFNF3BB653 .,,10/02/2023,1324,0,0.0
BHF3WSA28 Premium at Maturity 2026-05-19 . Variable Annuities Exh 5 Equity/Index INTL. PLC 4PQUHN3JPFGFNF3BB653 .,,10/02/2023,1314,18435,0.0
PUT OPTION DEC23RTYP@1305 MORGAN STANLEY & CO BHF3WSA02 Variable Annuities Exh 5 Equity/Index INTL. PLC 4PQUHN3JPFGFNF3BB653,,10/02/2023,1305,0,0.0
BHF3WSB43 Premium at Maturity 2024-12-24 . Variable Annuities Exh 5 Equity/Index INTL. PLC 4PQUHN3JPFGFNF3BB653 .,,10/02/2023,1298,0,0.0
BHF3WSAF9 Premium at Maturity 2025-06-24 . Variable Annuities Exh 5 Equity/Index INTL. PLC 4PQUHN3JPFGFNF3BB653 .,,10/02/2023,1288,0,0.0
BHF3WS9K0 Premium at Maturity 2026-05-19 . Variable Annuities Exh 5 Equity/Index INTL. PLC 4PQUHN3JPFGFNF3BB653 .,,10/02/2023,1078,0,0.0
CITIGROUP MORTGAGE LOAN TRUST SUPSEN WHO,,12/01/2023,1020,0,0.0
WAMU ASSET-BACKED CERTIFICATES SENIOR AB,,12/26/2023,757,0,0.0
STRUCTURED ASSET MORTGAGE INVE SUPSEN WH,,12/26/2023,668,0,0.0
JP MORGAN MORTGAGE ACQUISITION SENIOR AB,,12/01/2023,509,0,0.0
WAMU ASSET-BACKED CERTIFICATES SENIOR AB,,12/26/2023,399,0,0.0
RESIDENTIAL ACCREDIT LOANS,IN,12/01/2023,305,0,0.0
GREAT-WEST LIFECO FINANCE DELA SENIOR,CO,12/01/2023,231,0,0.0
GSAA HOME EQUITY TRUST GSAA_06 SENIOR AB,,12/26/2023,138,0,0.0
Value Years Than- Capital- Book/ Exchange Value Foreign BLIC-NY PROPERTY VENTURES LLC WILMINGTON,DE,12/16/2022,0,0,0.0
GOVERNMENT NATIONAL MORTGAGE A SENIOR AG,,12/01/2023,0,0,0.0
TEXAS PUBLIC FINANCE AUTHORITY MUNITAX_B,,10/27/2023,0,0,0.0
TEXAS NATURAL GAS SECURITIZATI MUNITAX_B,,03/10/2023,0,0,0.0
ALEXANDRIA REAL ESTATE EQUITIE SENIOR,CO,02/02/2023,0,0,0.0
AMERIPRISE FINANCIAL INC SENIOR CORP_BND,,03/06/2023,0,0,0.0
BX COMMERCIAL MORTGAGE TRUST B LCF SENIO,,12/07/2023,0,0,0.0
GM FINANCIAL REVOLVING RECEIVA SENIOR AB,,11/06/2023,0,0,0.0
HEALTHPEAK PROPERTIES INC SENIOR CORP_BN,,01/09/2023,0,0,0.0
KSL TRUST KSLCMT_23-HT LCF SENIOR_CMBS _,,12/04/2023,0,0,0.0
PENSKE TRUCK LEASING,CO,01/05/2023,0,0,0.0
TRAVELERS COMPANIES INC SENIOR CORP_BND,,11/28/2023,0,0,0.0
CANADIAN PACIFIC RAILWAY COMPA SENIOR,CO,04/19/2023,0,0,0.0
BNP PARIBAS SA SRP CORP_BND 144A 5.89 D,,11/28/2023,0,0,0.0
CREDIT AGRICOLE SA LONDON,BRA,01/05/2023,0,0,0.0
POLICYGENIUS INC PFD_EQUITY,,04/26/2023,0,0,276.0
SEASONED CREDIT RISK TRANSFER SENIOR AGE,,08/01/2023,0,0,0.0
SUMMARY ADJUSTMENT,,12/31/2023,0,-3462,0.0
Variable Annuities Exh 5 Equity/Index BARCLAYS BANK PLC . G5GSEF7VJP5I7OUK5573,,12/09/2022,0,0,0.0
BHF2PTWN6 Variable Annuities Exh 5 Equity/Index NA 7H6GLXDRUGQFU57RNE97,,06/22/2021,0,0,0.0
JPMORGAN CHASE BANK NA R Tot Ret PAY FEDL,,07/21/2027,0,0,0.0
BHF2SK7F7 Variable Annuities Exh 5 Equity/Index NA 7H6GLXDRUGQFU57RNE97,,08/04/2021,0,0,0.0
BHF2SK9P3 Variable Annuities Exh 5 Equity/Index NA 7H6GLXDRUGQFU57RNE97,,08/04/2021,0,0,0.0
Total Return Swap With Tot Ret PAY FEDL,,06/21/2027,0,0,0.0
BHF2PTWT3 Variable Annuities Exh 5 Equity/Index CAPITAL SERVICES I7331LVCZKQKX5T7XV54,,06/22/2021,0,0,0.0
Total Return Swap With Tot Ret PAY FEDL,,05/11/2026,0,0,0.0
BHF2X07Y4 Variable Annuities Exh 5 Equity/Index CAPITAL SERVICES I7331LVCZKQKX5T7XV54,,10/25/2021,0,0,0.0
Variable Annuities Exh 5 Equity/Index BARCLAYS BANK PLC . G5GSEF7VJP5I7OUK5573,,11/09/2022,0,0,0.0
BHF3F13V0 Variable Annuities Exh 5 Equity/Index USA KD3XUN7C6T14HNAYLU02,,11/10/2022,0,0,0.0
GOLDMAN SACHS BANK USA R Tot Ret PAY FEDL,,11/10/2026,0,0,0.0
BHF3F13Y4 Variable Annuities Exh 5 Equity/Index USA KD3XUN7C6T14HNAYLU02,,11/10/2022,0,0,0.0
Variable Annuities Exh 5 Equity/Index BARCLAYS BANK PLC . G5GSEF7VJP5I7OUK5573,,11/09/2022,0,0,0.0
GOLDMAN SACHS BANK USA R Tot Ret PAY FEDL,,03/10/2027,0,0,0.0
BHF3LDAK3 Variable Annuities Exh 5 Equity/Index USA KD3XUN7C6T14HNAYLU02,,03/10/2023,0,0,0.0
BHF3LDAQ0 Variable Annuities Exh 5 Equity/Index USA KD3XUN7C6T14HNAYLU02,,03/10/2023,0,0,0.0
BHF3Q6CN5 Variable Annuities Exh 5 Equity/Index INTERNATIONAL W22LROWP2IHZNBB6K528,,05/25/2023,0,0,0.0
Total Return Swap With FEDL P Tot Ret,,01/08/2027,0,0,0.0
BHF3Q6CT2 Variable Annuities Exh 5 Equity/Index INTERNATIONAL W22LROWP2IHZNBB6K528,,05/25/2023,0,0,0.0
BHF3V1B68 Variable Annuities Exh 5 Equity/Index USA KD3XUN7C6T14HNAYLU02,,08/24/2023,0,0,0.0
BHF3V1C75 Variable Annuities Exh 5 Equity/Index USA KD3XUN7C6T14HNAYLU02,,08/24/2023,0,0,0.0
BHF3V1TL6 Variable Annuities Exh 5 Equity/Index NA 7H6GLXDRUGQFU57RNE97,,08/24/2023,0,0,0.0
GOLDMAN SACHS BANK USA RCV FEDL P Tot Ret,,07/10/2027,0,0,0.0
BHF3VPZN2 Variable Annuities Exh 5 Equity/Index USA KD3XUN7C6T14HNAYLU02,,09/20/2023,0,0,0.0
BHF3WR7R9 Variable Annuities Exh 5 Equity/Index USA KD3XUN7C6T14HNAYLU02,,09/25/2023,0,0,0.0
GOLDMAN SACHS BANK USA RCV FEDL P Tot Ret,,09/10/2027,0,0,0.0
BHF3WR7U2 Variable Annuities Exh 5 Equity/Index USA KD3XUN7C6T14HNAYLU02,,09/25/2023,0,0,0.0
Variable Annuities Exh 5 Equity/Index BARCLAYS BANK PLC . G5GSEF7VJP5I7OUK5573,,09/25/2023,0,0,0.0
Variable Annuities Exh 5 Equity/Index BARCLAYS BANK PLC . G5GSEF7VJP5I7OUK5573,,09/25/2023,0,0,0.0
BHF3WRHY3 Variable Annuities Exh 5 Equity/Index USA KD3XUN7C6T14HNAYLU02,,09/27/2023,0,0,0.0
BHF38KDU7 Premium at Maturity Variable Annuities Exh 5 Equity/Index BNP PARIBAS R0MUWSFPU8MPRO8K5P83,,06/23/2022,-2975285,0,0.0
BHF1S77R2 Premium at Maturity 2024-10-02 Variable Annuities Exh 5 Equity/Index N.A. R0MUWSFPU8MPRO8K5P83,,09/30/2019,-66760404,0,0.0
